,Created at,User ID,Text
0,2022-10-07 19:53:05+00:00,1578473509369843713,"Newsflash: yet another @Starbucks has gone union with @SBWorkersUnited — and this time it’s the one very closest to my own house! No matter how much union busting the company undertakes, let us all stand with these brave workers until they achieve justice!"
1,2022-09-12 19:45:15+00:00,1569411837887668226,"Whether they work at Vanity Fair or a corner coffee shop, all workers deserve the dignity and respect that comes with collective voice."
2,2022-09-12 19:44:41+00:00,1569411697265213440,Huge 👊 to over 500 Condé Nast workers for winning a card check agreement and forming a union with the NewsGuild of NY. Their solidarity even forced the company to include over 100 subcontractors in the union. https://t.co/dWRgwJO7Fd
3,2022-09-12 19:12:54+00:00,1569403699054747648,"Here, the sides talked and talked for many months. But when Local 1166 members put solidarity into *brave action* the company started taking them very seriously, very fast. You go, Kokomo!!"
4,2022-09-12 19:12:35+00:00,1569403617106436096,"When it rains, it pours. Another interesting &amp; important tentative agreement in a labor dispute. Is the strike as an instrument of justice back, or what?! https://t.co/0uYNk5dAZt"
5,2022-09-12 16:20:03+00:00,1569360201047744519,"Congrats to AAUP-AFT Local 6759 members for their strong solidarity and winning the hearts of students and the community. Professors are workers, too!!"
6,2022-09-12 16:19:36+00:00,1569360086220283906,"Carol Kuhnke may not be a familiar name to labor law aficionados, but the Washtenaw County Judge’s wise decision to allow EMU faculty to continue walking the picket line almost certainly accelerated an agreement on a new contract—and likely contributed to a more just settlement. https://t.co/RoYBTWEWRR"
7,2022-09-07 22:51:39+00:00,1567646807626326016,Doing what is right can work in practice. Let’s go!
8,2022-09-07 22:51:17+00:00,1567646716299513857,"Finally, this resolution can be implemented with real effect. The DCCC, DSCC and Democratic Caucuses in the House and Senate, not to mention the Democratic leaders in the House and Senate have plenty of tools to enforce discipline in fundraising."
9,2022-09-07 22:50:04+00:00,1567646412686458886,"And if anyone thinks this is all about AIPAC, you know Big Oil, Big Pharma, the gun industry and other groups are watching and lining up to pick their favored nominees from *both* parties. It’s a can’t lose proposition for them!"
10,2022-09-07 22:49:02+00:00,1567646149401612289,No one is calling for unilateral disarmament in general elections! All folks are saying is that corporations and wealthy individuals should not be able to put their thumbs on the scales in Dem primaries.
11,2022-09-07 22:48:43+00:00,1567646070888439809,How can we criticize Citizens United and pass bill after bill in the House to ban dark and unaccountable money from politics but then allow it in our own primary elections with the excuse that its legally allowable because of bad Supreme Court decisions?
12,2022-09-07 22:48:06+00:00,1567645916999327746,Let us choose our own candidates to put up against Republicans in each November election – without outside interference! And let us live up to our values.
13,2022-09-07 22:47:48+00:00,1567645840625238016,Allowing Republicans or other outsiders to use dark money to determine the outcome of Democratic primaries is a sure way to destroy the Democratic Party. And that is true for any party.
14,2022-09-07 22:47:20+00:00,1567645721746149376,"It’s clear what the @DNC needs to do here, and I don’t understand why it’s controversial. 🧵 https://t.co/aX9B5O1IN4"
15,2022-08-31 13:58:41+00:00,1564975970590887936,"Today, I am first and foremost a Witty Warrior. All love, prayers and positive energy to Jamie, Staci, their amazing girls and the whole Witty family! https://t.co/xIBz6bHKPk"
16,2022-08-27 14:25:40+00:00,1563533207852941314,"Clearly, it’s time for a road trip to Lansing to grab some Chipotle - and celebrate the workers’ huge victory there. Go Team(sters)! https://t.co/UaCPD6zGYM"
17,2022-08-03 13:09:46+00:00,1554816797957935105,"I am humbled by neighbors throughout Oakland County and friends new and old across the country who stepped up to help me fight back until the very last minute.

I will continue to speak out against the corrosive influence of dark money on our democracy.

Onward."
18,2022-08-03 13:09:10+00:00,1554816647302549504,"Unfortunately, I was also the target of a largely Republican-funded campaign set on defeating the movement I represent no matter where I ran."
19,2022-08-03 13:08:31+00:00,1554816485318709248,"Together, we locked arms and worked side by side with enthusiasm and grit to engage our communities, answer the tough questions head on, and build a multi-racial, working class movement dedicated to creating a more just world. From the bottom of my heart, thank you."
20,2022-08-03 13:08:10+00:00,1554816397775183876,"I’m so proud of the campaign we have run, which truly has been people-powered. Words cannot express how grateful I am to everyone who worked so hard for the last several months."
21,2022-08-03 13:03:46+00:00,1554815289765896192,I will support her and work with her and others to elect Democrats up and down the ballot in Oakland County and across Michigan and the United States on November 8.
22,2022-08-03 13:03:38+00:00,1554815253766094848,"Congratulations to Congresswoman Haley Stevens, who ran a strong campaign and will be the Democratic nominee for Michigan’s new 11th District."
23,2022-08-03 00:03:53+00:00,1554619022691680257,"I’m so proud of this team. Together we knocked 73,519 doors and made 238,963 calls. We’re building a movement that lasts beyond any election. #LevinFor11"
24,2022-08-02 23:07:01+00:00,1554604712531484678,"📣 73,000 doors 📣 235,000 calls 📣 1 hour left to vote #LevinFor11 https://t.co/AVHgLg7t1P"
25,2022-08-02 22:38:47+00:00,1554597607049158656,With @sunrise_troy at the polls. 1.5 more hours to cast your ballot. Let’s go! #LevinFor11 https://t.co/FTLoCcSEQV
26,2022-08-02 22:00:01+00:00,1554587851336998914,"Two hours until polls close. Go vote if you haven’t already, and bring a friend or two or three!

Find your local polling place: https://t.co/1lYN8lo1EP https://t.co/Vd7xCDCYxV"
27,2022-08-02 21:40:29+00:00,1554582937923887106,"Greeting voters in Pontiac! We’re up to 72,744 doors and we’re running through the tape to victory. #LevinFor11 https://t.co/1GWB2QqtpY"
28,2022-08-02 17:43:36+00:00,1554523322129457152,@sunrisemvmt @sunrisemvmtoc @sunrise_troy @OurRevMichigan @OurRevolution @People4Bernie @FutureGenPAC
29,2022-08-02 17:42:49+00:00,1554523126549123072,"We’re up to 232,000 calls made! No matter where you live, you can help us remind voters to that today’s the day to vote for #LevinFor11! https://t.co/EDujOWBwms https://t.co/gKLoOwNvJw"
30,2022-08-02 17:01:10+00:00,1554512643389521920,There’s a ton of energy out here in Pontiac! Talking to voters at New Bethel Baptist Church and ran into supporters from @Detroit_Action. Let’s go! https://t.co/Uw5RV80FS2
31,2022-08-02 16:00:00+00:00,1554497250922938370,"#TeamLevin here—today’s the big day! If you’re in the new #MI11 and you haven’t cast your ballot already, be sure to vote Andy Levin for Congress before polls close at 8pm tonight!

Find your local polling place: https://t.co/1lYN8lo1EP https://t.co/8mhPmYU2dX"
32,2022-08-02 15:37:12+00:00,1554491512192475140,Let’s go! #LevinFor11 #MI11 https://t.co/bMRMnR48xO
33,2022-08-02 13:06:00+00:00,1554453462968156162,"Make a plan to VOTE today. We’ve built incredible momentum in this idealistic race for the soul of the Democratic Party in Michigan’s 11th District. We’ve knocked 69,637 doors and made over 228k calls — and we’re still going! 

#LevinFor11 #MI11 https://t.co/5YBzgyOSus"
34,2022-08-01 23:03:28+00:00,1554241430801059842,I applaud @GovWhitmer for taking swift action to block enforcement of today's ruling. She's demonstrated the kind of decisive leadership we need to protect people's bodily autonomy today and every day. #BansOffOurBodies https://t.co/aaC2lVSb3x
35,2022-08-01 22:37:14+00:00,1554234828517773319,I’m LIVE with @errolbarnett on @CBSNews to discuss the #MI11 primary. Tune in!
36,2022-08-01 22:09:30+00:00,1554227851901255682,Meeting new friends in Pontiac! https://t.co/ozS8OyiB0B
37,2022-08-01 22:00:00+00:00,1554225460170612739,"A strongly Democratic district like the new #MI11 needs an unwavering progressive in Congress.

The facts speak for themselves. I would be honored to earn your vote in tomorrow’s primary. https://t.co/hz5oT87Qbe"
38,2022-08-01 21:52:12+00:00,1554223497408385024,✨✨ Catch highlights from Friday’s rally with #berniesanders and vote #LevinFor11! https://t.co/QHpmkZFVYN
39,2022-08-01 21:36:11+00:00,1554219467567136769,We want to thank all of the volunteers who stepped up in these final days. We are sending a strong message that Republican billionaires do not decide a Democratic primary – the voters do. This is democracy at work. #LevinFor11 #MI11 https://t.co/5IDGWtTRNO
40,2022-08-01 21:10:27+00:00,1554212992413478912,"No places, no restaurant, no barbershop have been more central to my campaign than the Elam family businesses on Stanford Street in Pontiac. I love the Elams’ classic American mix of entrepreneurship and commitment to the community. https://t.co/vEVnTwvbVq"
41,2022-08-01 20:00:02+00:00,1554195267699609600,"#TeamLevin here with tips for an easy trip to the polls:
✅ Polls are open 7am to 8pm Tuesday✅ If you’re in line by 8pm, you can vote
✅ Double-check your polling site! https://t.co/1lYN8lo1EP
✅ Bring a friend
✅ And most importantly, vote Andy Levin for the new #MI11!"
42,2022-08-01 18:59:17+00:00,1554179981374267398,You can also still register to vote and vote up to 8:00pm tomorrow. Just bring proof of residency to your city or township clerk’s office. Learn where to go here: https://t.co/1lYN8l6qNh
43,2022-08-01 18:59:17+00:00,1554179979495309312,"If you haven’t cast your absentee ballot yet, don’t put it in the mail—go to your polling place or drop it off in person by 8:00pm tomorrow. Find your voting or drop-off location here: https://t.co/1lYN8l6qNh https://t.co/fU8rhTg3wj"
44,2022-08-01 18:29:13+00:00,1554172415827185666,"Love is at the center of everything, especially this campaign and the relationships we’re building for the long haul. https://t.co/BXBNzPNQKy"
45,2022-08-01 18:28:38+00:00,1554172268418371584,https://t.co/jzJVJ5DOvI
46,2022-08-01 18:28:38+00:00,1554172266740699136,https://t.co/1n0GlID4Fk
47,2022-08-01 18:28:36+00:00,1554172261661192192,https://t.co/bnpCQeO7UG
48,2022-08-01 18:28:35+00:00,1554172256288264192,https://t.co/OPQQKDbV5m
49,2022-08-01 18:28:34+00:00,1554172250890412032,https://t.co/eSqL1kNiCO
50,2022-08-01 18:28:33+00:00,1554172246654177280,"#TeamLevin here! Members of Congress, local elected officials, reproductive justice leaders, unions and other organizations fighting for justice have all thrown their support behind Andy in this race for the new #MI11. Take a look at some of the leaders supporting Andy:"
51,2022-08-01 17:46:35+00:00,1554161687669915652,"Former Congressman Sandy Levin, 90, shares his thoughts with Andy as the 8/2 primary approaches tomorrow. https://t.co/wur1WPqBwC"
52,2022-08-01 14:19:54+00:00,1554109672659066880,But women shouldn’t have to live in fear and confusion until then.
53,2022-08-01 14:19:40+00:00,1554109613880008704,"To be sure, we must make certain the Michigan Reproductive Freedom for All is on the November 8th ballot and that we pass it resoundingly!"
54,2022-08-01 14:18:08+00:00,1554109226410283015,"This Court of Appeals ruling poses an immediate danger to the rights and bodily autonomy of women and pregnant people across many Michigan counties. I trust it will be appealed, and hopefully fast. 🧵
https://t.co/97PqnyP2kp"
55,2022-08-01 13:52:26+00:00,1554102761591013377,"I love supporting Leeza and all the other small businesses like hers. And you have to admit, when the food is this good, it’s not exactly a sacrifice! 2/2"
56,2022-08-01 13:51:59+00:00,1554102644913934338,"To me, Leeza and her whole family are the American story. Immigrating from Lebanon, creating small businesses that become community institutions, working hard day in, day out, year in, year out, providing phenomenal opportunities for the next generation. 1/2 https://t.co/EyMAPI3qa6"
57,2022-08-01 00:23:08+00:00,1553899093541412865,"I am overwhelmed with gratitude for all the people who came out canvassing this weekend, from near and far, to make sure voters know what is at stake this Tuesday. https://t.co/fwxjwsWMLd"
58,2022-07-31 23:16:56+00:00,1553882433484898306,I made some new friends tonight canvassing in Bloomfield Township. #LevinFor11 #MI11 https://t.co/7aOqc1ZRUy
59,2022-07-31 21:45:23+00:00,1553859395217416193,Took 5 minutes out of canvassing today to hop on Zoom with over 230 of my friends from the Progressive Democrats of America. They’re going to be phone banking with us through Tuesday and you can too! 📱https://t.co/nXAjSMUDD3 https://t.co/JdPLk4S9JQ
60,2022-07-31 18:04:18+00:00,1553803756030001152,The people of Michigan’s 11th District deserve better than to have Republican millionaires and billionaires influence our election. Let’s send a message on Tuesday. #LevinFor11 #MI11 @BernieSanders https://t.co/nNdSFRxAel
61,2022-07-31 15:36:25+00:00,1553766538884386816,It's always a joy to be surrounded with friends new and old in the Ukrainian American community. I visited the Ukrainian American Cultural Center and reiterated my support. We cannot take our eyes off Putin's war of aggression in Ukraine. 🇺🇦 https://t.co/QRLZNeB9OY
62,2022-07-31 01:06:08+00:00,1553547525357027330,Wow! There were so many things to see at the Orchard Lake Fine Art Show today. Thank you to Keego Harbor Councilmember Ashley Attisha for showing me around. https://t.co/tWMFOPrqrV
63,2022-07-30 23:58:48+00:00,1553530581132222466,"It was such a joy to attend the Farmington Hills farmers market with Angie Smith! The variety of offerings from local vendors—from handmade products to fresh vegetables to CrossFit—was astounding. Thanks for taking me, Angie! https://t.co/jlIYmBcoff"
64,2022-07-30 15:54:33+00:00,1553408717080641537,"We are fired up to knock doors today! There are only THREE more days until the August 2nd election, and we’re running through the tape until we win. Let’s go! #MI11 #LevinFor11 #Jews4Andy https://t.co/caQ85st6mP"
65,2022-07-30 15:53:11+00:00,1553408373449805826,"“There is something profoundly wrong in our political system when a handful of billionaires, through super PACs that spend millions of dollars, try to defeat progressive candidates for Congress. That is not what democracy is about. That is what oligarchy is about.” @BernieSanders https://t.co/YSJYBS4ycT"
66,2022-07-30 15:22:55+00:00,1553400755167567872,RT if you’re knocking doors or making calls today! #LevinFor11
67,2022-07-30 00:33:59+00:00,1553177047845027840,"Thank you, Pontiac. https://t.co/dZg0JwjPpD"
68,2022-07-29 23:21:46+00:00,1553158872872935425,https://t.co/7cuAWzn9sa
69,2022-07-29 20:18:19+00:00,1553112705665581056,"🚨UPDATE: Doors open at 5PM, rally now starts at 7PM. See you soon! https://t.co/b8Q62r8piA"
70,2022-07-28 23:52:12+00:00,1552804145798733826,"I am heartbroken to learn about the passing of Zahra Abbas, beloved Board Member of the Young Democrats of Michigan and the first Arab-American DNC delegate from Michigan. Sending love to our friends grieving this tremendous loss. Rest in power, Zahra. https://t.co/ifHDl8hIqp"
71,2022-07-28 21:37:43+00:00,1552770302869966848,"So glad to be back home! I got to launch the last canvass of Democracy Summer and share green bandanas from @workingfamilies to commemorate my colleagues and my civil disobedience and our shared commitment to build a movement to protect abortion rights, no matter what. https://t.co/GDDYBkIEQh"
72,2022-07-28 19:12:24+00:00,1552733729340022784,"🚨TOMORROW🚨@berniesanders and @rashidatlaib are coming to PONTIAC! We can defeat the onslaught of spending from billionaire-funded corporate super PACs with people power! I hope you'll join us there. 

Sign up here: https://t.co/rRjZfCtU5y 🤝 https://t.co/cMmalDj5F2"
73,2022-07-28 17:17:51+00:00,1552704902392152065,"Before I headed back to DC, I had a ton of fun with launching yet another huge canvass out of Fifth Avenue in Royal Oak. @OurRevMichigan brought in the #PROAct Truck that has been to protests and events across the country. We can’t wait for Bernie to come to town tomorrow! https://t.co/KNPfPYkvC6"
74,2022-07-27 23:26:08+00:00,1552435198704644096,"Make your voice heard on August 2nd with a vote for Andy Levin!

➡️ Follow us on TikTok @andylevinmi

#michiganprimary #mi11 #troymichigan #ferndale #bloomfieldhills #pontiacmi #royaloakmichigan #farmingtonhillsmi #oaklandcounty https://t.co/aLuLLK5SD4"
75,2022-07-27 22:35:37+00:00,1552422486146519041,"The late Congressman John Lewis was famous for saying you only make progress when you need to stand up and make some ""good trouble"" for what's right. Congressman Lewis said of Andy, ""We need his voice. We need his leadership. And sometimes you have to get in the way."" https://t.co/GT8Zop8y4g"
76,2022-07-27 18:10:17+00:00,1552355710251548674,"In addition to knocking doors, my wife Mary is also one of our big sign installers! If you have a large space or commercial property that could use one, send us a message! https://t.co/lNcOhRrXWi"
77,2022-07-27 18:08:45+00:00,1552355324207792129,"My wife and high school sweetheart Mary Freeman canvasses 7 days a week, rain or shine, and just hit 4,000 doors! 🤩 Babe, you’re the best! She also gets many, many others out there with her, including our daughter Molly and all manner of friends, old and brand new. https://t.co/Qrgq8MDmn7"
78,2022-07-27 17:58:44+00:00,1552352802311127040,"I refuse to accept money from groups that support Republican insurrectionists. It’s not good for our elections, and a danger to our fragile democracy. https://t.co/eKI9qjnGSd"
79,2022-07-27 11:41:21+00:00,1552257834431176706,https://t.co/jBhVz8DWYF
80,2022-07-26 23:48:13+00:00,1552078366701912064,"While I’m in DC fighting to ensure that policing bills we’re considering include accountability and oversight, Christopher was able to represent me at Pontiac City Council. He shared about the $3.2M we helped to secure to reconstruct Golf Road and help drivers across the region. https://t.co/JbpLjszJuJ"
81,2022-07-26 19:59:33+00:00,1552020822717505537,"🔔Bernie Sanders is coming to Pontiac!🔔 Can we count on you there? 👀 

Sign up here ➡️ https://t.co/rRjZfCLvu8 https://t.co/IxsccZPatM"
82,2022-07-26 19:46:38+00:00,1552017570106048524,"This Friday, @berniesanders and @rashidatlaib are coming to PONTIAC! We can defeat the onslaught of spending from billionaire-funded corporate super PACs with people power! I hope you'll join us there. https://t.co/6zceP7Z9TI"
83,2022-07-26 18:15:20+00:00,1551994595805896705,"“These candidates represent the future of the Democratic Party and they understand the threat posed to our democracy by our out-of-control Supreme Court,"" — @brianefallon @WeDemandJustice #ExpandTheCourt #WontBackDown https://t.co/WDBXRjSzDM"
84,2022-07-26 17:21:34+00:00,1551981063731400706,One of the million reasons Sunday was so special was all the young women and girls who @ewarren took the time to meet — from the abortion rights activist who went viral after the Senator tweeted about her to the daughters joining their parents on the campaign trail day after day. https://t.co/MEwKf4cAy5
85,2022-07-25 12:59:22+00:00,1551552688617361416,Billionaires don’t want somebody like me in Congress. #GreenNewDeal #GND #MedicareForAll #M4A #TaxTheRich https://t.co/TTny1s3p2r
86,2022-07-25 01:10:14+00:00,1551374229655928833,"“When it comes to the battles over the climate crisis that is bearing down on us, I trust Andy.” — @ewarren #GreenNewDeal #GND #ClimateAction #LFG https://t.co/QrlAfKzpxY"
87,2022-07-25 00:06:33+00:00,1551358206458347521,.@AIPAC and their dark money super PAC has spent $3M+ to defeat me in my primary in #MI11—all because I stand up for human rights. I’ll be live with @mehdihasan on @MSNBC soon to discuss.
88,2022-07-24 22:47:15+00:00,1551338248554831873,Tonight I’ll join @mehdirhasan on @MSNBC to talk about the influx of Republican billionaires’ money in my Democratic primary for #MI11. Tune in at 8 PM ET. https://t.co/qTfxsgangk
89,2022-07-24 21:37:00+00:00,1551320569907482630,📷: Tejasvir Singh Rekhi @tejasphotos
90,2022-07-24 21:34:46+00:00,1551320006948003840,"“When it comes to #RoeVsWade, I trust Andy. When it comes to the battles over the climate crisis that is bearing down on us, I trust Andy. When it comes to standing up for working people, I trust Andy Levin. I trust Andy because he fights from the heart."" —Sen. @ewarren #MI11 https://t.co/63vrQXPAuv"
91,2022-07-24 16:00:00+00:00,1551235761105559552,"I had so much fun chatting with vendors and visitors at the Pontiac Arts Crawl on Saginaw Street just up the road from my house. And to think, next week we'll be dancing at our block party on Saginaw Street with @berniesanders! #MI11 https://t.co/FubLNqIxsz"
92,2022-07-24 13:47:36+00:00,1551202440254574592,"We will have a limited number of ponchos on hand for those staying to canvass, but we encourage you to bring your outdoor gear if you can join us on the doors. We only have 9️⃣ days left to knock every door and knock this race out of the park! See you soon! -Team Levin"
93,2022-07-24 13:46:39+00:00,1551202201313460224,"While Bailey doesn’t mind a walk in the rain, we wanted to confirm that the @ewarren Rally is ON and we will be nice and dry inside the Crofoot. 🐶🐶🐶 

https://t.co/jpuujmvqfh https://t.co/KBv85lyIeT"
94,2022-07-24 13:00:00+00:00,1551190462190567424,I loved visiting the Muslim Community Mosque in Farmington Hills with Dr. Abdul El-Sayed and the Muslim Unity Center near my house in Bloomfield Twp. #MI11 https://t.co/igRWvkNaS4
95,2022-07-23 17:18:47+00:00,1550893199090130945,Out knocking doors in Farmington Hills just down the road from our house! 1️⃣0️⃣ days to go and we're knocking every one of them! #MI11 https://t.co/LPlDBG3BaL
96,2022-07-22 22:14:51+00:00,1550605317389668352,"We had a great party with local LGBTQ+ activists and candidates, our Democracy Summeristas and our steadfast supporters. A neighbor asked what we were celebrating and I earned another vote! https://t.co/fz1dw1TRDR"
97,2022-07-22 22:14:20+00:00,1550605187588521985,"I just can’t express how much it meant to have my friend @MarkPocan in town — to talk about our shared fight against the corruption of our political system, yes, but also to celebrate this incredible campaign. #MI11 https://t.co/rMkGeha1Bm"
98,2022-07-22 15:34:19+00:00,1550504519917772801,My opponent is supported by Republican megadonors corrupting Democratic primaries across the country. I’m live with @markpocan and local advocates to condemn the influx of outside spending in #MI11. https://t.co/sxQWGxOgUn
99,2022-07-22 15:14:37+00:00,1550499564096028675,"I’m live with @markpocan, local clergy and democracy advocates to discuss the influx of @AIPAC and dark money in the #MI11 race. Tune in! 👇🏼 https://t.co/sxQWGxOgUn"
100,2022-07-21 21:30:33+00:00,1550231782536232963,@janeclimatepac
101,2022-07-21 20:28:04+00:00,1550216056857296897,"🥰 Register here: https://t.co/rRjZfCLvu8 🥰

@ewarren @janefonda @janefondaclimatepac https://t.co/bluhZ2FZYI"
102,2022-07-21 18:30:20+00:00,1550186431481610241,"🚨TODAY: @ayannapressley is hosting an #MI11 phonebank at 6 PM🚨

Link in bio ✨

#Repost @sunriseoaklandcounty https://t.co/6WbPLQRkth"
103,2022-07-21 01:20:53+00:00,1549927359813455878,"🚨Jane Fonda is coming to Michigan!🚨 

Can you join us at a rally? 💃

➡️ https://t.co/rRjZfCLvu8 ⬅️ https://t.co/WPUtaTlOKT"
104,2022-07-20 23:47:25+00:00,1549903837955227648,"Have you bought your ticket to meet Mark yet? 🏳️‍🌈 
Link in bio! https://t.co/vYYSNYUHRi"
105,2022-07-20 21:36:48+00:00,1549870965420658693,#NoContractNoPeace https://t.co/vUGgAUJNZt
106,2022-07-20 20:55:46+00:00,1549860641221083138,https://t.co/VwoIOttcQM
107,2022-07-20 20:55:30+00:00,1549860574426701825,https://t.co/eDiUEdtUL3
108,2022-07-20 20:35:54+00:00,1549855642965401606,.@unitehere https://t.co/MT3PSvWBEZ
109,2022-07-20 20:32:37+00:00,1549854814317805569,I led a campaign at @AFLCIO to wake America up to the fact that workers rights are human rights. Some of the arrests I took in the past were on this very issue. Here we are in 2022 with @UNITEHERE workers in the halls of Congress not able to achieve a 1st contract. Unacceptable. https://t.co/16Wt5OuQ6a
110,2022-07-20 15:42:40+00:00,1549781845155483648,".@ewarren is coming to Pontiac on Sunday! Have your registered? https://t.co/jpuujmvqfh
•
•
•
•
#lfg #abortionrights #mi11 #wontbackdown https://t.co/ii6KZSSMo4"
111,2022-07-20 12:56:49+00:00,1549740107896442881,"We support Andy Levin because he leads with his Jewish values…His record on health care, climate change, reproductive justice, and gun violence reflects his consistent alignment with the priority issues of America’s Jewish community.

Signed, https://t.co/sJcQhoA9kv"
112,2022-07-19 19:10:54+00:00,1549471861226053635,"I’m willing to do whatever it takes to protect abortion rights—even if it means getting arrested. I joined my Democratic Women’s Caucus colleagues in a civil disobedience action outside the Supreme Court. We won’t go back! 
@cpdaction @rashidatlaib #wontbackdown https://t.co/3Pzws27IOY"
