,Created at,User ID,Text
206,2022-06-22 20:03:35+00:00,1539700649381822464,"When I say Mary knocks doors every day — I mean every day! 90+ degrees? No matter! Thanks to Nia Luke for inviting her in to cool down while she was out in Pontiac. And now she has our son Ben and our niece and nephew home to join her, too. ☀️ https://t.co/7rPfvNXYVr"
207,2022-06-22 14:52:58+00:00,1539622479160872961,“Andy is one of us. Organizing is in his blood and working-class in his heart. He always fights to build power for everyday people and a world of promise for our children.” — @FlyingWithSara @afa_cwa @CWAUnion https://t.co/MLdiXqmvyc
208,2022-06-21 20:31:56+00:00,1539345396803244032,"I was blown away by the huge turnout, the army of volunteers feeding so many hundreds of people, and what a great time everyone was having!"
209,2022-06-21 20:30:50+00:00,1539345116321787904,"Thanks to Pontiac’s ISSO Shree Swaminarayan Temple and the Gujarati Samaj for welcoming me to your Kite Festival! In India, the kite festival signals the end of winter and the beginning of the harvest. https://t.co/0Fm8x0jFX0"
210,2022-06-21 20:23:43+00:00,1539343326410842113,"Incredibly moving to be with the Drikers, the Fensters and so many other neighbors from Huntington Woods and environs who believe in our fight for justice. We’ll keep defending democracy at home and abroad, a free press and the rights of all people. #MI11 https://t.co/fZqzgPmlfp"
211,2022-06-21 15:01:10+00:00,1539262152921468930,"""We are proud to endorse his campaign and look forward to continuing to work with him in Congress."" 
— Sean McBrearty, Legislative and Policy Director of @CleanWaterMI #MI11 https://t.co/t72uiwPoCj"
212,2022-06-21 14:51:41+00:00,1539259770393198596,"""We need Congressman Levin’s bold, creative and courageous leadership in Congress now more than ever."" — Mary Brady-Enerson, Director of @CleanWaterMI 

#WaterIsLife #WaterIsAHumanRight #ClimateActionNow #GreenNewDeal #EnvironmentalJustice https://t.co/u7SRvVI8cZ"
213,2022-06-20 22:19:49+00:00,1539010158537351212,"In a time when attacking our LGBTQ siblings is a central feature of Republican policy making, and anti-trans and anti-gay bills spread across the country like wildfire, it is vital to grow LGBTQ representation at every level of government."
214,2022-06-20 22:19:28+00:00,1539010070683451392,Thanks to Dave Garcia and @GoAffirmations for hosting the Unity Fund Summer Fundraiser and to Unity Fund participants for helping so many great candidates. #pridemonth #pride https://t.co/4fVnzxRrv0
215,2022-06-20 19:14:20+00:00,1538963476521132038,"""For our schools, libraries, housing, and parks, Andy Levin is the fighter we need. In Congress, Levin has shown time and time again that he will stand up for our local communities and support the public spaces we all enjoy. Let’s get Andy back to Congress!"" — Raylon Leaks-May https://t.co/yU0gXTNGkJ"
216,2022-06-19 19:43:09+00:00,1538608342679048192,"Dad taught me to partner with Black leaders in the fight for voting rights, economic justice, quality public education and more. I can only hope I’m still fighting this hard at age 90! We’ve got a lot of work ahead to achieve true justice and equality for Black Americans. #MI11 https://t.co/tpOsoIInPo"
217,2022-06-19 19:09:02+00:00,1538599757895065601,"It’s quite meaningful to me to be celebrating #Juneteenth and #FathersDay on the same day in Pontiac with my dad. We’ve been on the campaign trail together for decades, my dad teaching me what it means to be an anti-racist ally. 🧵 https://t.co/9qwRQHsCSu"
218,2022-06-19 15:59:34+00:00,1538552075524706304,"Closing out #Juneteenth events yesterday in Farmington and gearing up for today, I want to thank all of the Black activists welcoming us into their spaces and their celebrations. As we commemorate the end of slavery, let’s commit to dismantling systemic racism. https://t.co/cgsMi4ZNXo"
219,2022-06-19 11:48:14+00:00,1538488826196377600,"What a fantastic surprise to have dinner with my colleague-to-be @SummerForPA! We had a blast unpacking our races and talking about the imperative of building a movement for justice for all-all-all people with @SEIU leader Scott Holiday and my wife Mary, fresh off canvassing. https://t.co/eznOJFZSng"
220,2022-06-18 21:42:02+00:00,1538275870896431109,Great work by Commissioner Michelle Elder getting the Anti-Racism Committee off the ground in Huntington Woods. At their #Juneteenth event I got to meet with representatives from the Berkley African American Parents Network and the Diversity Club from my former high school! https://t.co/aoXdGsPzB6
221,2022-06-18 21:17:38+00:00,1538269733300191234,What a truly a unique honor to celebrate #Juneteenth in West Bloomfield with a few of the legendary Tuskegee Airmen! Dad and I also got to meet students and some really cool vendors. https://t.co/5QvfxBix2k
222,2022-06-18 15:42:00+00:00,1538185266329968642,Another Andy Levin sign in a native lawn! You love to see it! 🌎 💚 #MI11 https://t.co/EPlzEOL8b6
223,2022-06-17 20:33:37+00:00,1537896268235563010,"Even when I’m in DC, #TeamLevin is on the trail in #MI11. Christopher spoke at the @SEIU Local 1 Justice for Janitors event about the jobs we helped save at the Levin Courthouse. Next, he hit Oak Park, Huntington Woods and Royal Oak Township’s Dem Club #Juneteenth Picnic. https://t.co/JjlH1d00OR"
224,2022-06-17 01:09:28+00:00,1537603299926589442,Me want more unions! Endless unions! No barriers to unions for all workers who want them!! https://t.co/tLklfaJA6S
225,2022-06-16 18:14:18+00:00,1537498818308100097,"Activists like @JaneFonda have been sounding the alarm for years, and we’ve reached a point of no return. Nevertheless, I remain hopeful that we can meet this challenge, transform our society and create millions of good, union jobs in the process. https://t.co/TysJOw5gdC"
226,2022-06-16 18:11:07+00:00,1537498016931782656,"Our very planet, our Great Lakes, our communities, and our health are all on the line in this election. I’m honored to have @JaneFonda's faith in my ability to help lead the way. 

#MI11 #GreenNewDeal #ClimateCantWait @janeclimatepac https://t.co/Sp5bAxywQy"
227,2022-06-16 18:08:04+00:00,1537497248778661890,"Dude, yoga with a senator-to-be? I’ll have to fire up my backbends and everything. Love it!!! https://t.co/JnhmF0ljDw"
228,2022-06-15 17:38:39+00:00,1537127458742358018,We’re building momentum and this grassroots movement. There’s no time to slow down — we’ve got an election to win! Help continue to grow this coalition and represent the new 11th District: https://t.co/97Zm7hZbjE
229,2022-06-15 14:41:24+00:00,1537082852851974145,"“Every day, AFT Michigan knows that Andy Levin fights not only for respectable pay and well-funded and safe public schools and college campuses — but that he is a leading voice for the labor movement in the halls of Congress,” — David Hecker, @aftmichigan President https://t.co/gFwJXXH6zG"
230,2022-06-15 00:45:35+00:00,1536872515137687552,"It takes a lot of resources to keep an ad like this one running. Can pitch into our campaign to keep it on the air? 

https://t.co/Irg6668evu"
231,2022-06-14 18:27:04+00:00,1536777257435467777,"I’m honored to have @ewarren’s support for my reelection campaign in #MI11 to keep fighting to #ProtectRoe, to stop gun violence and more. Here is our newest ad: https://t.co/djNljxdnV4"
232,2022-06-14 13:19:35+00:00,1536699874892185602,"Pontiac! You can pick up an Andy Levin for Congress sign at @TheCrofoot on Saginaw Street, Monday - Friday 9AM to 5PM or anytime there is a show! #MI11

https://t.co/nfFrB5EhWs https://t.co/cRDZGhgQif"
233,2022-06-13 22:41:25+00:00,1536478878591483904,Thank you to the brave Troy Firefighters responding to the Somerset fire. I pray everyone is safe. https://t.co/CM8ouxChxb
234,2022-06-12 17:24:16+00:00,1536036678493683805,"If we deeply respect other people, act with integrity and always seek the truth, we will find a way forward. 5/ https://t.co/yWzssQ7De5"
235,2022-06-12 17:23:23+00:00,1536036452190011394,"As we face the pile-up of problems bedeviling our nation, from authoritarianism to the overheating of our planet to surging white supremacy to the epidemic of gun violence and more, it’s calming to me that we can stand on Uncle Carl’s shoulders. 4/ https://t.co/uP4ncpkQIl"
236,2022-06-12 17:22:10+00:00,1536036149193498624,"He understood how fragile our democracy is, and that its very survival was hanging in the balance when he passed away. Ever the champion of bipartisanship, he would have been so proud of the performance of our fierce ideological foe, Liz Cheney. Country before party. 
3/"
237,2022-06-12 17:21:48+00:00,1536036055329165317,"Carl so loved our country. He was a student of American history. He collected everything – stamps, coins, memorabilia. Among his favorite items was a framed, original copy of the Chicago Tribune with the headline plastered across the front page, Dewey Defeats Truman. 
2/ https://t.co/jT5iW0DqCL"
238,2022-06-12 17:21:12+00:00,1536035904405524480,I think it’s fitting that we are remembering Uncle Carl’s life as the House Select Committee to Investigate the January 6th Attack on the Capitol has finally begun its public hearings. 🧵 1/
239,2022-06-11 23:59:46+00:00,1535773818643525633,"We had a wide-ranging discussion on: 
▫️a #GreenNewDeal
▫️my bill to provide two years of free community college for all
▫️the importance of unions 
▫️protecting abortion rights and voting rights 
▫️why health care is a human right"
240,2022-06-11 23:59:30+00:00,1535773754005114880,"The Talwars in Farmington Hills have been amazing supporters, joining Dad at the Farmington Art Fair to talk to voters and now hosting a house party for me to meet residents of the new #MI11. Justice Bernstein joined to break down the MI Supreme Court race! https://t.co/npYXAtI8ai"
241,2022-06-11 19:06:03+00:00,1535699901576880130,"In a time of reflection, mourning, and anger, protests like these give me hope. They give me hope that my kids — and the kids of my kids — might be able to go to school without the fear of life-threatening violence. https://t.co/C2CsoKIh9a"
242,2022-06-11 19:00:46+00:00,1535698573945356296,"Honored and humbled to stand in solidarity with the young people leading the way on gun violence prevention. Thank you to the organizers of @AMarch4OurLives, @RashidaTlaib and to all the parents, grandparents, teachers &amp; students urging local, state, and federal action. https://t.co/HiIgdlkK0W"
243,2022-06-10 14:00:21+00:00,1535260581892087808,"Get vaccinated! Get boosted! Get your at-home tests! All three could save your life. 

For more information on where to get vaccinated and boosted, visit https://t.co/rwBpOXFrkS.

And to request your free rapid COVID-19 tests, head to https://t.co/m0hignOEHC."
244,2022-06-10 14:00:20+00:00,1535260580600242177,"We are far from through with this pandemic. Cases are rising, and with spring turning into summer, there’s reason to expect things could get much worse. https://t.co/xKiqEzevS7"
245,2022-06-10 11:01:40+00:00,1535215614498947072,"I just can’t get enough of these stories about workers organizing their own unions from the bottom up! As someone who worked at the @AFLCIO for years, I can love our established unions and also say, “Let 1,000 worker power flowers bloom!” https://t.co/o7cVdEgLA6"
246,2022-06-09 18:46:46+00:00,1534970275346927628,"Huge congrats to the workers of the Clinton Township @Starbucks, who I had the pleasure to meet in February. Their hard work and solidarity will make the store a better place to work for everyone. When we fight, we win! #1u https://t.co/l3AMpqGB0h"
247,2022-06-09 14:34:20+00:00,1534906748338855936,BREAKING NEWS: People like unions! https://t.co/9qxwbrnNSj
248,2022-06-08 19:37:05+00:00,1534620551263797251,"In Congress, I will uplift their voices to bring Pontiac the resources and the policies they deserve."
249,2022-06-08 19:36:33+00:00,1534620416991535106,"Pontiac knows what it means to build resilient communities and to fight for justice. That’s why I am so honored to earn this kind of diverse support from elected officials, activists and small business owners.  #MI11 https://t.co/oGe2vzJzN1"
250,2022-06-08 14:02:39+00:00,1534536384941281283,"This event was incredibly moving, and I’m more inspired that ever to get back to Washington and pass Protect our Children and to take action on gun violence. https://t.co/Y806DrR8Ug"
251,2022-06-07 22:49:10+00:00,1534306501652889601,I made a special effort to ensure that this policy would not criminalize Black and Brown students and parents disproportionately and would study the impacts on our communities of color. I will keep fighting for equitable gun sense policy.
252,2022-06-07 22:48:38+00:00,1534306364826210305,"In the wake of #Oxford, I wrote legislation supported by every major gun violence prevention group and teachers unions to curb school shootings. I’m proud to earn the @MomsDemand Candidate Distinction and to be fighting for commonsense policies in Congress at this very moment. https://t.co/fiqoISA93I"
253,2022-06-07 20:48:54+00:00,1534276234825318400,"“Andy Levin has a demonstrated track record of representing the working people of Michigan. He is a strong, clear voice for progressive change and environmental protection. Join me in voting for Andy Levin on Tuesday, August 2.” — Jeff Kingzett, Pontiac #MI11 https://t.co/wvRT6p3wFT"
254,2022-06-07 17:36:28+00:00,1534227805428404224,"We’re hard at work bringing resources home to Michigan. I was proud to bring home over $6M in Green New Deal project funding last year, and I’m excited about the water projects we submitted this year, too. https://t.co/xThjU9Ud7H"
255,2022-06-07 15:43:31+00:00,1534199384614785025,"Flying back to DC, ready to pass more meaningful gun reform measures through the House. And happened to be seated next to my old clean energy buddy Kyle Peczynski! https://t.co/wfqFm4nUXn"
256,2022-06-07 00:55:28+00:00,1533975896880779264,"Thanks to my friend @RashidaTlaib for bringing the #GetTheLeadOut Tour to Pontiac to show that when organizers come to Washington, we stay #RootedInCommunity. I’m proud to join the Get the Lead Out of Water Caucus and say #WaterIsAHumanRight. 📷: @ThreeLyons https://t.co/hAhx5ZL50G"
257,2022-06-06 23:00:37+00:00,1533946994753998849,"Meanwhile, Tameka is helping to lead a ballot initiative to amend our state constitution and codify abortion rights to provide #ReproductiveFreedomForAll. What can’t she do?! &lt;2/2&gt;"
258,2022-06-06 23:00:03+00:00,1533946851363274754,"Congrats Madame Chairwoman (!) Tameka Ramsey of the Pontiac Charter Commission! The commission is charged with revising the city’s charter, or constitution. &lt;1/2&gt; https://t.co/h4BcHVHB04"
259,2022-06-06 17:40:04+00:00,1533866325818363904,Use of footage and images authorized by the John R. Lewis Trust.
260,2022-06-06 16:05:40+00:00,1533842570966605825,"John Lewis was a hero and a dear friend to our family, and I’m honored to share our next TV ad highlighting his visit to the new #MI11 in 2018. https://t.co/nK5il3vsyW"
261,2022-06-06 15:32:48+00:00,1533834297345458176,"""But Andy Levin is more. He is a humanitarian who knows that the path to justice isn’t always easy or popular. We need to send Andy back to Washington because I know he will walk that path."" — Mayor @AHammoudMI https://t.co/ssIQ6KfS76"
262,2022-06-05 21:47:33+00:00,1533566218573172741,"What an honor to attend services and pray with the people of Hopewell Baptist Church on Rev. Terrance Garrett’s 14th pastoral anniversary there. It was a thrill to hear guest preacher Rev. Dr. Robert Smith, who clearly thinks so much of Pastor Garrett. I can’t wait to join again! https://t.co/N1PHjLSLVO"
263,2022-06-05 20:30:44+00:00,1533546888821186577,"At the Farmington Art Fair this afternoon, Sandy Levin is doing what he loves — talking to voters to re-elect Andy! #MI11 https://t.co/vwEBHqW2KR"
264,2022-06-05 19:03:39+00:00,1533524970994794500,"Wow! Another huge canvass with incredible energy from voters. This time, we were in Ferndale with my friend @cavell4commish…and we were lucky to have @MalloryMcMorrow stop by! We’re gonna win this on the doors, folks, I can feel it! #MI11 https://t.co/NgP4uwjFav"
265,2022-06-04 23:04:28+00:00,1533223188745924608,"It was super cool to end a #Pride full of personal expressions and inclusivity at @GoAffirmations with Dave Garcia, @TheBlindJustice and our #DemocracySummer fellows! https://t.co/SeAiiW644u"
266,2022-06-04 22:59:35+00:00,1533221957109432321,"This was the most joyously crowded #Pride festival yet in Ferndale and it was so fun to visit with everybody from my queer son Koby at the T’Chiyah booth, to Grace an 81-year-old trans activist, to Ferndale Councilwoman Raylon Leaks-May and Pleasant Ridge Mayor Bret Scott! https://t.co/lTabuwkerb"
267,2022-06-04 21:05:39+00:00,1533193288236294144,The response on the doors as we meet new voters is exceeding all of our expectations. #MI11 https://t.co/VD06VG3Kh2
268,2022-06-04 21:03:45+00:00,1533192810089918465,"I’m blown away by the turnout at our Youth Canvass in Troy today. Councilwoman @Rebecca4Troy and @djk4909 did such a great job organizing. Thanks to @sunrisemvmtoc, @sunrise_troy and @mikalforpontiac for coming through! https://t.co/u7eBXGZ7JH"
269,2022-06-04 20:02:12+00:00,1533177320650973185,"Royal Oak Dems is back in-person and on zoom! We talked about how our hometown race has garnered national attention about the direction of the Party. I’m proud of the grassroots movement we’re building that’s accountable to our Oakland County families, not special interests. https://t.co/wLJ9es0dBs"
270,2022-06-04 11:30:00+00:00,1533048417387220993,"What an honor to have Whip  @ClyburnSC06 on Belle Isle for a gorgeous #MI14 Annual Dinner, talking about House Democrats’ work to reduce costs for Americans, like health care and higher education. https://t.co/dAYpiW1Aen"
271,2022-06-03 22:21:05+00:00,1532849882712645632,"""Some politicians are public servants. And some politicians are change-makers. Andy Levin is both. His hands-on, unapologetically progressive vision not only leads us toward justice, but fights for a future that the people of Michigan deserve."" Dr. @MonaHannaA #MI11 https://t.co/ts7d1K5nm2"
272,2022-06-03 21:33:20+00:00,1532837866849636353,https://t.co/QXbZ6OuLaD
273,2022-06-03 17:02:40+00:00,1532769749783957508,"I’m overwhelmed by the encouraging messages since this clip was shared. Y’all, @AIPAC has already started running digital ads against me. I need you to chip in so we can send a message that they won’t silence our moral movement: https://t.co/i8XLXPAabw https://t.co/xCkk3Etrkn"
274,2022-06-03 01:44:39+00:00,1532538723333718028,"We discussed the fight to protect abortion rights, save our planet from overheating, and deliver police reform. It was an honor to join you tonight, and I look forward to our continued work together to build a more just and equitable world. Join us Sat 6/4 https://t.co/Ljdph3OvGn"
275,2022-06-03 01:41:42+00:00,1532537980505702401,"Wow, the youth at tonight’s Birmingham-Bloomfield Democratic Club Forum give me such hope for the future. They are exactly what we need—young people dedicated to building a movement for change and talking about the real issues! https://t.co/DrotBMd5aC"
276,2022-06-02 23:15:04+00:00,1532501077618196504,We are live at the Youth Forum for #MI11! https://t.co/ufZ5NNEnAc
277,2022-06-02 18:24:40+00:00,1532427998363803648,"Learn more about the work my friend @hboothgo did with the Jane Collective, an underground abortion service before Roe v. Wade: https://t.co/NwbVYkKxQa https://t.co/ppctGm6Oxj"
278,2022-06-02 01:34:34+00:00,1532173796098068481,"As we celebrate #Pride, I’m thinking of the resilience of the LGBTQIA+ community, and especially the trans and non-binary kids, who are growing up amid relentless anti-LGBTQ+ legislation. This month and every month, your Congressman has got your back. You are loved. You belong. https://t.co/sUHyE8TxhF"
279,2022-06-02 01:15:54+00:00,1532169100792832003,"Nowhere I’d rather be tonight than the OPHW Dem Club, which is united at last in the new #MI11. We talked about the movement we need to build to curb gun violence, protect our rights and achieve a cool, peaceful planet in our lifetime. Love the activism and energy in this group! https://t.co/tGrXLU1Ilp"
280,2022-06-01 18:51:20+00:00,1532072322072739840,"Did you catch our first ad? Feat. @APWUnational @CWAUnion 
@SEIU @UNITEHERE ✊ #1u https://t.co/GXlGAuqbRV"
281,2022-05-31 23:58:15+00:00,1531787172717768706,I’m so excited to share my first TV ad with you! What do you think? #MI11 https://t.co/C2epHxNxWj
282,2022-05-31 16:27:40+00:00,1531673777687302144,"I look forward to fighting my hardest to defend @dananessel as our AG, lifting up all of the incredible work she has done and our ability to engage in productive dialogue on difficult topics."
283,2022-05-31 16:26:55+00:00,1531673590722093057,"However, the insurrection is not a policy disagreement, it’s an undoing of our democracy. Supporting a perpetrator of the Big Lie to become our state’s top law enforcement official is unacceptable. Period."
284,2022-05-31 15:52:38+00:00,1531664962464227329,"Kensu’s innocence was something my Uncle Carl believed in and fought for, and I hold firm that friends like Dana and I can have policy disagreements — in fact, we’re the better for it. It makes for a robust debate and better public service."
285,2022-05-31 15:11:14+00:00,1531654543481704449,"I was shocked to see this tweet from Paula Kensu, whom I’ve never met. Let me be clear: @DanaNessel is a great AG for MI, and I support her 💯. https://t.co/ler97GJnvz"
286,2022-05-30 23:50:16+00:00,1531422774215987200,It was so cool to be right in the heart of Pontiac with Mexican Americans from all throughout the region and to share the stage with Banda Seducción 🐍. The music and the energy was incredible! https://t.co/WtMpgOOXCY
287,2022-05-30 21:38:53+00:00,1531389711360589825,"I got to see @MomsDemand,  @boyscouts, and meet the Wahoo Baseball Club at the Royal Oak Parade. They play the 1864 version of America’s pasttime with wooden bats and no gloves. Big Willy, Sweepy and Woody gave me a great run down of the game. https://t.co/sHxVrptCdb"
288,2022-05-30 19:51:26+00:00,1531362670062014464,"It was amazing to connect with Mayor @Greimel4Pontiac, Councilmen Carrington and @mikalforpontiac, Commissioner @PowellPontiac and @MomsDemand Action — especially my new best friend Riley. &lt;3/3&gt; https://t.co/BzyajFsefh"
289,2022-05-30 19:44:41+00:00,1531360972971048961,I’m in awe of the event and march that Deleah organized today. It’s going to take movement just like this in communities across America demanding action on gun violence….and I will be right there with you. &lt;2/3&gt;
290,2022-05-30 19:43:10+00:00,1531360588475076611,"I met with @DeleahSharp and learned about Identify Your Dream when I first got to Congress, and sadly, we have passed bill after bill to address gun violence in the House since that day, and none have gone anywhere in the Senate because of the filibuster. #StompOutViolence &lt;1/3&gt; https://t.co/g2pSNgFHfj"
291,2022-05-30 18:26:53+00:00,1531341392504664071,#MemorialDay2022 https://t.co/k4j44EZrwM
292,2022-05-30 18:25:59+00:00,1531341166528106497,"I’m so excited about Farmington and Farmington Hills being in the new #MI11, and Dad, Mary and I loved marching in the American Legion’s parade. We got to catch up with longtime Levin Family friends like @JocelynBenson and the newest member of #TeamLevin, Councilman Mike Bridges! https://t.co/XAjNVaQi31"
293,2022-05-30 18:07:26+00:00,1531336495394701313,"We had an amazing time as always at the Royal Oak Memorial Parade and Dad was a huge hit on the route with his neighbors. Honoring veterans, service members, military families and fallen soldiers is so central to RO’s identity, and they really pull out all the stops for this day. https://t.co/GAcJn8aYQb"
294,2022-05-30 01:02:57+00:00,1531078678083424259,"Team Levin covered three cities in #MI11 this weekend … including Dad knocking on his neighbors’ doors in Royal Oak! The conversations are so positive, and voters are very excited about the wins we’ve secured and the movement we’re building — together! https://t.co/lIUa7zVa1e"
295,2022-05-29 23:39:38+00:00,1531057710069952518,I look forward to continuing the work with Bishop Gibson and delivering for Pontiac. #MI11
296,2022-05-29 23:39:11+00:00,1531057595653537793,"Thank you Bishop Antonio Gibson for having me to the New Experience Church of Christ today. In addition to praying and praising, we got a chance to sit down and talk about gun violence, the bloated military budget and our family histories. https://t.co/e6V8EfJnev"
297,2022-05-28 19:51:28+00:00,1530637901842743296,Canvassing is democracy in action. I had great conversations with so many wonderful people today. Perhaps my favorite was a veteran who needs some help with a couple matters. No better person to spend a little time and make an action plan with on Memorial Day weekend. https://t.co/vL5gS213Mf
298,2022-05-27 19:12:42+00:00,1530265758143549442,"“Andy Levin has time and time again been on the right side of history and has championed the progressive movement since day one. With this endorsement, the youth of the party are saying they want a progressive champion to represent the new #MI11; not business as usual."" https://t.co/7s8ddwUAwL"
299,2022-05-27 17:54:59+00:00,1530246202771611657,"On the doors, Mary met the parents of yet another couple that was able to get married because of the immigration work our office has done! My sweetheart bringing home sweet stories. 

&amp;:-) https://t.co/mNDKqD6cSp"
