,Created at,User ID,Text
339,2020-10-23 22:23:56+00:00,1319766534299045890,"Great to be in Amherst &amp; Milford today with @shannonchandley to talk about voting &amp; meet with business owners.

As we build back from this pandemic, it's crucial we support our small businesses—that's why I'm fighting in Congress to bring more support to NH for those hit hardest. https://t.co/UVIgb9ZOBD"
340,2020-10-23 15:55:00+00:00,1319668655131688961,"This pandemic has forced millions out of the workforce, a disproportionate number of them women.

To all the moms out there struggling with COVID-19: I hear you, I see you, and I want to support you. #NHpolitics https://t.co/dcnFIcaEK7"
341,2020-10-23 14:21:12+00:00,1319645049165107200,"The only way we're going to get through this pandemic is by listening to experts and following the science. Last night's #debate made clear: we need leadership who puts facts over politics to get us back on track.

That's what I'm doing in Congress, and why I support @JoeBiden. https://t.co/PqEgFnvanr"
342,2020-10-23 00:15:05+00:00,1319432118133530624,"In Congress, I'm focused on bringing together Republicans and Democrats to deliver results for Granite Staters. 

I'm running for re-election with a plan to build back better from this pandemic, because we're all in this together.
#WMURDebate #nhpolitics
https://t.co/bKyWxqpiVn"
343,2020-10-22 23:54:43+00:00,1319426992018698240,"Protecting our planet and combating the effects of climate change does not have to come at the cost of the economy—we can build the clean energy economy of the future, together. That's what I'm fighting for every day in Congress. #WMURDebate #NHpolitics https://t.co/mG1aSxLfO4"
344,2020-10-22 23:34:29+00:00,1319421898904768512,"I believe a woman’s reproductive decisions are between her and her doctor, not the government.

#WMUR #NHpolitics #NH02"
345,2020-10-22 23:17:06+00:00,1319417524493144066,"The only way we're going to get through COVID-19 is together. That’s why I’m fighting for relief funding for our hospitals and small businesses directly impacted by the virus, struggling individuals, and our families who need help.

#WMURDebate #NHpolitics
https://t.co/CXCGyfx6lD"
346,2020-10-22 23:09:42+00:00,1319415664294154240,"Since the COVID-19 pandemic began, I’ve worked with scientists, doctors, and experts to combat the virus and save lives. As we continue to build back, I will always prioritize science and the wellbeing of Granite Staters over politics. 

#WMURDebate #NHpolitics #NH02"
347,2020-10-22 22:52:13+00:00,1319411263924035584,"Thank you to all the supporters who came out tonight before the #WMURDebate! 

Tune in to watch live at 7:00pm on @WMUR9 or online at https://t.co/2WRhnqJ5N8. #NHpolitics #NH02 https://t.co/Q205wSWXbC"
348,2020-10-22 20:34:19+00:00,1319376559065747457,"Join me tonight at 7:00pm for the final debate of this campaign!

Watch on @WMUR9 or online at https://t.co/2WRhnqJ5N8. #WMURDebate #NH02 #NHpolitics https://t.co/OEDqBoEjdf"
349,2020-10-22 19:02:39+00:00,1319353493606567938,"We are so proud of you, Brayden! 

Thank you for showing us how to be courageous and to always persevere, the New Hampshire way. https://t.co/DvRT3PLjdu"
350,2020-10-22 18:53:33+00:00,1319351200836354049,"The partisan lawsuit against the Affordable Care Act does nothing but harm the American people and our health care—we should improve and build on the #ACA to create a system that works for everyone, not tear it down without a replacement. #nhpolitics 

➡️https://t.co/27wS73OjwO https://t.co/sO7hfH1ltr"
351,2020-10-22 16:07:11+00:00,1319309335760162824,"This election, we have the opportunity to reunite our country, reclaim our shared values of respect, compassion, and resiliency, and pave a better path forward. 

Together, we can build back better. #VOTE
https://t.co/v5FubW0hj0"
352,2020-10-22 14:17:49+00:00,1319281811831230464,"It's so disappointing to see the Senate and the White House playing politics with a much needed COVID-19 relief package.

I'm urging my colleagues to come together and get a bill passed for the American people. This cannot wait.
https://t.co/fI9ashgYSp"
353,2020-10-22 00:39:10+00:00,1319075792685535232,This election is about more than just one party or another—it's about bringing our country back together after 4 years of division. #Vote by November 3rd. https://t.co/9AzkGno7eJ
354,2020-10-21 23:03:16+00:00,1319051658899369984,"Join me and @GabbyGiffords tonight at 8:00PM to talk about why this #election is so important. 

Register below! https://t.co/5jDyiEvEbx"
355,2020-10-21 20:25:33+00:00,1319011967558967297,"This election is so important, and your vote will decide the future of our state and our country for the next four years. 

If you haven’t cast your ballot yet, visit https://t.co/4oA7gmdPdC today and make your plan to #vote. 

Don't sit this one out. https://t.co/iFjxP3x8KO"
356,2020-10-21 17:56:51+00:00,1318974544221274117,"I believe everyone deserves access to affordable health care.

I believe insurance companies should cover those with pre-existing conditions.

I believe we should build on the #ACA to improve access—not tear it down without a replacement. #NHpolitics

➡️ https://t.co/QKHutP3nvU https://t.co/4mzTwJ6SCq"
357,2020-10-21 16:24:55+00:00,1318951410340331521,"It was great to be with @ProtectCareNH's Jayme Simoes, Dr. Marie Ramas, Secretary Kathleen @Sebelius, Nancy Glynn and @Maggie_Hassan today to talk about open enrollment starting November 1 and plans to expand the #ACA to improve our nation’s health care system—not tear it down."
358,2020-10-21 16:24:04+00:00,1318951195864682498,The Affordable Care Act has been a crucial step in expanding access to care for Granite Staters and millions of Americans. We should work together across party lines to improve the #ACA to lower costs and ensure it works for everyone. #NHpolitics https://t.co/rTXi9OtAjI
359,2020-10-20 22:56:30+00:00,1318687566888132611,"It was so great to meet and talk with the employees of @AnheuserBusch here in New Hampshire this evening, and to hear their thoughts and answer their questions.

A big thank you to Anheuser-Busch for having me and for your commitment to our communities. #NHpolitics #NH02 https://t.co/xzWUdlgnvF"
360,2020-10-20 18:57:29+00:00,1318627413815943175,"We have just two weeks left in this election. That's 14 days to make a plan to vote and to get your friends and families to do the same. 

Don't wake up November 4th wishing you had done more.
--&gt; https://t.co/p0mZAo95zL https://t.co/33Ct393enh"
361,2020-10-20 13:41:14+00:00,1318547830647234561,Wishing my friend @KamalaHarris a very happy birthday! I know a great way to make her day. Go to https://t.co/OrpseTiuNM and make a plan to vote! https://t.co/N9N2MTD7dD
362,2020-10-19 20:26:59+00:00,1318287549950005251,"There are just 15 days left in this #election, and it's so important that you make your voice heard. 

Because of COVID-19, there are special voting options here in New Hampshire—however you decide to cast your ballot, make a plan, and #vote!
https://t.co/tvi7TDceKr"
363,2020-10-19 16:56:34+00:00,1318234597747019776,"This #election couldn't be more important to hard working families here in NH.

I was proud to join Nashua leaders this weekend for the Women’s March to make clear that we will stand together on the issues important to Granite State women and families.
https://t.co/rfRGQQ0OuQ"
364,2020-10-19 14:41:22+00:00,1318200574551183361,"I'm honored to have the support of so many Granite State service members and veterans who have bravely served our country, and I'm proud to fight for them in Congress. 

Thank you to the supporters who made this banner! #NHpolitics #NH02 https://t.co/mDgTSzoRTu"
365,2020-10-18 21:15:12+00:00,1317937297837490177,"Thank you for your letter, William!

In Congress, I've worked hard to ensure the Granite State has a strong voice. It's an honor to fight for our veterans, first responders, frontline workers and communities—I look forward to continuing this important work.https://t.co/szUeGmKY0K"
366,2020-10-18 18:07:42+00:00,1317890110852075520,"In Congress, I've worked across the aisle to fight for Granite State families, first responders, veterans, and small businesses. I'm running for re-election to continue that work. #NHpolitics #NH02

Read the full editorial: https://t.co/bvjPK6r3Jq https://t.co/Y9a6tXs3NS"
367,2020-10-18 18:06:22+00:00,1317889778143105025,"It's an honor to receive the endorsement of the 
@Keene_Sentinel, and to represent the great state of New Hampshire. #NHpolitics #NH02

Read the full editorial: https://t.co/bvjPK6r3Jq https://t.co/UsrRDbV0FO"
368,2020-10-18 15:34:33+00:00,1317851569879191556,"Whether it's how we operate our businesses or cast our vote this fall, COVID-19 has changed our daily lives. It's been great to meet with NH business owners and community leaders to discuss how they've adapted and how we can support them as we build back. https://t.co/ezBGIHZXrk"
369,2020-10-18 14:15:22+00:00,1317831643797819392,"ICYMI: Watch the @nhpr debate for #NH02! It was great to discuss my vision for our state, how we can work together to support our first responders and small businesses, and how we can build our economy back from this pandemic. 

Watch now ⬇️
https://t.co/v34CdBPt6F"
370,2020-10-17 22:31:08+00:00,1317594020437262337,"This #election is about more than just one party or another, it's about the future we want to build for our children. Here in NH, you can #vote absentee right now, vote absentee by mail, or vote in person on Election Day. 

However you chose, make a plan and #VoteForHer. https://t.co/SPG6ZXfDmN"
371,2020-10-17 20:35:37+00:00,1317564946583093252,"The Vote Now event and #WomensMarch2020 were great reminders of the importance of your #vote and what's at stake this #election. 

In the Granite State, you can vote absentee right now, absentee by mail, or in person Election Day.

Make your plan now ➡️ https://t.co/3wSGOhhO5e https://t.co/tmvBL7OiyK"
372,2020-10-17 18:42:18+00:00,1317536430114168834,"It was so great to join the Women's March in Nashua today to talk about how far we've come and how far we have to go to ensure #equality for all, regardless of gender, color, skin, or creed. #WomenAreVoting

Make your plan to #vote now --&gt; https://t.co/p0mZAo95zL https://t.co/PkPvYensAE"
373,2020-10-17 13:32:22+00:00,1317458432388104193,"There are just 17 days left in this #election, and we can't afford to have anyone sit this one out. 

Make a plan to #vote and get involved today! https://t.co/3wSGOhhO5e"
374,2020-10-16 23:20:33+00:00,1317244068544524293,Great to join @NHDems for the 2020 Eleanor Roosevelt Dinner! Together we will win up and down the ballot on November 3rd! Make a plan to vote --&gt; https://t.co/GPdLBk9j8q https://t.co/KR37iuDBZ8
375,2020-10-16 22:01:24+00:00,1317224149258018816,Reminiscing on a few of my favorite stops over the years and looking forward to visiting more local businesses and restaurants and talking about how they've adapted during COVID-19. Small businesses are the backbone of our economy here in NH and it's so important we support them! https://t.co/bXLOBRx1sS
376,2020-10-16 19:57:40+00:00,1317193012016013313,Beautiful day in Plymouth and Littleton yesterday! It was great to meet with small business owners and local leaders to talk about our response to the COVID-19 pandemic and how we can support their work. I’m proud to fight for our communities and businesses across New Hampshire! https://t.co/OHusma2zYu
377,2020-10-16 17:27:54+00:00,1317155321748574208,"Like the late Justice #RBG said, ""Women belong in all places where decisions are being made.""

I'm so proud of New Hampshire Democratic women for leading the way in women's participation in government and for giving voice to those across the Granite State.
https://t.co/E4Z0z85dQY"
378,2020-10-16 14:55:26+00:00,1317116948816285696,"I believe in creating a clean energy economy. 

I believe in holding polluters accountable. 

I believe that we can build a better, more sustainable future for generations to come. https://t.co/OQj1iBu8TF"
379,2020-10-16 13:33:17+00:00,1317096275796463616,"18 days—are you registered to #VOTE? 

https://t.co/3wSGOhhO5e"
380,2020-10-15 23:15:13+00:00,1316880336454930432,"A joy to be in Littleton today to talk about voting this year and meet with business owners. Thanks to Little Village Toy &amp; Book Shop and @Chutters_NH for hosting me, and for all their work during COVID-19.

Read my plan to build back from this pandemic -&gt; https://t.co/YANHnNZjCQ https://t.co/Qix6QZCbxj"
381,2020-10-15 17:05:53+00:00,1316787392167268352,"Great to be with Alex Ray, owner of @thecommonmannh, to talk about their COVID-19 operations. It's crucial that we support small businesses and restaurants as we recover from this pandemic—that's what I'm fighting for in Congress.

More on The Common Man ➡️https://t.co/NKp1deMky8 https://t.co/HWGCUyutqg"
382,2020-10-15 15:56:02+00:00,1316769814363492355,"I'm so grateful to have the support of so many Granite Staters, and I'm proud to fight for New Hampshire every day in Congress. Thank you to Sally and Sandy who made this incredible Kuster for Congress barrel! 

Keep your #TeamKuster photos coming! #NHpolitics #NH02 https://t.co/IbC06zHxll"
383,2020-10-15 00:40:45+00:00,1316539475540037632,"With just 20 days until the #election, it's wonderful to see so many Granite Staters getting involved &amp; showing support through yard signs!

Share a photo of your Kuster for Congress yard sign with #TeamKuster to be featured!

Request yours now: https://t.co/7nReotcQdw https://t.co/vFTfuHsHkF"
384,2020-10-14 21:13:09+00:00,1316487231624941568,"This November, we have the chance to reclaim our American values of civility and integrity and put them back into the White House—thank you to Cindy McCain for showing us what it means to put country over party. https://t.co/bWSkXLCiBY"
385,2020-10-14 16:58:55+00:00,1316423251535564801,"Join me and @AdamSextonWMUR on @WMUR9's Facebook Live to talk about why I'm running for re-election and my priorities for New Hampshire!

Tune in now! https://t.co/7OS74KMoyp"
386,2020-10-14 16:08:23+00:00,1316410533713768449,"Honored to receive the endorsement of the Sentinel Editorial Board! 

I'm running for re-election to continue to rebuild our economy, support small businesses and first responders, and to ensure access to health care for all Granite Staters.

Read more ➡️ https://t.co/H6qhFTuPlF https://t.co/N8GXpmhZlS"
387,2020-10-13 23:26:37+00:00,1316158432462995457,"Happy birthday to the @USNavy! 

Thank you to our brave sailors who serve and protect us at home and around the globe. #Navy245 https://t.co/xxt2gzbNlR"
388,2020-10-13 21:40:04+00:00,1316131615639302147,"Here in New Hampshire because of COVID-19 we have special options to vote safely and securely—head to https://t.co/GmwlfMTK8h to make your plan, and thank you to @BarackObama for helping to get out the #vote!

#NHpolitics #NH02 https://t.co/VHxQMAd8Sk"
389,2020-10-13 16:06:21+00:00,1316047631794270210,"COVID-19 posed a major challenge to our country and state—but the strength and resilience of our community has been so inspiring.

It was great to meet with the Claremont Fire Department, The Ink Factory, and Claremont MakerSpace yesterday to talk about their COVID-19 operations. https://t.co/daD9kv51Er"
390,2020-10-13 13:00:12+00:00,1316000789177995265,"Thank you to all the incredible supporters who braved the rain this morning for the @nhpr debate! 

Tune in here: https://t.co/PL3LfwPH9u https://t.co/D66wswym62"
391,2020-10-13 00:21:26+00:00,1315809839197622273,"Senate Republicans are rushing through President Trump's Supreme Court Nominee to overturn the Affordable Care Act and strip health coverage from millions of Americans. 

I agree with my friend and colleague @CoryBooker: this is not normal. https://t.co/HJKjLomZRT"
392,2020-10-12 21:36:16+00:00,1315768270121848837,"I just checked my ballot status and it was so easy to confirm my ballot 🗳️ was accepted for the #GeneralElection! 

Check your own status and ensure you have a #voting plan!

--&gt; https://t.co/Oavp3DGhYj"
393,2020-10-12 14:26:43+00:00,1315660172451295237,"A big thank you to my longtime friend Tom Rath for putting country over party this November—this election is so important, and together we can restore character, decency, and honor to the White House.
https://t.co/02irFG3YvY"
394,2020-10-12 13:31:30+00:00,1315646275543592960,Brayden embodies the New Hampshire spirit of hope and courage—he makes the Granite State proud every day! https://t.co/ehHlbuI1I2
395,2020-10-11 21:16:19+00:00,1315400864920743939,"On this #NationalComingOutDay, I was so inspired to see my good friend @PeteButtigieg on @MSNBC. https://t.co/x14JYwy4dZ"
396,2020-10-11 18:15:20+00:00,1315355316322738178,"With COVID-19 cases on the rise here in New Hampshire, it's so important we all do our part to keep our communities safe and businesses open. Wear a mask when you're out and about, social distance when you can, and together we will get through this!

➡️ https://t.co/1Wp0lXXhq5 https://t.co/80YFs1kaLb"
397,2020-10-11 15:26:19+00:00,1315312782317887488,"It's so great to see our kids getting involved in our democracy! Jackson here is too young to vote, but he's still fired up for this election.

Be like Jackson, and make your own plan to vote today! #KidsforKuster
➡️ https://t.co/3wSGOhhO5e https://t.co/JUxhmQrahR"
398,2020-10-10 19:46:16+00:00,1315015811963158528,"While today is #WorldMentalHealthDay, it's crucial we recognize mental health matters every day. COVID-19 has made 2020 particularly difficult, interrupted our routines and put us under new pressure and stress.

But, no one has to go through this alone: https://t.co/oI3gNrRJvW https://t.co/oX0rFaF0dF"
399,2020-10-10 17:52:01+00:00,1314987062941167616,"It was incredible to meet with business owners and community leaders yesterday in Keene to talk about their innovative work during COVID-19.

Small businesses are the backbone of our economy—I'm fighting every day to provide them with support as we build back from this pandemic. https://t.co/vQsXDXcL1F"
400,2020-10-10 00:01:45+00:00,1314717721817485313,"Great to join the #ElectDemocraticWomen's Issue Conference with so many incredible female leaders. In 2020 there are 203 Democratic women running for the US House—the most ever. I know these strong, qualified candidates are going to help deliver a big blue wave on Nov 3rd!

#VOTE https://t.co/7oa2WMwojL"
401,2020-10-09 20:17:26+00:00,1314661270340202499,"This #election is so important—we must elect leaders with a clear vision for our future.

I'm running for re-election to continue to build our economy back from COVID-19, improve access to health care, and support Granite State families.

Learn more ⬇️️
https://t.co/8x9BRcnhsu"
402,2020-10-09 15:43:40+00:00,1314592374283284481,"Republicans and Democrats need to come together and find common ground to make a much needed deal for the American people. It's time to stop playing politics with COVID-19 relief. 

This can't wait.

➡️ https://t.co/5t9Z7QY0z0 https://t.co/5yx9ksXbxH"
403,2020-10-09 12:58:44+00:00,1314550865164931074,It was incredible to be with so many fired up Granite Staters yesterday to talk about how to #vote in New Hampshire and the importance of electing Democrats up and down the ballot! I'm so thankful for my supporters and am humbled to be representing the Granite State in Congress. https://t.co/HeuvZlV22r
404,2020-10-08 22:54:45+00:00,1314338470177931265,"COVID-19 tested our nation, but I've been so inspired by the courage and strength of my fellow Granite Staters.

It's an honor to represent NH in Congress and I'm running for re-election with a plan to lift our economy and communities out of this crisis.
https://t.co/hXilTzbmsl"
405,2020-10-08 21:44:02+00:00,1314320674350129158,"Today I cast my ballot in New Hampshire for the General Election! It was so easy to vote—remember, this year you have special voting options because of COVID-19. 

Learn more at https://t.co/3wSGOhhO5e and go #VOTE! 

#NHpolitics #NH02 https://t.co/nfUjVnnnXI"
406,2020-10-08 15:17:35+00:00,1314223420327026688,"American voters deserve a substantive, civil debate to determine for themselves the character and position of the presidential candidates. Claiming that such a debate is a waste of time insults our democracy and the American people. https://t.co/WQT5abxVrl"
407,2020-10-08 02:48:32+00:00,1314034915114184705,"Tonight, @KamalaHarris made history at the #VPDebate. She was poised, effective, and made clear why #BidenHarris2020 is the right choice for our country. https://t.co/ntONBZNeqB"
408,2020-10-08 00:13:07+00:00,1313995807306264577,"Tonight is the #VPDebate2020, and I'm so excited to watch @KamalaHarris talk about her and @JoeBiden's vision for our country. 

Make your plan to watch now! https://t.co/Bvb45zQLgp"
409,2020-10-07 19:33:56+00:00,1313925547102175232,"I had the opportunity to spend time with @KamalaHarris in the lead up to New Hampshire's #FITN primary and saw first hand her poise and genuine care for people.

Before the #VPDebate tonight, will you sign my good luck card for her?

✍️: https://t.co/c15iDORl01 https://t.co/3zbr03v6HG"
410,2020-10-07 14:44:45+00:00,1313852769305059328,"In case you missed it, this past weekend I joined @AdamSextonWMUR on @WMUR9 to talk about this election, the president's COVID-19 diagnosis, relief funding for New Hampshire, and more. 

Watch the full interview now, and remember to #VOTE!

https://t.co/MpOjgBM1M6"
411,2020-10-06 18:44:10+00:00,1313550632977084417,"It was great to celebrate @AnheuserBusch's donation of 61,000+ ounces of sanitizer for NH polling locations!

Election officials are the unsung heroes of our democracy and this donation exemplifies the spirit of service ingrained in our state—together, we'll get through this. https://t.co/mvGSg3cChC"
412,2020-10-06 16:46:13+00:00,1313520952211378176,"Honored to be endorsed by @StonewallNH. I'm a proud LGBTQ+ ally &amp; will always stand against efforts to limit individual freedoms. I look forward to continuing this work to ensure no one is discriminated against because of sexual orientation, marital status or gender identity. https://t.co/T1DO19MXvC"
413,2020-10-06 13:49:09+00:00,1313476392257040384,"Good morning, Keene State! 

Today's the day! Join me and the @KSCDemocrats tonight at 5 PM to talk about voting this year and the importance of this election! 

Sign up now ⬇️
https://t.co/qkkHv5VDaJ"
414,2020-10-05 19:12:10+00:00,1313195292825710593,"In Congress, I'm working every day to protect women's rights, autonomy, and freedom of choice. I do not believe it's the role of the government to insert itself in this most private and consequential decision.
https://t.co/DkutU1JbcU"
415,2020-10-05 13:16:27+00:00,1313105773011103748,"Happy #WorldTeachersDay2020!

To all the teachers in New Hampshire and across the country: thank you. Your leadership and continued dedication to our students during the COVID-19 pandemic has helped keep our country going.

We appreciate you today and every day! https://t.co/xpvcdbGdwg"
416,2020-10-04 23:51:28+00:00,1312903191680421890,"We've got some great volunteers helping us get yard signs up! This election is going to determine the future of our state and our country. Show your support and get your own yard sign now!  

➡️ https://t.co/7nReotcQdw https://t.co/boJwOM5s54"
417,2020-10-03 20:06:25+00:00,1312484170111705088,"There's now just one month left until November 3rd—let's make the most of it! Use this time to volunteer, make phone calls, and to get your friends and family to register and #vote. 

One month left to make sure your voice is heard in this election ➡️ https://t.co/3wSGOhzoWM https://t.co/T7I8itUdV1"
418,2020-10-03 17:40:53+00:00,1312447545751134209,"Thousands of Granite Staters rely on the ACA—repealing it without an alternative in the middle of a pandemic could cause unthinkable damage.

That's why I'm working to improve the #ACA to ensure all families have access to affordable, quality health care.
https://t.co/CS4EQy2rxl"
419,2020-10-02 12:03:29+00:00,1312000246818406402,My thoughts are with President Trump and the First Lady. I wish them a quick and full recovery from COVID-19.
420,2020-10-01 22:21:21+00:00,1311793351184785423,"Happy 96th birthday, President Jimmy Carter! https://t.co/zxu3euIA9A"
421,2020-10-01 21:02:08+00:00,1311773413644566529,"October is Domestic Violence Awareness Month 💜

Domestic Violence can come in many forms—this pandemic has heightened the risk for those facing abuse. We must continue working to end domestic and sexual violence and provide survivors support.

Learn more:https://t.co/EgqtwcRo48 https://t.co/eXC6YG7M04"
422,2020-10-01 18:25:18+00:00,1311733945692758017,"Your health care is on the ballot.

This administration is trying to repeal the #ACA while offering no comprehensive plan to replace it, putting millions at risk of losing coverage during a pandemic. We need leadership with a plan. We need @JoeBiden.
https://t.co/uRg6amK3Ze"
423,2020-10-01 15:05:56+00:00,1311683773327724548,"Keene State students: You can vote on campus this year!

📝 Fill out the form linked below
📅 Pick a date
🗳️ Vote in the Student Center

Thank you, @KeeneState_ for working to make voting safe! 

Make sure your voice is heard—click below to learn more. https://t.co/sTl4pETxKe"
424,2020-09-30 17:08:36+00:00,1311352255715725313,"As the president refuses to denounce white supremacy, let me be clear: I denounce white supremacy."
