,Created at,User ID,Text
510,2020-08-25 21:14:05+00:00,1298368070696796161,"We're 2️⃣ weeks away from the #NH primary and there are special options to ensure that everyone can vote safely and securely.

You can:

✅ Vote from home through the mail
✅ Vote early in person at your Town/City Clerk
✅ Vote in person on Election Day

https://t.co/itI1YJiEIj"
511,2020-08-25 16:05:10+00:00,1298290331998453761,"Today I joined the @APWUnational in their National Day of Action. Thousands of Granite Staters rely on the #USPS to deliver their medicine, social security, and other essential items. 

We must defend our postal service. https://t.co/AxQ2N0Gc5Y"
512,2020-08-24 23:55:47+00:00,1298046376169869312,"We need an immediate investigation into the shooting of 29-year-old Jacob Blake.

We need to invest in de-escalation tactics.

We need a policing system that doesn’t punish you because of the color of your skin."
513,2020-08-24 20:40:40+00:00,1297997272328949761,"I'm proud to have the support of @LCVoters Action Fund!

It was great to talk with Rob Werner of LCV and Beatrice, a student climate activist, about the #climatecrisis and how to prevent its worst effects.

Read my plan to create a clean energy future ➡️  https://t.co/mG1aSxLfO4 https://t.co/pQOcOjIRrP"
514,2020-08-24 15:54:27+00:00,1297925246708781056,"Part of #ASeatAtTheTable are races 'On the Radar,' primaries where two candidates stand out &amp; will fight for reproductive rights.

This November, it's vital we elect pro-choice Dems like Beatriz Pastor &amp; @PrentissSuzanne to the State Senate for District 5.
https://t.co/bw0SgucJmi"
515,2020-08-23 17:28:53+00:00,1297586623446691845,"Thank you to the women who wrote this letter. It's so important that we elect strong, pro-choice leaders this November to fight for women &amp; our rights. 

Great to see #ASeatAtTheTable candidates @cindewarmington, @PlunkettNH &amp; @BeckyWhitley80 speaking out.
https://t.co/0BcadiQ4Lk"
516,2020-08-21 22:07:44+00:00,1296932020271173633,"As we wrap up the #DemConvention, I’m so inspired by the powerful words from those across the country.

Our nation deserves leaders who will help build a stronger America where everyone can succeed. We need @JoeBiden and @KamalaHarris!

Make sure your voice is heard and VOTE. https://t.co/JHhdEHq13V"
517,2020-08-21 03:16:01+00:00,1296647216975708168,"Congratulations to @JoeBiden for formally accepting the Democratic Nomination for President of the United States of America.

I couldn’t be more thrilled to be on team #BidenHarris and to be a part of this proud American moment. https://t.co/RFeqhfAy6x"
518,2020-08-21 02:49:01+00:00,1296640421045719042,"Way to go Brayden!

You did a wonderful job addressing the nation and representing the Granite State at the #DemConvention ! https://t.co/PInmmXahES"
519,2020-08-21 01:27:53+00:00,1296620005392605185,"Thank you @PeteButtigieg for your kind words – cannot wait to hear you speak tonight at the #DemConvention!

Let's do this 🇺🇸 https://t.co/JaVO5yXyav"
520,2020-08-20 21:57:46+00:00,1296567125423853568,"It was incredible to hear @GabbyGiffords share her story with the country last night at the #DemConvention.

She was one of the many leaders who spoke about our national moment, the capacity for positive change, and the power of our American democracy. https://t.co/Z15ReCKltk"
521,2020-08-20 19:31:03+00:00,1296530204530270208,"Loved hearing @KamalaHarris accept her historic #VP nomination last night.

This November 🗳️, we all must stand together to reclaim the American values of compassion and resiliency. https://t.co/JpEN7c3TxD"
522,2020-08-20 14:52:54+00:00,1296460205778247680,"We are only 19 days away from the NH primary and 74 from Election Day 🗳️ – make sure you have registered to vote and have a plan for September 8th AND November 3rd! 

Make your plan now! ⬇️  https://t.co/yofZLAB1Tn"
523,2020-08-20 02:59:45+00:00,1296280735041630209,Love to see the POWER of women in Congress being represented at the #DemConvention! https://t.co/QmqMx7Cvt8
524,2020-08-20 00:27:42+00:00,1296242471026995201,"T-minus 30 minutes until we kick off night 3 of the #DemocraticConvention! I'm so excited to hear from great leaders across the country on why they support #BidenHarris.

⬇️ Don’t miss a second of the action ⬇️ 

https://t.co/Ske7dOQMMa https://t.co/kfJN3gicPC"
525,2020-08-19 17:49:49+00:00,1296142341120696321,"This #election is so important.

@MichelleObama said it best in her speech Monday night, ""Vote as if our lives depend on it.""

Register to vote now ➡️ https://t.co/Nqp62yxOxa https://t.co/hgSBqgiA2b"
526,2020-08-19 14:23:46+00:00,1296090483698077701,So great to see our very own @RepDenny speak at the #DemConvention last night – you made the Granite State very proud! https://t.co/rQqL9fUMiE
527,2020-08-19 12:36:51+00:00,1296063579653906432,"Paul was a tremendous leader, friend, and mentor to so many of us. 

My thoughts are with his family during this difficult time."
528,2020-08-19 12:36:33+00:00,1296063501480472578,"I'm deeply saddened by the passing of Paul McEachern. Paul showed his dedication to New Hampshire and our nation in everything he did; from his military service to his tireless work to better the Granite State for all families.
https://t.co/OwXCUjHiUo"
529,2020-08-19 11:29:34+00:00,1296046646107742208,"🚨Happening now🚨

Join me and @gretchenwhitmer  this AM to kick off #Day3 of the #DemConvention. We will be talking about the importance of this election and will hear from @amyklobuchar on how to elect Democrats up and down the ballot!

Sign up below ⬇️ https://t.co/8r3to4gLT5"
530,2020-08-19 11:10:59+00:00,1296041971220393984,Congratulations @JoeBiden! It's time for real leadership in the White House and the American people are ready to elect @JoeBiden &amp; @KamalaHarris. We all need to do our part and work every day to ensure that @TheDemocrats win up and down the ballot in 2020! https://t.co/LF4ciR5jif
531,2020-08-19 00:29:36+00:00,1295880561345679360,Happening now! Join me at the Convention Pre-Program to kick-off the second day of the #DemocraticConvention!  https://t.co/vCfB9njnQI
532,2020-08-18 22:42:55+00:00,1295853714234920960,"So great to hear from our incredible Senator @JeanneShaheen during tonight's Elect Democratic Women event about the importance of electing female candidates up and down the ballot!

When women succeed, America succeeds and together we will WIN this November! https://t.co/7Zwc5hmtQn"
533,2020-08-18 19:12:18+00:00,1295800708734889984,"📣 TONIGHT @ 5:00PM EST 📣

Join me, @TeamPelosi, @StenyHoyer, and other Democratic leaders for a conversation with Elect Democratic Women about our work to recruit and elect female candidates in the 2020 election!

⬇️ Register now ⬇️ 

https://t.co/9PJhhikEBJ"
534,2020-08-18 16:52:41+00:00,1295765574769872896,"100 years after the ratification of the #19thAmendment, we honor the suffragists who fought to grant women the right to vote—like my great grandmother.

The next step in the ongoing fight for #equality is to pass the John Lewis Voting Rights Act.

For liberty and justice for all. https://t.co/E1QQwyMWs2"
535,2020-08-18 16:34:22+00:00,1295760963665383432,"Join me tomorrow morning at 7:30am EST to launch #Day3 of the #DemConvention! 

Sign up below ⬇️ https://t.co/QNBiL0Mdig"
536,2020-08-18 15:33:11+00:00,1295745564978499584,"I am proud to fight for the women of New Hampshire and those all across the country. 

And, after this November, I look forward to having more strong female leaders join me in Congress to advocate for women's rights and #equality in our country.

#WomensVote100"
537,2020-08-18 15:29:54+00:00,1295744739334119429,"As we celebrate this anniversary and milestone, we must also recognize that there's more to be done to ensure all women have equal access to vote and to protection of the law, regardless of zip code or skin color."
538,2020-08-18 15:29:04+00:00,1295744528637452290,"100 years ago the #19thAmendment was ratified granting women the right to vote!

In Congress I serve with strong female leaders who fight for survivors of sexual assault, advocate for unheard voices &amp; who wouldn't be eligible for office without the progress of the 19th Amendment. https://t.co/Tc203XyfRt"
539,2020-08-18 13:36:27+00:00,1295716191072288773,"Join me tonight at 8:30pm EST to kick off #Day2 of the #DemConvention! 

Sign up below ⬇️ https://t.co/sOrZo86FPH"
540,2020-08-18 02:15:27+00:00,1295544810510651392,"If you aren’t already, tune into the #DemocraticConvention! 

Still to come are @AmyKlobuchar and @MichelleObama to speak about our nation, this moment, and why #BidenHarris is the right choice for America. https://t.co/UpQEUWbNAK"
541,2020-08-18 00:55:51+00:00,1295524778623881216,"The @DemConvention represents the future of our country and the hope of a new chapter.

Tonight we are going to hear from those across the political spectrum on why they are on #TeamBidenHarris.

⬇️ Don’t miss a second of the action ⬇️ https://t.co/Ske7dOQMMa"
542,2020-08-17 21:20:11+00:00,1295470505550585862,"🚨 TOMORROW @ 8:30PM EST 🚨 

I will be speaking at the @OrganizeNH Convention Pre-Program to launch the second day of the #DemocraticConvention! 

Will you join me? https://t.co/vCfB9njnQI"
543,2020-08-17 17:24:57+00:00,1295411304937730056,"Today kicks off the #DemocraticConvention!

Don't miss a second of the excitment – join your fellow Granite Staters to watch as we unite to elect @JoeBiden and @KamalaHarris! 

⬇️ RSVP to events in #NH now ⬇️ https://t.co/Q8Nv1o8Ant"
544,2020-08-17 16:16:58+00:00,1295394197680291849,"Part of #ASeatAtTheTable are races On the Radar, primaries where two candidates stand out &amp; will fight for reproductive rights.

It's crucial that we elect strong, pro-choice Dems like @PlunkettNH &amp; @CindeWarmington to the Executive Council for District 2.
https://t.co/msFedBpMnh"
545,2020-08-16 16:18:54+00:00,1295032294584066052,"Child care is essential to building back our economy. 

That's why I'm fighting to ensure robust support for child care services in New Hampshire and across the country.

https://t.co/CJ6iaee4Zk"
546,2020-08-14 22:02:54+00:00,1294394091887788032,"85 years ago, FDR signed the Social Security Act into law. Today, more than 300,000 Granite Staters rely on #SocialSecurity to live and retire with dignity.

I will continue to fight for this vital program to ensure that all Granite Staters receive the benefits they've earned. https://t.co/TyhZ6WoIKd"
547,2020-08-14 17:10:52+00:00,1294320596483018754,"The President's attacks against @KamalaHarris are unfounded and sadly straight out of @realDonaldTrump's usual playbook.

This is more than just a baseless conspiracy theory – it's a racist lie, and we can not tolerate it.

https://t.co/VRz0CUVyug"
548,2020-08-14 15:30:49+00:00,1294295417597894661,Let’s be clear: an attack on the @USPS is an attack on the American people and our democracy. https://t.co/HzAPytbfnP
549,2020-08-13 20:38:05+00:00,1294010358303281154,Our health care is under attack – this election is our chance to save it. https://t.co/Jg7IJ2LI7P
550,2020-08-13 17:13:10+00:00,1293958788509323276,"That's why I wrote my Clean Energy Agenda which includes legislation to create a clean energy future of renewable energy, energy efficiency, and clean transportation in the Granite State.

Together, we can protect the environment for generations to come.
https://t.co/mG1aSxLfO4"
551,2020-08-13 17:09:13+00:00,1293957793653968897,"It was great to speak with Beatrice, a high schooler in NH, about the importance of combating climate change for future generations, our economy and the environment. 

It's going to take coordinated and long-term effort to prevent its worst effects. https://t.co/LyLdqd1TMm"
552,2020-08-13 17:06:59+00:00,1293957233240309760,"I am proud to receive the endorsement of the @LCVoters and to stand with them in their mission to build a future with clean air, clean water, public lands, and a safe climate. https://t.co/GLnaxGufzS"
553,2020-08-13 14:19:14+00:00,1293915017696313347,"Fund the @USPS.

Pass it on. https://t.co/CyFgYOO2jz"
554,2020-08-12 19:36:06+00:00,1293632371724607488,"This election is going to determine the future of health care in our country – make sure your voice is heard. 

⬇️ Register to vote today ⬇️
 https://t.co/Nqp62yxOxa"
555,2020-08-12 15:51:19+00:00,1293575800889978880,"Beyond excited @JoeBiden chose @KamalaHarris as his running mate. I spent time with Kamala in the lead up to the first-in-the-nation primary &amp; saw first-hand her poise and care for those she met.

Her experience &amp; leadership will make her an incredible VP.
https://t.co/2vDagH7tMa"
556,2020-08-12 13:56:52+00:00,1293547001246883841,"Taking #ASeatAtTheTable next is District 18 State Senator, @DonnaSoucy!

Donna is working to ensure families can get ahead by supporting public schools, increasing access to affordable health care, &amp; expanding economic opportunity. 

Support Donna now! https://t.co/qpiYVac81O https://t.co/y3hKXDfRb2"
557,2020-08-11 20:40:06+00:00,1293286088287584257,"Congratulations to @KamalaHarris for being @JoeBiden’s #VP pick! She will be an incredible running mate and Vice President. 

I’m so proud to support the #BidenHarris2020 ticket! 

RT if you’re with me 🇺🇸 https://t.co/OSISaqxBon https://t.co/SC70CZjcGI"
558,2020-08-11 15:58:05+00:00,1293215117488857093,"The COVID-19 #pandemic has shown how important access to affordable, quality healthcare is for families across NH – and that's the fight I'm in everyday in Congress.

We must protect and build on the Affordable Care Act to ensure everyone has access to the #healthcare they need. https://t.co/FpspnoOMoq"
559,2020-08-10 22:14:31+00:00,1292947461422698496,"Delaying #USPS deliveries directly denies veterans access to essential medication and puts their health at risk.

We cannot allow this vital service to be corrupted or for our vets to be neglected, especially during a pandemic when mail-ordered prescriptions are crucial. https://t.co/oS84WINdcp"
560,2020-08-10 17:02:42+00:00,1292868992160366595,"Meet State Senate candidate for District 13, Senator Cindy Rosenwald!

@CindyR4NH has dedicated her career to serving NH and is an advocate for affordable health care and policies to help working families. #ASeatAtTheTable

Support Cindy now ➡️ https://t.co/tnCzkdcYlO https://t.co/VedDKS4qqP"
561,2020-08-08 13:38:41+00:00,1292092873220001798,"Interesting to see @realDonaldTrump coming around to what for years @TheDemocrats have fought for – luckily this already exists in the Affordable Care Act, so all you need to do is stop actively trying to destroy the ACA and you can save the paper. https://t.co/l5IkLJoevL"
562,2020-08-07 20:03:49+00:00,1291827406668533760,"Taking #ASeatAtTheTable next is District 12 State Senator, Melanie Levesque!

As the Chairwoman of the Senate Election Law and Municipal Affairs Committee, @Melanie4Senate is an advocate for election innovation and security.

Support Melanie Now ➡️ https://t.co/EodRao7Luq https://t.co/SJzxxNOPvO"
563,2020-08-06 20:57:43+00:00,1291478584394166273,"2020 marks #100years of women’s suffrage 🗳

Generations of women fought to secure our right to vote – don’t waste yours this November. I’m proud to support @JoeBiden for president and I believe in his Women’s Agenda.

Read the plan now ➡️ https://t.co/IgTmpPOcmJ https://t.co/PLQFEEKBOL"
564,2020-08-06 18:22:25+00:00,1291439501928210434,"Honored to receive the endorsement of the 
@SEIU1984!

As we build back from this pandemic, we must expand economic opportunity so that every Granite Stater has the chance to get ahead.

I'm proud to stand with SEA/SEIU and to join their advocacy for working people and families. https://t.co/augXBUg3rf"
565,2020-08-06 14:26:17+00:00,1291380076521697280,"Aug 6 1965—the Voting Rights Act was signed into law, prohibiting racial discrimination in voting. 55 years later, we're still fighting to ensure that promise is kept.

Congress must restore the VRA – now the John R. Lewis Voting Rights Act – and secure the right to vote for all. https://t.co/mB7E3PxHzd"
566,2020-08-05 19:04:23+00:00,1291087673092972544,"Representing NH's 11th District, meet State Senator @shannonchandley!

In her first term, Shannon has prioritized property tax relief, PFAS remediation, water protection &amp; the health and safety of those exposed to toxins. #ASeatAtTheTable

Support Shannon! https://t.co/eosBQDPD8N https://t.co/c70qYyWzQO"
567,2020-08-04 21:22:43+00:00,1290760098575527936,"Wishing President Obama a very happy birthday! 

I remember fondly getting to know @BarackObama in 2007 and his inspiring message of a brighter future for all Americans. Let's all commit today to building on his incredible legacy and continuing the important progress he made! https://t.co/9Vp4meVlvZ"
568,2020-08-03 23:29:08+00:00,1290429525516521475,"This day in 2019, 23 people were killed in a horrific act of violence at a Walmart in El Paso, TX.

Today is a grim reminder of the need to end racism &amp; hate in our nation &amp; address the plague of gun violence that's ruined so many lives.

We cannot let history repeat itself."
569,2020-08-03 18:36:31+00:00,1290355886183944194,"Taking #ASeatAtTheTable is District 9 State Senator, @JeanneDietsch!

In just one term, Jeanne's fought for universal broadband in rural communities, local control of school curricula &amp; easing the burden of property taxes on families.

Support Jeanne ➡️ https://t.co/ed49xG5p0e https://t.co/B6o7gPxoRm"
570,2020-07-31 18:59:56+00:00,1289274613587836928,"Meet State Senate candidate for District 8, @jalfordteaster!

Jenn is running to fight for NH families and to ensure that everyone has access to the opportunities they need to move from surviving to thriving. #ASeatAtTheTable

Support her campaign now! https://t.co/A6MK5dm89R https://t.co/u13czoIF17"
571,2020-07-31 17:40:20+00:00,1289254583491899392,"This election is going to determine the future and wellbeing of New Hampshire, and we need your help to ensure a WIN this November. 

Get a Kuster for Congress yard sign today to show your support!

⬇️⬇️⬇️⬇️
https://t.co/qGj5icIOVw"
572,2020-07-31 15:10:14+00:00,1289216809959268354,https://t.co/Nqp62ygd8A
573,2020-07-31 15:07:14+00:00,1289216055949197313,"Thank you for your letter Liz – voting from home is safe, secure, and an option for all Granite Staters. 

This election is so important. Make sure you're registered to vote and have a plan for November 3rd 🗳

https://t.co/wZ5dFCX0JA"
574,2020-07-31 13:58:13+00:00,1289198686447140864,"This November, we're voting to protect...

⭕ Access to affordable health care
⭕ Women's rights to comprehensive care
⭕ The ACA and free preventative care

We can't afford to lose. That's why I'm proud to have the endorsement of @PPact and to support @JoeBiden's Women's Agenda. https://t.co/eOdRLdi8Hd"
575,2020-07-30 19:02:44+00:00,1288912933960003585,"Trump should read the Constitution &amp; pay attention to facts. He can't delay the election. Voting from home is safe &amp; secure.

Register to vote now ⬇️️https://t.co/qHAk1GKeji"
576,2020-07-29 15:45:08+00:00,1288500816538738689,"Running for State Senate in District 1, meet Sue Ford! 

@sueford06 is a lifelong educator and experienced legislator. She's running for State Senate to expand educational opportunities and women's access to health care. #ASeatAtTheTable

Support Sue Now! https://t.co/yzCfrsneNR https://t.co/zIg4HujCFd"
577,2020-07-28 21:10:56+00:00,1288220420890660865,"Our communities and state cannot enjoy a full recovery if women continue to be left behind.

That's why I support @JoeBiden's Women's Agenda – to ensure that families are able to access quality, affordable child care and that women are paid the same as their peers. https://t.co/TWwujUd6mr"
578,2020-07-28 20:08:22+00:00,1288204673464377348,"☎️ Calling all volunteers ☎️

Join me tomorrow for a women-to-women phone bank with @OrganizeNH – let's make sure Democrats win up and down the ticket this November!

Register now ⬇️
North &amp; Western NH: https://t.co/Gl1ggjWX5s
Greater Manchester: https://t.co/30f0HQa7a9 https://t.co/v7OWRyaZsR"
579,2020-07-28 17:13:06+00:00,1288160564200472583,"Happy #WorldConservationDay!

As we work to bolster conservation policy, we must prioritize creating a clean energy economy. Let's combat climate change, reduce carbon pollution, and create good paying jobs in the clean energy sector.

Are you with me? ➡️ https://t.co/xc3gmWUxjE https://t.co/wKpalnSJep"
580,2020-07-27 19:23:40+00:00,1287831035196182533,"Meet District 5 Executive Councilor, Deb Pignatelli!

On the Executive Council, Deb has vetoed anti-choice judicial nominees &amp; worked to stop political favors. Her re-election is crucial to keep the EC's Dem majority. #ASeatAtTheTable

Support Deb now ➡️ https://t.co/yzCfrsneNR https://t.co/0sFxnMbzmw"
581,2020-07-26 13:18:47+00:00,1287376823215587329,"There's only #100days until the election! Make sure that you...

✅ Registered to vote
✅ Requested your absentee ballot
✅ Have a voting plan

Make your plan today👉https://t.co/Nqp62yxOxa https://t.co/XPVtiPDIjs"
582,2020-07-24 18:42:24+00:00,1286733487823880193,"Joining us at the table first, meet District 3 Executive Council candidate, Mindi Messmer!

@Support4Mindi is an experienced legislator who uses her scientific expertise and perspective as a small business owner to create strong policy. #ASeatAtTheTable
https://t.co/2qp44Idn3u"
583,2020-07-23 21:23:32+00:00,1286411651307180032,"Also part of the initiative are races 'On the Radar,' primaries with multiple candidates who will fight to protect reproductive rights.

These #Democratic women will take a seat at the table this November to fight for a better future for all.

Full list ➡️ https://t.co/gwfCBuA364"
584,2020-07-23 21:19:49+00:00,1286410714102497285,"""If you don’t have a seat at the table, you may be on the menu.""

Nowhere is this more apparent than in the debate over women’s #reproductiverights in New Hampshire. That's why I am endorsing a slate of #NH 2020 candidates within the 2nd District.

Read more ⬇️ https://t.co/byCHFsbf5e"
585,2020-07-23 19:22:51+00:00,1286381280586870785,"Working families need support on the path to recovery.

Join me tomorrow at 10am to discuss how @JoeBiden’s 'Build Back Better' plan will ensure access to high-quality, affordable child care and assistance to working families and caregivers. 

RSVP ➡️ https://t.co/32jeQyrrlq"
586,2020-07-22 14:34:03+00:00,1285946213293084672,"“Rep. Lewis’ legacy teaches us that we must never think ‘I’ve done enough.’ Instead we must ask ourselves, ‘What more can I do?’”

Thank you for your article, @K_JeanPierre and for reminding us that we can always do more. https://t.co/xfBZyPgsDD"
587,2020-07-18 14:23:43+00:00,1284494061236367362,"""Do not get lost in a sea of despair. Be hopeful, be optimistic. Our struggle is not the struggle of a day, a week, a month, or a year, it is the struggle of a lifetime. Never, ever be afraid to make some noise and get in good trouble, necessary trouble.""

Rest in power, John. https://t.co/3Yv3zmcxPW"
588,2020-07-16 18:56:39+00:00,1283837971247116289,"Honored to receive the endorsement of the @SierraClub 🌳

Reducing carbon pollution is more important than ever, both for the wellbeing of our planet and our economy. That’s why fighting for #RenewableEnergy will always be one of my top priorities.

➡️ https://t.co/rIMVRv64KA https://t.co/OAafpDBnkc"
589,2020-07-14 23:33:58+00:00,1283182984791822338,"Our national response to #COVID19 has to be based on scientific fact and proven results, not conspiracy theories and distrust. This administration's attempt to discredit the nation's leading experts puts millions at risk. https://t.co/zIoP0NPDCH"
590,2020-07-14 20:58:37+00:00,1283143891135365120,"Delaying his rally in New Hampshire is not good enough. President Trump should never jeopardize the health and wellbeing of our state.
https://t.co/uUSMhwoZ19"
591,2020-07-14 00:09:20+00:00,1282829495184044032,"Had a great time this evening talking to Upper Valley @NHDems and @OrganizeNH about how to #VoteFromHome this November – make your voting plan and get involved now: https://t.co/Nqp62yxOxa

Let's do this💪 https://t.co/oHyDiQbskb"
592,2020-07-13 20:02:16+00:00,1282767320696467463,"Now is a time for innovation and adaptation, something Granite Staters have proven they are able to do time and time again.

It's great to see the @concordchamber still throwing their #BusinessShowcase – register and support local businesses! https://t.co/hrj4ieJ7Xf"
593,2020-07-11 15:50:24+00:00,1281979158554443776,Granite Staters: Looking for something to do this weekend? Seize the day and volunteer virtually with @OrganizeNH – join the movement. https://t.co/Z2ZKNyg9Bf
594,2020-07-10 17:17:06+00:00,1281638591932891137,"Rain or shine, POTUS should indefinitely postpone his rally in New Hampshire to avoid a grave risk to the health &amp; wellbeing of Granite Staters. NH families &amp; businesses have sacrificed too much already. Now is not the time &amp; New Hampshire is not the place to threaten our safety! https://t.co/ZqJM2TeLgk"
595,2020-07-09 20:50:28+00:00,1281329897084985350,"Reports show NH is 1 of only 2 states where new COVID-19 cases are decreasing &amp; President Trump's mass gathering threatens to jeopardize this success. To hold this rally as planned is reckless, irresponsible &amp; poses a grave threat to the safety &amp; wellbeing of Granite Staters. 3/3"
