,Created at,User ID,Text
0,2021-04-15 05:01:08+00:00,1382559594820497409,Phone when you can from your home thru April 18. VPB to Get Dems out to Vote May 1 Link: https://t.co/XgrYhAJgNK    VPB Code: 76B7D4O-320353 https://t.co/4PswCN8AhG
1,2021-03-29 16:45:11+00:00,1376576180032274432,https://t.co/SNY380hRwK
2,2021-03-29 16:44:56+00:00,1376576117306499077,"Please retweet and donate if you can. #TX06 #Democrats #veterans #Veteran #Jan6 #CivilRights #VotingRightsAreHumanRights @ChristianGooden 

https://t.co/DgsNgSHwHt"
3,2021-03-29 16:27:10+00:00,1376571646035779584,"Special Election District 6 Texas Vote Daryl Eddings Sr https://t.co/SNY380hRwK via @YouTube 
@robreiner @VoteBlueVets @RepAlGreen @RepEscobar @SylvesterTurner @BudKennedy  @RepColinAllred @RepMarciaFudge @staceyabrams @NancyNichols @PeaceAndLove_US @StopRepublicans @BlogTalkUSA"
4,2021-03-28 18:42:47+00:00,1376243386018103297,"Please retweet and donate if you can: https://t.co/DgsNgSHwHt
@robreiner @VoteBlueVets @RepAlGreen @RepVeasey @RepEscobar @SylvesterTurner @BudKennedy @CBSNews @RepColinAllred @RepMarciaFudge @staceyabrams @NancyNichols @PeaceAndLove_US @StopGOPRape @StopRepublicans @BlogTalkUSA https://t.co/bw9DO86iNY"
5,2021-03-28 18:25:24+00:00,1376239012311142401,Special Election District 6 Texas Vote Daryl Eddings Sr https://t.co/SNY380hRwK via @YouTube
6,2021-03-27 14:58:05+00:00,1375824449509994496,"Please retweet and donate if you can.

https://t.co/SNY380hRwK

https://t.co/DgsNgSHwHt"
7,2021-03-26 15:45:08+00:00,1375473902965653511,#BLM #PoliceBrutality #PoliceReform #mentalhealth #MentalHealthAwareness @RepVeasey @SheliaJacksonl1 @robreiner @AdamParkhomenko @HillaryClinton @moodyforelpaso @RepEscobar @JudgeClayJ @ChristineMannTX @susancriss @RepMarciaFudge @staceyabrams @garrymauro @HinojosaTX Please tweet https://t.co/h3RNf9vL8e
8,2021-03-26 15:39:55+00:00,1375472589817135107,"Please retweet and donate https://t.co/DgsNgSHwHt
Inter-agency Collaboration is a MUST Vote Daryl Eddings Sr District 6 Te... https://t.co/c587zeskKx via @YouTube"
9,2021-03-24 23:13:18+00:00,1374861914887577613,Eddings For Congress Internet Services For All District 6 Texas https://t.co/HjofpcK9pb via @YouTube
10,2021-03-24 11:28:30+00:00,1374684545216299014,Daryl Eddings Sr serves the community and serves other vets. We need him in Congress. Donate now so he can flip the Texas 6th District Seat in Congress May 1. https://t.co/DgsNgSHwHt https://t.co/6rwdqmW0c5
11,2021-03-24 11:15:18+00:00,1374681224694923270,"Work shouldn't make you sick. Living near industries should not endanger your family. We must bring Clean, Safe, New Industry Good Paying Jobs to Ellis, Navarro and Tarrant Counties. Vote for Daryl Eddings Sr. for US Congress May 1st. https://t.co/yDwKfFJuHD https://t.co/pIyZ6K8MFs"
12,2021-03-24 11:07:03+00:00,1374679145414807554,"Republicans have left many people too sick to work, too broke to pay for dental care and too poor to buy a house. This is not how it should be. Daryl Eddings Sr will work to bring health care and good paying jobs to the Texas 6th District. Vote May 1 to send him to Congress https://t.co/PjkwztK6Aj"
13,2021-03-24 10:58:36+00:00,1374677018529435652,"Daryl Eddings Sr. knows that much of Rural America has insufficient internet connectivity to compete in business, study remotely or connect with loved ones at a distance. The pandemic moves improving Internet Connectivity to the top of our infrastructure priorities. https://t.co/Yqy4MwyQnP"
14,2021-03-24 10:54:59+00:00,1374676108008902657,"Daryl Eddings Sr has served 30+ years in Federal Service (DOJ, DOD, US Marshal's Service). A highly decorated Senior Non Com Officer in the US Army, he is a person who listens, assesses needs, and persuades people to in delivering solutions for the people. We need him in Congress https://t.co/abLrhC1RPb"
15,2021-03-24 10:50:50+00:00,1374675063945986050,"I am Daryl Eddings, Sr (1st Sgt) and I am asking for your support. I am running in a Special May 1st Election for the Open Seat in Congress Texas 6th District. Please visit my website: https://t.co/yDwKfFJuHD https://t.co/MrKRr5Bnbg"
16,2021-03-21 20:51:17+00:00,1373739009353121796,https://t.co/M0VpjwVGHm
17,2021-03-21 16:08:23+00:00,1373667814754619398,How an obscure paperwork foulup left much of Texas in the cold during blackouts https://t.co/hKFqv8YvI1
18,2021-03-20 09:04:04+00:00,1373198643902226435,#FBR #TruthMatters #BLM #BlackLivesMatter #Covid19 #WearADamnMask #BuildBackBetter  #SeditionHasConsequences  #Lies. #ResistTheGOP @FLEOAORG https://t.co/oG95qI4k4S
19,2021-03-20 08:53:24+00:00,1373195960520744961,"@EddingsTx
Vote for Dem Daryl Eddings May 1 for open TX 6 Seat in Congress.  Barton's and Wright's measuring prosperity by O&amp;G profits leaves too many people too sick to work, too poor to pay for dental care  and too broke to buy a house. https://t.co/DgsNgSHwHt …"
20,2021-03-20 08:01:58+00:00,1373183018387529728,"Measuring prosperity by Energy Sector profits leaves too many people too sick to work, to poor to afford dental care and too broke to buy a house. Daryl Eddings Sr. is running for the Tx 6th District seat in Congress May 1st. Please share this and donate: https://t.co/DgsNgSHwHt"
21,2021-03-20 07:56:08+00:00,1373181550259490817,Donate or volunteer (in person or virtually) for Daryl Eddings for Congress at https://t.co/yDwKfFJuHD https://t.co/vuWrBL1dao
22,2021-03-19 14:52:57+00:00,1372924056970858497,"Measuring prosperity by Energy Sector profits leaves too many people too sick to work, to poor to afford dental care and too broke to buy a house. Daryl Eddings Sr. is running for the Tx 6th District seat in Congress May 1st. Please share this and donate: https://t.co/DgsNgSHwHt"
23,2021-03-19 14:51:05+00:00,1372923588383236096,Daryl Eddings is running for Congress in the Texas 6 District where Phil Gramm &amp; Ronald Reagan’s Trickle Down Economics leaves too many people out in the cold. Elect Democrat Eddings May 1 to fill Ron Wrights vacant seat. Please donate and share. https://t.co/DgsNgSHwHt
24,2021-03-19 13:49:48+00:00,1372908163981271043,Clean Air &amp; Water is essential for sustained life on this planet. Dem. Daryl Eddings asks for your vote May 1 to send him to Congress. Help flip the purple TX 6 District Blue. https://t.co/DgsNgSHwHt @SenBooker @dccc @CBCInstitute @RepAlGreen @texasdemocrats @TexasTribune https://t.co/1mfCgQwNp3
25,2021-03-19 13:22:24+00:00,1372901271150194706,"Vote Dem May 1. TX 6 Congress District is where Phil Gramm's &amp; Reagan's Trickle Down Economics left too many people out in the cold. 
 https://t.co/DgsNgSHwHt"
26,2021-03-19 13:22:06+00:00,1372901194096607239,"Vote for Dem Daryl Eddings May 1 for open seat in Congress.  Barton's and Wright's measuring prosperity by O&amp;G profits leaves too many people too sick to work, too poor to pay for dental care  and too broke to buy a house. https://t.co/DgsNgSHwHt"
27,2021-03-16 23:49:26+00:00,1371971903913664514,"I’m attending Tarrant County Democratic Party’s event, “Meet the Democratic Candidates Running for TX-06” – sign up now to join me! #TarrantDems https://t.co/7SafjHazxe"
28,2021-03-16 23:05:12+00:00,1371960770855108608,"Please check out Daryl Eddings, Sr for Congress website and share it with others: https://t.co/Tk9Y0wSSxh"
29,2021-03-13 03:00:39+00:00,1370570474435010563,"https://t.co/nienvOcQU4
There are 12 Trumpites in this May 1st Special Election to fill an open seat in a Purple District. Please Help. @ccjr16222 @LupeValdez @KGHatton @GinaForAustin @RepColinAllred @RepAlGreen @alfranken @AdamParkhomenko @HillaryClinton @ChristianGooden"
30,2021-03-13 02:40:59+00:00,1370565526053871621,#VoteBlue2022 #VoteBlue #VOTEBLUENOMATTERWHO #VoteBlue22 #VoteEddings #VoteTX6May1 #FliptoBlue #BlackLivesMatter #BlackDems https://t.co/5cKruIUhvi
31,2021-03-13 02:37:02+00:00,1370564528841326593,https://t.co/nienvOcQU4
32,2021-03-11 15:02:55+00:00,1370027461174423556,Now we need to increase the Democrats seated in Congress. Help Daryl Eddings keep the TX 6th seat away from 12 Trumpster Reps on the May 1 Special Election Ballot. Please share Daryl's donor link https://t.co/slAEf25QxN https://t.co/zGNe0Vu4aF https://t.co/k3PmTAVYpC
33,2021-03-11 15:00:15+00:00,1370026791939674116,"Speaker Pelosi, help keep the Texas 6th seat away from the 12 Trump supporters on the May 1st ballot. Support and retweet Dem Daryl Eddings donor link https://t.co/slAEf25QxN https://t.co/A2sFbhM8J7"
34,2021-03-11 14:46:46+00:00,1370023397577551885,Democrat Daryl Eddings is a highly decorated non com officer. His donation link is https://t.co/slAEf25QxN https://t.co/9XlxLntTO4
35,2021-03-11 14:45:22+00:00,1370023043993571329,It is 10 with 12 Trumpsters and 2 others who are probably Trumpsters. One R ran unsuccessfully in NV as a Trump endorsee and is now carpetbagging to Texas. Help Daryl Eddings https://t.co/slAEf1OfGf https://t.co/QqGYuaWacg
36,2021-03-11 14:43:41+00:00,1370022619794333698,Thanks. Keeping this seat away from the 12 Trumpsters on the ballot is crucial! Help us by retweeting Daryl's messages. Donation link is https://t.co/slAEf1OfGf https://t.co/5uAtloAUlZ
37,2021-03-11 14:20:04+00:00,1370016680039026689,Democrats and Trump Republicans compete together May 1 for vacant TX 6th Congressional Seat. Please donate to Daryl Eddings -- help flip  this purple seat to Democratically Blue. https://t.co/slAEf1OfGf https://t.co/Wt2S3ZNpY8
38,2021-03-11 14:17:44+00:00,1370016092274446336,"Send another Democrat to Congress. May 1 Special Election in TX 6 attracts former Trump Staffers. Help Democrat Daryl Eddings win that seat. Please share and donate. 
https://t.co/NpF8uguaqJ..."
39,2021-03-11 09:02:55+00:00,1369936865814585348,Says who Bud? This Texas Republic descendant Dem knows Mexico won. Democrats are as likely as Republicans to take Texas History. We actually seem to retain some of our Civics lessons too. For instance we know storming the Capitol to overturn an election is treason. https://t.co/FVtspb0PB8
40,2021-03-10 05:04:10+00:00,1369514395835961344,https://t.co/DgsNgSHwHt https://t.co/tbXsSiZqgU
41,2021-03-07 06:46:01+00:00,1368452861085028354,"23 candidates filed. 11 Rep., 10 Dem. 1 Lib, 1 Indep. Help turn out the Democratic base to put Democratic candidates ahead of the others. If we get two Dems in a run-off we succeed in flipping the Tx6! Don't let Trump's folks take this seat! https://t.co/OheffzmPBA"
42,2021-03-07 06:42:53+00:00,1368452073801519108,There is a March 20 Special in Louisiana 2nd and 5th Congressional Districts too! Their run-off is April 24th. In LA 5 Candy Christophe is the only Dem with 9 Rs and 3 other candidates. Help Ms Christophe flip the LA 2nd seat! https://t.co/Ze5xrLkVs6
43,2021-03-07 06:40:13+00:00,1368451403706949633,The last day for mail applications to BE RECEIVED for this election is April 20. We need every Democratic vote possible to flip this seat. There are 12 Republicans and 3 Independents/Libertarians who are rt leading competing with 10 Dems. Help Dems win or make the June run off. https://t.co/Ze5xrLkVs6
44,2021-03-05 13:15:05+00:00,1367825995915526149,Those who gave Trump liberty to rob the coffers now are trying to play like deficit hawks. Daryl Eddings makes decisions on what is necessary for the people not for big donors. Elect Eddings May 1 in Texas 6th US House District.
45,2021-03-05 13:12:27+00:00,1367825336725999618,"Mail ballots for the Special Election May 1st in the Texas 6th US House District must be RECEIVED by April 20. Long ballot. 11 Republicans wanting to extend ""Trump's Legacy"" or ""Barton's/Wright's"" are on the ballot. Lots of out of work Trump staffers on the ballot. https://t.co/a8Py6CPEOc"
46,2021-03-05 08:16:13+00:00,1367750784574779392,"I’m attending Tarrant County Democratic Party’s event, “Meet the Democratic Candidates Running for TX-06” – sign up now to join me! #TarrantDems https://t.co/RIkohHWP5H"
47,2021-03-05 06:41:19+00:00,1367726902518091777,"I prefer living the legacy of John Lewis - not Trump or Phil Gramm, Joe Barton or Ron Wright.  Daryl Eddings, Candidate Special Election 5/1 Texas 6th US House https://t.co/hONU3kezeb"
48,2021-03-05 03:35:43+00:00,1367680196493668354,Tea Party Republican activist Susan Wright wants to continue her husband's and his former boss Joe Barton's legacy of extreme Right ignore the people and enrich the energy companies with no accountability.  Special Election May 1st is BATTLEGROUND in TX 6 US House race.
49,2021-03-05 03:32:39+00:00,1367679424519417856,"Practically every former Trump staffer filed to run in the Special Election for TX 6 US House Seat May 1st. 12 Rep's, 1 Lib, 1 independent face a slate of Democrats May 1st for the seat. The strongest D is Daryl Eddings Jr."
50,2021-03-01 21:15:38+00:00,1366497378736500740,"Wed March 3rd at 5 we will see who pays the money and or presents 500 signatures gathered during a pandemic and actually files to fun.  Facing $3125 filing fee and $3000 to use the Dem VAN for 2 months eliminates some. That is before you start with signs, staff, GOTV, etc. https://t.co/QqGYuaWacg"
51,2021-02-27 21:29:18+00:00,1365776043773198344,"Instead of incentives to weatherize and upgrade, Republicans in TX and the US Congress developed an energy scheme  where providers profited when they failed to deliver electricity and natural gas to Texas residents and businesses. Daryl Eddings will look out for people."
52,2021-02-27 21:26:11+00:00,1365775260419817474,"Ron Wright and Joe Barton have spent decades protecting the bottom line of their energy sector donors at the expense of homeowners and businesses in the TX 6 district. That changes when you elect Daryl J. Eddings Sr to fill the open seat in the May 1, 2021 Special Election."
53,2021-02-27 21:17:27+00:00,1365773060138299394,"Screaming ""freedom"" or ""patriot"" doesn't wipe fascist, racist assaults on the US Constitution. Daryl J. Eddings, Sr. is running because we have too many right wing extremist in both houses of Congress who dishonor and ignore our Constitution. https://t.co/28K4y2eISO"
54,2021-02-27 21:15:30+00:00,1365772572445573133,"Precious patriotic symbols which generations of American men and women have given their lives and limbs for were used as weapons to assault our capitol in attempts to usurp the legally elected presidency. Let's elect another lifelong Democrat, Daryl J. Eddings, Sr. to US TX 6."
55,2021-02-27 21:10:40+00:00,1365771356923658243,"A highly decorated non-commissioned Army officer/combat vet, Daryl Eddings Sr. joins most of the nation in disgust at the sight of our American flag being used to batter and attack Capitol Police."
56,2021-02-27 21:06:17+00:00,1365770250130702336,"Daryl J. Eddings, Sr. (1st Sgt) is running for the open Texas 6th Congressional Seat because it has been filled too long by men who dismantling government agencies instead of focusing them in serving the people."
57,2021-02-27 21:02:54+00:00,1365769399253274628,https://t.co/K3vC458eFv
