,Created at,User ID,Text
373,2021-10-21 18:43:03+00:00,1451257740366581760,"I’m constantly reminded of the survivors of this deadly illness, the people we’ve lost, &amp; those with a new diagnosis -- navigating treatment, unsure of the future."
374,2021-10-21 18:43:02+00:00,1451257738340745222,"At just 30 years old, my mom received a diagnosis that changed her life: breast cancer. She had a double-mastectomy and a lymphadenectomy when I was a little girl. 

#BreastCancerAwarenessMonth https://t.co/QUyNaEpQaP"
375,2021-10-08 21:55:05+00:00,1446595028013436929,You know you’re back in Michigan when it’s pouring and the sun is shining! https://t.co/iugpyHNJLO
376,2021-09-30 17:06:03+00:00,1443623185530998784,"My dad can’t watch TV without seeing an attack ad. Why? Because 2022 is heating up. Democrats hold the House majority by just 4 seats - and mine’s a top target.

Chip in before our midnight deadline to help us fight back &amp; keep the House!

https://t.co/3tuEIwhdct https://t.co/xUIlt0PpCF"
377,2021-09-25 15:00:37+00:00,1441779681246646276,"Just had to re-up this from last year.  Happy anniversary, Dave! https://t.co/pxXr5spxHj"
378,2021-09-20 20:29:15+00:00,1440050444282171392,"When people still in Afghanistan began reaching out, my team &amp; I started making calls. An incredible group of veterans &amp; dedicated citizens across the globe answered. 

I joined @DevinScillian to talk about the round-the-clock evacuation effort. Watch ⬇️

https://t.co/rJpwo4oMbq"
379,2021-09-19 14:42:50+00:00,1439600878680424448,Great win for @MSU_Football in Miami yesterday! @Coach_mtucker is doing something special this year and I can’t wait to be back at Spartan Stadium to see it in person! #GoGreen https://t.co/O57IqwqW5g
380,2021-09-11 14:24:15+00:00,1436697098083348485,"Today, we honor the commitment of our first responders and remember those we lost, and acknowledge that our country is so much stronger when we stand together."
381,2021-09-11 14:24:14+00:00,1436697095818317825,"Reflecting on my own experience in NYC on 9/11, what's stayed with me is the way our country came together in the aftermath. That has always been my reminder of what our country can be when we’re at our best and feel that we’re playing on the same team. https://t.co/8bHCNBH6jT"
382,2021-09-07 17:47:27+00:00,1435298685232033793,"To all who are celebrating #RoshHashanah in Michigan and beyond, L’Shana Tova to you and your loved ones! I want to wish you a happy, healthy, and sweet New Year."
383,2021-08-11 20:14:47+00:00,1425551288083927044,"I hope leaders will join me in condemning this hate-inspired behavior and doing everything in our power to make sure that next year’s Melon Fest returns as the joyful, inclusive tradition it has been for so long."
384,2021-08-11 20:14:46+00:00,1425551287093956611,"All elected officials, candidates &amp; local leaders share a responsibility to lead by example for our kids, de-escalate tense situations &amp; to disavow threats of violence. This goes two-fold when so many local businesses depend on the revenue, especially after the tough last year."
385,2021-08-11 20:14:46+00:00,1425551286016040963,"The hateful vandalism perpetrated against one of our community farmers &amp; leaders, on top of the onslaught of violent threats and hate, stand in complete opposition to the values the majority of people share in Livingston County, and the spirit of the Howell Melon Fest."
386,2021-08-11 20:14:46+00:00,1425551284703203340,"Howell’s Melon Fest has been a community staple for years. That’s why it’s so disheartening that this tradition, which brings families together &amp; supports local farmers, was scaled down because of the repugnant &amp; threatening behavior of a small minority. https://t.co/P3HCgbXqBa"
387,2021-08-11 16:18:06+00:00,1425491724705665029,Need health insurance or want to see if you can get it for a lower rate? There are four days left in the special enrollment period for ACA health insurance. Visit https://t.co/WpdCimYGl0 to find a plan that works for you and get covered.
388,2021-08-05 17:06:59+00:00,1423329702094286852,"Richard Trumka dedicated much of his life to advocating for working men &amp; women all over the US. His efforts left our middle class stronger &amp; our country more prosperous. I send my deepest condolences to his loved ones, Ron Bieber at the @MIAFLCIO &amp; the whole @AFLCIO family."
389,2021-08-02 22:03:16+00:00,1422317097275772932,"Tomorrow is Election Day in Michigan! There are all sorts of local officials up for election in our district, from city council members to mayor. Local elections have a major impact, so be sure to make your voice heard. Find your polling place here: https://t.co/VlwMWPiCdg"
390,2021-08-02 17:12:07+00:00,1422243827277041667,"Oakland STRONG and Michigan proud! Congratulations to Oakland University’s Katherine Nye — the first Team USA woman to win silver in weightlifting in 20 years! 

https://t.co/hJG3qmpteK"
391,2021-07-28 20:29:00+00:00,1420481438999273476,"Elissa Slotkin for Congress is searching for stipended fall interns to play a key role on our top-tier political campaign. Check out the full posting and apply by Wednesday, August 11. https://t.co/V3oM0wizD1"
392,2021-07-24 16:58:48+00:00,1418978986399576064,"While she’s taught me a thing or two about Gen Z and the latest social media trends, I [hope] I’ve taught her a thing or two about government and how we try to deliver for our constituents."
393,2021-07-24 16:58:47+00:00,1418978982419128324,"“Some people need a person to fight for them, not a party” -- that’s what my 15-year-old cousin says she learned while shadowing me for the past two weeks. It’s been so fun to have her with me, especially on #NationalCousinDay. https://t.co/lsnIY2zDGK"
394,2021-07-22 15:38:01+00:00,1418233883150233601,"Environmental security *is* homeland security. Preserving our environment and removing PFAS from our water is about the safety of our kids and the preservation of our way of life in Michigan. 
https://t.co/OhWxOVwsKg"
395,2021-07-21 17:04:46+00:00,1417893324497866752,"For over a year, the FBI’s Indianapolis field office knew about the allegations against Larry Nassar but did nothing. This kind of government failure is unacceptable, and I want to know exactly what the FBI is doing to make sure this can't happen again. https://t.co/GYAgmyOoXr"
396,2021-07-21 14:37:05+00:00,1417856160154234883,"So you could probably say my family is a hot dog family. We talk about hot dogs, dress up as hot dogs, and of course, eat a lot of ‘slot-dogs.’ Today, I am wishing you and your family a day *filled* with hot dogs."
397,2021-07-21 14:37:05+00:00,1417856158434533379,"It’s one of my single favorite days of the year -- #NationalHotDogDay! When my great-grandfather arrived in the United States he founded Hygrade Foods, which created the famous Ballpark Frank, first sold at Tiger Stadium. https://t.co/oo1oB81XCI"
398,2021-07-16 14:04:12+00:00,1416035943333744641,"On this summer’s ballot are various ballot proposals and elections for school board representatives, city council members, and mayors all across the 8th District. Check out what’s on the ballot in your area at: https://t.co/VIcGHpqpLn"
399,2021-07-16 14:04:11+00:00,1416035942285066245,"Local elections can have a big impact on our lives, and on August 3rd you’ll have the chance to make your voice heard.  

Register to vote, update your voter information, or apply to vote absentee by visiting: https://t.co/bNRJ9VhYHb"
400,2021-07-15 14:06:00+00:00,1415674010411618304,"If you filed taxes this year and qualify for the credit, the payments are automatic. You can learn more at: https://t.co/IPP0Wuxooo"
401,2021-07-15 14:06:00+00:00,1415674008905920512,"I voted for this tax cut as part of the last COVID relief package because we had to help working families get through the pandemic. More than 75% of kids in #MI08 will benefit from expanding the tax cut, lifting families out of poverty and putting money in parents’ pockets."
402,2021-07-15 14:05:59+00:00,1415674007144251392,"Great news for thousands of Mid-Michigan families: starting today, most families who have kids under the age of 18 will start receiving payments of up to $300 per child through the #ChildTaxCredit."
403,2021-07-12 21:40:44+00:00,1414701282846253056,"My 15-year-old cousin also joined me to meet the first woman VP -- a first that means so much to so many. Thanks for coming to our great state, Madam Vice President. Now let's all do our part and get vaccinated."
404,2021-07-12 21:40:43+00:00,1414701280673636353,"Today I joined @KamalaHarris in Detroit as she talked about the importance of getting vaccinated. It’s critically important, not just for your own health, but to help prevent strains like the Delta variant from spreading through our communities. https://t.co/1ST5YLZ1js"
405,2021-07-04 17:19:41+00:00,1411736483489325057,"Happy 4th! We’re having a great time with the whole family here at the farm -- it’s been too long since we’ve all been together. We’re celebrating with hotdogs (of course), cold beers, and our family tradition, grilled salami. Wishing you and your loved ones a terrific holiday! https://t.co/WJQpjFc0GH"
406,2021-07-02 21:07:59+00:00,1411069162722578435,No better way to celebrate my brother David’s birthday than a family paddle on the Shiawassee! The water was high — and fast — so it was a perfect Pure Michigan day for many of the kids’ first experience getting in on the paddling action. https://t.co/nqQQVrJRUa
407,2021-06-23 23:32:26+00:00,1407844025688903680,"If you read the GOP-led report, you can’t claim Michigan has a problem with election integrity. It’s therefore hard to see these Republican bills as anything other than attempts to confuse the voters in the hopes that fewer people end up voting."
408,2021-06-23 23:32:26+00:00,1407844024858316802,"Today the Michigan Senate released a report on the 2020 election that found there was “no evidence presented to prove significant acts of fraud.” But hours later,  Republicans in the State House passed bills that will make it harder to vote in person &amp; to get an absentee ballot."
409,2021-06-20 12:52:39+00:00,1406595855143116800,"Happy #FathersDay, Dad. Thank you for everything you’ve taught me."
410,2021-06-20 12:52:39+00:00,1406595853977063428,"It’s something I still admire about him today in retirement -- his loyalty and concern for his family and friends. I use the lessons my dad taught me every day. The simple value of integrity matters, even in a complicated place like Congress."
411,2021-06-20 12:52:38+00:00,1406595851573673988,"My dad Curt has had such an impact on my life. He worked in the meat business his whole life, and ninety percent of his work was confirmed with a handshake. For him, a promise is a promise. He lived his value of integrity in his business decisions and in his everyday life. https://t.co/qrJu8hnqiY"
412,2021-06-17 23:43:29+00:00,1405672475728531463,"For all of these families and so many others, I’m so relieved the Supreme Court has upheld the protections provided by the ACA. Now, we have to build on it to make sure everyone has access to quality, affordable healthcare."
413,2021-06-17 23:43:28+00:00,1405672474721796099,"And there’s Mark and Susan. Susan survived brain cancer, but if protections for people with pre-existing conditions went away, she could lose her coverage."
414,2021-06-17 23:43:28+00:00,1405672473740419072,"Linda and Craig, who have two sons with serious, chronic conditions, are still paying huge premiums. Linda worries they could never afford market coverage."
415,2021-06-17 23:43:28+00:00,1405672472695934977,"Last October, I spent a day traveling the district and hearing from folks about what repealing the ACA would mean for them. I heard from Keith, about his concern for his son Kyle, who has muscular dystrophy but has been able to stay on his dad’s insurance through college."
416,2021-06-17 23:43:27+00:00,1405672470900793349,I’ve heard from so many Michiganders about how key pieces of the ACA -  like protecting folks with pre-existing conditions from being targeted by insurance companies and allowing young adults to stay on their parents’ plans - are life-saving. https://t.co/nz0Eu63M3s
417,2021-06-17 19:14:13+00:00,1405604715606515722,"There’s lots happening in celebration of Juneteenth, as we mark the beginning of a struggle not yet finished. Check out what’s going on in our area, both virtually and in-person: https://t.co/jrGOkjjMKg"
418,2021-06-12 15:52:24+00:00,1403741985345789952,"Today, our family expresses our gratitude to an institution that has given us so much and continues to instill the values of service, tradition and patriotism in Americans all across the country. #ArmyBday"
419,2021-06-12 15:52:24+00:00,1403741984561508364,"As a proud @USArmy family, we’re particularly excited to wish the U.S. Army a Happy 246th Birthday! My husband Dave served in the Army for more than 30 years and my step-daughter is now an Army officer."
420,2021-06-08 18:23:20+00:00,1402330417907253253,"We owe this progress to the hard work of so many who have stood up and fought for equality. So this month, I'm recognizing the work we still have to do, and celebrating those who have worked so hard to get us where we are today. In honor of my mom, I wish you a very Happy Pride."
421,2021-06-08 18:23:20+00:00,1402330416745484293,"My mom would be so excited by the progress we’ve made in the last decade, but I know she’d be telling me to “keep on it,” -- to keep pushing forward the mission for equality."
422,2021-06-08 18:23:19+00:00,1402330415759867914,"She passed away in 2011, so she never got to see marriage equality become a reality. I’ll never forget watching her longtime partner, Annie, care for her, knowing our state didn’t recognize their commitment to each other under the law."
423,2021-06-08 18:23:19+00:00,1402330413566201860,"Every #PrideMonth, I think of my mom. She came out in the 1980s in suburban Detroit, which was no easy thing to do. https://t.co/KJ2751YQ9G"
424,2021-06-02 19:16:46+00:00,1400169538814103556,"Back in 2018 when I first ran for Congress, I pledged not to take corporate PAC money because I never wanted my constituents to question why I voted a certain way."
425,2021-06-02 19:16:46+00:00,1400169537329373187,"I’m committed to running a people-powered campaign, and today I’m proud to be endorsed by End Citizens United and Let America Vote, two organizations that are dedicated to getting money out of our elections, protecting the right to vote and strengthening our democracy. https://t.co/3Pkw5i4jUI"
426,2021-05-31 23:01:32+00:00,1399501327726641152,"The best part of the event? Seeing the young people in the crowd, including Boy Scouts and the Howell High School Junior ROTC, appreciate the generations who have come before them. It felt good to be all together again."
427,2021-05-31 23:01:32+00:00,1399501326942302211,"While it was great to connect with folks I haven’t seen in person in over a year, there was also a solemn ceremony that reminded the hundreds in attendance of all we have lost."
428,2021-05-31 23:01:31+00:00,1399501324534763524,"It’s fitting that the first parade I’ve attended since COVID started was the American Legion Memorial Day parade in Howell — you could just feel how ready people were to come out, especially to recognize those who have paid the ultimate price for our country. https://t.co/hLEPVW6AXm"
429,2021-05-27 22:35:44+00:00,1398045283670544390,"Mela, I will not say goodbye, but instead “until we meet again.” But as she departs, we welcome Matt Hennessey as my new Chief of Staff. He’s a major asset to our team and, despite having big shoes to fill, he’s already hitting it out of the park. Welcome, Matt!"
430,2021-05-27 22:35:44+00:00,1398045282659672066,"Mela has been a pivotal part of our win in 2018 &amp; our work in Congress ever since I somehow convinced her to move to Holly from Bahrain, where he husband was deployed. I’m so proud of the leader she’s become &amp; thrilled that DOD, and the entire country, will benefit from her work."
431,2021-05-27 22:35:43+00:00,1398045280382095361,"Today, Team Slotkin bid farewell to my longtime Chief of Staff &amp; Campaign Manager, Mela Louise Norman. Mela is returning to the Pentagon, where we first worked together, to take up the critically-important job of Deputy Chief of Staff to Secretary of Defense Lloyd Austin. https://t.co/FktenDnMjQ"
432,2021-05-26 19:09:43+00:00,1397631049748910086,"You know the light at the end of the COVID tunnel is a little bit closer when you experience live music three times in 36 hours. Doesn’t get much better than MSU music students, a dad band and a Marvin Gaye tribute. https://t.co/GGoibICBXJ"
433,2021-05-20 22:30:02+00:00,1395507133123342337,"Last night the House passed a bipartisan bill to create an independent, bipartisan commission to investigate the 1/6 attack.

Now it’s time for the Senate to stop worrying about the midterms, put on their big boy pants &amp; pass this bill for the good of the country. https://t.co/uTnmqonQBE"
434,2021-05-18 23:39:30+00:00,1394799839628742662,"Any day we get to talk trucks, bringing good-paying jobs to Michigan, AND setting up the U.S. to lead the world in sustainable tech is a *very* good day. 

I got to do just that when I joined @JoeBiden and @gretchenwhitmer to tour the Ford plant making the electric F-150. https://t.co/hCWSZwo9Rq"
435,2021-05-12 23:12:00+00:00,1392618590768144386,Eid Mubarak to all who are celebrating! Wishing everyone a blessed day filled with safe and joyous celebration with the hope that next #EidAlFitr we can all celebrate together again.
436,2021-05-09 23:13:23+00:00,1391531775369830403,"This year, I was asked to share a story with the @freep about a lesson that I learned from my mom, Judith. 

That lesson? ""You don't ask, you don't get.""

https://t.co/apwMo6qe4A"
437,2021-05-08 00:56:20+00:00,1390832907460165641,"Joining @RealTimers tonight to talk about protecting our democratic system &amp; how we maintain a healthy, substantive debate between the two parties. Tune in at 10pm EST. https://t.co/UkqdnC7TaK"
438,2021-05-06 13:12:09+00:00,1390293309017427974,"Michigan’s own @BobSeger was my first concert ever, at the old Pine Knob, and Dave and I went back there in 2017 for another Seger concert. Wishing this Michigan legend a Happy Birthday. Bob, if you’re reading this, I am a *massive* fan. https://t.co/tJE7a8PX96"
439,2021-05-06 13:07:03+00:00,1390292023408726017,A very happy Seger de Mayo! You may still be recovering from the margaritas of Cinco de Mayo but today should be a state-wide holiday – @BobSeger’s Birthday.
440,2021-04-29 21:52:24+00:00,1387887515978407940,"This sums up how I’m feeling about it being @stabenow’s birthday. Thank you for your kindness, sound advice, and the example you have set for all of us in Michigan. https://t.co/mVGcEiRp2Z"
441,2021-04-29 01:40:23+00:00,1387582503964270593,Watching the address. Rocky liked the made-in-America parts. https://t.co/T8e6NSqrpS
442,2021-04-22 21:44:21+00:00,1385348776039231493,"Want real-world experience in politics? Our paid campaign internship program is perfect for young people seeking real, applicable experience on a campaign. This program is the main pipeline for full-time paid staff roles. Application at the link below! 

https://t.co/UknukwoDfy"
443,2021-04-22 13:34:52+00:00,1385225592539336713,"On this #EarthDay we’re reminded of the urgency that’s required to address climate change so that our kids and grandkids can enjoy all the natural beauty Michigan has to offer, including Isle Royale, one of my favorite spots that Dave and I have paddled! https://t.co/Qm3Q2Rcc2P"
444,2021-04-22 13:34:51+00:00,1385225589917945861,"Environmental security is also economic security, because investing in the development of clean energy technologies isn’t just good for the planet, it also means economic potential and good new jobs -- especially in Michigan, where we’ve always been a leader in manufacturing."
445,2021-04-22 13:34:51+00:00,1385225589158780933,"For me, environmental security is homeland security, because if you can’t give your child a glass of tap water without risking them getting sick, that’s a threat to you and your family."
446,2021-04-19 18:55:52+00:00,1384219211963146244,"Attention college students -- especially class of 2021!
Elissa Slotkin for Congress is searching for stipended summer interns to play a key role on our top-tier political campaign. Check out the full posting and apply by Monday, April 26. https://t.co/mRfciU7GBz"
447,2021-04-19 00:15:43+00:00,1383937318415855618,"My 8 year old niece is learning about poetry and rhyming, and woke up repeating this gem. Politics, family, and dogs. Sounds about right. https://t.co/AncJaIroMB"
448,2021-04-18 22:38:37+00:00,1383912883369639942,"This bill will help vets cut through red tape at the VA so that they get the care they need, because no veteran should be fighting the VA while they’re fighting for their life."
449,2021-04-18 22:38:37+00:00,1383912882266509319,"That’s why I introduced the Veterans Burn Pits Exposure Recognition Act, a bipartisan bill that will make it easier for veterans who have suffered from toxic exposure to get the benefits and care they’re entitled to."
450,2021-04-18 22:38:37+00:00,1383912881150857217,"It’s an issue I follow closely because I lived near one during each of my 3 tours in Iraq with the CIA. 

What’s a burn pit? They're literal pits used to burn trash &amp; waste produced by the U.S. military in combat zones. The fumes have had long-term consequences on people’s health"
451,2021-04-18 22:38:37+00:00,1383912879762538503,"I’ve heard painful stories from service members about veterans suffering from strange illnesses but being unable to prove to the VA that they need proper care. 
https://t.co/CTtQDO3hrx"
452,2021-04-14 00:26:27+00:00,1382128078302875649,"Tonight I joined @RanjeevPuri for a virtual #Vaisakhi celebration, where I reminisced about great memories from a trip I took to Northern India in college. 

As Sikhs across Michigan celebrate the New Year, I’m wishing all who are celebrating a very Happy Vaisakhi."
453,2021-04-12 20:34:04+00:00,1381707210628153344,"#ramadanmubarak to all who celebrate! Wishing you and your families a blessed month of peace &amp; reflection. It's been such a stressful year–here’s hoping that next year’s holy celebration can include the family, friends, and festivities that usually come with this special month."
454,2021-04-10 14:05:00+00:00,1380884522422706177,"Happy #nationalsiblingsday to my brothers Keith, Jon, and David. In 2018 &amp; 2020, Keith came out to MI to volunteer with the campaign -- he was even with me when I turned in my first nominating petitions to get on the ballot. Excited to rope him back into door knocking in 2022! https://t.co/xqJfxziFcf"
455,2021-04-09 18:15:01+00:00,1380585053546287104,"Today, we honor the service, sacrifice and remarkable bravery of Norius and our other prisoners of war."
456,2021-04-09 18:15:01+00:00,1380585052329947144,"Earlier this year, @MLive published this story about Norius Crisan, a Michigan WWII vet who survived a plane crash behind enemy lines. Norius was a POW for over two years before returning home at the end of the war. https://t.co/kk3u3fEPi8"
457,2021-04-09 18:15:00+00:00,1380585051277131783,"Today is #FormerPOWRecognitionDay, which marks the 79 year anniversary since the largest number of U.S. service members were captured in the Philippines during WWII."
458,2021-04-08 01:32:40+00:00,1379970414483537921,"Thanks @BrookeBaldwin for the copy of your new book #HUDDLE: How Women Unlock Their Collective Power.  Proud to be in it, along with the other ‘Badass’ women of the congressional class of 2018.  Wine in paper cups and cheap ice cream ANY time. https://t.co/BZS3eeRAnL"
459,2021-04-04 12:55:00+00:00,1378692578384637953,"#HappyEaster to all who are celebrating today. After such a challenging year, may your day be filled with hope for a brighter 2021 with the light at the end of the tunnel ahead."
460,2021-04-01 14:54:17+00:00,1377635436403826693,P.S.: Darlene’s handiwork can be found at: https://t.co/3xJOtbwCgX
461,2021-04-01 14:54:17+00:00,1377635433669070852,"Spring = Tigers = Spring! I’m sporting my @tigers mask for opening day, generously made by Darlene in Brighton, who made Dave and I some lovely Michigan-themed masks like this one. Since most of us can’t be at opening day, feel free to show off your Tigers spirit wear! https://t.co/YdR0hbk6eW"
462,2021-03-30 19:50:32+00:00,1376985211385344006,"Semiconductors, ice cream, powerboats, and puppy warmers -- check out some of the coolest things made in our own state!

https://t.co/OENz8wEepR"
463,2021-03-27 23:45:00+00:00,1375957053345267713,"Wishing all who celebrate a joyous Passover. Even though this is the second Passover in a row many families have had to celebrate apart, may we find hope in seeing the light at the end of the tunnel. Next year, in person! #ChagSameach"
464,2021-03-26 14:37:40+00:00,1375456924540547084,"Grateful to have the support of @emilyslist, a grassroots organization doing the nitty-gritty work to help elect women at all levels of government. https://t.co/VQbmbAckY4"
465,2021-03-24 12:50:25+00:00,1374705160803483649,I previewed the work I plan to do as Chair of the Intel &amp; Counterterrorism Subcommittee with @NPRinskeep - listen below: https://t.co/GGtqXb9zJg
