,Created at,User ID,Text
100,2022-03-02 03:36:55+00:00,1498864906451443716,"What we didn’t hear tonight: Any plan to lower prices at the gas pump, fight inflation, cut taxes on hardworking Americans, or secure the border. In Congress I will get to work creating opportunities for Virginians, not creating more government. https://t.co/ML10eyhK4F"
101,2022-03-01 02:11:15+00:00,1498480957023739910,It was great to join the @LoudounGOP for a packed meeting this evening! Thank you to outgoing Chair Sharon Sadler for your years of dedicated service to Loudoun and our Commonwealth. https://t.co/0eyg1XT7Ii
102,2022-02-28 13:59:34+00:00,1498296825861787654,Thank you @LarryOConnor for having me on @WMALDC this morning! It was great to have the opportunity to discuss our fight to protect the Manassas National Battlefield Park and the rural areas of Prince William County. https://t.co/7m68jRpDow
103,2022-02-25 20:42:37+00:00,1497311090245578753,https://t.co/vfubBbl08i
104,2022-02-25 20:41:18+00:00,1497310759562489859,"I'm honored to be selected by the @NRCC Young Guns program and added to the ‘On the Radar’ list. Our message of reining in spending, restoring commonsense leadership and standing up for our values is resonating. We are ready to flip Virginia’s 10th District this November! https://t.co/195fbZG2Kv"
105,2022-02-24 14:47:53+00:00,1496859430792855553,"Our country and the world need strong leaders to stand up to countries like Russia. Biden has proven that he is anything but a strong leader. In Congress, I will support strong foreign policy, deter acts of war before they are committed, and make our country respected again."
106,2022-02-24 14:47:52+00:00,1496859429538574341,"This lack of American leadership rests fully with Joe Biden and his refusal to stand up to Putin. By allowing the Nord 2 pipeline and failing to take action against violations of international law, Biden sent a clear message to Russia that the road into Ukraine was wide open."
107,2022-02-24 14:47:52+00:00,1496859428372758530,Vladimir Putin’s military assault on Ukraine is an act of war and an unprovoked violation of international law. My prayers are with the Ukrainian people as they fear for the safety of their families and the future of their country.
108,2022-02-22 22:10:42+00:00,1496246095348969484,"Russia’s actions were enabled by President Biden’s inexcusably weak policy towards Russia. In part, the waiving of sanctions on Nord Stream 2 in the first place. https://t.co/OcmPLAmzik"
109,2022-02-22 00:17:23+00:00,1495915588694204416,This is a woefully inadequate response. Biden’s foreign policy enabled this invasion. A weak response like this is more of the same and will only lead to further Russian aggression. #UkraineRussiaCrisis https://t.co/fur7Id7RNq
110,2022-02-21 23:27:15+00:00,1495902971468693506,"Leave it to the liberal media to accept the label of “peacekeeping troops.”

This is a military invasion, and the blame lies fully on Joe Biden and his weak, non-existent response to Putin’s blatant aggression. https://t.co/2nq4w2Psws"
111,2022-02-21 14:03:32+00:00,1495761108854087686,"With the radical left canceling our past presidents at every turn, it is more important than ever that we observe this day to honor the many great leaders who have served our nation. 

Happy President’s Day! https://t.co/i5eZ3X14ys"
112,2022-02-19 15:09:06+00:00,1495052830390071298,"We’re winning the battle for our children, but this fight is far from over. In Congress I will oppose mask mandates across the board at the federal level, just as I have in Prince William County. https://t.co/ncrzYStNFn"
113,2022-02-18 21:43:15+00:00,1494789634974437376,"Thank you to the Lansdowne Woods Republican Club for having me as your guest speaker this afternoon!

As your next Congresswoman I will continue to oppose costly tax hikes, protect our constitutional rights, and be transparent and accountable to those I’m elected to represent. https://t.co/sWrCIu1ZOH"
114,2022-02-18 03:27:49+00:00,1494513961156366363,"Glad to join @LoudounGOPWomen this evening to talk about my candidacy. Thanks for having me, and I’ll be back soon! https://t.co/fvrX0djxGm"
115,2022-02-18 01:02:23+00:00,1494477358799204354,"It’s always refreshing to be back with my home club, the Bull Run Republican Women. Many of these ladies have been with me through my earliest Supervisor campaigns, and I’m grateful to have so many with me now. https://t.co/yxtY1tdeFf"
116,2022-02-17 20:20:59+00:00,1494406545119002631,It is unbelievable that members of Congress are regularly able to exploit non-public information for their own personal advantage. I am fully supportive of Representative Chip Roy and his efforts to ban Congressional stock trading. https://t.co/1VOWmZIc9L
117,2022-02-16 21:11:37+00:00,1494056898756321283,It’s a great day in the Commonwealth! Thank you @GovernorVA for putting our children first. https://t.co/GEnzLO0ven
118,2022-02-15 15:43:53+00:00,1493612035501871105,"How lock-step are Jennifer Wexton and Nancy Pelosi? Close enough that Pelosi appointed Wexton to stand in as Speaker Pro Tempore this morning. 

It’s time to send Jennifer Wexton packing - visit my campaign at https://t.co/8IoAuQVFOw to learn more! https://t.co/jUFZjOFp5W"
119,2022-02-14 18:16:55+00:00,1493288158766804994,"Promises made, promises kept. Thank you to our Republican majority for putting our children first today. All we need now is @GlennYoungkin and a pen!

https://t.co/7oSP8XuqrH"
120,2022-02-14 00:55:16+00:00,1493026017199415298,I don’t see a single mask on any of the liberal celebrities at the Super Bowl. @LCPSOfficial @PWCSNews maybe it’s time to follow the science?
121,2022-02-13 18:33:16+00:00,1492929883860783107,"It was great to be at the @YFTVA Heart to Heart Gala, last night! Thank you for allowing me to join you and for the transformative work that you do. Always a pleasure to visit with @WinsomeSears as well! https://t.co/zchgHkyvU0"
122,2022-02-11 19:52:33+00:00,1492225060337242114,You lost the right to determine what “student safety first” means when you sided with the left-wing school board that hid sexual assault. https://t.co/ogibknb1m7
123,2022-02-11 16:30:00+00:00,1492174087568994319,I can’t believe that Democrats are STILL opposing this investigation. The only corruption here involves the Loudoun County School Board and Scott Ziegler covering up sexual assault. It’s far past time to drop the political games and cooperate fully with the Attorney General. https://t.co/QwvmutaR9z
124,2022-02-10 15:28:55+00:00,1491796327776206855,"Still waiting on an answer from @RepWexton as to whether she supports Buta Biberaj like she did in 2019. Loudoun residents deserve elected representatives who will do the right thing. Not blindly back Soros candidates and turn a blind eye to sex offenders.
https://t.co/GSmME0YJnq"
125,2022-02-10 00:10:17+00:00,1491565144748478469,"I’m so excited to announce that today I signed the @taxreformer Taxpayer Protection Pledge! As your representative, you can count on me to oppose tax hikes, lower your cost of living, and work to make life more affordable for hardworking Virginia families. https://t.co/PvjXh5akbF"
126,2022-02-09 20:09:30+00:00,1491504551203069953,"Three Democrats in the State Senate joined Republicans today to end mask mandates in Virginia schools. I hope this legislation passes the House and is signed by Governor Youngkin.
 
We need to stop letting woke school boards play politics with our kids and end mask mandates. https://t.co/D9Xjraf8uA"
127,2022-02-09 01:55:05+00:00,1491229132705136640,"It’s almost as if Senate Democrats have realized they’re up for re-election next year, and mask mandates are wildly unpopular. 

I’ve opposed mask and vaccine mandates as Supervisor. In Congress, I’ll ensure that you and your children have the freedom to make your own decisions. https://t.co/cQXsFVSHFS"
128,2022-02-08 14:07:37+00:00,1491051091844546560,Thank you Senator Petersen (D) for being a voice of reason amid this chaos.  I stand with parents and teachers against these irrational COVID policies.
129,2022-02-08 14:07:25+00:00,1491051041831661569,"“It has become hard, if not impossible, to find a respected medical researcher who still defends Forced Masking of Children as a public safety measure,” Sen. Chap Petersen wrote Monday. https://t.co/oiBPXIILxI"
130,2022-02-07 21:43:11+00:00,1490803353567252484,"Join #TeamLawson today and show off some swag with a #ParentsMatter t-shirt!

@WINRED’s #MerchMonday is the perfect time to buy yours! ✏️ #VA10 

https://t.co/NrNJfKLVLC"
131,2022-02-07 21:10:46+00:00,1490795193678843905,This is not right. I will always stand against mandates and fight for our freedom! https://t.co/GEh2UrTRYO
132,2022-02-07 20:33:39+00:00,1490785854763188228,Great news for Virginia! https://t.co/jnZ6tAbq3z
133,2022-02-07 17:50:11+00:00,1490744714148073473,We cannot allow the government to implement invasive and unconstitutional mandates.  I will always stand up for the liberty of all Americans to make the decisions best for their own healthcare.
134,2022-02-07 17:50:10+00:00,1490744711962931207,"Thank you, Congressman &amp; former Lovettsville resident, @chiproytx for standing up against these ridiculous and unconstitutional COVID mandates.

When elected to represent the people of Virginia's 10th Congressional District, I will proudly sign-on to your letter. https://t.co/ekwjBHk1lh"
135,2022-02-05 20:01:20+00:00,1490052944544346115,"#pups4Jeanine 🐶 #VA10 

#NewProfilePic https://t.co/eqk4nccNgP"
136,2022-02-05 17:17:16+00:00,1490011657183105025,It’s a great day to talk to voters about their Second Amendment rights! #2A https://t.co/1ZtOXPfbaC https://t.co/ov9P8vxDF1
137,2022-02-05 16:02:03+00:00,1489992727433551878,"Efforts to destroy the Second Amendment empower an out-of-control government and erode our liberty.  World history has consistently demonstrated after a government disarms its citizens, tyranny ensues.  I will proudly defend our Second Amendment to ensure that NEVER happens here."
138,2022-02-05 16:02:03+00:00,1489992726179467264,Come say hi 👋🏻 to me at The Nation’s Gun Show today in Chantilly! #2A
139,2022-02-05 02:55:27+00:00,1489794773615583233,"This mom gets it! I applaud you, @MerianneJensen. I am proud of you for standing up &amp; fighting for our children. https://t.co/DS4h5NcAPj"
140,2022-02-04 20:03:14+00:00,1489691035202633731,"The Loudoun County School Board, and school boards across Virginia do not make it make sense. That’s why I’m fighting back — taking this fight from the county level all the way to Congress. We need common sense leadership, not hypocritical policies. #VA10 https://t.co/Wi58GXnwUV"
141,2022-02-04 18:37:23+00:00,1489669432100204544,"#TeamLawson was out in full force at college campuses this week talking to @CRFVirginia about internship &amp; volunteer opportunities. 

If you’re interested in volunteering or interning for my campaign in #VA10, sign up here ➡️ https://t.co/9fjaT0GRAG https://t.co/h0tEO8ozp1"
142,2022-02-04 16:09:32+00:00,1489632220730081280,It doesn’t make sense. That’s why I’m running to defeat Jennifer Wexton &amp; bring common sense leadership back to #VA10! https://t.co/vMuy00EgDo
143,2022-02-03 18:53:39+00:00,1489311136658993157,I am proud to be endorsed by Prince William County Sheriff Glen Hill! #VA10 https://t.co/voHx8DFvM7
144,2022-02-03 18:04:44+00:00,1489298826968113153,"I have always &amp; will always support a parent’s right to choose what's best for their children. PWCS should not be getting in the way of that when the Governor’s EO has made clear, it’s beyond time we let students &amp; teachers take off their masks! https://t.co/3zcwAmwEH6"
145,2022-02-03 18:04:44+00:00,1489298825558773760,"“We have turned kids' lives upside down for what is essentially a non-risk. . . We play politics with kids’ faces.” — Merianne Jensen

I was proud to stand with Prince William County parents and teachers last night as they took their fight to the school board."
146,2022-02-03 00:41:42+00:00,1489036338573807620,We’re here loud &amp; proud in Prince William County tonight! #VA10 https://t.co/YC3ATEbPDm
147,2022-02-03 00:23:48+00:00,1489031831915745285,Great News! https://t.co/e6BUlU184J
148,2022-02-02 23:46:30+00:00,1489022447198343172,"I’m cheering on our mama bears 🐻 and fighting for our teachers &amp; children tonight at the Prince William County School Board meeting.

#VA10 https://t.co/sbRNlPr8kJ"
149,2022-02-02 20:59:00+00:00,1488980292215967749,I applaud this PWC parent &amp; nurse who is standing up and fighting the nonsensical policies our school boards are putting into place. #ParentsMatter #VA10 https://t.co/11ngOynLc7
150,2022-02-02 20:56:11+00:00,1488979582707511300,"Join #TeamLawson TODAY by donating $22.22 on 2/2/22 and help us flip the House in 2022!

https://t.co/04vkM7308u https://t.co/YWNRIyieL9"
151,2022-02-02 01:38:52+00:00,1488688336025837573,I won’t take a single vote for granted! I am grateful to be here talking to new friends in #VA10 https://t.co/5VeRcJpkv4
152,2022-02-02 01:17:58+00:00,1488683078310670338,"It’s great to be at the Fauquier County GOP meeting tonight in Warrenton talking about FIRING Pelosi, fighting for our parents, and protecting our history! #VA10 https://t.co/LaPMjHqvlU"
153,2022-02-02 00:15:46+00:00,1488667425155555331,"Dan and I are praying for the victims &amp; their families in this tragedy today in Virginia. 

I am thankful for the brave men and women in Law Enforcement who answer the call of service each and every day. #BackTheBlue https://t.co/CtVGNFDyLy"
154,2022-02-01 22:20:39+00:00,1488638454556725250,It’s the mama bears &amp; papa bears 🐻 standing up &amp; fighting for what’s right. I applaud them and will always stand up &amp; fight with them! #VA10 https://t.co/QTFhtdHEXn
155,2022-02-01 19:42:37+00:00,1488598683935518723,"I am proud to stand with these teachers who oppose these government mandates. In Congress, I will always stand with you and oppose government overreach.

See my letter below that I sent to Superintendent McDade and the Prince William County School Board. #VA10 https://t.co/uQ1GWAAF1W"
156,2022-02-01 14:07:02+00:00,1488514230420709382,"To kick off #BlackHistoryMonth I would like to honor our Lieutenant Governor, the first black woman to serve in this role, @WinsomeSears! https://t.co/2a4qbyUYLm"
157,2022-02-01 00:15:12+00:00,1488304891059752961,"It's the mama bears 🐻 who have stood up to these power hungry school boards from the start! Go Carrie! I stand with these parents, and oppose mandates on our kids. 

https://t.co/Ew9LB6WGfb"
158,2022-01-31 20:20:49+00:00,1488245907489529856,"Good on the National Fraternal Order of the Police. It's appalling Jen Psaki was so dismissive of the real crime concerns facing our communities today.

Public safety is no laughing matter. Jeanine has always and will always stand with our Law Enforcement. https://t.co/DIspWuWfuI"
159,2022-01-29 18:58:37+00:00,1487500446352691201,"I’ve opposed these mandates as a Prince William County Supervisor, and I’ll always support those opposing them elsewhere. Stand strong! #VA10 https://t.co/aKOnCHtVht"
160,2022-01-28 19:26:30+00:00,1487145073510912001,"I stand with the teachers, parents, and students opposed to vaccine mandates and I support ALL Virginians' medical freedom."
161,2022-01-28 19:26:29+00:00,1487145071992610816,This is great news for Virginians. I have talked to many college-aged children and parents concerned about the vaccine mandates imposed by universities and colleges across the Commonwealth. https://t.co/BJWb6WkAPe
162,2022-01-28 00:46:35+00:00,1486863238004367364,"It’s great to have @pattiehmenders here tonight talking about our great new administration in Richmond. 

The Momma Bears 🐻 stood up and fought — and they’re not done! #ParentsMatter https://t.co/k6onHnYDIC"
163,2022-01-28 00:44:27+00:00,1486862701439733760,"#TeamLawson is proud to be at Patriot Pub in Loudoun County this evening!

Over 150 people are in attendance tonight — what a crowd. The momentum is here 🔥 for #VA10 to FLIP ruby red ❤️ &amp; take back our country 🇺🇸 https://t.co/boe5vPyzNq"
164,2022-01-26 00:34:51+00:00,1486135510561136642,It’s great to be in Purcellville tonight with fellow conservatives! #VA10 https://t.co/PWxSiFMr3K
165,2022-01-25 17:26:32+00:00,1486027719611670529,We’re ready to take back #VA10 together! https://t.co/3d788U2esz
166,2022-01-25 00:20:41+00:00,1485769556387844096,It’s great to be in my home county tonight! @PWCGOP https://t.co/OiduHVvrkz
167,2022-01-24 16:38:58+00:00,1485653361198305282,"This is what happens when we let Woke radical Leftist take control. We cannot let them win. The Governor said it best, the Parents will win! 

I will always stand with our parents from the county level to the US House you can count on me to be a fighter for parental rights! #VA10"
168,2022-01-24 16:38:25+00:00,1485653222584897544,"“It’s never about our kids for them. It’s never been about their safety. It’s never been about their education. It’s about their power.” — Loudoun County Mom, Megan Rafalski #ParentsMatter

https://t.co/t21IbkfuCE"
169,2022-01-24 15:16:09+00:00,1485632521895305219,"“I am committed to fighting for our families, public safety, and a robust economy in Congress. Together, we will defeat Jennifer Wexton this November.”"
170,2022-01-24 15:16:09+00:00,1485632520687398914,"“I am honored to receive VIEWPAC’s endorsement, a critical organization that helped make 2020 the Year of the Republican Woman. I look forward to joining Republican women this year as we become Majority Makers taking back the House."""
171,2022-01-24 15:16:08+00:00,1485632518770540546,"The Lawson for Congress campaign is proud to announce that @VIEWPAC is endorsing Jeanine Lawson in #VA10. VIEWPAC’s mission is to support serious, credible, and electable Republican women candidates running for federal office. https://t.co/o5ljOMpVEg"
172,2022-01-24 14:10:39+00:00,1485616036556775433,"On #MerchMonday it’s a great time to order your #ParentsMatter t-shirt. 

#TakeBackVA10 https://t.co/SE8VQMTiC8"
173,2022-01-21 14:38:44+00:00,1484535941427519491,"In Congress, I will proudly support the longstanding and bipartisan Hyde Amendment which ensures federal funds are not used to pay for abortions."
174,2022-01-21 14:38:43+00:00,1484535939384893441,"Today, I stand in solidarity with the March for Life in Washington. Amid our cultural chaos, I will remain relentlessly dedicated to promoting a culture of life. https://t.co/PLshndCiqa"
175,2022-01-21 00:05:39+00:00,1484316223676436482,It’s a packed house for the Loudoun County Republican Women tonight! #VA10 https://t.co/iRQiCfFYTM
176,2022-01-20 02:15:40+00:00,1483986553840050176,"Defending the perpetrator and ignoring the victim isn't justice.
 
Mr. Darr, you deserve answers. I'm going to help you get them. (2/2)

https://t.co/IzhJMHbyNB"
177,2022-01-20 02:15:39+00:00,1483986551549960193,"Only one day? This is tragic and despicable to suspend the perpetrator for just one day for sexual assault. The woke, Democrat-controlled board ignored this father and his family's pleas for months and swept it all under the rug. (1/2)"
178,2022-01-19 13:37:08+00:00,1483795662793809926,"And that is why I’m proud to endorse Jeanine Lawson for Congress.” — @PYNance 

(5/5)"
179,2022-01-19 13:37:07+00:00,1483795661308977154,"Jeanine Lawson is the proven conservative fighter we can trust to go to Washington and be a voice for the people, not the radical leftist agenda or the swamp elites. She will oppose tax hikes, fight inflation, and stand for parental rights in education in Congress.

(4/5)"
180,2022-01-19 13:37:07+00:00,1483795660134621195,"and [she] has stood on the frontlines with Loudoun County and Northern Virginia parents as they battle woke school boards and radical curricula.

(3/5)"
181,2022-01-19 13:37:07+00:00,1483795658503036929,"Our children should not be afraid of being harmed in our schools, and our parents should not be afraid of sending their children to our public schools. As a concerned parent of two, Jeanine deeply understands this . . .(2/5)"
182,2022-01-19 13:37:06+00:00,1483795656741425155,"ENDORSEMENT ALERT 🚨 Penny Nance (@PYNance)

“Jeanine Lawson is THE candidate in Virginia’s 10th Congressional District who will stand up and fight for families and public safety. 

(1/5) https://t.co/m5HQUXfQx4"
183,2022-01-17 20:21:21+00:00,1483172612863840258,👀 Join the team ➡️ https://t.co/uZd6HsswuX https://t.co/AOwACqRF2m
184,2022-01-17 13:39:59+00:00,1483071605504983040,"""I have a dream that my four little children will one day live in a nation where they will not be judged by the color of their skin but by the content of their character."" #MLKDay https://t.co/HVKYuMBKHp"
185,2022-01-16 15:19:14+00:00,1482734193419460608,"But I need your help. Join #TeamLawson to #TakeBackVA10 by volunteering with my campaign.

Sign up TODAY⬇️ https://t.co/9fjaT0GRAG"
186,2022-01-16 15:19:13+00:00,1482734190919622663,"Those concerned about the safety of our children deserve better &amp; hardworking Virginians deserve better than her pushing higher utility bills &amp; taxes on our families.

We unseated the radicals who had taken over Richmond, now we will take back Congress &amp; defeat Jennifer Wexton."
187,2022-01-16 15:19:12+00:00,1482734186834407430,"Jennifer Wexton has failed to put safety and parents first and remained silent on the scandals that our Republican ticket took on. 

#VA10 deserves better than Jennifer Wexton’s inaction."
188,2022-01-16 15:19:11+00:00,1482734181687992320,"Where woke schools have pushed an agenda in the classroom, @GlennYoungkin will get back to teaching kids how to think, not what to think.

I am proud to stand with them."
189,2022-01-16 15:19:10+00:00,1482734177850122248,"We have taken back Virginia, in 2022 we take back Congress!

Locally, we have seen a need for reform. Where soft on crime Commonwealth Attorneys have failed parents and citizens, @JasonMiyaresVA will ensure we keep our families safe."
190,2022-01-16 15:19:09+00:00,1482734172972240896,Youngkin will repeal the gas tax hike &amp; eliminate the regressive taxes on groceries. Miyares will enforce the rule of law &amp; reform our broken parole board.  Sears will play a pivotal role as a key vote in passible leg bringing us closer to restoring our majority in the VA Senate.
191,2022-01-16 02:29:56+00:00,1482540594790641664,This is an awful anti-Semitic terrorist attack and breaks my heart. I am praying for those being held hostage and the first responders. https://t.co/Cq89L7bm4p
192,2022-01-15 23:50:21+00:00,1482500432698167298,"We are grateful to have you, Governor! https://t.co/JCFwntAQGJ"
193,2022-01-14 20:06:14+00:00,1482081643464740868,"Yesterday, Jennifer Wexton voted against removing illegal immigrants from states' voter rolls. 

American citizens and only American citizens should have the right to vote in our American elections. It's common sense."
194,2022-01-13 20:46:49+00:00,1481729468632817664,Great news! The Supreme Court struck down Biden’s vaccine mandate!
195,2022-01-13 19:02:44+00:00,1481703275288223749,"This just in 🚨 Jennifer Wexton voted on the House floor to federalize our elections.

The federal government should not be given the power to control state election laws.

I got in this race to stop government overreach, while Wexton ushers it in.

Let’s take back #VA10!"
196,2022-01-13 17:43:48+00:00,1481683412104749056,"“I’m proud to endorse my friend Jeanine Lawson in #VA10. As a steadfast supporter of our Constitution, she’ll continue to fight for our values in D.C. Like me, Jeanine is a lover of liberty &amp; believes in America’s exceptionalism &amp; our founding principles."" - @NickForVA https://t.co/TqadDzC94x"
197,2022-01-12 22:30:22+00:00,1481393142830182401,We must ensure safe schools for every child.
198,2022-01-12 22:30:22+00:00,1481393141320142850,"It has been brought to light that there was a third victim. This is a horrific tragedy that should have been prevented.

All members of the Loudoun County School Board and Superintendent Ziegler must resign. We cannot allow dangerous predators to stay in our schools. https://t.co/clEHH7JA79"
199,2022-01-12 18:13:15+00:00,1481328435771416581,"Congratulations, Speaker Gilbert! https://t.co/GPB25JvUW4"
200,2022-01-11 22:02:38+00:00,1481023772979310596,"Thank you for volunteering, Julia! You’ve been a rockstar 🌟 on #TeamLawson https://t.co/OnWLMl1UYj"
201,2022-01-09 15:53:56+00:00,1480206209923825667,Thank you to all our hard working LEOs! Please make sure to thank a member of Law Enforcement today! #NationalLawEnforcementAppreciationDay https://t.co/JhBDh7ku1V
202,2022-01-07 15:40:25+00:00,1479478035925684225,"She is THE pro-life, pro-family candidate I want to represent me &amp; my family as residents of #VA10. Jeanine is a conservative who has proven she can win in deep blue northern Virginia, and I am proud to endorse her candidacy for #VA10"" 
- @KenCuccinelli (3/3)"
203,2022-01-07 15:40:25+00:00,1479478034445082624,"""I've known Jeanine Lawson for almost 20 years, which is why I know she is a principled conservative we can trust to stand up for our values in Washington and defend the constitution from government overreach - whether that overreach comes from Democrats or Republicans. (2/3)"
204,2022-01-07 15:40:24+00:00,1479478030833700867,"I am proud to announce today my friend and fellow conservative, @KenCuccinelli's endorsement of my campaign for Virginia's 10th Congressional District. It is my honor to be endorsed by such a strong voice in our party. (1/3) https://t.co/queFG9CqtO"
205,2022-01-04 23:18:38+00:00,1478506187113050113,Thank you for having me on @LarryOConnor !
