,Created at,User ID,Text
206,2022-01-04 23:18:38+00:00,1478506183845720064,"Listen below as I talk about our campaign to #takeback10, or as @jgunlock said: ""There's only one Squad that you should be a part of if you're running in NoVa and that's the Squad of Moms &amp; Dads that are concerned about schools.""

#VA10 @WMALDC 
https://t.co/7DQ38fRrkq..."
207,2022-01-03 17:07:39+00:00,1478050437311963137,Thank you @PWCGOP for leading the way in servant leadership! I am proud to be from Prince William County! #VA10 https://t.co/4M00UIcFyX
208,2022-01-03 00:57:47+00:00,1477806360431632391,"Look forward to discussing redistricting maps and the coming red wave! 🇺🇸 #takebackVA10, #restorecommonsense https://t.co/yQg2RPlfTl"
209,2022-01-01 16:02:22+00:00,1477309231124647940,"I look forward to defeating Jennifer Wexton, taking back the House, and retiring Nancy Pelosi once and for all in 2022!

What’s your New Year’s resolution? #TakeBackVA10 https://t.co/2xJXwFB3zM"
210,2021-12-29 00:42:55+00:00,1475990682447798276,We’ve built a strong campaign the last 6 months &amp; I look forward to meeting more Virginians in 2022.
211,2021-12-29 00:42:55+00:00,1475990680661106689,The lines are final. I live in #VA10 &amp; have represented parts of it as a PWC Supervisor for the last 7 years. I will defeat Nancy Pelosi’s Puppet Jennifer Wexton next November &amp; restore common sense leadership to the people. https://t.co/HGls4OzL6P
212,2021-12-28 21:52:10+00:00,1475947710930956288,Happy Pledge of Allegiance Day! 🇺🇸 https://t.co/eK0aMwfjK4
213,2021-12-25 13:37:06+00:00,1474735956800462856,"Merry Christmas to you &amp; yours!

May you enjoy the day with family &amp; friends and remember the reason for the season. https://t.co/CYQ8efQWTh"
214,2021-12-21 16:43:05+00:00,1473333209693884429,"I’m always happy to be in the company of good friends and great dogs! #pups4jeanine 🐶 

#VA10 https://t.co/dMFpl89ZPS"
215,2021-12-21 15:39:46+00:00,1473317276506013696,I had the pleasure of meeting Mr. @StephenMoore earlier this year on the campaign trail. I couldn’t agree with him more — this is an early Christmas gift to America! 🎄🎁 https://t.co/lrzKPUxNEw
216,2021-12-18 22:13:06+00:00,1472329098190102535,What a great tribute for our fallen soldiers. Thank you to all the wonderful volunteers in Virginia and across America 🇺🇸 for their work today! https://t.co/qXHKU367kJ
217,2021-12-18 15:34:38+00:00,1472228820002476036,"I enjoyed making new friends as well who know we must stand up for the rule of law, against the woke radical school boards, and STOP Nancy Pelosi’s wasteful Washington spending. When I defeat Jennifer Wexton next November, I will restore common sense leadership to #VA10!"
218,2021-12-18 15:34:37+00:00,1472228816777056259,"Thank you to the fabulous #VA10 GOP Committee for hosting a very merry Christmas Open House last night at their headquarters in Ashburn. 

It is always great to see so many of my Loudoun fighters! https://t.co/9rBEkOacjg"
219,2021-12-16 00:26:37+00:00,1471275536706154508,"I received a warm welcome at the Rappahannock County Republican Christmas Party as #VA10’s newly proposed maps expand south.

I so enjoyed meeting new friends who are just as excited as I am to #FIREPELOSI! https://t.co/b2qBWWnPr7"
220,2021-12-15 16:38:43+00:00,1471157784825716744,I can’t get over how high gas prices have gone up this Holiday season. Are you better off than you were a year ago? https://t.co/bGw4Dl3Jki
221,2021-12-14 02:35:48+00:00,1470583269947322368,"It was great to speak with the Spotsylvania Conservative Women’s Club this evening! Thank you to President Dale Swanson for the warm welcome! 

Let’s #takeback10! #VA10 https://t.co/K9PMkz1FUQ"
222,2021-12-13 17:04:23+00:00,1470439468742189060,Happy Birthday @NationalGuard ! https://t.co/fQ83ElbhT7
223,2021-12-13 16:20:44+00:00,1470428484547883014,"Thank you, Jason! I am proud you are our next Attorney General! https://t.co/Sucxiq0mwW"
224,2021-12-11 01:10:36+00:00,1469474666108657669,"Thank you for joining me on @FoxNews tonight! Dan was nice enough to DVR it for me, so I could watch.

Join #TeamLawson and the fight for #VA10 here 👉🏻 https://t.co/UodorvTNuV https://t.co/atTqv95bQD"
225,2021-12-10 23:43:00+00:00,1469452621052317706,"I am looking forward to it! 

Tune in 📺 in the 7 o’clock hour 🇺🇸 https://t.co/xPxqjL7KDK"
226,2021-12-09 23:20:31+00:00,1469084572512104458,UPDATE: catch me on Fox News tomorrow night! https://t.co/LXzf44uR4K
227,2021-12-09 23:04:56+00:00,1469080651919986693,"Join #TeamLawson today to #takebackVA10!

https://t.co/veCCD0F26y"
228,2021-12-09 22:06:19+00:00,1469065901655928836,"Tune In 📺 @FoxNews w/@HeyTammyBruce!

I'll be on in the 7 o'clock hour with a few of my fellow #EPAC endorsed candidates.

I am looking forward to talking about why I am running to take back #VA10 from Jennifer Wexton and bring common sense leadership back to the People's House. https://t.co/2XPTNaVQue"
229,2021-12-09 21:03:59+00:00,1469050214602391553,"Enes is truly inspiring! 

Read why he became an American in his own words👇 https://t.co/biaQwL5qqq"
230,2021-12-08 16:19:05+00:00,1468616127592943617,"And I am proud to be one of those #EPAC endorsed candidates, right here in Northern Virginia, ready to #takebackVA10 ! https://t.co/xFAy6FE0qL"
231,2021-12-07 19:15:28+00:00,1468298128164110344,Thank you to these heroic Loudoun County firefighters 🚒 for rescuing the pups 🐶 from a fire in their home. https://t.co/Wa5JyRB73D
232,2021-12-07 18:01:19+00:00,1468279467474927635,Pearl Harbor changed the world. May we never forget the service and sacrifice of our Great American heroes on this 80th Remembrance Day. 🇺🇸
233,2021-12-06 22:40:11+00:00,1467987261304229895,"Congratulations to my friend @TimParrishVA for winning 2021 @VA_GOP Unit Chair of the Year!

We are so proud to have you as our Prince William County Chair! #VA10 https://t.co/YgjhMGnSsw"
234,2021-12-05 18:03:17+00:00,1467555187640483852,"We lost an American hero today, Senator Bob Dole. 

I pray for his family today as we honor his life of service and sacrifice."
235,2021-11-30 23:37:48+00:00,1465827433534431232,Tune In 📺 tonight ! https://t.co/F5JsVqlUYs
236,2021-11-28 18:09:29+00:00,1465020035206893571,"Happy Hanukkah to all those who celebrate. 🕎 

May this year’s celebration bring light, hope &amp; joy to you and your loved ones."
237,2021-11-27 14:13:10+00:00,1464598176556539908,"Happy #SmallBusinessSaturday!

I love to shop local, especially for my chai tea latte at Cupcake Heaven in Haymarket! 

Where do you shop local? #VA10 https://t.co/fiquYMvsks"
238,2021-11-25 14:11:10+00:00,1463872897278259209,Happy Thanksgiving 🦃 https://t.co/LEy9y4iIHZ
239,2021-11-23 02:14:56+00:00,1462967873538830337,"“Jennifer Wexton has supported radical prosecutors who give deference to criminals, not victims,"" said Jeanine Lawson, a Prince William County supervisor challenging Wexton next year who promises to ""oppose the woke anti-police agenda and work with law enforcement."" https://t.co/0Bq5jZ3a6u"
240,2021-11-22 01:17:02+00:00,1462590915365773321,"I am heartbroken for those in Waukesha, Wisconsin tonight. They have my prayers."
241,2021-11-19 17:06:20+00:00,1461742649019449350,"I look forward to taking back the House from Nancy Pelosi and her Socialist Spending Squad! Next year, we will defeat Jennifer Wexton in #VA10 and bring common sense leadership back to the Majority!"
242,2021-11-19 17:06:19+00:00,1461742647723413504,"➡️ doubles the size of the IRS 

➡️ gives amnesty to millions of illegal immigrants 

And these are just a few of the disastrous pieces of the bill!"
243,2021-11-19 17:06:19+00:00,1461742646385385474,"Today, Jennifer Wexton voted for Build Back Broke, a bill that:

➡️ creates tax hikes for our small businesses that have already suffered enough during the pandemic

➡️ adds a natural gas tax at a time when heating costs are already rising for American families"
244,2021-11-17 23:22:01+00:00,1461112417161723910,"Celebrate #WinRedWednesday by joining #TeamLawson TODAY to bring common sense leadership back to Washington! #VA10 

https://t.co/UodorvTNuV"
245,2021-11-17 21:45:08+00:00,1461088039195889671,We're not domestic terrorists. We're not the alt-right. We are parents who CARE. #ParentsMatter and Parents' voices must be heard! #VA10 https://t.co/HVUZlJuhHM
246,2021-11-13 22:52:54+00:00,1459655541450592256,#ParentsMatter ! https://t.co/SJGlK14lHn
247,2021-11-13 18:47:56+00:00,1459593891754262536,Meet Governor-Elect @GlennYoungkin tonight in Loudoun County! #VA10 https://t.co/LMENjKcw97
248,2021-11-12 19:17:40+00:00,1459238987370045448,"Police officers shouldn’t have to worry about being sued for doing their jobs and keeping us safe.

In Washington, I will stand up to The Squad and stand with our police and #BackTheBlue."
249,2021-11-12 19:17:40+00:00,1459238986019446793,"Qualified Immunity protects our police from frivolous lawsuits while they are doing their jobs, and on the County Board, I have pushed our government to oppose this dangerous legislation in Richmond."
250,2021-11-12 19:17:39+00:00,1459238984291393543,I will always support and defend our police. Part of that comes with supporting qualified immunity -- which is under attack by the radical Defund the Police Leftists. They’ll remove qualified immunity from our public servants but not themselves.
251,2021-11-12 19:17:39+00:00,1459238982051586051,"In Richmond and Washington, our police are under attack by radical Leftists who are working every day to put felons before the public safety of our families.

We must stop them. #DefendOurPolice https://t.co/GrURCwA9n8"
252,2021-11-11 13:13:11+00:00,1458784875373281282,"Thank you for your endorsement, @FWForAmerica! I am ready to take on the fight for the people of #VA10 and bring common sense leadership back to Washington! 

#TakeBackVA10 https://t.co/yY2p3XtUh9"
253,2021-11-11 12:08:23+00:00,1458768565063016450,"Today, I'd ask you to reflect on all of the men and women who spent some of their precious time on this earth serving our great nation, and say thank you to a loved one or friend who served."
254,2021-11-11 12:07:58+00:00,1458768461920968704,"On this day, and every day, we honor our Veterans for their sacrifice to our country. The millions of Americans willing to lay down their lives for our freedoms deserve our deepest thanks. https://t.co/b5xLc6jvRj"
255,2021-11-10 20:24:56+00:00,1458531139715534851,Happy Birthday to the @USMC ! Thank you for your service &amp; sacrifice to our country. 🇺🇸 https://t.co/uL5NG8CMR8
256,2021-11-10 16:07:21+00:00,1458466316910747657,Help us #FIREPELOSI by supporting my campaign here ➡️ https://t.co/veCCD0F26y
257,2021-11-10 16:04:04+00:00,1458465488233713670,"I am honored to have Chairwoman @EliseStefanik's endorsement today! #VA10 

We will be Majority Makers next year! #EPAC #GOPWomen https://t.co/twE5CS4g3b"
258,2021-11-10 14:04:41+00:00,1458435444606181376,Where’s Wexton? https://t.co/utMdFt5nAS
259,2021-11-10 01:25:45+00:00,1458244453039288328,Proud of @iandprior &amp; his team of parents standing up for what’s right. https://t.co/r4UukYi7cR
260,2021-11-09 19:15:48+00:00,1458151355059671042,"It was a great day to thank our Veterans! 

Always great to be with you, Congressman! https://t.co/51837JkFJn"
261,2021-11-08 21:17:39+00:00,1457819628864950272,"And it’s going to be an even tougher day on November 8, 2022! https://t.co/Vq6JbVkLK2"
262,2021-11-08 18:04:48+00:00,1457771097445654536,"As your representative in Congress, I will be a fresh voice for cracking down on illegal border crossings, providing more resources to the U.S. Border Patrol agents, and protecting those who choose to follow American immigration laws. #VA10"
263,2021-11-08 18:04:47+00:00,1457771094518091776,"The Biden/Wexton Border Crisis is mounting and untenable.

🗞 “Border Patrol released 283,000 migrants into US over past year, 95,000 untracked”

Read more 📰 from @dcexaminer 👇🏻
https://t.co/INlf52N9bu"
264,2021-11-08 15:05:46+00:00,1457726044606242818,Join #TeamLawson 🐶 today 👇🏻 https://t.co/UodorvTNuV
265,2021-11-08 15:05:46+00:00,1457726043138273280,"It’s exactly one year out from Election Day 2022!

There is a lot of work to be done in the next 365 days to #TakeBackVA10! 

Help me be a voice for the people, by the people!

Not a Rubber Stamp for Nancy Pelosi’s Far-Left Socialist Spending 💸 Agenda"
266,2021-11-06 20:38:48+00:00,1457085079327592455,"It was a great day in Manassas to be at the NoVa Veteran’s parade! 

I am so grateful for the service of our Veterans &amp; the sacrifice of their families 🇺🇸 https://t.co/zzLfAEihMN"
267,2021-11-05 16:26:39+00:00,1456659233940852737,"Gas prices ⛽️ are rising all across the country impacting all Americans in their daily lives — yet the Biden Administration seems completely unfazed. 

This is the failed leadership of the Biden Administration. https://t.co/5uB4amoPqK"
268,2021-11-04 23:27:21+00:00,1456402719846064128,"This is why we elected him! Thank you, @JasonMiyaresVA ! https://t.co/dAv1XgtI8x"
269,2021-11-04 18:17:25+00:00,1456324719964266498,"They should ALL resign. But if they won’t do the right thing, @iandprior will remove them! https://t.co/IyLhoSCA58"
270,2021-11-04 15:17:34+00:00,1456279462115426307,I am so proud to call @WinsomeSears my Lieutenant Governor-elect ! ❤️ 🇺🇸 https://t.co/3klrKiIQ0n
271,2021-11-04 12:13:26+00:00,1456233121582616576,"From Fox News 📺: AOC, Squad silent on Winsome Sears' historic Virginia election victory

https://t.co/yFh9H1v1n0"
272,2021-11-03 18:45:41+00:00,1455969445248217092,You are right! 📚 ✏️ https://t.co/N6axT0HuAV
273,2021-11-03 14:06:08+00:00,1455899096217227265,"Congratulations @GlennYoungkin, @WinsomeSears, &amp; @JasonMiyaresVA!

I am so proud to call you the next Governor, Lieutenant Governor, and Attorney General of Virginia.

We took back the Commonwealth last night! #ParentsMatter https://t.co/fSNWAk9g43"
274,2021-11-02 02:23:36+00:00,1455359910997340168,"The spirit is in the sky tonight! 

We’re excited to elect @GlennYoungkin Governor of Virginia! https://t.co/WjVfKKEzXE"
275,2021-11-01 22:33:53+00:00,1455302101500841987,This is ridiculous! 👇🏻 The madness must end! They all must resign! https://t.co/NPGHowez5x
276,2021-11-01 17:00:11+00:00,1455218123091677193,🐶 https://t.co/21dmL7rKxQ
277,2021-10-31 18:20:51+00:00,1454876034453618688,"Nothing is better than spooking the Dems on Halloween!

Help me give a SPOOK to Pelosi’s Puppet by outraising Wallflower Wexton again this month! Donate today: https://t.co/UodorvTNuV"
278,2021-10-30 18:14:52+00:00,1454512138521878535,"#ParentsMatter ! What a movement here in Virginia for @glennyoungkin &amp; our Republican ticket !

Go vote 🗳 and I will see you at the next bus stop in Fairfax! https://t.co/E4ziFyFnNI"
279,2021-10-30 15:51:32+00:00,1454476069143261186,Great morning to door knock 🚪 for @DrSteveVA &amp; our entire Republican ticket ! 🇺🇸 #LeadRight https://t.co/jspWSEbf77
280,2021-10-30 13:20:09+00:00,1454437974016462856,We're proud to stand with @GlennYoungkin today as we take back Virginia for the people! #ParentsMatter https://t.co/FkneETBDtM
281,2021-10-29 21:42:20+00:00,1454201963722252296,"Shameless, just like their candidate, @TerryMcAuliffe. https://t.co/HAs3UgHT75"
282,2021-10-29 17:20:36+00:00,1454136096519069702,"Join #TeamLawson in celebrating Izzy's 12th by donating $12 today 🐶➡️
https://t.co/CAE12jgPj1"
283,2021-10-29 17:20:35+00:00,1454136092769333252,"Happy Birthday, Izzy! 🎂

I had to stop at my favorite local coffee shop in #VA10, Cupcake Heaven, to celebrate! 🧁

#pupsforJeanine 🐶 https://t.co/4Mv7KbcEoi"
284,2021-10-28 20:07:14+00:00,1453815644546285571,"Thank you, Mr. Vice President, for being a leading voice on this issue today! https://t.co/5yZwV7W68q"
285,2021-10-28 13:12:09+00:00,1453711182418808840,Check it out here ➡️ https://t.co/nnwFlwupZm
286,2021-10-28 13:11:12+00:00,1453710945470099463,It’s #ThreadThursday 🧵 on @WINRED — join #TeamLawson &amp; cozy up for Fall 🍂 with a quarter zip https://t.co/bIzgoPvW9Z
287,2021-10-27 23:04:49+00:00,1453497945152790535,"Thank you for your leadership, Nick! I can’t wait for you to represent us in Richmond! https://t.co/WSYJ0GsZWQ"
288,2021-10-27 21:57:03+00:00,1453480892463304711,Got my vote 👍🏻 🐶 https://t.co/9Z4M1dTGf2
289,2021-10-26 22:21:57+00:00,1453124769042292746,"“This should stop. And this should stop immediately!” 

Thank you, @NancyMace, for leading on this issue. https://t.co/Z6Db87ziU1"
290,2021-10-26 21:46:55+00:00,1453115955152891906,Tune in 📺 ⬇️ https://t.co/iLwvQzGyhV
291,2021-10-26 19:41:48+00:00,1453084467967381505,Team Lawson is excited to see you there ! https://t.co/PFHIcIEV5d
292,2021-10-26 17:01:09+00:00,1453044039004086278,I applaud 👏🏻 these students for standing up against sexual assault. https://t.co/Qv50Dv3xu3
293,2021-10-26 01:19:23+00:00,1452807034374606853,"The victim will never truly have justice, the perpetrator was held accountable, but the failure of the Loudoun County School Board and Superintendent to keep our children safe is unforgivable and won't be forgotten. https://t.co/IqJIDrJSVJ"
294,2021-10-24 21:49:38+00:00,1452391860027248651,"It was a beautiful day in Stephens City to help our local candidates &amp; our Republican ticket 🗳🇺🇸 

Make sure you get out &amp; early vote before it’s too late ! https://t.co/GByNxvkLAB"
295,2021-10-22 15:54:56+00:00,1451577823446065152,"They knew.  They lied.  The Loudoun County School Superintendent and School Board suppressed the truth, prevented this girl’s parents from speaking, and attempted to cover this all up.  It’s time for all involved to resign.

https://t.co/USJwv1iCRZ"
296,2021-10-20 20:58:39+00:00,1450929481183604740,I am supportive of special accommodations for those students dealing with gender dysphoria.  Paramount is to enact a policy that ensures safety for ALL children. (3/3)
297,2021-10-20 20:58:39+00:00,1450929478343987204,"The idea that the PWC School Board would adopt a reckless policy without a thorough public vetting is disturbing, especially given how a similar policy was abused by an alleged rapist in Loudoun County. (2/3)"
298,2021-10-20 20:56:25+00:00,1450928918878474242,"Prince William County should learn from the sexual assault that has come to light in Loudoun County schools.  Children should not be forced to compete, room, or use facilities with those of the opposite biological sex. (1/3)"
299,2021-10-19 23:30:05+00:00,1450605199677079557,This is the right leadership Virginia needs right now. ⬇️ I am proud to support our ticket. https://t.co/z29TaS4R25
300,2021-10-19 23:27:34+00:00,1450604568308588546,"Thank you, @GlennYoungkin ! This is the right move, at the right time.

I appreciate your leadership on this issue, and look forward to working with you as our next Governor. https://t.co/aUoD51zj9R"
301,2021-10-19 16:22:04+00:00,1450497488096567301,"The 10th CD's Fall Festival is this Sunday, October 24th! 

We hope you'll join a great event to support our candidates &amp; volunteers in this November's election. With only two weeks until Election Day, every bit of support matters -- from dollars to doors!
https://t.co/yzk77qp3Ii"
302,2021-10-19 13:41:17+00:00,1450457026535084038,"It’s despicable, Buta should join Beth Barts and resign from office. The mismanagement and dangerous coverups going on in Loudoun County Schools deserve a full investigation, and those culpable should be held responsible."
303,2021-10-19 13:41:17+00:00,1450457024345542668,"Buta Biberaji, the Loudoun County Commonwealth Attorney is unqualified to serve as chief prosecutor.  She let a rapist off the hook because he ‘had no history.’  It’s unbelievable, unacceptable, and endangered every child in Loudoun County Public Schools.
https://t.co/jlz1slO49g"
304,2021-10-18 19:19:06+00:00,1450179652107087873,"#TeamLawson is proud to be in Manassas today supporting @GlennYoungkin ! 🇺🇸

🙌🏻 PARENTS MATTER, and this man knows that👇🏻that’s why we’re electing him the next Governor of Virginia! https://t.co/wLPSmIgcyf"
305,2021-10-18 18:20:51+00:00,1450164993060659202,We mourn the loss of a Great American today and pray for his family. https://t.co/kvvw9yHSno
306,2021-10-17 16:35:28+00:00,1449776081804963843,"In honor of #NationalPoliceWeek, I’d like to honor our men &amp; women in uniform.

Thank you for your service &amp; sacrifice. I will always defend the thin blue line. https://t.co/W2eZfvp9az"
307,2021-10-16 17:20:45+00:00,1449425089800384512,"So am I ! 

❤️ @WinsomeSears https://t.co/EpjXeOoZS6 https://t.co/TyhEXY5lSi"
308,2021-10-16 16:42:13+00:00,1449415395019051010,"Thank you for coming to Gainesville this morning @WinsomeSears ! 

You inspire me everyday ❤️ now go win this thing ! 🗳 https://t.co/bRh0fsDy5V"
309,2021-10-15 19:04:35+00:00,1449088835690840069,Parents spoke. The Loudoun County School Board is starting to listen. It’s time for change in Loudoun County.
310,2021-10-15 19:04:18+00:00,1449088761522970631,Beth Barts resigned. This is a small victory in restoring common sense &amp; decency to Loudoun County Schools.
311,2021-10-14 19:21:39+00:00,1448730742255673344,Tune into @FoxNews NOW to watch my friend @iandprior @fightforschools ! https://t.co/ClGnbpmPuI
312,2021-10-14 02:24:38+00:00,1448474798984769538,"I am so excited to watch Loudoun’s own Patriot Fighter, @pattiehmenders, on @IngrahamAngle tonight !"
313,2021-10-13 03:10:46+00:00,1448124022693236738,Safe Schools Legal Fund https://t.co/ksQ7eBU73a
314,2021-10-13 03:03:57+00:00,1448122306774110208,Proud to stand with Loudoun Co parents! https://t.co/vOou2CSR2Z
315,2021-10-12 18:15:13+00:00,1447989247609278471,"Adding to a great list of events in Prince William County, join @GlennYoungkin on Monday in Manassas with @HalParrishVA ! https://t.co/0UxzQs6Euk"
316,2021-10-12 16:26:30+00:00,1447961889397432320,"Shame on you, Superintendent Ziegler, and shame on the Loudoun County School Board. 

Parents are watching and will remember.
https://t.co/5a2VDsu313"
317,2021-10-12 16:26:30+00:00,1447961887203897346,"When a child was sexually assaulted in Loudoun County Schools their initial reaction was to do nothing and cover it up by lying to parents.

Now there is another victim, by the same perpetrator."
318,2021-10-12 12:57:34+00:00,1447909306112909323,Read Full Release from #VA10 Here ⬇️ https://t.co/DYpdGCUR8n
319,2021-10-12 12:57:33+00:00,1447909303218839558,"🚨🚨🚨 Team Lawson is proud to announce Jeanine raised over $330,000 in her bid to defeat Jennifer Wexton and #TakeBackVA10! 💸"
320,2021-10-11 20:42:28+00:00,1447663914355994628,Are you better off than you were a year ago? https://t.co/oxwPMLeAqh
321,2021-10-11 17:44:43+00:00,1447619185614405632,Thank you to College Republicans all across the country for committing to help take back the Commonwealth! 🇺🇸 🐘 https://t.co/mOnkIk5AXJ
322,2021-10-11 16:27:28+00:00,1447599743476146179,"Thank you for fighting the good fight in Fairfax, @PatHerrity ! https://t.co/g68fV8HmAE"
323,2021-10-10 21:31:15+00:00,1447313806112313347,"Join us this Saturday, October 16th before Haymarket Days for Breakfast with @WinsomeSears !

We’re looking forward to a great event to support our statewide candidates just weeks before Election Day. https://t.co/s7x2ypxftk"
324,2021-10-07 18:34:54+00:00,1446182262282797059,"In Congress, I will stand up against egregious abuses of power from Far-Left extremists like Biden and Jennifer Wexton and make sure that parental rights are protected in Virginia."
325,2021-10-07 18:34:54+00:00,1446182260093431809,"The Biden/Wexton admin's decision to weaponize the FBI against parents who are trying to fight for their child's education is reprehensible. The motives of the Democrat party are clear, as Terry McAuliffe said, ""parents should not be telling schools what they should teach."" https://t.co/YDX8unAwaw"
326,2021-10-07 18:07:54+00:00,1446175466444963840,"And with principled conservatives like me on the ballot next year, I know we will take back the House and FIRE Nancy Pelosi! #TakeBackVA10 https://t.co/xhY7t5TpoW"
327,2021-10-07 16:05:50+00:00,1446144745865154563,"It’s #ThreadThursday 🧵

Support my campaign today by shopping on my @WINRED storefront here ➡️ https://t.co/nnwFlwupZm https://t.co/9ejWM583gi"
328,2021-10-07 15:24:44+00:00,1446134405051912192,"What a great enthusiasm for @GlennYoungkin last night in Winchester!

I wish I could have been there but I had my County Supervisor Town Hall. 

Let’s keep up the fight for the Commonwealth #VA10 https://t.co/ZWjRpdLLgg"
329,2021-10-05 22:41:40+00:00,1445519587282505728,What great work you’re doing to @fightforschools ! Congratulations to all the parents working hard in Loudoun county! https://t.co/WigEQxT5gM
330,2021-09-30 13:08:24+00:00,1443563380024004615,"Our FIRST major fundraising deadline is TODAY! September 30th, and with your help, we can hit our goal. 

Taking Congress from Nancy Pelosi starts with the 10th District. #VA10 

Donate today and join our effort.👇🏻

https://t.co/bVkH7DGQEk"
331,2021-09-29 16:53:52+00:00,1443257732870676486,This is the reaction from those supporting the woke education establishment when parents show up &amp; make their voices heard in VA. The state telling you that you don't have a right to know or have input on what your kids are learning is an insane position to take. https://t.co/W3fdVRz3ko
332,2021-09-23 20:44:51+00:00,1441141532250165260,"Happy #NationalDogsInPoliticsDay to all my furry friends 🐶 🐾 

I’ll never stop loving up on some pups ! #pups4Jeanine 🐩 🐕 https://t.co/eESVA1rJej"
