,Created at,User ID,Text
0,2022-09-11 17:22:51+00:00,1569013615549681664,"I'll never forget this day, where I was, the lives lost, and how we came together as brothers and sisters who loved the USA. https://t.co/NEZLd7q66b"
1,2022-08-23 13:29:34+00:00,1562069536995688449,Vote Today! https://t.co/yK9EFMGDtD
2,2022-08-22 12:50:08+00:00,1561697228045094913,Happy Election Eve! https://t.co/IIKwneegra
3,2022-08-22 11:28:23+00:00,1561676653503430658,Great time with @GovRonDeSantis at the Education Tour last night. Happy to see so many fellow Republicans. https://t.co/l0ak0fdVsV
4,2022-08-22 11:23:47+00:00,1561675496454234112,I enjoyed speaking at the Greater Intercoastal Republican Club this month. https://t.co/aVWqDHMJNp
5,2022-08-09 12:03:41+00:00,1556974494199291910,"The FBI claims they needed to secure classified documents in Trump's home to ""protect our national security"", but Biden has compromised our national security more than any other president and continues to trample on the Constitution he swore to protect!
https://t.co/qYCItvvvZw"
6,2022-08-09 02:38:07+00:00,1556832164519501824,A short 2 minute video! https://t.co/Zq2DKcBu1r
7,2022-08-03 02:23:00+00:00,1554654033507385350,Thanks again to the @RLibertyCaucus for endorsing my campaign for US Congress! #Election2022 https://t.co/KjM74NZiYn
8,2022-07-26 11:22:03+00:00,1551890586805964801,"When Democrats complain about Florida's new Congressional maps, remind them that across the country, Democrats drew more maps in their favor, netting 6 more possible seats over Republicans. It's not a coincidence they took over during a redistricting year. https://t.co/rYZzUaxnz2"
9,2022-07-24 20:02:26+00:00,1551296771883732993,"Be sure to elect men and women of faith this election cycle! Prayer was replaced with sexual indoctrination, the family has been damaged, drugs are pouring across our border, states allow the murder of the unborn, etc. This is not a normal election! 
https://t.co/Rs4Uh7b0kS"
10,2022-07-24 01:39:47+00:00,1551019281051262977,God is calling men and women of faith to rise up and defend our country. Will you join me? #Election2022 #Election2022 #jacksonville #duval #nassau #clay #florida #republican #gop #floridagop #obedience #faith #usa #patriot #donate #district4 #chuba https://t.co/B02lpflIrs
11,2022-07-23 03:18:04+00:00,1550681624853053441,"This must stop! We need to prioritize families over investors! #HousingCrisis 
https://t.co/eKBoCWRDau"
12,2022-07-23 02:47:08+00:00,1550673840833019907,"This is not okay! No foreign adversary should ever be allowed to buy our land! This is a major national security risk! 
https://t.co/l3HWoKPwWv"
13,2022-07-23 01:49:03+00:00,1550659224203657221,"Prayers for Huk who was shot near the Jacksonville Zoo 🙏 #K9 
https://t.co/rqV74FcY8A"
14,2022-07-21 00:42:39+00:00,1549917738621194242,"When a poll only contacts 400 voters, has a margin of error at 4.89%, and shows 59% to be undecided, I believe I should have been included in the upcoming #SunshineSummit, but I will be there nonetheless to support my state and country with @GovRonDeSantis. https://t.co/9ZEIjp6Rht"
15,2022-07-20 23:48:58+00:00,1549904227551559680,"I'm pretty sure most people are concerned about inflation, high gas prices, and not being able to afford rent, but I guess the summer heat is more pressing. #ClimateEmergency
https://t.co/ciboE6H7tl"
16,2022-07-20 23:36:20+00:00,1549901050953580546,A good guy with a gun was able to stop a bad guy with a gun. Lives were saved and he is a hero indeed. https://t.co/DDMf6ZWyIP
17,2022-07-14 16:50:04+00:00,1547624481073422337,Will you donate $7.14 on 7/14 in honor of 2 Chronicles 7:14? Visit https://t.co/IHDj9286sZ to donate. https://t.co/2f5sjnwQ82
18,2022-07-06 02:07:11+00:00,1544503195443027974,The ice cream truck came by while I was knocking on doors today. The little kid in me had to buy some! https://t.co/pPBOvwqVLx
19,2022-07-03 10:47:11+00:00,1543546892323373057,"We need to resolve the supply issues for housing, cars and their chips, oil for gasoline, etc. We also need to get interest rates back in control and enact policies that help reign in inflation. #savetheamericandream 
https://t.co/LW8FIYvqLZ"
20,2022-07-03 10:45:57+00:00,1543546582494232577,"This Biden economy is making all of us poor. Between rent, utilities, car payments, car insurance, parking, gasoline, and groceries, most people need to work 2 jobs to make ends meet, so many people are giving up on trying at all, and it shows when you drive down the street."
21,2022-06-26 00:39:54+00:00,1540857350684377093,Great meeting voters today at the Clay County Watermelon festival and Freedom Fest at the Orange Park Mall. #Election2022 https://t.co/Hkia3I2Uak
22,2022-06-24 16:46:55+00:00,1540375931713372161,"The unconstitutional right to kill innocent life in the womb has ended. The choice is now in the hands of states. Blue states will expand it, while red states will restrict it, but no state should allow abortion after a heartbeat is detected. #ProLife 
https://t.co/Cxizv6iadL"
23,2022-06-24 03:37:40+00:00,1540177309596106752,Thank you Clay Republican Party of Clay County and News4jax for hosting such a great candidate forum! #Election2022 https://t.co/XpSc8EORaS
24,2022-06-22 18:32:41+00:00,1539677773236674561,"Check out this video from News 4 Jax!
https://t.co/HBXvldeZVt"
25,2022-06-22 16:10:05+00:00,1539641884439633920,"Exciting opportunity!
https://t.co/nheVvEKAFB"
26,2022-06-18 03:21:12+00:00,1537998838971043841,Here we go! https://t.co/e4CIlAGHcI
27,2022-06-15 18:10:35+00:00,1537135495112794114,"Get your t-shirt before the August 23rd primary!
https://t.co/LtsMA4SYF7"
28,2022-06-15 11:02:24+00:00,1537027739965960193,"Even if Al Lawson retained his district, the same would have happened here. The American people need bold leaders who will restore the economic health and security of our nation. #Elections2022 #RedWave 
https://t.co/u1ec1TC1WO"
29,2022-06-03 02:30:51+00:00,1532550351181717504,Date updated to June 16th https://t.co/cQl4BvRHuS
30,2022-06-03 02:30:24+00:00,1532550236081643520,https://t.co/8lH8jCdLDj
31,2022-05-25 01:13:12+00:00,1529269318629965825,"It upsets me so much that this man could take the life of 2 adults and 18 children. My heart mourns for families broken by this tragedy.
https://t.co/Ay5kSsoEjk"
32,2022-05-24 16:33:58+00:00,1529138650222559232,"No! The WHO will not tell the USA what to do and I will not stand by watching freedom slip away! Time for the USA to flex our economic muscle to promote freedom!
https://t.co/KvvsZBXjCA"
33,2022-05-20 23:00:06+00:00,1527786271753519104,"We need to get people out of rentals and into homes they can afford! Increase housing supply and prioritize families over investors! #HousingCrisis #Election2022 
https://t.co/c2pMYq0d0H"
34,2022-05-08 17:19:17+00:00,1523351848412876801,Thankful to all the moms out there who fight to protect our kids and American family values! #MothersDay #strongfamilies https://t.co/565i4tgORX
35,2022-05-08 16:51:22+00:00,1523344822278316032,Happy Mother's Day to all the moms out there! #ThankYouMom https://t.co/weX2Qchqqu
36,2022-05-03 00:58:34+00:00,1521293100911636480,Let's pray and fight for our country! #Elections2022 #Election2022 #Florida #Jacksonville https://t.co/7PAINpDMns
37,2022-04-26 20:24:42+00:00,1519049855657816068,"Learn more at https://t.co/IHDj91QvBr 
#Florida #Jacksonville 
#Republican #Election2022 https://t.co/ZdPCbwzuKA"
38,2022-04-23 02:54:03+00:00,1517698284051222528,"My district used to be CD5 which extended from West Duval to Gadsden. Now it is labeled CD4 which contains West Duval, Nassau, and Clay. #FloridaGOP https://t.co/9oOx5wSNid"
39,2022-04-17 11:00:37+00:00,1515646408396783623,"He died and rose, so that I, dead to sin, could also be brought back to newness of life, living in Him. https://t.co/3wq8GtWnOb"
40,2022-02-28 02:11:43+00:00,1498118689287294980,"Genie, Genie+ and Lighting Lanes @WaltDisneyWorld are a mess. Disney needs to go back to the old system or sell fast-passes like Universal Studios which work for every ride. Way too difficult to get a good ride at a good time. Genie+ is a waste of money. Just my honest review."
41,2021-12-25 18:16:51+00:00,1474806360260984835,https://t.co/qLJlItPbEu
42,2021-11-12 19:02:36+00:00,1459235195165495303,"He cut an oil pipeline and prices went up. Now he is thinking of closing more pipelines. If this happens, gas prices will be in the double digits! The rich will buy electric cars. The poor and middle class will suffer even more. #energy #GasPrices 
https://t.co/Uwx68PAMms"
43,2021-08-26 23:14:38+00:00,1431032367553126404,I am so sad to hear about the loss of life in Afghanistan today and I am so disappointed in the lack of leadership in our country. #Afghanistan
44,2021-08-16 01:38:42+00:00,1427082356251406341,"After 7 months, we have an unsecure border, excessive spending, record inflation, high unemployment, too many COVID hospitalizations and deaths, Cubans are ignored, and the Taliban has taken over Afghanistan. #BorderCrisis #SOSCuba #SaveAfghanistan"
45,2021-08-14 11:00:34+00:00,1426498978691133440,"Saying it is not our problem is disrespectful to our service men and women. This is our problem, as is Cuba, the border, COVID, crime, inflation, and unemployment. No one wants to be in a war, but we do need to be strategic with the decision we make.
https://t.co/8OdVQpL3Zh"
46,2021-07-12 13:45:23+00:00,1414581655751307271,"The people of #Cuba live in buildings that have fallen apart, they are in need of food, medicine, and supplies, and they want liberty from socialism; I stand with the people. #SoSCuba https://t.co/MhCyauHHDi"
47,2021-06-25 13:40:46+00:00,1408419904001282048,"Praying for all involved and their families 😢

https://t.co/Yhd28WgkNA"
48,2021-04-04 16:23:57+00:00,1378745163909042177,He is Risen! May the love of Jesus bring joy to your heart!
49,2021-03-13 15:52:53+00:00,1370764814428033026,I used to pay $20 to fill up my car. Now I pay $40. That's what happens when we pay for foreign oil over domestic oil. America deserves better.
50,2021-03-13 13:57:25+00:00,1370735752770957312,I got a black S21+ for $162.00 after trading in my S20 on https://t.co/Odgd461dkY and I have no regrets; this phone is awesome! #Samsung #s21 https://t.co/mOQIIyDW1j
51,2021-02-27 01:59:15+00:00,1365481591842217989,Stopping construction of the keystone pipeline did not change demand for gasoline. It increased unemployment and shifted production overseas resulting in higher gasoline prices for all Americans.
52,2021-01-06 23:54:45+00:00,1346968478469779462,"The left thinks the right is crazy. The right thinks the left is crazy. Until we learn to respect our differences and talk about them cordially, whether religion or politics or ethics, we will continue to divide and tear down, rather than work together and build up."
53,2021-01-06 23:48:20+00:00,1346966865675956225,"Almost every state is evenly divided (50/50) as red in suburbs and rural areas, versus blue in cities. We must realize that 50% of the time, we will not have our choice in office, but we must treat each other with respect and uphold values of a balanced government."
54,2020-12-25 19:11:14+00:00,1342548474626256897,"May the joy and love of Jesus fill your heart this Christmas, that you may be filled with peace and hope."
