,Created at,User ID,Text
0,2022-09-13 18:52:22+00:00,1569760918019481602,"“A coach is someone who tells you what you don’t want to hear, 

who has you see what you don’t want to see, 

so you can be who you have always known you could be.”

-T. Landry"
1,2022-09-09 18:08:26+00:00,1568300312083025923,"What did Steve Jobs, Larry &amp; Sergey, Zuck &amp; Sheryl, Gates, Bezos, Andreesen &amp; Horowitz, Dorsey all have in common? 

They all had a coach.

https://t.co/T5L0YiOKfP"
2,2022-08-27 22:24:39+00:00,1563653748869648385,"Are you tired of feeling tired? 

This is for you. https://t.co/aUDiUSNLrS"
3,2022-08-18 16:21:54+00:00,1560300968952086535,How to Make Any Decision - https://t.co/53Xm8CoPUb
4,2022-08-13 18:21:56+00:00,1558519234937905154,How to Achieve Any Goal - https://t.co/RWBKjIxkff
5,2022-07-30 19:22:50+00:00,1553461132203016192,"This, but push smarter, not harder. https://t.co/RIYCqPjbKH"
6,2022-07-25 23:35:07+00:00,1551712680951644160,Your brain’s just trying to keep you safe in the cave.
7,2022-07-25 23:27:43+00:00,1551710819750187011,Having a thought doesn’t make it true.
8,2022-07-22 19:22:50+00:00,1550562028837806086,"A network state, where the One Commandment is: feeling your feelings"
9,2022-07-22 19:22:15+00:00,1550561883702366211,How to Become Self-Confident https://t.co/qgZFNmIT83
10,2022-07-21 13:19:48+00:00,1550108281191903233,Love is always an option.
11,2022-07-21 03:40:55+00:00,1549962599089033217,“Morality is the software in people’s heads” https://t.co/3foR8YzbaF @BanklessHQ
12,2022-07-21 03:02:15+00:00,1549952869821997056,Shame and sadness are the keys to getting what you want.
13,2022-07-21 02:58:59+00:00,1549952046941569026,Learning to process your emotions makes you invincible.
14,2022-07-21 02:57:22+00:00,1549951641952129030,Shame and sadness are the biggest money-making emotions.
15,2022-07-21 02:56:23+00:00,1549951393502531584,"When you open yourself up to feeling shame and sadness, you create even more connection."
16,2022-07-21 01:04:13+00:00,1549923165975068674,"When you get clear on what you want, you get it."
17,2022-07-20 15:58:22+00:00,1549785798031163392,"Coaching is literally the best investment you’ll ever make in your life. 

Guaranteed."
18,2022-07-16 01:22:01+00:00,1548115703827337216,“Courage calls to courage everywhere” @johannhari101 https://t.co/k7eKEGmEZO
19,2022-07-16 01:13:24+00:00,1548113537918062594,The @johannhari101 joins the pod to talk the book endorsed by @HillaryClinton @Oprah @eltonofficial and all things gay https://t.co/k7eKEGmEZO
20,2022-07-14 23:11:40+00:00,1547720512263991296,Human agency is limitless.
21,2022-07-12 17:54:27+00:00,1546915909012447233,You get to choose your thoughts.
22,2022-07-12 13:50:19+00:00,1546854470868500488,"You make the grass perfectly green on either side. 

With your mind."
23,2022-07-12 13:42:45+00:00,1546852566981566466,Occam’s Razor.
24,2022-07-11 18:24:36+00:00,1546561106948284416,"Whoever decides they are in charge, is."
25,2022-07-11 18:22:47+00:00,1546560652290019328,Everyone thinks someone else is in charge.
26,2022-07-06 22:07:27+00:00,1544805249239638018,Marvel in the miracle.
27,2022-07-06 02:47:14+00:00,1544513270723272704,Believing it’s possible gets you 80% of the way there.
28,2022-07-05 22:24:03+00:00,1544447038460268546,❤️ https://t.co/MS4Kr4nPp3 https://t.co/YEU4EN7xJV
29,2022-07-05 21:26:35+00:00,1544432580250013696,"Moral leadership in the 21st century is embodied by @balajis 

Network-bless 🙏"
30,2022-07-05 21:25:03+00:00,1544432193300303873,"Bringing back the moral high-ground like no other @balajis 

The first real alternative to wokeness. 

With greater analytical, historical, moral, and philosophical rigor than *any* course at Harvard 

You *must* read this book (free at https://t.co/S9DMBC03Gt) https://t.co/4VlLim3HYA"
31,2022-07-05 21:18:40+00:00,1544430586311442432,"I mean every other line is this damn book is 🔥 

The book you need to read to understand the world as it is - and how it can be 🚀 https://t.co/J1kDgMnN7P"
32,2022-07-04 12:47:33+00:00,1543939572643631104,It’s book day here July 4th 🇺🇸🚀 https://t.co/g4h7brUy5S https://t.co/XW2NSosYnA
33,2022-07-04 12:44:54+00:00,1543938904277110784,It’s here! Free mini-book out now at https://t.co/5GKKIVdQws ❤️ Happy 4th! 🇺🇸 https://t.co/qwDbgNrg8Z
34,2022-07-02 19:11:54+00:00,1543311520792182792,"If you’re stuck, where aren’t you in integrity with yourself?"
35,2022-07-02 19:11:30+00:00,1543311421697654786,"When you’re in integrity with yourself, there’s nothing you can’t solve."
36,2022-07-02 19:03:25+00:00,1543309387103625216,What matters is asking the right questions.
37,2022-07-02 19:02:09+00:00,1543309066658844686,Why?
38,2022-07-02 19:02:02+00:00,1543309039370735616,"If you knew you’d be happy either way, which would you choose?"
39,2022-07-02 19:01:25+00:00,1543308884328202243,You choose to guarantee it.
40,2022-07-02 18:59:59+00:00,1543308521973944322,Are you willing to be wrong  about everything you thought was right in order to get what you want?
41,2022-07-02 18:57:27+00:00,1543307885438017536,Question every premise.
42,2022-07-02 18:56:57+00:00,1543307760321839104,"It’s not that you’re confused, it’s that you’re afraid of the truth. 

What if that fear wasn’t a problem?"
43,2022-07-02 18:55:26+00:00,1543307375620259845,Give yourself the permission.
44,2022-07-02 18:54:45+00:00,1543307204647960582,"When you stop indulging in the lie of “I don’t know,” your life opens up to you. 

But what if you did?"
45,2022-07-02 17:47:31+00:00,1543290286012616706,It really is that simple.
46,2022-07-01 15:33:08+00:00,1542894076768538625,Slowing down speeds you up.
47,2022-06-30 19:37:48+00:00,1542593261000429570,"I just donated to @SurajPatelNYC! Suraj is a first-generation American attorney, business owner, and Obama staffer who is running for Congress to bring change and sense back to NY-12. Consider donating to his campaign! https://t.co/ewsJjH0hJu"
48,2022-06-30 19:35:33+00:00,1542592695461453828,"If we had #RankedChoiceVoting for federal elections, there’d be 10s of thousands of Upper West Siders who’d rank @surajpatelnyc #2 today. 

Say that’s you. 

And you’re seriously considering leaving the city for good. 

Why not give it one last shot at success?"
49,2022-06-30 19:21:42+00:00,1542589211383037956,"NYC Upper West Siders: 

you’re thinking of fleeing the city for good but also of voting for Nadler again. 

It’s been 30 years. 

How have things been going? 

Consider @surajpatelnyc."
50,2022-06-30 19:11:13+00:00,1542586573291757574,NYC is in free fall but gets the once in a generation chance to vote out not 1 - but 2 (!) 30-year incumbents by voting @surajpatelnyc on August 23rd ✅ https://t.co/7CTrutufhj
51,2022-06-30 18:05:52+00:00,1542570128604364804,Get ready 👀🚀 https://t.co/ZlM2n1XPkW
52,2022-06-28 23:00:16+00:00,1541919437451919360,Possibility begets possibility.
53,2022-06-28 22:57:47+00:00,1541918816451584002,There’s a solution to every problem.
54,2022-06-28 16:05:54+00:00,1541815161769582593,Keep it simple.
55,2022-06-28 00:35:44+00:00,1541581076266713088,What if it is working?
56,2022-06-27 14:50:33+00:00,1541433808955867138,You think it’s them. And then realize it’s you.
57,2022-06-26 22:02:12+00:00,1541180048790769666,"First, the truth."
58,2022-06-26 21:56:08+00:00,1541178524312240130,Resting your hope for the Republic on Mark Cuban running after he’s repeatedly said no doesn’t seem like a plan.
59,2022-06-26 21:53:44+00:00,1541177918210048002,"When you don’t understand why, it’s hard to know how."
60,2022-06-26 21:51:53+00:00,1541177453149929472,"Pick one thing, and go."
61,2022-06-26 21:44:43+00:00,1541175652577058818,Constraint gives you freedom.
62,2022-06-26 21:34:33+00:00,1541173093900685312,Never look to the past to decide what’s possible.
63,2022-06-26 21:24:00+00:00,1541170436226093056,"What exactly is the goal of @Fwd_Party? 

How will we know when we’ve achieved it?"
64,2022-06-26 21:22:41+00:00,1541170104217620480,"The goal you set is the goal you get. 

Most never set a goal, fearing failure. 

So you fail, but in advance."
65,2022-06-26 21:17:10+00:00,1541168717551255553,"Leadership has nothing to do with power or status. 

It’s having the courage to do what others won’t."
66,2022-06-26 21:13:06+00:00,1541167694963171328,The best leaders know when and who to follow.
67,2022-06-26 21:12:48+00:00,1541167618794688513,"When you look around wondering, “why is no one leading?” -

Remember that you are someone."
68,2022-06-26 21:11:13+00:00,1541167222466531328,We generally wait around for someone to decide - I’m the one to lead.
69,2022-06-26 21:09:38+00:00,1541166820106846209,Hint: the person you think is.
70,2022-06-26 21:08:21+00:00,1541166499414564865,You’d be surprised who also thinks someone else is in control.
71,2022-06-26 21:07:04+00:00,1541166175207530496,"The way to achieve any goal - 

First, how will you know when you’ve reached it?"
72,2022-06-26 20:58:28+00:00,1541164012855070721,"When you think someone else will get it done, it never does."
73,2022-06-26 20:47:48+00:00,1541161328181760002,"When you get exactly what you want, you realize it’s no better there than here. 

There’s no off-ramp from the 50/50 of life."
74,2022-06-25 16:15:06+00:00,1540730310542778370,“Deconstruct the deconstruction.” -@balajis
75,2022-06-24 19:36:59+00:00,1540418730018078721,"Allowing an urge has nothing to do with willpower. 

It’s 3 simple steps. 

1) Name it 
2) Describe the physical sensations
3) Allow it to pass through your body https://t.co/Z5MeWhhStb"
76,2022-06-24 16:10:23+00:00,1540366738067529728,“The good news and the bad news is that ideas really matter” - @bariweiss
77,2022-06-24 16:08:10+00:00,1540366179482718208,It’s a comforting lie to think someone else is in control.
78,2022-06-24 16:06:51+00:00,1540365847377608710,What do you think you’re just observing that you’re actually creating?
79,2022-06-24 16:05:26+00:00,1540365492648660994,Self-confidence is the willingness to feel any feeling.
80,2022-06-24 16:04:36+00:00,1540365280077127681,"You think someone else should do it. 

So you don’t."
81,2022-06-24 16:00:27+00:00,1540364235611508736,"When you think someone else has the power, you choose to give it to them."
82,2022-06-24 00:23:45+00:00,1540128510144135168,"You don’t have an under-earning problem, you have an under-feeling problem."
83,2022-06-23 23:21:19+00:00,1540112799090855941,"How to make a million dollars - 

https://t.co/Hs0EekJYLB"
84,2022-06-22 04:05:18+00:00,1539459487177887744,"New approach, new result."
85,2022-06-18 12:28:37+00:00,1538136602391764993,Learning to consciously redirect your mind is the single most valuable skill.
86,2022-06-18 04:19:08+00:00,1538013417205665793,You get to choose what you make it mean.
87,2022-06-17 13:29:09+00:00,1537789447223246851,"It’s 10,000 iterations, not 10,000 hours."
88,2022-06-16 18:52:38+00:00,1537508466235002881,"How to find happiness and change the course of history with @evanwolfson 

https://t.co/V0Dj2Hjvf4"
89,2022-06-16 17:49:00+00:00,1537492451010744320,Your thoughts create your results.
90,2022-06-16 17:39:39+00:00,1537490098018729984,"How do you change public opinion on an issue so quickly? 

@evanwolfson tells us how he did it. 

https://t.co/V0Dj2Hjvf4"
91,2022-06-16 17:37:08+00:00,1537489464238415872,"7 years ago marriage for same-sex couples was illegal. 

32 years ago a law student with an idea and a dream set a plan into motion. 

He’s the reason we take this right for granted today - @evanwolfson. 

https://t.co/V0Dj2Hjvf4"
92,2022-06-16 17:29:28+00:00,1537487534657179648,"The reason we have gay marriage - @evanwolfson - joins the podcast to share how and why he spent 32 years achieving it. 

https://t.co/019RBiO4Bo"
93,2022-06-16 17:27:59+00:00,1537487162635128833,"The “godfather of gay marriage” @evanwolfson joins the podcast - 

this episode will expand your heart and blow your mind. 

https://t.co/019RBiwtJQ"
94,2022-06-16 13:59:15+00:00,1537434634576769035,There’s a moral philosophical alternative to wokeness coming soon. https://t.co/IipIUyApgA
95,2022-06-16 01:09:29+00:00,1537240915659857920,"I’ve learned the hard way that not everyone is open to coaching. 

And wanting something more for someone than they do doesn’t work.

But for those who are, they consider me the “coach of last resort.” 

We do in 1 hour what would take 10 years. 

https://t.co/5GKKIVeom0"
96,2022-06-14 14:29:07+00:00,1536717375667687424,New Yorkers get the rare joy of ousting not 1 - but 2 (!) incumbents at once by voting @surajpatelnyc ✅ 🚀
97,2022-06-12 23:23:52+00:00,1536127174603943941,You can make it work for you.
98,2022-06-12 21:33:51+00:00,1536099484916191233,"“Why does it have to be me?” 

It *gets* to be."
99,2022-06-12 21:30:12+00:00,1536098567181553665,"What you celebrate, you integrate."
100,2022-06-12 19:48:57+00:00,1536073087531237382,"This one episode of the pod will change your life - 

https://t.co/a2uij9zvUn"
101,2022-06-11 01:16:13+00:00,1535430672269168641,"On getting outed by the local paper, overcoming his first political loss, and his rise to be so many firsts in the nation - @Evan_Low on the heels of a big primary win on the podcast 

https://t.co/c2wF4fjM7N"
102,2022-06-11 01:08:27+00:00,1535428717824049152,"On coaching and therapy 
@BrookeCastillo 

https://t.co/FRiHqfr2Vm"
103,2022-06-10 19:20:35+00:00,1535341174457831426,"Trailblazing @Evan_Low who represents Silicon Valley, former Yang2020 national co-chair, on the heels of another big primary win -

joins the podcast to share his story and journey to authentic leadership. 

https://t.co/c2wF4fjM7N"
104,2022-06-10 14:02:09+00:00,1535261036617531396,"“Whether you think you can, or you can’t - you’re right.” 

- H. Ford"
105,2022-06-08 15:20:42+00:00,1534556028897046540,"“The risk of a wrong decision is preferable to the terror of indecision” 
- Maimonides"
106,2022-06-08 14:41:55+00:00,1534546267174494209,"What you think is what you see. 

What you see is what you create."
107,2022-06-07 23:37:20+00:00,1534318623262744577,"If you see it in someone else, you’ve got it in you."
108,2022-06-07 23:27:08+00:00,1534316054805196802,"Hey! You get to keep being an a**hole to yourself. 

AFTER you celebrate 3 wins with me now. 

Ready? Let’s go. https://t.co/z730NRkcTh"
109,2022-06-06 01:37:47+00:00,1533624158076248064,"I’m a life coach and I can help you. 

If you’re ready to finally feel better and get exactly what you want in life — 

Book a 1 on 1 consult at https://t.co/5GKKIVdQws https://t.co/CrkVDQPXPq"
110,2022-06-05 21:54:22+00:00,1533567933192056832,The belief precedes the success.
111,2022-06-04 20:17:54+00:00,1533181268959105024,The way you feel here is the way you’ll feel there.
112,2022-06-04 20:16:37+00:00,1533180947427954689,The thoughts you think now are the thoughts you’ll think then.
113,2022-06-01 21:01:01+00:00,1532104956085514240,A- work done &gt; A+ work never begun
114,2022-06-01 20:38:52+00:00,1532099384128708609,"5 minutes a day is 1,825 minutes a year. 

That’s more than 30 hours. 

Of whatever you choose to spend 5 minutes a day on."
115,2022-05-31 12:53:36+00:00,1531619905589608452,On today’s podcast we have @jkirchick joining us to discuss his new book ‘Secret City: The Gay History of Washington” and what this means for gay men today https://t.co/1BSmJFN9TY https://t.co/Oz32RLr0V9
116,2022-05-29 21:53:11+00:00,1531030923050885121,"You can lose 20 pounds in 6 months and keep it off for life. Easily. And have fun and never feel deprived 😄

Want 1 on 1 support? Head on over to https://t.co/5GKKIVdQws and book a free consult now. 

*This is NOT medical advice. It is for informational purposes only.*"
117,2022-05-29 21:53:11+00:00,1531030922048462848,"Adipose tissue (fat) is not moral. 

Start by practicing thoughts like “this is a human stomach.” 

When you feel your gut or look in the mirror, practice saying “this is a human stomach.”

If you feel a little less sh*tty then it works!

Try this for 5 days."
118,2022-05-29 21:53:11+00:00,1531030920819625985,"The food you choose to eat is created by your feelings.

Your feelings are created by your thoughts. 

Hating your body won’t lead to sustained weight loss. 

Nor will positive affirmations, mantras, pretending you love it. 

You can go from loathing your body to feeling neutral"
119,2022-05-29 21:53:11+00:00,1531030919330553857,"You can lose 20 pounds in 6 months and keep it off for life. 

Without feeling deprived or hangry. 

Here’s how:

First, what you eat matters 10x more than exercise. 

Second, what you eat matters more than how much you eat."
120,2022-05-29 20:06:14+00:00,1531004004473491457,"What you’re actually afraid of most is getting the thing you want because —

Then you’ll be disabused of the lie that it’ll make you happy. The lie that it’ll be an off-ramp from the human experience. 

The good news is you can have both. 

Happiness AND the thing."
121,2022-05-29 20:01:02+00:00,1531002699373756421,"When you make it fun, it lasts."
122,2022-05-29 20:00:22+00:00,1531002529093406723,"Of course you care what they think. You’re human. 

The question is: 

What do you think?"
123,2022-05-29 19:59:28+00:00,1531002303150444544,"The truth is abundance. 
The truth is positive-sum.
The truth is possibility."
124,2022-05-29 19:56:39+00:00,1531001593000251392,Your information diet matters as much as your food diet.
125,2022-05-29 19:52:53+00:00,1531000646907973633,"If you can be happy without the thing — 

why go after it?

Because you can. Because it’s fun. 
Because it matters. Because you’re human. 

To be human is to grow and evolve. 
To create, serve, and to love."
126,2022-05-29 19:48:03+00:00,1530999429427347458,"Happiness is created by your thoughts. 

You get to choose your thoughts. 

You can choose to be happy."
127,2022-05-29 19:46:17+00:00,1530998986278154244,You being happy creates more happiness in the world.
128,2022-05-29 19:45:33+00:00,1530998803058380800,You being exactly who you are helps others be exactly who they are.
129,2022-05-29 19:44:31+00:00,1530998542218706945,"People pleasing is lying. 

Lying is not virtuous. 

People pleasing is not virtuous."
130,2022-05-29 19:28:16+00:00,1530994453560889344,"Telling the truth is virtuous. 

Beginning with the truth of who you are."
131,2022-05-29 15:49:32+00:00,1530939406252662784,"If you’re ready to get to the part where your brain works FOR you, not AGAINST you, let’s go. https://t.co/5GKKIVdQws"
132,2022-05-29 15:49:32+00:00,1530939404222705666,"This is the part where…

Is a powerful phrase to add to negative thoughts - 

This is just the part where 

My brain tells I’m going to fail… they’re going to judge me… it won’t work… I’m not enough… 

This is just the part where it freaks out. https://t.co/9XjTmT8cjM"
133,2022-05-29 15:40:37+00:00,1530937160106487809,"Resolution: 0/10 People pleasing (deceiving) 

Reframe: 10/10 truthful 

Result: *Exactly* what you want"
134,2022-05-28 01:16:06+00:00,1530357209397329920,"When you don’t have an example for what’s possible, become one."
135,2022-05-27 14:29:56+00:00,1530194597388894210,"There’s a deep history to this. 

“Gay men had to develop studiousness, compartmentalization, discretion to survive. 

This made them uniquely skilled to high-level advising.” 

-@nytimes on @jkirchick https://t.co/jb43b0ZOi0"
136,2022-05-27 14:24:00+00:00,1530193106859180032,"The Lavender Scare - 

“At the height of the Cold War it was safer to be a Communist than a homosexual. 

A homosexual was forever tainted.” https://t.co/RMgVfKI79Q"
137,2022-05-27 13:21:20+00:00,1530177333553922048,"It’s a great honor when someone else takes credit for your work. 

So when you work for yourself you know exactly what to do."
138,2022-05-26 16:41:22+00:00,1529865284659585024,"The Thought That Changes Everything - 

https://t.co/JNRGkwye00"
139,2022-05-24 21:00:17+00:00,1529205669722742786,New Yorkers now get the rare chance to vote out two out-of-touch incumbents at the same time by voting @surajpatelnyc - so fun!
140,2022-05-24 19:43:15+00:00,1529186281972019205,Belief Plan &gt; To-Do List
141,2022-05-24 14:47:17+00:00,1529111798892445702,The goal you set is *exactly* the goal you get.
142,2022-05-24 14:40:35+00:00,1529110116632563714,"At 24, Hayden was laid off from his job. 

He didn’t know how to code. Was unemployed for 5 months. 

5 years later. $1T. On track to be larger than the NYSE. 

You don’t have to aspire to be on the cover of Forbes. 

You can *become* the new Forbes. https://t.co/qxlIPzhytE"
143,2022-05-24 00:31:08+00:00,1528896342612910082,"If you actually knew that *exactly* what you wanted was available to you —

how would you show up today? https://t.co/5XcJsN2Qeh"
144,2022-05-23 20:35:59+00:00,1528837165756690432,"How to process an emotion in 3 simple steps: 

1) Name it 

2) Describe the physical sensations as you would to a doctor or an alien who didn’t know what emotions were

3) Notice the physical sensations change +  dissipate 

When you can process any emotion, you become invincible https://t.co/nI4sSPmZy9"
145,2022-05-23 17:07:10+00:00,1528784615107878914,"Other people will be exactly who they are. 

Who will you be?"
146,2022-05-23 01:50:14+00:00,1528553860700291072,"How to Feel Better Now 

Out on Spotify 

https://t.co/fSylia7X6l https://t.co/fhdfD80tdf"
147,2022-05-21 18:15:49+00:00,1528077117782646787,"When you get super f*cking clear about what *exactly* it is you want —

that’s when you create it.

The lie is that you don’t know. 

What if you did?"
148,2022-05-21 17:10:54+00:00,1528060777936068613,"When you talk about yourself that way —

we assume it’s how you’ll talk about us one day."
149,2022-05-21 17:08:50+00:00,1528060257884418055,"You sweep that judging thought about your body, yourself under the rug. 

Then wonder why you’re not getting what you want.

There’s no confusion. 

People don’t follow leaders who sh*t on themselves. 

If you talked to your friends the way you talk to yourself, you’d have none."
150,2022-05-21 17:04:28+00:00,1528059159509344256,"You ask yourself “what actions can I take to achieve my goal?”

No, my friend. 

“What thoughts can I think to make it possible?”"
151,2022-05-21 17:02:55+00:00,1528058769174839297,"Sh*tting on yourself doesn’t empower anyone.

Loving on yourself does. 

The difference is hundreds of billions of dollars of value. Literally."
152,2022-05-21 15:59:17+00:00,1528042754613424130,"Get up, let’s go! 

The world is waiting for you to get over your sh*t. 

Have you ever googled “how to be happy as a gay man?” 

I’ve got news for you. If I can do it, so can you. https://t.co/adhZrRG6jv"
153,2022-05-21 15:47:06+00:00,1528039691018244097,https://t.co/7db43lHMnL
154,2022-05-21 15:47:05+00:00,1528039686635143169,The simple guide to stop being defensive ⬇️❤️ https://t.co/G5djylEgOx
155,2022-05-19 23:39:10+00:00,1527433712887119877,"We’re in a mental health panic. 

We’re teaching a generation of young people that negative emotions are problems. 

Thereby creating one. 

The way out is through. 

*This is not medical advice. It is for informational or educational purposes only.* 

https://t.co/1egVnfNqC1"
156,2022-05-19 23:32:22+00:00,1527432001367818242,"You can add years to your lifespan now. 

*Spoiler alert: Your thoughts create your results.* 

It is that simple.

By going all in on this work.

All in on you. 

*This is not medical advice. It is for informational or educational purposes only.* https://t.co/1egVnfNqC1"
157,2022-05-19 16:18:16+00:00,1527322759369412608,"We’ve been taught that 

Gay men are not leaders. 

We’re just the sidekicks who helps the boss get the job done. 

It doesn’t have to be this way. 

You can gain control over your time, money, and life and step into your leadership now. https://t.co/5GKKIUWf7S https://t.co/p7gWU3Ltos"
158,2022-05-17 15:08:27+00:00,1526580414483243008,"Do you want to finally feel better and get what you want in life? 

The 3 secrets to a happier life: 

1) You are not your thoughts

2) Your thoughts create your feelings

3) Your feelings are harmless physical sensations in your body. 

https://t.co/i8p3IR0lQr"
159,2022-05-17 01:59:09+00:00,1526381780768641024,Your thoughts create your results.
160,2022-05-16 01:02:02+00:00,1526005014896025604,"Why do you keep doing the thing you know you shouldn’t be doing, and how do you stop?

The answer is not more willpower or white-knuckling through. That’s what leads to burnout and the f*ck it effect.

The answer is retraining your mind. https://t.co/TZJTf0QKvd"
161,2022-05-16 00:56:33+00:00,1526003638484738048,"If I put a pack of cigarettes on the table, what would you do? 

Would you start smoking or think that’s gross and let them be?

Your self-critical soundtrack is like that pack of cigarettes. 
https://t.co/WaeIThopBN"
162,2022-05-16 00:49:27+00:00,1526001849416949761,"Our best hope is that the right people develop the self-belief and sufficiency to lead us out of crisis. 

Social change doesn’t just happen. 

It’s created by people with human brains. And insecurities."
163,2022-05-16 00:39:03+00:00,1525999232737591298,"Do you immediately doubt yourself the second someone disagrees with you?

But then realize you were right the first time? 

There’s no amount of expertise or mastery that will make you hold your ground. 

You can learn to trust your instinct and stick to it. Even when challenged. https://t.co/PFqIb6qI7v"
164,2022-05-15 19:10:40+00:00,1525916591317299200,"There’s nothing more empowering - and true - 

than knowing that you can solve *any* problem."
165,2022-05-15 15:06:42+00:00,1525855197993525249,Just posted a photo https://t.co/rCICkoDeRh
