,Created at,User ID,Text
0,2021-01-15 14:56:30+00:00,1350094512815829000,"Here’s the 🔑 to motivating Congress, ensuring they work for us, and keeping lobbying dollars out...

#TermLimits"
1,2021-01-08 21:54:22+00:00,1347662960550948865,Here’s some great news for 2021...@RachelAnneLevy is running for Delegate #HD55
2,2021-01-07 13:30:41+00:00,1347173816213118982,If you can’t be trusted on Twitter HOW are you being trusted with Nuclear codes?!
3,2021-01-06 20:14:29+00:00,1346913046493597696,The police couldn’t be in the crowd and protecting the US Capital.....thus a lack of police presence
4,2021-01-06 19:34:06+00:00,1346902882587697155,"They are invading the US Capital and no signs of the National Guard, Militarized Police, or Tear Gas!"
5,2021-01-06 19:26:20+00:00,1346900930004922368,"How is it acceptable for @POTUS supporters to scale the Capital in “protest”?

There’s no mistaking Protesting and Anarchy!
@#CERTIFY #unacceptable"
6,2021-01-06 18:35:55+00:00,1346888241971081217,Did @senatemajldr just find his soul and activate his integrity?!
7,2021-01-06 01:51:39+00:00,1346635511876739073,Congratulations and we are honored to have you https://t.co/v0wFFasX04
8,2021-01-05 16:52:14+00:00,1346499762867068929,"As an IT Professional we use IF/THEN Statements. For example:

IF: The Presidential ballots were fraudulent 

THEN: The Senate ballots were fraudulent 

Can’t have it both ways 😒"
9,2021-01-03 22:04:22+00:00,1345853537301966848,"Integrity is doing what’s right when no one is around, when no one is watching, when no one hears you.

If you witnessed this in private and didn’t speak out... you lack integrity https://t.co/GlLunlr4wX"
10,2020-09-30 02:17:05+00:00,1311127899836162049,"There is a difference between legal and ethical. @realDonaldTrump taking advantage of tax loopholes to not pay taxes may be legal, but being the POTUS and not paying taxes surely isn't ethical."
11,2020-09-30 02:02:51+00:00,1311124317774778368,Just shoot bleach in your arm! #Debates2020
12,2020-06-10 22:10:57+00:00,1270840905860288512,"I'm super excited, I had the pleasure of voting today for @QasimRashid . If you haven't made a decision for the upcoming primary, meet Qasim Rashid tonight at 7pm for a virtual coffee 

https://t.co/X3Vze81WbG"
13,2020-05-10 11:32:34+00:00,1259446225121808384,"Running for Congress I made a commitment to do what's best for CD-1, and to support the Candidate with the most momentum. Following yesterday's debate and reviewing fundraising reports, it's time for @Vangie4Congress to do the same! @QasimRashid is the most qualified Candidate."
14,2020-04-28 02:05:13+00:00,1254954792037859330,"Rest in Peace my friend and Gospel legend Troy Sneed. You blessed so many with your laughter, kindness and talents."
15,2020-04-22 15:10:14+00:00,1252978023445532673,"I have lost Battle Buddies in war and to suicide following war. 
Veteran's need strong support from Congress. This is why you should join @MuslimMarine @FoggyBottomLine @herb4virginia and Myself in supporting @QasimRashid for CD1 https://t.co/SaSDiQR0Cm"
16,2020-04-21 16:57:55+00:00,1252642733723996161,Sign up today! Your talent is needed to take this campaign over the finish line. https://t.co/F7KRW3M8jH
17,2020-04-14 21:11:30+00:00,1250169835142688770,"I’m attending Rashid for Virginia’s event, “1st CD Veterans Virtual Town Hall” – sign up now to join me! #TeamRashid https://t.co/IavLPkWUcM"
18,2020-04-09 11:52:32+00:00,1248217229554069507,"He may not have won, but we are definitely better because he ran! Our political leaders are thinking, walking and talking more like @BernieSanders . Thank you"
19,2020-04-04 23:56:39+00:00,1246587516343521280,I lost my uncle today to COVID-19. I encourage you all to stay in side and be as diligent as possible in following the guidelines. #AloneTogether
20,2020-04-01 00:47:08+00:00,1245150669352439808,"Hey y'all. My good friend @QasimRashid is running for US Congress in Virginia

He rejects corporate money &amp; Today is the last day of fundraising for Q1.

I promised I'd find 10 people to donate at least $5 to his campaign to help them hit goal. Who's in?
https://t.co/LZwCZM3qnj"
21,2020-03-26 19:18:18+00:00,1243255976792395779,Hard to see the solution to a problem when you're complaining about the problem
22,2020-03-17 19:55:45+00:00,1240003913711063042,So the GOP fully supports tax breaks for Corporations and a $850B economic stimulus.... but @BernieSanders talks about education or Healthcare and it's Socialism 🤦🏾‍♂️😪
23,2020-03-17 04:03:01+00:00,1239764149976080385,"While I'm glad to see a #FamiliesFirstBill pass, it's truly disappointing to have a country with a Healthcare system that doesn't put #FamiliesFirst requiring a #FamiliesFirstBill 🙄"
24,2020-03-10 11:59:18+00:00,1237347292664991744,I am proud of the progress! I will fight with you next year. https://t.co/mJjEmVcwpD
25,2020-02-19 12:31:39+00:00,1230107680372596736,"I have always advocated a living wage! 
If you don't know what it's like to live in poverty then you don't know how HUGE this is 👏🏾👏🏾👏🏾 https://t.co/RCmTCQs1yd"
26,2020-02-15 17:00:26+00:00,1228725769289052161,"It is my esteemed pleasure to endorse and support @QasimRashid 

He is dedicated to creating the change we need. https://t.co/54V8RHlfxN"
27,2020-02-14 12:22:22+00:00,1228293404024545281,"He's got to be talking about the bakery at his Dad's hotel! He doesn't even know WIC, let alone a damn bread line. SMH 🤦🏾‍♂️ https://t.co/rl9C5KiUVS"
28,2020-02-10 20:14:14+00:00,1226962600786833408,"The goal is to run, but can't be mad at the crawl https://t.co/MqMz6ts5dN"
29,2020-02-08 15:53:16+00:00,1226172151960653825,"To my supporters, it is with a heavy heart—but also with immense gratitude—that I am suspending my campaign today.

The fight will continue and rest assured I will be on the front lines of that fight! https://t.co/pqBhz77jCm"
30,2020-01-29 13:55:23+00:00,1222518604173905920,Spread the word! https://t.co/5E6wG9QgU3
31,2020-01-28 15:53:19+00:00,1222185897203990528,"Voter suppression is administrative!

It's about...
❌ Removing voters from rolls
❌ Changing polling locations 
❌ Creating obstacles for voting

Fight back 
https://t.co/qxC04rEgJk"
32,2020-01-27 01:32:59+00:00,1221606996606058497,"I've been in awe all day. Kobe's passion and love will be missed. 

Real purpose is leaving this world better than you found it! https://t.co/aR8BzoQUkx"
33,2020-01-26 20:33:26+00:00,1221531614502670339,"My heart goes out to @kobebryant and his family! 

Tell the ones you love that you love them EVERY day https://t.co/xdbcPhv41v"
34,2020-01-26 18:30:38+00:00,1221500711902556166,"We will win the 1st Congressional District and defeat Rob Wittman by getting the highest voter turnout the district has ever seen!

It will take a campaign of passion and excitement!

https://t.co/qxC04rEgJk"
35,2020-01-25 12:51:00+00:00,1221052852304478209,"“Call it democracy, or call it democratic socialism, but there must be a better distribution of wealth within this country for all God’s children."" 

- Dr. Martin Luther King Jr. 
https://t.co/CcmfXMflWV"
36,2020-01-25 00:34:01+00:00,1220867385319665669,"✅Virginia needs offshore wind!

❌What we don't need is the offshore drilling proposed by my GOP opponent Rob Wittman.

I'm running in Virginia's 1st Congressional District. Join me in my fight for clean and renewable energy today!♻️
https://t.co/8B09v2SOuV https://t.co/0ibLk7GSuB"
37,2020-01-23 18:44:08+00:00,1220416945465544709,"There is a time for incarceration.

But there is always a time for rehabilitation!

#CriminalJusticeReform"
38,2020-01-22 12:17:27+00:00,1219957243363385346,"The GOP controlled SENATE just voted to have a trial and not allow evidence or witnesses 53-47 vote.

@realDonaldTrump said, ""He could shoot a man on 5th Avenue"" 

He meant every word!

I am fighting Corruption in Politics! Join me
https://t.co/qxC04rEgJk"
39,2020-01-22 04:48:46+00:00,1219844331156185088,"Finally, at 102 years old, this Navy veteran is sailing into retirement. Thank you, Bob, for your service! https://t.co/ooo34qpxTp via @actionsprout"
40,2020-01-20 12:34:21+00:00,1219236722275495936,"Virginians should never be afraid to go to work, go to school, walk the streets, go shopping

You'll NEVER see a @MomsDemand  protest that causes people to live in FEAR! See the difference 
#IStandWithVirgina https://t.co/Grk4ODHqT5"
41,2020-01-19 22:36:34+00:00,1219025886290370560,"This issue is all too familiar in the U.S.

We must have Affordable Housing and a Living Wage!

https://t.co/F1J6OGwZfP"
42,2020-01-19 13:58:25+00:00,1218895491427160065,"RETWEET THIS‼

Help me get my followers to 2,500

Let's make people aware of my goal to end Corruption in Politics!"
43,2020-01-18 13:51:43+00:00,1218531417728131072,"My campaign is experiencing great momentum! Please help fuel that momentum with a donation to help reach our $100K goal by March 1st.

https://t.co/8B09v2SOuV"
44,2020-01-16 18:22:09+00:00,1217874697330855938,"Absentee Voting for Virginia Democratic Presidential Primary will begin on Thursday January 16, Friday January 17, or Saturday January 18, depending on office hours and observation of State holidays.

The deadline to VOTE absentee in-person is on Saturday February 29, 2020! https://t.co/K1C1udy3qN"
45,2020-01-15 20:38:08+00:00,1217546528870617091,"I was proud to watch as @JCarrollFoy delivered her well formulated and intelligent case to Ratify the ERA. 

Now I'm celebrating all the work that @HalaAyala , @JennMcClellanVA , and so many other Bad Ass Women did to make this happen!!! https://t.co/epdjSUJb8g"
46,2020-01-15 02:29:23+00:00,1217272539505930240,"Tonight the Presidential Candidates express their vision in a debate, but don't forget about the #DemDebate on January 22nd Congressional  Candidates will have for #VA01"
47,2020-01-15 01:26:32+00:00,1217256722131312640,The energy in this video is magnetic! @HalaAyala and @JCarrollFoy you have a lot to be proud of! 👏🏾👏🏾👏🏾 https://t.co/7hY1Szju5r
48,2020-01-13 16:04:17+00:00,1216752840049295361,"Keep fighting for change and watch it change!
#MondayMotivation"
49,2020-01-12 02:12:20+00:00,1216181081424244742,Huge Congratulations to @JoshuaCole https://t.co/HxzJ7j4fum
50,2020-01-11 18:33:31+00:00,1216065617339518979,I'm a Candidate for VA-01. I will get things done! https://t.co/bkHZ6LszfJ
51,2020-01-10 12:03:46+00:00,1215605147969163264,"My daughter was threatened at school, I had police patrolling my home due to threats. But We Will NOT STOP! Changing Rural Virginia is not easy."
52,2020-01-10 12:03:46+00:00,1215605146727714816,"As an Army Veteran I faught for the freedoms of all Americans. I served as an Equal Opportunity Leader and worked to protect civil rights. A few months ago I was kicked out of a NRA meeting, I protested a KKK Rally, my wife had a gun pulled on her while Canvassing,"
53,2020-01-10 12:03:46+00:00,1215605144982884357,@JCarrollFoy @CliffHayesJr @JennMcClellanVA @pwcdanica @HelmerVA @JoshuaCole @VaBlackCaucus @90For90 @delegateguzman @AdamParkhomenko @herb4virginia @delegatebagby @DelCPeace @ChelseaWiseRVA @WJCCIndivisible @IndivisibleVA @lasseire @BobbyScott @Donald_McEachin
54,2020-01-10 12:03:45+00:00,1215605143246426114,"I want Healthcare for all, Criminal Justice reform, to Ratify the ERA, A Living Wage, Affordable Housing, Equality 

They clearly want me dead!

Help me fight back and show them we are strong!
https://t.co/8B09v2SOuV https://t.co/opQMcumg3w"
55,2020-01-08 16:28:22+00:00,1214946961591341056,Who's excited about this new General Assembly starting today?!
56,2020-01-08 00:21:19+00:00,1214703593594540032,"I love coaching! Kids learn so much about team, community, rules, and compromise https://t.co/wIDLzpk8Vg"
57,2020-01-07 15:46:16+00:00,1214573978209210368,"The Iran Nuclear Deal was working! Until #45 came and messed it up.

We need a strong strategic plan for Diplomacy"
58,2020-01-07 13:37:11+00:00,1214541494243221504,"If you support: 

✅ Overturning Citizens United
✅ Medicare For All 
✅ Green New Deal
✅ Criminal Justice Reform
✅ A Living Wage

Then please support our 💯 grassroots funded campaign with $25 for VA-01 so we can defeat Wittman! 
#VA01
https://t.co/8B09v2SOuV"
59,2020-01-07 00:40:59+00:00,1214346154474983424,"Protecting the right to vote is by far one of the most important challenges we face as a State and Nation. 

Riding voter intimidation, voter suppression 

Promote access to the Ballot and Voter restoration 

Protect civil liberties"
60,2020-01-06 15:59:58+00:00,1214215035918135299,"Join me in signing on! Tell our legislators that it's time to progress.

Fully Legalizing for regulated adult use and expunge the records of this bias law. 

Use the tax revenue for Education and not wasted funding on incarceration https://t.co/3n9Eq1ByrI"
61,2020-01-06 00:19:02+00:00,1213978243105202176,"How do you unwind, even if for a moment?"
62,2020-01-05 01:44:59+00:00,1213637485923897345,"This is unacceptable! Following the Geneva Convention, Rules of War, and Rules of Engagement have shown the World we are ethical!

#TrumpsWar #IranWar https://t.co/AaBVyuHDEK"
63,2020-01-04 22:24:21+00:00,1213586993692782596,"#AnInconvenientTruth came out in 2006. It's incredible to see the accuracy of the climate change predictions! 

Stand with @herb4virginia @FoggyBottomLine and I against climate change https://t.co/5e0uPf8Mkm"
64,2020-01-04 13:53:35+00:00,1213458457644486657,"I'm an Army Veteran, but just as outraged as @GilCisnerosCA https://t.co/PnrE7LBrw1"
65,2020-01-04 13:38:43+00:00,1213454713649291264,"This is the worst bushfire season in Australia's recorded history. #ActOnClimate

Half a billion animals affected

Over 250 million tons of CO2 released.

The #climatecrisis is Real.

#AustraliaBurning #AustraliaOnFire https://t.co/pJ7SdFkWAi"
66,2020-01-03 15:23:35+00:00,1213118715895668737,"I’m not accepting corporate PAC money. 

I’m counting on real people to fund our movement.

Will you chip in today to help us defeat Rob Wittman and his big corporate donors?

#LowerDrugCosts 

—Kevin 

https://t.co/8B09v2SOuV"
67,2020-01-03 14:15:30+00:00,1213101584839794691,War is NOT diplomacy! A war with Iran is not the solution. I served in Iraq and have friends still serving in Afghanistan. I have witnessed the devastation.
68,2020-01-02 12:02:43+00:00,1212705779062640643,"I'm running for Congress. I am asking you to join me today as a part of a continued movement to improve equity, equality and quality of Life. Together we will restore integrity and values to our government! Join Me:
https://t.co/GCHkS8HdVA"
69,2020-01-01 14:31:09+00:00,1212380747367174146,"Happy New Year! This year will be about equity, equality and a higher quality of Life! https://t.co/wDpTAY2x3z"
70,2019-12-26 15:10:52+00:00,1210216415808110594,"Happy #Kwanzaa 

Umoja - strive for Unity in our families, community, and country https://t.co/dV9EUKdHAi"
71,2019-12-25 22:20:08+00:00,1209962055035478016,Merry Christmas 🎅 from the Washington family. Have a blessed one! https://t.co/mtTLaVEpW4
72,2019-12-23 19:29:00+00:00,1209194213419757571,"The President doesn't understand wind, and denies climate change 🌍. We need leadership that will work proactively towards renewable energy and creating jobs! #GreenNewDeal https://t.co/9aLGbLUYGW"
73,2019-12-22 14:47:04+00:00,1208760875127062528,"I have lived all over the World. In countries without guns and countries with assault weapons bans. Guess what, they're still happy, economy still thriving, and best of all their streets are safe!New Zealand, 56,000 guns and 194,000 parts buyback https://t.co/oo2VGiE8wK"
74,2019-12-21 23:20:15+00:00,1208527632641536007,"Congratulate to Virginia's own Camille Schrier on being crowned Miss America! Your victory is well-deserved. I'm excited about all of the young women that you will inspire to pursue their dreams. 

https://t.co/IGEvaHHg06"
75,2019-12-21 16:33:41+00:00,1208425317301403649,There's something special about every season! Enjoy #FirstDayOfWinter https://t.co/ZlL9sOP2hA
76,2019-12-20 17:22:12+00:00,1208075138408865792,"You can understand an issue and show empathy, even if it doesn't affect you
#FridayThoughts"
77,2019-12-20 03:34:36+00:00,1207866863801294848,Campaign finance reform is a must! #winecave
78,2019-12-19 13:16:26+00:00,1207650899440685056,Impeachment isn't a waste of time or money. It's about upholding law and order. It's about showing the Country and World that no body is above the Law! #Impeached #ImpeachmentDay
79,2019-12-17 00:59:10+00:00,1206740587023650817,"The best part about this coming GA, is they will make positive change and improve the lives of so many. To include those that voted against their own interests! 🙏🏽👍🏾"
80,2019-12-15 12:42:26+00:00,1206192791778463744,"Something's require no explanation. Thus, commonsense legislation! When I tell you @JoshuaCole is doing it....He DOING IT! https://t.co/XrW6HDFAU1"
81,2019-12-11 15:00:14+00:00,1204777922025922560,The most important aspect is resolving past convictions! @MarkHerringVA thank you for working to make the COV fairer and more inclusive https://t.co/rQxBrtXUYt
82,2019-12-11 14:53:23+00:00,1204776196967403521,"When the @FBI targeted, harrassed, and investigated Malcolm X, Huey P. Newton, and Martin Luther King it was an injustice and a ""witchhunt"". The FBI investigation into REAL crimes committed by @realDonaldTrump is not a witchhunt!"
83,2019-12-10 12:04:34+00:00,1204371325776740352,Our elected officials should stand for something and should be #BOLD this is leadership! Thank you @Sam_Rasoul for leading the way https://t.co/7wzUmEOl38
84,2019-12-03 23:24:16+00:00,1202005660898144266,Thank you for your commitment and sacrifice. Very well run campaign https://t.co/a6i2xgUCKz
85,2019-11-30 18:51:33+00:00,1200849865686888448,It's simply a matter of priorities! If Florida can provide free school lunch surely Wealthy Virginia can too! This may be some children's only meal. https://t.co/qaAyjYt8rM
86,2019-11-28 13:37:19+00:00,1200046011932168195,Happy Thanksgiving from my family to yours. We are blessed and have so much to be thankful for. https://t.co/S7WbjwS09D
87,2019-11-27 13:43:47+00:00,1199685249426493441,You have the Power to make it better! #WednesdayMotivation https://t.co/aPHbW0FmLO
88,2019-11-26 20:25:59+00:00,1199424079943606272,If your representatives aren't standing up for you replace them with someone who will! Drug prices are out of control and it's time to Stand! https://t.co/1VLkWyI4ri
89,2019-11-25 17:08:04+00:00,1199011882964856837,2 reported dead at UNC Health Care. Gun violence is absolutely a public health issue. I pray for those involved and their families https://t.co/y1sT9tAoym
90,2019-11-15 21:22:56+00:00,1195452143840481280,Our State and Country so desperately needs criminal justice reform! Thank you @JCarrollFoy https://t.co/DDop2mkX41
91,2019-11-14 18:59:00+00:00,1195053535995596802,"Let's Stand with @RealByronAllen in this fight for Economic Inclusion! The American Dream is a dream that everyone should not only share, but be able to achieve!

 https://t.co/8Jkit8aJHM"
92,2019-11-12 14:49:07+00:00,1194265874989015040,"I absolutely agree Eliminating corruption in politics takes courage and determination! Ultimately it takes YOU!#NationalRunforOfficeDay, think 🤔 about running 🏃🏾‍♂️🏃🏾‍♂️🏃🏾‍♂️🏃🏾‍♂️ for office https://t.co/1tBW0NKBoy"
93,2019-11-11 17:07:48+00:00,1193938386626715648,Thank you to all you have served and for the many sacrifices you've made https://t.co/K76U2UaTZy
94,2019-11-10 19:41:14+00:00,1193614611632795649,Thank you @NetworkVirginia for allowing me to fellowship with such Badass Women! You all are truly awesome. We voted and we won. #RatifyERA https://t.co/KSZatfPkGH
95,2019-11-10 14:22:38+00:00,1193534435091714050,"The goal was to #FlipItBlue I'm excited for Virginia! Congratulations to Speaker-designee @EFillerCorn, Majority Leader @C_Herring, and Caucus Chair @RipSullivan48!"
96,2019-11-07 00:03:51+00:00,1192231148824530944,"Thank you so much for all of your support, hard work and dedication! https://t.co/rqscsG5Dk5"
97,2019-11-06 21:20:30+00:00,1192190040287391747,Thank you for your support! https://t.co/5KNdGcNHq4
98,2019-11-04 14:41:39+00:00,1191364892781137921,My agenda is to fund early Childhood education and increase teachers pay! I see how my opponent may view this as radical since he opposes doing either. #HD97 #kevinforvirginia #FlipItBlue #VOTE https://t.co/nY54qy48tO
99,2019-11-02 19:43:30+00:00,1190716081771601922,Thank you @Vangie4Congress for your endorsement and support! Let's work hard the next 3 days to #Flipitblue https://t.co/N2RcgYS42c
100,2019-10-29 13:00:33+00:00,1189165122452938753,"There are a lot of key issues critical for improving the quality of life in the COV. While they are all important to me, I will Sprint 🏃🏾‍♂️🏃🏾‍♂️🏃🏾‍♂️🏃🏾‍♂️ to Ratify the ERA! @VAratifyERA

https://t.co/Fsn8fFROXD"
101,2019-10-28 23:15:45+00:00,1188957553960652800,Had a visit from my #1 supporter! Thank you Mom for always being in my corner https://t.co/2sw5lYeaoy
102,2019-10-27 17:51:35+00:00,1188513589595906049,I have spoken to voters who have received cards from @postcards4va . They are always excited! I appreciate the support and have witnessed the impact. Only 9 days left! Let's finish strong https://t.co/Qg1zZwkZpD
103,2019-10-17 17:27:10+00:00,1184883565739335681,"Today our country lost a true leader. Congressman Elijah Cummings. He was a passionate fighter for justice, and a powerful voice of moral conscience in our government who served his country for decades with dignity and integrity. We need more leaders like him. https://t.co/93j3Kyl84A"
104,2019-10-15 16:36:39+00:00,1184146073780129792,"Today, Oct. 15th is the deadline to register to vote. If you still need to do so, it takes 5 minutes. Visit my website to register:
https://t.co/Q4Ry5LTQsm"
105,2019-10-03 20:25:53+00:00,1179855109938978819,"On the DD Waiver Waitlist? IFSP application submissions will be open October 1 at 9 am and close October 11 at 5 pm. I am excited for the day when we no longer have those in need waiting for services.
https://t.co/NLRkToZqlQ https://t.co/lDadSVE6mq"
106,2019-10-02 20:19:44+00:00,1179491174907879424,"""You cannot buy acceptance, friendship, love or community, but a cookie can open the door and the crumbs can lead the way.”

https://t.co/QxZEjxqCsd"
107,2019-09-29 16:34:03+00:00,1178347216014135297,Thank you @clean_virginia for your endorsement. Virginia needs clean energy and I'm happy to work with you. https://t.co/qWwms02FB9
108,2019-09-26 16:41:09+00:00,1177261837764743168,"If you missed my interview on @CBS6 with @BillFitzCBS6, you can view it here

https://t.co/peZOxQuFE8"
109,2019-09-24 13:21:15+00:00,1176486755220021248,"It's #NationalVoterRegistrationDay! Take 5 min to register or update your registration - VA's election is in 42 days!
 
🔹Register online → https://t.co/6y9H4jFcM6
🔹Register by mail → https://t.co/6mAi5JR33S 
🔹Find your local registration office → https://t.co/0ldQlwtKpL"
110,2019-09-22 21:39:44+00:00,1175887429745741826,"Thank you to The Brooks Family for blessing us with your hospitality and devoting your time today. It was an amazing event. I truly enjoy hearing about the various issues and offering real solutions. Let's press forward so I can be elected November 5th to represent you!
#HD97 https://t.co/LIfdtSnvG4"
111,2019-09-22 16:46:50+00:00,1175813719672180738,"Staying motivated around solving critical issues this election cycle with @JCole4VA 
#HD97 #kevinforvirginia #HD28 #jcole4va https://t.co/jIagEhn4Ow"
112,2019-09-21 23:58:13+00:00,1175559889877393409,While out canvassing today tough conversations were had and relationships were built. I think we all realize a lot is at stake this election. NOV. 5th will let us know what will happen to our Commonwealth! #kevinforvirginia #VotingRights https://t.co/9p63cN2FED
113,2019-09-20 13:42:28+00:00,1175042545937715200,"Absentee Voting starts today!
#HD97 #kevinforvirginia #FlipItBlue https://t.co/vhsCUTsCfA"
114,2019-09-17 14:59:15+00:00,1173974702102110208,"As a veteran, I know the harsh affects of trauma, anxiety, and hazardous working conditions. Let's ensure that our Police officers, Firefighters, and First Responders are well cared for and protected. Show them that they are truly appreciated!

https://t.co/0wYVNfcgGl"
115,2019-09-16 23:39:46+00:00,1173743308335702016,"I’m proud to be a gun safety candidate because it’s time for leaders who will protect us from gun violence. Thank you to @giffordscourage for the endorsement.

https://t.co/1GpDTsQzKO"
116,2019-09-16 01:05:58+00:00,1173402614119174145,I wanted to share my Canvassing schedule with you. I canvass everyday that ends in Y !🏃🏾‍♂️🗳 https://t.co/mnLNi1bc6R
117,2019-09-11 15:14:51+00:00,1171804302081437701,Today we remember those who have fallen. And show our gratitude to the first responders who sacrifice so much! #NeverForget #September11 #911Anniversary https://t.co/xmGSlEQmFj
118,2019-09-08 14:18:59+00:00,1170703080377262084,"Meeting neighbors and learning how we can make Virginia better is always fun. But ending it all at New Kent Snow Shack is the Best!
#HD97 #kevinforvirginia https://t.co/e0Ot8XjlMa"
119,2019-09-06 14:39:11+00:00,1169983389056868354,"We only have 60 days left until Election Day! choose just 1 of those days to volunteer to support our campaign for 1 hour.
#HD97 #kevinforvirginia #vote #FridayMotivation 

https://t.co/Q4Ry5LTQsm"
120,2019-09-06 00:31:26+00:00,1169770042902425600,"Come un-wine with us for a Postcards Happy Hour #CHEERS 🍷! 
#HD97 #KEVINFORVIRGINIA https://t.co/YnzsiXaxI4"
