,Created at,User ID,Text
554,2019-07-28 16:52:21+00:00,1155521383709007872,"Thank you to the Merrick, N. Merrick &amp; Bellmore Fire Departments for swiftly responding to a fire that broke out this morning at the Merrick waste transfer station. The fire is fully extinguished and Levy park has been re-opened to the public. Luckily nobody was injured. https://t.co/xiXu8Q33PU"
555,2019-07-26 15:51:08+00:00,1154781202924146689,Recently a significant amount of seaweed has been washing up on beaches. Factors like increased nutrients in the water are causing greater seaweed blooms.  We are focusing our cleanup efforts to include handpicking the seaweed prior to the weekend and raking in unrestricted areas https://t.co/tSMKWIAg2n
556,2019-07-26 15:32:05+00:00,1154776409493164032,"The corruption scandals and accompanying #CorruptionTax that residents are forced to pay never seems to end. I am fighting the corruption tax that has plagued the Town of Hempstead for decades.  
https://t.co/QMcIqqgFQO"
557,2019-07-22 16:57:39+00:00,1153348393135149056,"This morning I joined @NassauExecutive @NassauCountyPD &amp; boating safety advocate Gina Lieneck, whose 12 yo daughter was lost in an accident, to stress the importance of proper boater education. 12 mph is the speed limit in the Town’s waterways &amp; it’s 5 mph in “no wake zones.” https://t.co/m2lQllzcVq"
558,2019-07-21 15:16:11+00:00,1152960467595354112,"If you're in the area, stop by the St. Agnes Parish Center in #RockvilleCentre for the @NYBloodCenter's Blood Drive, being held today until 2 p.m. https://t.co/SZJjmVFdtT"
559,2019-07-21 14:12:00+00:00,1152944316144324608,"Had an amazing time at the The Mary Ruchalski Foundation's 2nd Annual Mary's Cup event!

This swim meet fundraiser raises awareness for pediatric cancer and helps patients and families affected by the disease. 

For more info, visit https://t.co/IAjXiZhImg. https://t.co/MymLiJfmfO"
560,2019-07-20 18:12:39+00:00,1152642491969146880,#CampAnchor remains the most happy &amp; special place in the Town of Hempstead! Thank you to the @nassaucountypba for sponsoring another successful carnival for hundreds of our campers! https://t.co/kli6PC57G9
561,2019-07-20 14:24:36+00:00,1152585099931770880,"Today we celebrate the 50th anniversary of one of humanity's greatest achievements.

The legacy of the men and women of #NASA who helped make this astonishing endeavor a reality and fulfilled President Kennedy's vision will never be forgotten. #Apollo50th https://t.co/vSER29475U"
562,2019-07-19 22:41:39+00:00,1152347797196333056,Please take extra precautions this weekend and remember to stay hydrated! https://t.co/ueR7SZ9AGz
563,2019-07-19 17:04:22+00:00,1152262920069427200,"Proud to welcome the new kids on the block in Merrick today: Bayou Jones Southern Kitchen &amp; Bar and Alexander Madison Realty, both on Merrick Ave! w/ @SylviaCabana #SmallBiz https://t.co/OcK5hvqoB3"
564,2019-07-19 12:13:05+00:00,1152189613395599362,"Thank you to ⁦@News12LI⁩ ⁦@erincolton⁩ for coming out to Newbridge Rd Park to highlight our amazing ⁦@HempsteadTown⁩ lifeguards, pools and beaches! All of our 23 pools and 9 beaches will be open this weekend to help our residents stay cool and beat the heat! https://t.co/e1BSX6MKzO"
565,2019-07-18 20:01:48+00:00,1151945182797029376,"Beginning tomorrow all Hempstead Town beaches will remain open an extra hour, until 7PM, in order to help residents beat the heat. Beaches will remain open an extra hour through Sunday, July 21st. For more info about the Town's beaches &amp; pools please visit https://t.co/OC2pASblOd"
566,2019-07-18 14:31:06+00:00,1151861961887551489,"Out of an abundance of caution I am closing Hempstead Town offices at 200 N. Franklin St. until Monday so that a second exterminator, with a bed-bug sniffing dog, can be brought in to ensure that bed bugs have been completely eradicated. Employees will be temporarily relocated."
567,2019-07-17 21:36:54+00:00,1151606728460505088,Congratulations to our 2019 @HempsteadTown rookie ocean guards for successfully completing weeks of grueling and physically demanding training! Our lifeguarding program is the only program in nation to receive 4 national awards from the @uslifesaving Assoc. #Lifeguards https://t.co/jPOsjc15Px
568,2019-07-16 22:57:06+00:00,1151264524227555329,"I was elected to speak out against these kinds of backroom deals that don't have taxpayers at heart. The vendor even admitted the contract included an error, and that the taxpayers are due more $$$! That's why every contract should be public and voted on! 
https://t.co/PAkbFqMPFO"
569,2019-07-16 00:19:14+00:00,1150922804193349634,"The elimination of the SALT deduction is a slap in the face and a punch in the gut that will have devastating impacts on the local housing market &amp; our local economy. I am proud to be part of the bipartisan push to restore this critical tax deduction!
https://t.co/4cxrfmsNVr"
570,2019-07-15 16:55:24+00:00,1150811111261921283,Proud to stand w/ @SenSchumer &amp; fellow town supervisors @JudiBosworth @JosephSaladino9 to support a new plan to restore SALT deductions for LI homeowners. We already give far more to Washington than we get back. Protecting the middle is a must &amp; paying more is not an option! https://t.co/ELJAYKjhaY
571,2019-07-14 18:02:03+00:00,1150465497084944385,Thank you to @VillageRVC Mayor Murray and the Village Trustees for hosting a beautiful fireworks celebration last night at Mill River Park in celebration of the founding of the village. This year marks the 126th anniversary of @RVCLongIsland ! https://t.co/VCJKpOdo4Z
572,2019-07-14 00:24:30+00:00,1150199354625613825,Congratulations to the #CampANCHOR Parents Fund on having their most successful ball yet! The Town of Hempstead is grateful to all the honorees for all of your support of ANCHOR programs! Also has a wonderful time at our ANCHOR lifeguard reunion to toast our own Sally Schutta! https://t.co/9ee8MIJsEP
573,2019-07-13 00:04:30+00:00,1149831933838483459,"This is just another outrageous example of the #CorruptionTax residents are forced to pay when backroom deals transpire in the dark. Over $70K in taxpayer money to operate 1 toll booth for 1 summer is a joke! #StayTuned

https://t.co/pwPFKAHAy9"
574,2019-07-11 22:54:03+00:00,1149451817379651584,"Thanks to NY Attorney General @TishJames for helping @HempsteadTown fight the proliferation of zombie homes. I am committed to properly maintaining these vacant, unsafe properties &amp; bringing them back to life so that they won't drag down property values!
https://t.co/Bfu0rH0dJ0"
575,2019-07-10 21:30:17+00:00,1149068350162636800,"Happy to announce a new member of our Hempstead Town family! Congratulations to @SteveSmirti from my staff, along with his wife Carrie, on the birth of their son today! https://t.co/43w9oORSz6"
576,2019-07-09 19:27:44+00:00,1148675118425673728,"Congratulations Crystal and the rest of the @USWNT on winning the #FIFAWWC !!!

#HempsteadTown is so proud of you! Hope you bring that trophy back home to #RVC! https://t.co/8WBWLfuW2q"
577,2019-07-09 14:40:38+00:00,1148602868477366272,"Our Child Car Seat Inspection Program will be at Shell Creek Park in #IslandPark, tomorrow, July 10 and Saturday July 13 from 9 a.m. to 2 p.m.

Checks are by appointment only so call 516-538-1900 ext 7709 or visit https://t.co/2Gy7ZiOO0z to schedule. https://t.co/FcTnD13n4f"
578,2019-07-08 19:44:22+00:00,1148316916731326467,"The location of the new Belmont station is great news 
for so many Hempstead Town residents that are currently undeserved by the LIRR! It will also help alleviate traffic and increase economic opportunities for all! https://t.co/hroGugTaqk"
579,2019-07-07 16:59:05+00:00,1147912933755752450,.@USWNT ARE CHAMPS!!!!! #OneNationOneTeam #FIFAWWC https://t.co/XCnORavHXj
580,2019-07-05 15:38:04+00:00,1147167770389491712,"This little #pittie is looking for his #foreverhome.

Taking home Johnny, or any of our pets at the #TOHAS is easier than ever now that we've waived adoption fees during our #SummerofLove event.

Enjoy summer with this pup by your side! Visit https://t.co/eUmPUXovac for info! https://t.co/36h5FgusDx"
581,2019-07-04 11:59:47+00:00,1146750448440922112,"Happy Birthday America🇺🇸!

Wishing everyone in #HempsteadTown and across the country a very happy, healthy and safe 4th of July! https://t.co/EKKWwTyyVd"
582,2019-07-03 22:01:20+00:00,1146539446935965696,"I fought hard for these changes and I'm thrilled that the tougher guidelines to our ethics code unanimously passed.

We must protect the interests of the taxpayers first and with these stricter amendments, we're doing just that. https://t.co/Mmtu5LXg15"
583,2019-07-03 17:51:21+00:00,1146476535328718848,"Today we say goodbye to a true American / Hempstead Town hero, Luis Alvarez. His advocacy for 9/11 first responders who deserve better from their government will never be forgotten. #LuisAlvarez https://t.co/LjwTRHfay0"
584,2019-07-03 17:31:00+00:00,1146471415971033088,"Clean, safe drinking water is a human right. That right however comes with a price tag. Those who pollute our water should be the ones responsible for the costs of cleaning it up. That's why I've authorized the Town to start going after the bad actors. https://t.co/M4wGqcoXiB"
585,2019-07-02 23:49:24+00:00,1146204256707534848,"Another shameless act by the Town Council and one that should give every victim of the #HempsteadTown Buildings Department pause.

Sandy victims, small businesses owners, and all of our residents deserve a fully functioning department. https://t.co/LFhMhrgqrA"
586,2019-07-02 21:01:57+00:00,1146162113263652864,HUGE WIN!!!! Congrats Crystal Dunn and the rest of the @USWNT team! #HempsteadTown is behind you! #OneNationOneTeam #FIFAWWC https://t.co/Bt2m9isYgy
587,2019-07-02 14:19:46+00:00,1146060900899553282,"The history of our country has deep ties to Long Island and #HempsteadTown.

In what is now #TanglewoodPreserve, on June 22, 1776, the first blood spilled on Long Island was in response to a failed assassination attempt on General George Washington. https://t.co/0RcvqQhJOq"
588,2019-07-02 00:09:17+00:00,1145846869458903040,"Our residents have bore the brunt of the inefficiencies and mismanagement of the Building Department for too long.

It has to end. https://t.co/9FP32wxWli"
589,2019-07-01 22:03:52+00:00,1145815307480682496,"My office has put forward a contract for an outside firm to conduct an independent operational audit &amp; assessment of our Building Department. I am committed to transparency &amp; accountability, which is why reforming this department is an absolute priority.
https://t.co/8QwZn0VCm2"
590,2019-07-01 20:57:37+00:00,1145798637261340675,Seven years!  #isles #YesYesYes👆👆👆 https://t.co/ynCRfixcsD
591,2019-07-01 19:45:01+00:00,1145780366919254017,"We're bringing our child car seat inspection program to Speno Memorial Park in #EastMeadow, July 2 &amp; 3 from 9 am to 2 pm.

Our certified technicians will be checking car seats to ensure that they meet the necessary standards. 

Call 516-538-1900 ext 7709 to make an appointment. https://t.co/GUh4vnBsua"
592,2019-07-01 18:18:37+00:00,1145758623592845312,"Thank you to @NYSDHSES for bringing the Citizens Preparedness Training Program to Town Hall yesterday. Our residents were trained on how to properly prepare for any disaster. To sign up for the next event near you, please visit: https://t.co/3owd8x2RhW https://t.co/ZJi0WpXLvS"
593,2019-07-01 13:30:44+00:00,1145686173240758272,"We partnered with the @NYSDHSES to bring the Citizens Preparedness Training Program to #HempsteadTown Hall yesterday.

Residents were trained on how to properly prepare for any disaster and how to develop a family emergency plan, including stocking up on emergency supplies. https://t.co/VGQtcA2jmT"
594,2019-06-30 12:38:54+00:00,1145310743627206656,"Such a wonderful time at our Veterans Salute event last night in #PointLookout!

Congratulations to all the honorees and thank you for your service to our country! You're all exceptional people &amp; we're grateful for all that you've done to protect &amp; ensure our freedom.

Thank you! https://t.co/NKpAQOzoCv"
595,2019-06-30 02:45:12+00:00,1145161333610078208,Incredible night at @HempsteadTown's Salute to Veterans Event in @PointLookoutNY! Truly an honor to recognize the service of so many outstanding service members on the heels of #IndependenceDay2019 https://t.co/QJg3l8MM3B
596,2019-06-29 22:09:18+00:00,1145091901198098433,"As of right now, the town will proceed with tonight’s concert series and fireworks show as soon as this storm passes.

Sorry for the inconvenience, but please stay tuned."
597,2019-06-29 17:48:17+00:00,1145026213527851010,Please join us tonight at 7:30 p.m. at Town Park at #PointLookout for our Veterans Salute featuring a fireworks display and a performance by @That70sBandLive! https://t.co/bEnOrVc2p3
598,2019-06-29 14:41:48+00:00,1144979281937883137,"Heartbroken hearing of the passing of 9/11 first responder Luis Alvarez.

His fight for justice and his heroism in the face of tragedy will never be forgotten. https://t.co/COkglqv1XM"
599,2019-06-29 12:29:36+00:00,1144946013670653952,"Happy to join w/ #HempsteadTown Clerk @SylviaCabana , my Town Board colleagues and Stew &amp; Kim Leonard of @StewLeonards to speak about the importance of pool safety.

It's important to be aware of what's happening in the pool &amp; make sure your child is safe. https://t.co/V8vtzP1hKC"
600,2019-06-28 22:08:53+00:00,1144729406633627649,"Thank you to our town lifeguards &amp; @stewietheduck water safety foundation for helping us promote pool safety! All town pools &amp; beaches will be open this weekend for residents to cool off, but please remember to keep an eye on your small children whenever they are in the water. https://t.co/l0PzCnU8ZV"
601,2019-06-28 19:19:09+00:00,1144686693741748224,A picture perfect day as we honor and celebrate #HempsteadTown's diverse and vibrant Caribbean community today at Town Hall! #CaribbeanAmericanHeritageMonth https://t.co/HdSC6LBgXi
602,2019-06-28 15:23:32+00:00,1144627396253028352,"Today marks the 50th anniversary of the #Stonewall uprising, the unofficial beginning of the gay rights movement. 

We've made much progress both in #HempsteadTown and throughout the country but there's more work to do &amp; more minds to change. #Stonewall50 https://t.co/ttIgVH3BA6"
603,2019-06-27 22:46:05+00:00,1144376381201145857,"Good luck to new #Baldwin Summer Program Director Teddy Rohrs!

You have some big shoes to fill, but I know you're up to the task!

The camp has an open registration cycle so if you're interested in signing up, call 516-865-0482. https://t.co/TKaMXzLXQI"
604,2019-06-27 17:02:19+00:00,1144289870220877825,"REMINDER that this Saturday we'll be honoring our military members at #HempsteadTown's Veterans Salute at Town Park, #PointLookout at 7:30 p.m.

Come down and show your support for our men and women in uniform and enjoy a fireworks display and a performance by @That70sBandLive! https://t.co/S281NeBgs9"
605,2019-06-27 15:14:43+00:00,1144262791253110786,"Read this story and smile.

“I realized that she was going to be my wife,” Phillip Falzone said. “I just felt it.”

Congratulations to these three #HempsteadTown residents on celebrating a cumulative 190 years of marriage! #Loveisallyouneed https://t.co/nYGm2KktY0"
606,2019-06-27 13:26:35+00:00,1144235580194267136,"The cost of cleaning up our water supply should be footed by the polluters.

They have been able to evade paying for their mistakes and that ends when this bill becomes law. https://t.co/b32W8B9Mrs"
607,2019-06-26 23:00:03+00:00,1144017507268870146,"A beautiful day for the beginning of our Senior Enrichment program in #LidoBeach!

So happy to see so many of our residents down at the beach, soaking up some sun and enjoying the warm weather! https://t.co/HYQ7xMNVj3"
608,2019-06-26 21:03:55+00:00,1143988280997928961,"By closing this loophole, we'll be able to recoup the costs of cleaning our drinking water &amp; place the tab at the foot of polluters.

Happy to join w/ Adrienne Esposito of 
@citizensenviro to support this bill and hold chemical manufacturers accountable. https://t.co/U7CzADSNhL"
609,2019-06-26 19:36:17+00:00,1143966229641777152,Please join us this Friday at noon at #HempsteadTown Hall as we celebrate National Caribbean American Heritage Month! https://t.co/CBEY74WTBX
610,2019-06-26 16:23:34+00:00,1143917731307229185,"Stood w/ Adrienne Esposito of @citizensenviro to support a bill clarifying the statute of limitations on contaminants, allowing Towns to recoup the costs of cleaning the drinking water.

This loophole has allowed polluters to evade consequences for their actions and it must end. https://t.co/GAZf7Svujb"
611,2019-06-25 20:20:57+00:00,1143615081177071616,"Congratulations to #Elmont High School student Ekele Ukegbu on being named Best Actress at the @JimmyAwards!!!

Can't wait to see you under the bright lights of #Broadway! https://t.co/tjF7tUrgLf"
612,2019-06-25 18:28:36+00:00,1143586809051529216,"The #Meadowbrook southbound road closure between #Merrick Road and #LoopParkway originally scheduled to begin tonight, has been pushed to TOMORROW due to weather concerns. https://t.co/IpQjkncSYf"
613,2019-06-25 15:51:30+00:00,1143547272736759808,"We've partnered with #BeachComfort🏖️ of #LongBeach to provide beachgoers with chair and umbrella rentals.

Staff will set up &amp; retrieve the items when you leave.

Lugging these items down the beach can be cumbersome. Now residents can avoid that scenario. https://t.co/4bXfHhJZKG"
614,2019-06-25 13:49:34+00:00,1143516588257267712,"Happy to be at the renaming ceremony for the #NassauCounty Office of Hispanic Affairs.

Formerly known as C.A.S.A., this agency serves as a liaison between Hispanic communities and local govt. It provides resources and programs to help assist people acclimate to life in Nassau. https://t.co/YVsfyzrEEP"
615,2019-06-24 13:32:02+00:00,1143149787430248448,"Good luck to #RVC's @crysdunn_19 and the @USWNT as they take on #Spain in the #FIFAWWC knockout round today!

We got your back! #OneNationOneTeam https://t.co/huCzuqtlqD"
616,2019-06-23 17:50:30+00:00,1142852444516491265,".@LIPride Parade is such an incredible event and I’m so happy to see it growing every year!

A beautiful day filled with laughter and love! Thank you to everyone who came and celebrated with us! #loveislove #pridemonth https://t.co/4nvinegHHR"
617,2019-06-23 15:50:50+00:00,1142822330936303616,An absolutely gorgeous day for the @LIPride Parade in #LongBeach! https://t.co/GG49wfXsTZ
618,2019-06-21 18:16:54+00:00,1142134310666952705,"The water in the Lido Beach – Point Lookout Water District is safe for all uses including drinking, cooking and bathing.  

If you have any questions, please do not hesitate to contact the Town of Hempstead Department of Water 24 hours a day at 516-794-8181."
619,2019-06-21 18:10:16+00:00,1142132641992458240,Please be advised that the water notification issued earlier by the City of Long Beach DOES NOT affect residents served by the Lido Beach – Point Lookout Water District. It is only for residents consuming water in the City of Long Beach.
620,2019-06-20 20:45:02+00:00,1141809201863376896,"I was honored to be joined by Town Clerk @SylviaCabana to present #RosemaryKennedy School student John Oyadiran with the #HempsteadTown Academic Excellence Award.

John is known throughout the school for his hard work and gregarious personality. Congrats on all you've achieved! https://t.co/PWwy2OaL3R"
621,2019-06-20 19:12:45+00:00,1141785978211840002,"#FYI - New traffic patterns for motorists who use #NassauExpressway beginning this Saturday. 

This will affect traffic in both directions 👇👇👇 https://t.co/GzLXAfsDm2"
622,2019-06-20 16:03:32+00:00,1141738363508219904,"Forty-four years ago today, the Mayor of Amity Island made the fatal mistake of putting tourism ahead of public safety. 

We can all learn from his mistake...when a huge shark appears in your waters, YOU CLOSE THE BEACH! #Jaws #needabiggerboat https://t.co/iMj8ZKIWuO"
623,2019-06-20 15:52:34+00:00,1141735601194110976,"Next Saturday, June 29th, we'll be honoring our military members at #HempsteadTown's Veterans Salute at Town Park, #PointLookout at 7:30 p.m.

Come down and show your support for our men and women in uniform and enjoy a fireworks display and a performance by @That70sBandLive! https://t.co/Smf0bUngB6"
624,2019-06-20 14:18:41+00:00,1141711973538811904,"Joined w/ #HempsteadTown Clerk @SylviaCabana to honor @TRCBSA scouts on achieving their #EagleScout Award!

Since the inception of the award in 1912, only 2% of scouts have earned this honor.

Congrats and thanks for your service &amp; commitment to making Hempstead Town better! https://t.co/SFdCh1V4tO"
625,2019-06-19 21:38:37+00:00,1141460298144145418,"Happy to see that the State Senate passed this bill allowing e-scooters to operate in New York. 

Last month, Councilwoman @ErinKingSweeney and I sent a letter to Sen. @jessicaramos and Assemblywoman @nily Rozic, pledging our support for the bill's passage in both chambers. https://t.co/kgeSL0NQHu"
626,2019-06-19 20:45:07+00:00,1141446834818359297,"We've partnered with @NYSDHSES to bring an emergency preparedness program to #HempsteadTown Hall on June 30 at 11 a.m.

Disaster can strike at any time so it's vital that residents have the info to help them get through an emergency.

Visit https://t.co/1Cg1QZNC8x to register! https://t.co/GfatASop78"
627,2019-06-19 19:13:26+00:00,1141423762694377472,Thank you to the @NassauCountyBar for hosting today’s panel on the toxic crisis that emerging contaminants in our drinking water pose on Long Island municipalities and property owners. We are not sitting idly by while we wait for a response from the federal @EPA #cleanwater https://t.co/KKXHcBe6Aq
628,2019-06-19 17:13:29+00:00,1141393576686956545,"Thanks to the efforts of @LGBTNetworkNY , @LIPride  has grown into a major event, attracting thousands of ppl from across the country &amp; solidifying Long Island as a diverse &amp; inclusive community where everyone can feel safe.

This year will be no different https://t.co/Ripsb8GnAo"
629,2019-06-19 13:26:01+00:00,1141336332695932928,"#OTD in 1865, slaves in Texas were finally told of their freedom by Union Troops, two years after President Lincoln issued the Emancipation Proclamation.

In commemoration of #Juneteenth, Sr. Councilwoman @dorothylgoosby is hosting a celebration at Town Hall this Sat. at 1 p.m. https://t.co/xUUz8wc3Df"
630,2019-06-18 22:00:01+00:00,1141103296263917570,"Glad to join with my local officials to call on the @EPA to set stricter standards on water quality on Long Island.

Our residents have the expectation that when they turn on their tap water, it’ll be clean and safe to drink. https://t.co/B7lHSzwH6b"
631,2019-06-18 20:16:38+00:00,1141077279147220994,"Happy to celebrate #PrideMonth in #HempsteadTown by raising the #LGBT Flag and singing #YMCA along side @VPCOWBOY1 of the @WeVillagePeople !

Proud of the tradition we’ve started last year and I’m so excited for the incredible lineup for @LIPride in #LongBeach this weekend! https://t.co/Mzzz9jemMZ"
632,2019-06-18 16:34:43+00:00,1141021434472554496,Calling on the @EPA with a bipartisan group of lawmakers in @HempsteadTown to set regulatory requirements for the emerging contaminants present in our drinking water w/ @RepKathleenRice @RepPeteKing @Tom_Suozzi @RepLeeZeldin @NassauExecutive @SuffolkWater @NYPIRG @citizensenviro https://t.co/BV06dCoG4F
633,2019-06-18 15:09:49+00:00,1141000066506940417,"Humbled by the generosity of the #Merrick Chamber of Commerce for awarding these six deserving students with $1,000 scholarships.

These students are truly exceptional and I can't wait to see what they'll accomplish in their college careers! https://t.co/coWYfiIIyL"
634,2019-06-18 13:01:13+00:00,1140967704905572354,"Thrilled to help honor so many incredibly talented and brilliant women at the #NassauCounty Women's Bar Association's Installation Dinner.

Congratulations to honorees, Susanna Laruccia, Assistant D.A. Tammy Smiley, @NassauDA @madelinesingas and Judge Angela Iannacci! https://t.co/IU4d9bwLtm"
635,2019-06-18 01:12:35+00:00,1140789368858251265,We need to end the #HempsteadTown corruption tax and stop with the excuses. https://t.co/jqjMF1FBE0
636,2019-06-17 16:57:25+00:00,1140664756702994437,Please join us to celebrate #PrideMonth as we raise the #LGBT flag with @LGBTNetworkNY President David Kilmnick and gay rights advocate and musician @VPCOWBOY1 of the @WeVillagePeople tomorrow at 1 p.m. at #HempsteadTown Hall! https://t.co/DAi36Pd24r
637,2019-06-16 20:04:45+00:00,1140349514336931841,"Happy Father's Day to this guy for being an incredible father to our four kids.

Thank you for always taking care of us, always being there and always having a smile on your face. #HappyFathersday https://t.co/nctUq0Idnq"
638,2019-06-16 14:32:15+00:00,1140265839691739137,"Happy Father's Day to all the dads out there who do so much their families!

And thank you to my dad for teaching me, supporting me and loving me unconditionally. #HappyFathersDay"
639,2019-06-16 12:15:42+00:00,1140231473406140416,"For the past 90 years, the 'Pink Lady' has been an iconic landmark in the #LidoBeach community.

I'm so happy to see that after being severely damaged during #HurricaneSandy, Lido Beach Towers is restored, revitalized and ready to serve #HempsteadTown for another 90 years! https://t.co/0pIshU98mj"
640,2019-06-16 01:00:05+00:00,1140061449957646336,"Absolutely nothing better than watching my guy play in the #LittleLeague Championship under the lights in #RVC!  

Go O!!! https://t.co/w0obOWdctn"
