,Created at,User ID,Text
0,2022-10-10 15:07:18+00:00,1579488749947604993,"Today we honor the rich culture, history and traditions of the Italian American community, like my grandfather Augustus, who sailed to America from a small town in Calabria 🇮🇹 Happy #ColumbusDay!"
1,2022-10-08 22:24:52+00:00,1578874091704299521,"Why is this the most important election of our lifetime?

Because everyone knows overturning #RoeVWade was just the start.

If extremists like my opponent take control, next up is a National Abortion Ban &amp; End to Birth Control 

Make sure you're #voteready https://t.co/vjjcXP8KuR https://t.co/XVAwW1njTd"
2,2022-10-08 17:30:38+00:00,1578800047227273217,"Our campaign is powered by the middle class &amp; the unions that fight to preserve dignity &amp; respect for all working Americans. Thank you to @1199SEIU @CarpentersNyc @nysut for hitting the streets today in #NY04! #UnionStrong 💪 sign up to volunteer 👇🏻 
https://t.co/0PWYtuUwIG https://t.co/jTUNLyO7Pb"
3,2022-10-07 21:00:55+00:00,1578490579176296448,"Proud to have the support of @USJewishDems in #NY04! Together, we stand for democracy and against all forms of extremism. https://t.co/sKmBlpaC4L"
4,2022-10-07 19:24:40+00:00,1578466356436951040,"Say it with me, we need 👏🏻 common 👏🏻 sense 👏🏻gun 👏🏻safety 👏🏻laws. I will vote to ban carrying weapons in public places where our children play, and outlaw the military style assault weapons that are used to slaughter innocent lives in mass shootings. My opponent won't. #NY04 https://t.co/vjdlparpfx"
5,2022-10-07 14:55:30+00:00,1578398620159713280,"Join us this Saturday as we get out and talk to voters about the most consequential election of our lifetime! We need all hands on deck to get the word out and let folks know how important it is to #voteblue this year! #NY04

https://t.co/P06xHF2I9U"
6,2022-10-05 21:34:04+00:00,1577774144053284865,I’ve always been an independent voice &amp; strong advocate for keeping our community safe. Yet my opponent continues to lie about my stance on the State’s cashless bail law. So here’s the record from the 2019 @lwvofnassaucoun forum. (The same one my opponent just chickened out of 🐥 https://t.co/a9BIt464CH
7,2022-10-04 21:20:26+00:00,1577408325746102277,"Wishing all those celebrating Yom Kippur an easy and meaningful fast! 

G’mar Chatima Tova. https://t.co/eSILYUPV8I"
8,2022-10-04 15:15:22+00:00,1577316452633395200,"Thank you to @HRC for endorsing our campaign in #NY04! As radical politicians like my opponent double down on attacking abortion access, voting rights, and LGBTQ+ rights, the stakes in this election have never been higher! #VoteBlueToSaveAmerica https://t.co/5YmjiV9Ein"
9,2022-10-03 22:34:33+00:00,1577064592165175296,"Endorsement Alert! I am proud to have the support of the @USJewishDems - an organization committed to fairness, integrity, the Jewish value of Tikkun Olam, and a strong relationship with our ally, Israel. 🇺🇸🇮🇱 https://t.co/kD8j2mBCHH"
10,2022-10-03 19:28:51+00:00,1577017859288760320,Thank you to @nysut for your support in #NY04! Quality public schools are the foundation of our communities and a vital component of our economic future! https://t.co/Vg7gKqk6Jm
11,2022-10-02 18:16:28+00:00,1576637252569964545,"Today marks 100 days since #RoeVsWade was overturned. Not only do millions of women no Ionger have access to basic medical care when their lives are at risk, the @GOP has since doubled down &amp; placed a national abortion ban on the table, which includes NY. 
https://t.co/64QCpsy0Nf"
12,2022-10-02 16:18:50+00:00,1576607649746931713,I’m proud to be a #UnionStrong 💪 candidate and have the support of those fighting to preserve the middle class here on Long Island. That’s why I cut taxes and my opponent raised them! https://t.co/JSxuVjQ6Ut
13,2022-10-01 22:33:00+00:00,1576339424283357184,"Thank you to @MomsDemand for braving the weather during this #WeekEndofAction. Unlike our opponent, I’m proud to be a #GunSenseCandidate fighting for real reforms that will make our children and families safer. https://t.co/mPUSfPKNOb"
14,2022-10-01 15:54:56+00:00,1576239249938345984,5 years today 60 people were killed and hundreds more injured in the worst mass shooting in modern U.S.  history. I am honoring the victims of #LasVegas with action that includes common sense reforms opposed by the gun lobby and my opponent to help bring an end to these slayings.
15,2022-09-30 22:21:12+00:00,1575974065499942912,"How do we know Republicans will pass a national abortion ban without exceptions for rape, incest and a mother’s life if they take control of Congress? Because they have literally been telling us that. That’s why I’m proud to receive the support of Planned Parenthood @PPact! #NY04 https://t.co/ExTNDhbcRq"
16,2022-09-30 20:33:11+00:00,1575946883591458817,"My opponent's lies are motivating his fellow extremists to call for people to show up at my house. While political campaign rhetoric is expected, his lies are now endangering my family. This type of behavior must be condemned. #NY04 https://t.co/rKlq3FUyDt"
17,2022-09-30 19:09:45+00:00,1575925885307437056,"🚨Endorsement Alert! While my opponent is fear mongering, we're actually proposing common sense gun legislation that will help keep illegal guns &amp; the military style assault weapons used in school shootings out of criminals' hands. Thank you to @GiffordsCourage for your support! https://t.co/FlygM6Toyk"
18,2022-09-30 03:31:24+00:00,1575689745077633025,"This is so heartbreaking. My thoughts are with Lt. Russo-Elling's daughter, grandchildren and parents during this difficult and tragic time. https://t.co/N1kaO1XkWc"
19,2022-09-29 21:01:47+00:00,1575591693704785921,"4/ I certainly would never, and do not encourage anyone to harass or threaten my opponent. I am grateful for the cooperation I have experienced from law enforcement in addressing this, and thank them for their continued partnership in ensuring we are all safe in our own homes."
20,2022-09-29 21:01:47+00:00,1575591692212006912,"3/ Yet, my opponent's knowingly false statements have now incentivized his extremist followers to call for people to show up at my house, distribute my home address online, and endanger my family. This type of behavior must be condemned on any side of the political aisle."
21,2022-09-29 21:01:46+00:00,1575591690248650754,"2/ I have always supported funding law enforcement, and spoke on the record against the cashless bail law."
22,2022-09-29 21:01:46+00:00,1575591688503861248,"Political rhetoric in campaigns is expected but my opponent's smear campaign has taken a very dark turn. Anthony D'Esposito's baseless lies about me have put the safety of my home, and my children in jeopardy."
23,2022-09-28 23:26:42+00:00,1575265773890801667,Hoping everyone down in Florida stays safe from #IanHurricane. https://t.co/aeJCoZrAHa
24,2022-09-28 21:20:01+00:00,1575233894403944449,"Today would be a good day for my opponent to condemn any one of the rioters who attacked and injured approximately 150 local law enforcement officers during the #January6thInsurrection. But he won't, because his party believes this violence was ""legitimate political discourse."" https://t.co/WOxchEOYNF"
25,2022-09-28 15:03:45+00:00,1575139203947663361,"Let's talk crime. Nassau County was named the safest community in America by @usnews the last 3 years in a row under Democratic leadership. Meanwhile, the top 10 highest murder rates per capita are in southern @GOP controlled states. 
https://t.co/f3W6kP7oXG"
26,2022-09-27 18:20:13+00:00,1574826258021715978,"Why is my opponent lying about my record? When ""Defund"" was a topic, not only was I against it, I was delivering critical PPE to the police! Why hasn't he ever condemned the #January6thInsurrection that resulted in 5 police officer deaths? You can't be pro-police &amp; pro-criminal! https://t.co/PlKOt4452d"
27,2022-09-26 20:29:33+00:00,1574496416554172416,"We put up with a lot in campaigns, but I'm not going to allow the GOP to get away with pretending to be the party of law enforcement when they can't even condemn the #January6thInsurrection where law enforcement had to fight for their lives. I support law enforcement, does @GOP? https://t.co/GGeaJckpej"
28,2022-09-26 17:41:56+00:00,1574454237915930624,I'm proud to have the support of the @LCVoters as our #NY04 campaign continues to bring together communities to address the climate crisis and invest in climate resiliency projects that will protect our homes against more intense storms and increased flooding. https://t.co/Stgw5ASDo1
29,2022-09-25 15:57:43+00:00,1574065621205192710,L’Shanah Tovah! Wishing my friends and neighbors a happy and sweet New Year on this #RoshHashanah. https://t.co/9mTYJXHsG0
30,2022-09-24 23:43:49+00:00,1573820530951655425,"Thank you to everyone who came out today for your support! Together, we are going to win in November and keep #NY04 blue! #VoteBlue2022 https://t.co/3CoImAzq1T"
31,2022-09-24 19:20:06+00:00,1573754164454342657,"Gun violence is a scourge in our country. Any parent with a child in school knows the fear. In Congress, I will ensure the mentally ill cannot get their hands on firearms and instead have access to medication and the treatment they need. @MomsDemand 
#NY04 #GunSenseCandidate https://t.co/Pl7bQRXCzg"
32,2022-09-23 20:00:16+00:00,1573401886279041031,Excited to announce our campaign office opening tomorrow! Please stop  by &amp; help our team get the word out to voters. We can't afford to move backwards w/ the extreme &amp; dangerous @GOP agenda to pass a national abortion ban which jeopardizes women's healthcare &amp; safety. #NY04 https://t.co/1S6ZLuhYRm
33,2022-09-22 20:59:27+00:00,1573054390998556672,"It’s worth asking why only 9 @GOP House members (all retiring) out of 203 voted for the Presidential Election Reforms Act. The bill makes clear for election deniers (like my opponent who refuses to take a stance) that presidents cannot overturn elections. 
https://t.co/HNxtMWxB5f"
34,2022-09-22 14:24:55+00:00,1572955102117347328,"The stakes in this election couldn't be more clear. 

Republicans want to pass a national abortion ban. 

Democrats want to codify Roe.

I'm proud to have the support of @NARAL because the government should not be dictating to women, or anyone, what to do with their bodies. https://t.co/escTIIu3Cs"
35,2022-09-21 18:50:48+00:00,1572659629632663553,"I believe advancing the cause of peace and backing Israel are one in the same. And I commend Democrats, like @RitchieTorres, who stand up to colleagues in their own party. #Israel #NY04 https://t.co/6b8FwRkZtr"
36,2022-09-20 20:21:57+00:00,1572320178536587264,Thank you to @HempsteadVill Mayor @WHobbsmayor for your support! I look forward to working hand in hand with New York State’s largest village in Congress! #NY04 #VoteBlue https://t.co/2LsB8jiERj
37,2022-09-19 22:20:48+00:00,1571987700537851904,I am honored to receive the endorsement of @DMFIPAC in our campaign for #NY04 ! Israel is a beacon of freedom and I am committed to safeguarding and strengthening this important relationship.#Israel #VoteBlue2022 https://t.co/QhHXhT1lBj
38,2022-09-19 20:06:20+00:00,1571953859182104576,"Devastating images coming out of Puerto Rico today as #HurricaneFiona passes through. More than a million people without power and running water. As the world watches the Queen’s funeral today, let’s remember these are Americans who need our support."
39,2022-09-18 15:55:56+00:00,1571528457711935490,Hispanic Heritage is American Heritage. #HispanicHeritageMonth https://t.co/QZjzXivTtn
40,2022-09-17 17:04:58+00:00,1571183442439577605,"Our democracy is on the brink and the consequences of this year’s midterm elections are extraordinarily consequential. If the @GOP takes Congress, there may be no stopping the tide of election deniers in our country. On this #ConstitutionDay, stand for and defend #Democracy. https://t.co/rPN64d9CCd"
41,2022-09-16 17:07:44+00:00,1570821750535098369,"Thank you to Majority Leader @chuckschumer for your support in my race for #NY04! Together, we are going to protect our democracy from extremists, stop a dystopian national abortion ban and continue fighting for the working class! #VoteBlueForSoManyReasons https://t.co/9G19n5jowe"
42,2022-09-14 16:58:55+00:00,1570094755337457667,Unions made the middle class strong by ensuring workers have an important voice in our democracy. Our campaign is built on the working class and I am proud to be fighting everyday for working class people. #NY04 https://t.co/zWySRdwM0P
43,2022-09-14 00:05:46+00:00,1569839787967922176,So how many other extreme @GOP politicians does this remind you of? #VoteBlue2022 https://t.co/rK4q8FBsJF
44,2022-09-13 17:50:49+00:00,1569745427439751168,"Does extreme Republican @ANTHONYDESPO support the @GOP’s radical National Abortion Ban, which makes abortion illegal everywhere - even in NY - &amp; strips away a woman’s right to make our own decisions? His silence is deafening. Keep your hands off of our bodies! #RoeIsOnTheBallot"
45,2022-09-13 02:17:41+00:00,1569510598303678471,Republicans like my opponent do not want abortion to be decided by each state...they want to ban it nationally. And tomorrow they will have their first bill. Let me be clear. Government should have ZERO role in women's  reproductive healthcare decisions. #VoteBlueToSaveAmerica https://t.co/oAF65h5qn1
46,2022-09-12 20:50:06+00:00,1569428158507630600,"""Republican zeal to pass stringent forced-birth laws and their pining for a national abortion ban — as the party’s candidates scramble to erase evidence of their antiabortion views from their campaign websites — reveal just how little they think of women.""https://t.co/IYqE1FTyKe"
47,2022-09-11 17:33:30+00:00,1569016294829162498,"Today we pause to remember the nearly 3,000 lives lost on September 11, 2001. 21 years later, that day still lives so vividly in our minds and in our hearts. Let us honor and never forget the sacrifices of so many who ran into the fire. 🇺🇸#September11th https://t.co/wlWljzCt5g"
48,2022-09-11 14:57:05+00:00,1568976931328081922,Today we take time to remember the tragic events of that day and pray for unity. #September11th https://t.co/TAdk3m3d7k
49,2022-09-10 19:39:07+00:00,1568685521588609026,Every election is a choice and the choice this year couldn’t be clearer. Democracy is on the ballot. Thank you to everyone who came out to volunteer in Rockville Centre today. Our #NY04 campaign is people powered 💪 Sign up to volunteer on our website: https://t.co/QWKFaBCSiH https://t.co/qO3T7Tp8JF
50,2022-09-10 15:29:08+00:00,1568622610162028550,"There are too many cowards in Congress who believe taking care of those affected by 9/11 is a ‘NY issue’ instead of an American issue. That’s shameful. I will fight tooth and nail in Congress to make sure the program remains fully funded. #NeverForget 
https://t.co/OFQYixgpGE"
51,2022-09-08 17:48:39+00:00,1567932943275884552,My heartfelt condolences to the people of Great Britain for losing one of the greatest leaders of our time. Queen Elizabeth will be remembered for her steady leadership &amp; reassuring presence through some of the most tumultuous periods of world history. #HMTheQueen #QueenElizabeth https://t.co/D8ujT8HfpF
52,2022-09-08 14:23:29+00:00,1567881314388381696,"Why am I running for Congress in #NY04? Because freedom &amp; choice are on the ballot this year.

As @GOP extremists attempt to invade our privacy &amp; roll back our freedoms brick by brick, it is up to us to stand up and fight back with our votes! 
https://t.co/Qv2lmsTw5q"
53,2022-09-07 18:51:07+00:00,1567586276278210561,"🚨Endorsement Alert🚨 Thank you @SenGillibrand for your support! I look forward to working with you to protect our children from the scourge of gun violence &amp; protecting women everywhere from a GOP national abortion ban without exceptions for rape, incest &amp; a woman's life. #NY04 https://t.co/hqcnF1ukcr"
54,2022-09-07 14:20:33+00:00,1567518184919498752,"I'm running for Congress because we need real leaders who put people before politics.

I fought to secure an outside natural gas provider that would have locked in prices at historic lows for all of our residents. 

@ANTHONYDESPO &amp; the GOP passed. 

Story: https://t.co/WcMskY4ybf https://t.co/kcnNxynCvv"
55,2022-09-06 23:29:26+00:00,1567293931125088256,"Good luck to @trussliz - Britain’s third female prime minister - on taking the reins today. The UK is not only one of our closest allies, but is an important, leading voice for Ukrainian freedom and independence in the face of brutal Russian military aggression. https://t.co/1tOyHDdafO"
56,2022-09-05 22:26:55+00:00,1566915809863139328,"Today in Long Beach I stopped by “Robbie’s Day,” which increases asthma awareness &amp; promotes healthy lifestyle choices for children. Thank you to the Robert D. Gause Foundation for organizing this important event &amp; for all their hard work addressing asthma one community at a time https://t.co/9nAduMLl3U"
57,2022-09-05 14:18:38+00:00,1566792929317949443,"Did you know the labor movement gave us safer working conditions, the 5 day work-week &amp; the 8 hour work day? This #LaborDay, for the first time in almost 25 years, union elections have increased significantly. Let’s recognize workers across the country!
https://t.co/mEeWeguzUe"
58,2022-09-04 18:05:43+00:00,1566487688328486912,"While speculation continues to unfold around the potential for a nuclear agreement with Iran, it’s important to unequivocally state that any such deal cannot be used to undermine U.S. security interests &amp; those of our allies. https://t.co/niCEEf2qQ8"
59,2022-09-04 16:20:01+00:00,1566461088631328769,Antisemitism and many forms of hate have been on the rise for years. It is in the vital interest of all Americans to unite and recommit ourselves to fighting back against these terrible acts of antisemitism and hatred wherever and whenever it rears its ugly head. https://t.co/rnZ11Va0vh
60,2022-09-02 23:33:57+00:00,1565845516679798784,"From more intense storms to the driest August in 17 years, climate  change is having a devastating affect on Long Island. In Congress, I will prioritize funding for climate resiliency projects that protect our communities, including renewable energy. 

https://t.co/jY3yIeGuyz"
61,2022-09-01 19:08:10+00:00,1565416240121790465,"Thank you to @NASRCC_UBC for pounding the pavement today in #NY04! Our campaign is honored to have your support! Together, we are going to build more than just structures… we are going to re-build the middle class and craft a better future for all! #UnionProud #UnionStrong 💪 https://t.co/d7CnZmcnkY"
62,2022-09-01 14:01:33+00:00,1565339076274049026,"Unions are up on Long Island ⬆️

Unions advance policies that strengthen the middle class 💪

Unions help ordinary citizens participate more &amp; have a greater say in our democracy 🗳

I am proud to support &amp; be supported by America’s workers in #NY04 🇺🇸 

https://t.co/HhrvqLTdWE"
63,2022-09-01 01:17:42+00:00,1565146847693479936,"💪 Pumped after Alaska?

🛑Want to stop EXTREME Republicans like my opponent in #NY04 from passing a national abortion ban without exceptions for rape, incest, or even if a woman's life is in danger?  

Sign up to help our campaign &amp; #SaveOurDemocracy 
https://t.co/3ldy4g8yXR"
64,2022-08-30 19:43:42+00:00,1564700407779266563,"As supervisor I took on corruption &amp; lowered taxes. Today, we received the endorsement of the independent, non-partisan Business Industry Action Fund @BIPAC because they know we will continue delivering fair policies that promote robust job growth &amp; economic opportunities  #NY04 https://t.co/oHKTGJGNNk"
65,2022-08-29 13:37:07+00:00,1564245764049608704,"Our democracy is built on the rule of law, peaceful transition of power &amp; free/fair elections. No one person, not even a former president, is above the law. I care less about Trump and more about protecting the greatest democracy the world has ever seen. 
https://t.co/RUUbD1Aw2a"
66,2022-08-28 16:14:40+00:00,1563923024654602241,"Thank you to @eleanorslegacy @Grace4NY &amp; @AnnaMKaplan for your support, along with all these outstanding candidates who are committed to ensuring the rights &amp; freedoms women have fought so hard for aren’t erased. Proud to carry on the legacy of Eleanor Roosevelt. #VoteBlue #NY04 https://t.co/8u7eFJCy1o"
67,2022-08-27 18:19:20+00:00,1563592014062841858,"Good luck to former @Mets pitcher Steve Dillon as he takes the mound today at @CitiField  What an honor for Steve and the entire Dillon family! Long Island is rooting for you! #MetsOTD #LGM 
https://t.co/3Ps3cgWLSW"
68,2022-08-26 15:06:50+00:00,1563181179934691328,"Today is #WomensEqualityDay in commemoration of 102 years since women secured the right to vote. Nobody gave women this right. They demanded it &amp; fought hard for decades. As far as women have come,#RoeVWade is a reminder that rights can be taken away if we don’t continue to fight"
69,2022-08-25 18:06:27+00:00,1562863992430768128,"1 in 3 women no longer have control over their own bodies, future &amp; healthcare. The Texas abortion ban doesn't even make an exception for rape &amp; incest. Why am I running? Because the @GOP told us they will pass a national abortion ban if they take Congress. And it won't end there https://t.co/f9iF4SG92q"
70,2022-08-24 16:52:13+00:00,1562482925198659585,"Our campaign owes a tremendous amount of gratitude to so many residents helping us put #PeopleOverPolitics, but the hard work has just begun. We cannot afford to take our foot off the pedal. Join our #NY04 campaign today &amp; let’s win in November together! https://t.co/0PWYtuCnuy"
71,2022-08-24 02:29:47+00:00,1562265887792664576,"I’m happy to share that we are victorious in #NY04! Our campaign is now one step closer to ensuring women have access to the care they need, one step closer to tougher laws that crack down on illegal guns &amp; gun violence &amp; one step closer to protecting our democracy!"
72,2022-08-23 18:37:48+00:00,1562147106634321921,"We are burning up the phone lines today in #NY04 to get out the vote, so please help spread the word that every vote counts. Polls will be open until 9 PM tonight. #PrimaryDay https://t.co/6co1CMGx3c"
73,2022-08-23 13:44:48+00:00,1562073372862959618,Spent the morning speaking with commuters in Valley Stream. It’s #PrimaryDay and #NY04 is ready to vote. Have you voted yet? https://t.co/gr9pKcYs1S
74,2022-08-23 12:28:35+00:00,1562054191589253120,"It’s #PrimaryDay! Did you make a plan to vote yet? Polls are open in #NY04 until 9pm tonight, so make sure to make your voice heard! https://t.co/cDRVHkeK3M"
75,2022-08-22 16:38:36+00:00,1561754722318565376,"I'm proud to receive the endorsement of the New Hempstead Democratic Club! The stakes are too high to allow Republicans to enact a national abortion ban if they take control of Congress. We need to keep #NY04 Blue. Please remember to vote in tomorrow's primary, polls open 6am-9pm https://t.co/QYj3e8Y0LA"
76,2022-08-21 20:32:43+00:00,1561451250184585219,"Had a wonderful time meeting with voters (and soon-to-be voters) in Baldwin this afternoon. Residents are not only ready to vote in Tuesday’s #NY04 primary, but can’t wait to send a message to D.C. that we need tougher gun safety laws &amp; control over our own healthcare decisions. https://t.co/p3XXOccIHj"
77,2022-08-21 16:41:52+00:00,1561393155383078912,"TODAY is the FINAL day to #VoteEarly in the New York primary! Early voting locations are open until 6pm tonight, so please be sure to get out and vote, especially if you plan on being away this Tuesday. #NY04 https://t.co/6VAb5lcNL7"
78,2022-08-20 22:17:25+00:00,1561115213319098369,Today is a great day to #voteearly and tomorrow will be the last day. Can you spare a few minutes for #democracy? https://t.co/mzn7OfX0sm
79,2022-08-20 21:16:56+00:00,1561099993565601792,"Thank you to Congressman @Tcardenas for stopping by #NY04 yesterday on his #HoldtheHouse tour! Our district is on the frontline of protecting women’s reproductive rights, and all of our rights, from the most extreme elements of Trump’s dangerous Party. #VoteBlueToSaveDemocracy https://t.co/UIAJZLiHqd"
80,2022-08-20 18:29:37+00:00,1561057885886582797,"Spent the afternoon hitting the pavement, talking with voters about the issues they care about. Residents are rightfully concerned about the dangerous direction our democracy has taken under Trump’s Republican Party &amp; the never ending assault on our rights. #GOTVBlue #NY04 https://t.co/Td6QWm7d7w"
81,2022-08-20 16:31:56+00:00,1561028267418714116,"🚨Tomorrow is the LAST day of early voting! Join our campaign and Get Out the Vote so that we can fight back against the @GOP’s dangerous assault on women. Because assault weapons shouldn’t have more rights than people. #NY04 
https://t.co/0PWYtuTYT8"
82,2022-08-19 21:07:27+00:00,1560735218084237312,I'm proud of our #UnionStrong campaign as we continue uniting working class folks from across #NY04 to fight for and preserve the middle-class values that our country was built on. https://t.co/UWaoS9PChx
83,2022-08-19 15:42:11+00:00,1560653361191403520,"And I stand with @nysut’s more than 600,000 active and retired professionals from across New York’s schools, colleges, and healthcare facilities. https://t.co/dbNMtpKPlR"
84,2022-08-18 15:56:06+00:00,1560294475112529920,"I’m excited to announce Bricklayers &amp; Allied Craftworkers (BAC) Local 1 &amp; BAC Local 7 Tile, Marble &amp; Terrazzo have endorsed our #NY04 campaign! The #UnionStrong support we have received is critical in our fight to protect America's workers! https://t.co/2HdASIOjlK"
