,Created at,User ID,Text
385,2019-09-30 13:17:15+00:00,1178660077462532096,"Another beautiful Sunday in #HempsteadTown. So happy to have spent it with Assemblywoman @judygriffinny at the #Malverne Fall Festival!

So many great local vendors, food options and games! Thank you to the Malverne Chamber of Commerce for hosting another fantastic festival! https://t.co/Gsqm9O0YHO"
386,2019-09-29 19:10:43+00:00,1178386643209871361,"Proud to be the Supervisor who welcomed the @NYIslanders back to #HempsteadTown and the @NYCBLive Nassau Veterans Coliseum!

Can't wait for the season to start and for the old barn to rock! #YesYesYes #isles https://t.co/tBc8kUrKd5"
387,2019-09-29 15:30:13+00:00,1178331150139482112,Want to wish all who celebrate in #HempsteadTown and around the world a very happy and healthy new year! #RoshHashanah
388,2019-09-29 13:25:35+00:00,1178299786275020800,"Absolutely awful news to wake up to this morning.

Please keep @NYPDnews Officer Brian Mulkeen, his family and his fellow Police Officers in your thoughts. https://t.co/MHTrWdcbmw"
389,2019-09-28 17:00:25+00:00,1177991462908305408,"#EatShopRock is such a fun event in #RockvilleCentre.

Great to see the community involved at our fairs and festivals.

BIG thank you to the #RVC Chamber of Commerce for sponsoring &amp; planning another tremendous day filled with so many great local vendors! https://t.co/CXPoAqfG3x"
390,2019-09-28 15:00:25+00:00,1177961262438928385,"Last night #HempsteadTown Clerk @SylviaCabana and I had the honor of recognizing the tremendous contributions #GardenCity Police Inspector Michael J. Doyle has made to the community during his distinguished 33-year career.

Congratulation on a well-deserved retirement! https://t.co/IJfAj8joXU"
391,2019-09-28 12:46:15+00:00,1177927499717775360,"With the dedication of the of the Memorial Garden of Forgiveness in #WestwoodPark in #Malverne, NYPD Det. #StevenMcDonald's message of faith &amp; forgiveness will never be forgotten.

He was a true hero whose words carried weight &amp; whose legacy will live on. https://t.co/2TubSAoezf"
392,2019-09-27 16:30:29+00:00,1177621540252405760,Interesting look at the Covert Avenue Grade Crossing project 👇 👇 👇 https://t.co/FamjPbnQNd
393,2019-09-27 14:30:46+00:00,1177591413963395072,This morning we honored @HempsteadTown’s longest serving current employee - Conservation Biologist John Zarudsky! This weekend will mark John’s 55th year on the front lines of environmental protection w/ all of our hardworking employees in the Dept. of Conservation &amp; Waterways! https://t.co/uXmLF5Nzy1
394,2019-09-27 14:28:10+00:00,1177590758389534720,"Seeing our communities come together to help those in uniform is truly remarkable.

Wonderful turn out for the Concert for #WoundedWarriors at Gries Park in #Lynbrook.

Thank you to the Lynbrook F.D. for all their work putting this event together. https://t.co/0MoWA66svM"
395,2019-09-26 18:37:53+00:00,1177291214766428160,"#HempsteadTown @LIRR riders - there will be no train service to or from #NewHydePark, Merillon Avenue, #Westbury or #CarlePlace this Saturday, due to track work. 

To accommodate riders, service at the #Hempstead LIRR station will be doubled.

More info: https://t.co/J7am4dzmQj https://t.co/hJjqVJ0yBy"
396,2019-09-25 18:12:56+00:00,1176922549789351936,"We're accepting nominations for #HempsteadTown's Make a Difference Awards, held on Oct. 29 at the #Merrick Road Park Clubhouse.

Know someone who's made a tremendous positive impact on their community? Fill out the form at https://t.co/YERkI7EesS &amp; email it to events@tohmail.org. https://t.co/b4vPOI1QSz"
397,2019-09-25 13:33:20+00:00,1176852183607914496,"Before last night's Town Board meeting, we honored the Mary Ruchalski Foundation for their work combating pediatric cancer here in #HempsteadTown.

September is Childhood Awareness Month. To learn how you can help fight this insidious disease visit https://t.co/eCRN8W8jzY https://t.co/XCqzQ7fQmP"
398,2019-09-24 23:14:02+00:00,1176635934382731265,"I'm proposing a 1.5 % property tax cut in my tentative budget.

If Republicans had their way, #HempsteadTown taxpayers would be saddled with a 7 % tax hike.

I'm committed to fighting the corruption tax in every budget negotiation &amp; everyday I'm in office! https://t.co/rFiRvd7YSZ"
399,2019-09-24 18:28:41+00:00,1176564123959795713,"Some notable events from 1913:

The Lincoln Highway opened.

@WilsonSportingG was founded. 

And Ida Scaduto was born. 🎉🥳

Happy 106th Birthday Ida! You're a beautiful soul &amp; a fixture of the #Baldwin Senior Center! 

Here's to another happy and healthy year! https://t.co/nVzT8fJT3c"
400,2019-09-24 14:32:40+00:00,1176504731264589825,"This Thursday, September 26, we're bringing our 'Smart Seniors Learning Seminar' to the #Baldwin Senior Center at 1 p.m.

This program, run in partnership with the @NewYorkStateAG's office, teaches seniors how to spot a scam, how to protect your identity and more. https://t.co/ZgHeG6u4Cn"
401,2019-09-23 15:32:26+00:00,1176157383132876805,"You may not realize it because it's 90 degrees and humid, but today is the #fallequinox, marking the official first day of autumn.

The leaves are changing, the days are getting shorter and the weather will eventually get cooler. https://t.co/6MFADGofCw"
402,2019-09-23 13:19:39+00:00,1176123966890610688,"Had a wonderful time at 'A Night Under the Stars' at @CFarmatG.

Thank you to the farm and the #Malverne Civic Association for hosting such a amazing fundraiser! https://t.co/mmzM0zke7N"
403,2019-09-22 14:07:35+00:00,1175773639570087937,"A picture perfect day at the #Bellmore Street Fair!

This event gets better and better every year thanks to the incredible work of the Chamber of Commerce of the Bellmores.

It's great to see the community come together and support local businesses! https://t.co/bMfDv1mg3n"
404,2019-09-21 22:21:28+00:00,1175535544253784064,"What a gorgeous day for a run!

Happy to support my alma mater @SacredHeart_LI at it’s Annual 5K race today. https://t.co/uku86RHiIU"
405,2019-09-21 18:00:04+00:00,1175469758805880832,"It's wonderful to know that so many organizations are committed to preserving and celebrating our history.

Had the honor of joining with Hempstead Town Clerk @SylviaCabana in celebrating The Garden City Historical Society's 150th Anniversary of #GardenCity. https://t.co/mqJImdOKnJ"
406,2019-09-21 16:02:20+00:00,1175440130989023232,"It was a special morning in #Malverne as we joined for the dedication of the #StevenMcDonald Memorial Garden of Forgiveness in Westwood Park.

This garden honors Det. McDonald's legacy and ensures that his message of faith &amp; forgiveness will resonate for future generations. https://t.co/mz3dwXnnz7"
407,2019-09-20 19:58:17+00:00,1175137121331494918,"Proud to stand with my daughter and her South Side H.S. classmates during #ClimateStrike. 

We're doing our part in #HempsteadTown by limiting emissions, investing in renewable solar energy and working toward an all-electric fleet.

It's up to us to ensure a future for them. https://t.co/cMFe9KaOQT"
408,2019-09-20 15:28:22+00:00,1175069194611810305,"This weekend is looking GORGEOUS.

Come down to #LidoBeach Town Park for #HempsteadTown's Festival by the Sea, Friday from 5 p.m. to 11 p.m., Saturday 11 a.m. to 11 p.m. and Sunday 11 a.m. to 10 p.m.

There's amusement rides, boardwalk games and live music! https://t.co/AY3nBFcp0Y"
409,2019-09-20 13:57:37+00:00,1175046355208888322,"Starting this Sunday, @nationalgridus will be doing work on Corona Avenue and the #SouthernStateParkway exit ramp at the corner of Midvale Lane in #NorthValleyStream.

Lanes will be open but expect delays during weekdays, 7 a.m. to 5 p.m.

For info visit https://t.co/SCO2m2L62l https://t.co/m8W55aIl93"
410,2019-09-19 19:51:52+00:00,1174773120521179140,"Check out #HempsteadTown's Fall 2019 Parks and Recreation Activities Brochure!

Inside you'll find info on all Fall Parks events and classes as well as the Fall calendar. https://t.co/gixq73tjYF https://t.co/dxDFnS7DNV"
411,2019-09-19 13:58:36+00:00,1174684215545384961,"Had the honor of recognizing our courageous officers at the Police Service Awards.

Our men and women in uniform are on the front lines every day, protecting us and ensuring that our communities our safe.

Congratulations to all of the honorees and thank you for your service! https://t.co/hY7HxbIDvB"
412,2019-09-18 15:44:03+00:00,1174348366299447296,"As part of #HispanicHeritageMonth we're displaying artwork and other items in the lobby of Town Hall that illustrate the culture and history of this vibrant community.

Please join us on Monday, Oct. 7th at 7 p.m. as we hold our annual #HispanicHeritage celebration at Town Hall! https://t.co/v0EvHr7ilj"
413,2019-09-18 13:54:59+00:00,1174320920707698689,"Big thanks to #HempsteadTown's own ""DJ Jazzy Jeff"" Kruska, the unofficial curator of the Town's music, &amp; the DGS staff for their tireless efforts to make Town Hall a welcoming and positive environment for residents and workers alike. https://t.co/0wjL1w2gsz"
414,2019-09-17 16:11:06+00:00,1173992787152384000,"There was a time when the coolest radio station on the planet was not broadcast from New York City but from right here in #HempsteadTown. 

92.7 @WLIRFM was the epicenter of new wave music and where I first heard Ric Ocasek and @thecarsband. @DTBthemovie https://t.co/VM4W0Os9hh"
415,2019-09-17 13:03:43+00:00,1173945629317443584,"I’m heartbroken hearing of this senseless and tragic act of violence that has resulted in the death of a 16-year-old boy.

Please keep him, his family and the #Oceanside community in your thoughts. https://t.co/TT2IxIrRcm"
416,2019-09-16 20:48:53+00:00,1173700303121715200,"It was an honor to help install the new officers of the Malverne American Legion post 44 with #HempsteadTown Clerk @SylviaCabana , Assemblywoman @judygriffinny and #Malverne Mayor Keith Corbett. https://t.co/3WoLJH46Jq"
417,2019-09-16 18:58:40+00:00,1173672565807693826,"While well intentioned, we need to deflate the growing myth that intentional balloon releases are acceptable as long as certain types of biodegradable balloons are used.

This will help us keep our parks cleaner, wildlife safer and local economy stronger. https://t.co/xt0NlaO1AV"
418,2019-09-16 17:48:58+00:00,1173655024884420608,"Had such a great time at the Nassau County #AOH Feis &amp; Festival!

A BIG congratulations to this year's honoree, Andrew Healey of #RockvilleCentre, and the #NassauCounty Ladies Ancient Order of the Hibernians on their 125th Anniversary! https://t.co/Oc3u89JPfr"
419,2019-09-16 15:34:30+00:00,1173621186305110018,"It's remarkable to see everyone at #CampANCHOR learn new skills thanks to so many incredible programs.

Yesterday was Annual Arts Experience show hosted by the Exceptional Artists Foundation and it was so wonderful to talk with our campers and learn about their artwork. https://t.co/MYUEWlSBhM"
420,2019-09-15 19:09:37+00:00,1173312935311085568,"It's hard to find a better way to spend a Saturday.

Had a great time at the #FranklinSquare Community Street Fair with #HempsteadTown Clerk @SylviaCabana .

Thank you to the #KiwanisClub of Franklin Square for hosting another incredible event! https://t.co/E3e9sghPCn"
421,2019-09-15 16:25:46+00:00,1173271700236095488,"Since taking office I have been working to a shine light on and eliminate these types of conflicts of interest, but constantly face opposition. 

Help me finish what I've started and let's bring real change to #HempsteadTown. https://t.co/6pQn1QrPu5"
422,2019-09-14 23:58:12+00:00,1173023172339347459,"It felt like a scene straight out of @CARandDRIVER. 

A wonderful day in #PointLookout for the 14th Annual Seaside Spectacular Collector's Car Show!

So many GORGEOUS vintage cars! It was pleasure to congratulate all the winners with #HempsteadTown Clerk @SylviaCabana. https://t.co/aXjnQu8iHH"
423,2019-09-14 21:18:30+00:00,1172982982782717952,"It was an honor to help celebrate the 100th Anniversary of the Baldwin American Legion Post 246 with @NassauExecutive, Legis. @DebraforLD5, Sen. @toddkaminsky and Sen. @Brooks4LINY .

This veterans group does so much incredible work in the community. Here's to the next 100 years! https://t.co/EmBxIDsObU"
424,2019-09-14 15:33:17+00:00,1172896104079417344,"Last night the community held a candlelight vigil for 9/11 first responder and #Oceanside resident Luis Alvarez.

Lou was a champion for his fellow first responders and urged Congress to extend benefits to those dealing with 9/11 related illnesses. 

He was a true hero. https://t.co/5v7PSwZa1z"
425,2019-09-13 14:44:11+00:00,1172521361786490885,"Sad to hear of the passing of music legend Eddie Money. 

Eddie was a fixture of the LI music scene, especially here in #HempsteadTown, headlining the Annual Independence Day Salute in 2010.

Hope you have heaven rocking! #RIP https://t.co/eM02xFXPHn"
426,2019-09-13 01:12:59+00:00,1172317215598628865,Thank you to ⁦@LtGovHochulNY⁩ &amp; all of our partners in NY State for helping to bring the Town’s “Path to the Park” protection project in Valley Stream to fruition! These new improvements will help protect thousands of lives &amp; millions in property! https://t.co/TT6jY7fwEy
427,2019-09-12 16:49:05+00:00,1172190406106370050,"Partnered with @MichaelleSolage, @SylviaCabana &amp; @NYSDHSES to bring Citizen Preparedness Training to #ValleyStream Central H.S. on Sept. 14 from 11 a.m. to 1 p.m.

You'll learn how to prepare for a disaster, develop an emergency plan and more!

Register: https://t.co/G62bpDxCJP https://t.co/SHSOc5OXSJ"
428,2019-09-12 14:05:52+00:00,1172149330477756423,"Though nearly two decades have passed, we are still dealing with the aftermaths of September 11th as so many of our first responders and people who lived and worked in lower Manhattan are continuing to be diagnosed with 9/11 related illnesses. https://t.co/87GY4xws6G"
429,2019-09-11 20:24:19+00:00,1171882184090816513,"Today we came together as a community to honor the thousands of people that were tragically killed during the terror attacks on September 11th.

The passage of time hasn't dulled the memory of the family members lost that day. 

We will #neverforget. https://t.co/AXMXOnqsvN"
430,2019-09-11 19:43:55+00:00,1171872014187057152,"It was a truly moving scene today at #JonesBeach as hundreds of motorcycle riders began their journey into lower Manhattan for the 9/11 Memorial Motorcycle Ride.

It was an honor to wish them well and thank them for continuing the legacy of our first responders. #NeverForget https://t.co/NkadY1U4Hz"
431,2019-09-11 16:18:47+00:00,1171820391951716352,"As we do every year on the #911Anniversary, the flags at #HempsteadTown Hall are flying at half-staff in memory of the victims of 9/11. #NeverForget https://t.co/3loMAI0z5w"
432,2019-09-11 14:25:15+00:00,1171791820344483841,"312 names have been added to the Memorial Wall this year.

312 more victims 18 years after the September 11th terrorist attacks.

312 families who have to suffer the loss of a loved one.

312 Americans who need our advocacy and our word that we will never stop fighting for them. https://t.co/2D7RfgSI3u"
433,2019-09-11 11:28:32+00:00,1171747347124117504,"As time passes, our memories fade. 

That’s why it’s so important that we come together to reflect and remember the nearly 3,000 people who were killed on September 11th. 

We will never forget the courage, the sacrifice and the legacy of those we lost. #NeverForget https://t.co/in3QKUbjSS"
434,2019-09-10 18:53:34+00:00,1171496956364935171,"Today is #WorldSuicidePreventionDay.

Sometimes, those close to us that seem the most happy &amp; vibrant are suffering in silence.

Suicide is never the answer. If you or someone you know is having a hard time, visit https://t.co/MQi8QBjN3Q or call its 24/7 hotline at (516) 679-1111 https://t.co/FHsUDsAj1E"
435,2019-09-10 16:53:37+00:00,1171466772165230595,"Our residents deserve a government that is free of conflicts of interest.

I've referred this to the Ethics Board and if it determines that the Republican majority's hand picked compliance officer has violated town code then I'll call for his resignation. https://t.co/tsE4aHDGxP"
436,2019-09-09 23:00:24+00:00,1171196684661088256,"In order to best serve our residents we must bring in a state monitor to oversee operations of the Building Department. 

Residents have faced consistent road blocks when attempting to rebuild after #Sandy. It ends now. https://t.co/jZciQe79Ix"
437,2019-09-09 21:45:02+00:00,1171177717884170241,"Today we said goodbye to one of the greats, @CSEALocal880 Public Safety Officer Jack Fiorvanti, who after 12 years of dedicated service to #HempsteadTown is calling it a career.

As a public safety officer, he served Town Hall with pride. Good luck on your retirement Jack! https://t.co/IyBlq1ouCV"
438,2019-09-09 20:25:01+00:00,1171157582469312513,"REMINDER - #HempsteadTown's 9/11 Memorial Service will take place this Wednesday, Sept. 11 at 7:30 a.m. at Town Park #PointLookout. https://t.co/frEh7FOfMS"
439,2019-09-09 19:00:26+00:00,1171136298846969857,"The Mary Ruchalski Foundation has worked tirelessly to raise awareness for pediatric cancer.

Honored to join #RVC Mayor Murray and Carol Ruchalski for the gold tree lighting ceremony for #ChildhoodCancerAwarenessMonth in front of Village Hall yesterday. https://t.co/OJAb0yAsPH"
440,2019-09-09 17:29:19+00:00,1171113365097340930,"With the release of @electrify_ny's Toolkit, municipalities like #HempsteadTown can find ways to transition to a fully electric fleet and integrate charging stations into its infrastructure. 

This is a part of the Town’s commitment to being a climate smart community. #goinggreen https://t.co/Hb0292geI2"
441,2019-09-09 14:00:26+00:00,1171060798485094402,"So happy to be at #HempsteadHomecoming with Clerk @SylviaCabana.

This event, hosted by the Salvation Army #HempsteadCitadel, brings the community together for fun, faith and family.

Congrats to Capt. Roberts for helping put together another wonderful celebration of #Hempstead. https://t.co/qnwWqzuR1E"
442,2019-09-08 21:04:09+00:00,1170805042217193477,"Wonderful day in #RVC thanks to the Chamber of Commerce, Brian Croutier and the Playing on the Porch event!

Neighbors and friends came out to hear local bands play throughout the @VillageRVC. 

Great music included #HempsteadTown's own Jon Crist and the Tristate Ale House! https://t.co/pvMWOWPI9P"
443,2019-09-08 17:53:48+00:00,1170757142003015680,"A gorgeous day to celebrate the opening ceremony of the #LevittownSoccerClub season!

Happy to join my colleagues to wish these athletes good luck and have fun this year! https://t.co/NMPOh2bAgb"
444,2019-09-08 13:30:05+00:00,1170690773731463168,"It's #backtoschool time in #HempsteadTown!

Happy to be joined by Sen @AnnaMKaplan, Sen. @toddkaminsky Sen. @AndreaSCousin and the #NCPD at our Back to School Backpack and Supply Giveaway in #Elmont.

Glad to get these necessary items into the hands of the students who need them! https://t.co/Ks1lx8h6KV"
445,2019-09-08 00:21:02+00:00,1170492202818125825,"Had such a great time at the #Merrick Chamber of Commerce's Annual #FallFestival!

Thank you to the Chamber and sponsors for another wonderful event for the community. So many great rides and booths! They were even providing #FluShots! https://t.co/tmFwUfetZB"
446,2019-09-07 17:11:29+00:00,1170384101230223360,"A beautiful day to be at Town Park at Point Lookout to kick off the 34th Annual #HempsteadTown Triathlon!

Congratulations to all the athletes participating this year! https://t.co/A5Lsf6OGMF"
447,2019-09-07 13:42:06+00:00,1170331410676273153,"🚨#HempsteadTown Seniors Update🚨

So excited for our #SeniorProm and as I announced this summer, I'm working on plans to keep our #Lido program running through September in 2020! https://t.co/wo85YxZ6wF"
448,2019-09-06 18:48:16+00:00,1170046071122399235,"Losing @FiOS1News_LI will weaken the news industry and put 150 people out of work.

We rely on good local journalists to hold government accountable by reporting on fraud and corruption.

Stood w/ @IamTDarling, @judygriffinny, @SylviaCabana to call on @verizon to save #FiOS1. https://t.co/adDcyPxS72"
449,2019-09-06 16:24:37+00:00,1170009919673765890,"It's hard to imagine everyday life without the convenience of the ATM.

For that we can thank Donald Wetzel, who 50 years ago invented the ATM at the Chemical Bank in #RVC, now a @Chase.

In honor of this historic occasion it felt fitting to offer him an honorary ATM card. https://t.co/S3NPkP0T5L"
450,2019-09-06 00:21:08+00:00,1169767452294733825,"This is yet another breach of the public trust and is part of a deeply disturbing culture of corruption in the Town of Hempstead. The GOP majority has blocked my every attempt for outside eyes to take a look at the building department. I wonder why... 
https://t.co/jKGYJJLdfO"
451,2019-09-05 20:23:38+00:00,1169707681726238729,"Despite being stymied by the Board into investigating the Bldg Dept, I've been successful in exposing the culture of corruption that exists in Town Hall &amp; will continue cooperating with the DA to ensure the full mess in this dept &amp; our Town is cleaned up. https://t.co/44kjrq8Uab"
452,2019-09-05 17:38:40+00:00,1169666166870220800,"Please join us for our 9/11 Memorial Service on Wednesday, September 11 at 7:30 a.m. at Town Park at #PointLookout. https://t.co/k99mdE1Cwz"
453,2019-09-05 14:19:56+00:00,1169616155000147968,"September is #ChildhoodCancerAwarenessMonth.

Over 11,000 children in the U.S. under the age of 15 will be diagnosed with cancer this year.

We partnered with @CRF4aCure &amp; the The Mary Ruchalski Foundation to help spread the word by tying gold ribbons to lamp posts at Town Hall. https://t.co/bFsdsmNRbM"
454,2019-09-04 20:54:18+00:00,1169353013456232449,"The Army Corps needs to stay on the South Shore until the job is complete.

Right now #HempsteadTown has half a blueprint and if the federal government has the funds to spend on a border wall, there should be enough to protect thousands of homeowners.
https://t.co/7WfWbmKpVM"
455,2019-09-04 19:50:49+00:00,1169337035947151360,"Summer thunderstorm season isn't over yet. 

Heavy showers and thunderstorms are supposed to roll in some time after 3 p.m. which could make the afternoon commute hectic. 

Stay safe on the roads and contact our helpline at (516) 489-6000 with any issues. https://t.co/eJhBblAb0H"
456,2019-09-04 17:13:47+00:00,1169297517982429184,"Was proud to stand with @SenSchumer today in the fight to extend the Nassau County Back Bays Study, which is critical to helping protect so many of our coastal communities from the next major storm. The Army Corps of Engineers needs to stay until the job is complete! https://t.co/tYXr3nMtiV"
457,2019-09-04 16:16:52+00:00,1169283192693710848,"My Town Board colleagues and I unanimously passed a resolution renaming Perimeter Road, the site of the new @NassauCountyPD Training and Intelligence Center on the #NCC campus, to 'Law Enforcement Way.'

Happy to unveil the new street sign &amp; honor our men and women on the force! https://t.co/CSYybohdYA"
458,2019-09-03 20:43:10+00:00,1168987825037086722,"We've partnered with @NorthwellHealth and @StonyBrookMed to bring mobile #BreastCancer screenings to four locations in #HempsteadTown.

The #StonyBrook Mobile Mammography facility will be at the Five Towns Community Center on Sept. 9th from 9-5.

To register call 631-638-4135. https://t.co/cmOMnwKrbt"
459,2019-09-03 18:32:51+00:00,1168955028037652481,"Today we took the next step on the #Baldwin redevelopment plan and are looking for public input on the project.

Send your comments on the project to BaldwinScoping@tohmail.org. To read more about the proposed plan visit https://t.co/k1i90vhaJ1"
460,2019-09-03 17:12:51+00:00,1168934894313058309,America’s largest township is fighting back against an epidemic of e-cigarette use that threatens the decades long progress our communities have made in reducing youth addiction to smoking. Thank you to @ErinKingSweeney &amp; @NassauExecutive for helping lead the way! https://t.co/fizW5V2uNJ
461,2019-09-03 13:24:45+00:00,1168877490338766848,"I'm so proud of our #HempsteadTown lifeguards who work so hard to make sure our residents have a safe summer at our beaches and pools.

Our guards train rigorously all year and this summer marks the 87th consecutive season without a drowning.

Congratulations! https://t.co/ur22UksyNr"
462,2019-09-02 20:09:06+00:00,1168616863514972163,"Thank you to Sen. @AnnaMKaplan for drafting state legislation to address the need for greater financial disclosure for political party leaders who do business with municipalities. Sunlight is always the best of disinfectants. 
https://t.co/u3URbnYhG4"
463,2019-09-02 14:24:49+00:00,1168530220946735104,"On #LaborDay, we’re reminded of the tireless efforts and sacrifices made by American workers to ensure valuable labor rights for future generations.

I’m thankful for everything our hard working #CSEA members do on a daily basis to keep #HempsteadTown running for our residents. https://t.co/vAAipLmPi2"
464,2019-09-01 14:00:28+00:00,1168161705060442117,"Check out the brand new Newsday doc #PoliticalPioneers, featuring @NassauExecutive, @LauraJensSmith &amp; me after our historic elections! More women are rightfully challenging the status quo by speaking up &amp; running for office, especially here on #LongIsland! https://t.co/N2QaocJPV8"
465,2019-08-31 21:11:54+00:00,1167907889622634499,"#ICYMI  - I sent a letter to the Board of Regents urging them not to adopt proposed regulations that would impose public oversight on private schools.

I stand w/ my constituents &amp; will continue to advocate for the educational freedom that our private and religious schools enjoy. https://t.co/x6kQXmxWN5"
