,Created at,User ID,Text
269,2022-07-18 02:39:01+00:00,1548859860124520449,"Ballots are out here in WA4. When you vote for someone to represent you in Congress DON'T GAMBLE your vote on a candidate who SAYS they will protect your rights, it's not worth the gamble. Vote for the candidate who has PROVEN he will."
270,2022-07-18 00:20:58+00:00,1548825116288528384,I refuse to live in fear. https://t.co/23BfAqzFUl
271,2022-07-17 23:30:54+00:00,1548812519564685312,I spent an entire year without seeing the faces of my Wife and two young boys while serving overseas in the US Army. These videos really hit home.  God Bless our military members.  https://t.co/E7uVxVhl7G
272,2022-07-17 22:06:42+00:00,1548791330121207809,"Happy to be Endorsed by Truth Teller, Rock and Roll Legend, 2nd Amendment Advocate, The Motor City Madman himself; @TedNugent https://t.co/3gItkQAZZe"
273,2022-07-17 19:44:25+00:00,1548755522995646464,"Biden and his handlers are ruining America while the rest of the world laughs.
#ImpeachBiden 
https://t.co/KeDuIAmTdB"
274,2022-07-17 06:43:57+00:00,1548559111637200897,He is lacking Integrity. Remaining silent when someone says you are endorsed by President Trump when you are not is lying but it's not the first time. https://t.co/7IXgOG3sky
275,2022-07-17 04:07:49+00:00,1548519816889176064,If you can't handle friendly media and correct them when they're wrong how the hell can anyone handle hostile media?  Sessler is weak and lied by omission.https://t.co/MGOAYXOCUI
276,2022-07-17 03:01:31+00:00,1548503134212722691,"I got @laurenboebert's new book on audible yesterday and listened to half of it today while on the road.  Highly recommend it!  Such an inspiring journey for anyone to hear, especially if you have struggled like most of us have.  https://t.co/Ly7Sxu9osF https://t.co/mOkyx9LRnX"
277,2022-07-17 01:20:32+00:00,1548477719926624256,Loren Live 7/16/22 https://t.co/fdMaOfdRLo
278,2022-07-17 01:02:39+00:00,1548473219572633601,Too many good people leaving Washington State including Pastor Dave.  He has a message for you. https://t.co/FSEtSDMeiQ
279,2022-07-17 00:45:54+00:00,1548469004917809155,I attended the funeral of a friend today and could not be in Pateros for the parade but that didn’t stop my supporters! https://t.co/m62oT0wY8i
280,2022-07-16 17:11:54+00:00,1548354753691729922,"Proud to be supported by both of these American Patriots!! 

(Triggered leftist tweet replies in 3,2,1) https://t.co/5saEmsOtiw"
281,2022-07-16 13:55:49+00:00,1548305407398907905,See that red in WA?  That's Dan Newhouse and Beutler. #VoteThemAllOut2022 https://t.co/75hUjJjnxa
282,2022-07-16 13:53:31+00:00,1548304827557351426,"Dan Newhouse, just a day ago, voted again along with Nancy Pelosi for the NDAA.  The vax mandate stays, CRT stays, funding the endless wars stays, it increased spending OVER what Biden requested and sends another Billion to Ukraine, funds ""alternative"" protein development etc; https://t.co/uftoNHn3mN"
283,2022-07-16 07:33:32+00:00,1548209201809305603,I look forward to standing with Congresswoman @laurenboebert and all of the @freedomcaucus members in the fight to save our country from the radical left and RINO's who are hellbent on ruining it. https://t.co/DzwAXAjbt9
284,2022-07-16 07:13:28+00:00,1548204149820469248,"""Hi, I'm Dan Newhouse and I voted AGAINST your second Amendment rights twice but it's time for an election so let me lie to you again"" #hypocrite https://t.co/3qfBbEY5a0"
285,2022-07-16 02:53:50+00:00,1548138810277392384,"Apparently now I’m “team China”.  This is weak, they have to try harder. https://t.co/J5Ey0esl6s"
286,2022-07-16 02:08:38+00:00,1548127439276036096,"Sexualizing children is WRONG, Period! CRT &amp; Graphic sex-ed is being pushed down to the states from unelected bureaucrats in the Federal Dpt of Education. Per the 10th amendment I will push to abolish that dpt and return education to the local level where parents are in charge. https://t.co/o7gBa6yNR0"
287,2022-07-16 00:25:18+00:00,1548101433815273474,The United Nations and W.H.O. are complete disasters.  America is a sovereign nation.  We should not be dictated to by any globalist organization. I will support this bill to remove us from it and it from American soil.https://t.co/3zYvByBm1U
288,2022-07-15 21:33:22+00:00,1548058163265515520,No fake diplomas from online diploma mills here. 👇 https://t.co/lRXQPuFHuQ
289,2022-07-15 21:28:35+00:00,1548056961156915204,"Biden chooses to beg Saudi Arabia for oil instead of unleashing American energy.

Treasonous!"
290,2022-07-15 20:30:33+00:00,1548042354904379392,Here is the one from April with all of the data:  https://t.co/3Yj1PmSGAM https://t.co/VBVTO6j6Hw
291,2022-07-15 18:55:09+00:00,1548018347219959808,"WA Voters! Online Voter pamphlets are at https://t.co/3Cc9zMB239
Ballots are out!"
292,2022-07-15 18:24:21+00:00,1548010595139461122,My condolences to the Trump family for the loss of your Mother. @DonaldJTrumpJr @EricTrump @IvankaTrump
293,2022-07-15 17:51:17+00:00,1548002275318108165,Most small business owners are conservatives. Most family farmers are too.  You think there is a reason small businesses were shut down and family farms are the targets of big government? #Newhousetotheouthouse https://t.co/dV5E9796MI
294,2022-07-15 17:43:48+00:00,1548000392423690241,Tuesday night Live w/Loren 7pm PT right here. https://t.co/9VScanL94s
295,2022-07-15 17:37:02+00:00,1547998687271350272,"There is something wrong with a ""poll"" that has a democrat leading in the most conservative district in WA State, an R+13 District.  Anyone can make a graphic don't be fooled. Legit polls have data released along with them, like this one: https://t.co/crVry9GPSX"
296,2022-07-15 16:39:10+00:00,1547984126350802945,"If the Biden administration wasn’t trying to destroy our country, what would they be doing differently?"
297,2022-07-15 00:33:54+00:00,1547741207295434752,"Voters all around my district feel abandoned by their leadership in DC.

Everyone keeps asking:
“Where’s @RepNewhouse?” 👀"
298,2022-07-14 23:15:50+00:00,1547721564761665536,The invasion at our southern border is FAR more important than the invasion at Ukraine’s border.
299,2022-07-14 20:24:53+00:00,1547678541088665600,"Trump gave us the strongest economy in a generation.

Biden gave us $6 gas and record inflation.

That’s the difference between America First and America Last."
300,2022-07-14 02:55:05+00:00,1547414352273162240,Some unethical people think this is how you win. Steal other peoples signs. https://t.co/tVkVuEWk2E
301,2022-07-14 01:38:18+00:00,1547395026342162432,Will the real Trump endorsed candidate in WA4 please stand up?  I will be on with @DanNewsManBall on @OANN tomorrow to set the record straight. https://t.co/oKwm8fWPTh
302,2022-07-14 00:55:19+00:00,1547384212805656577,Prices of everything are up @RepNewhouse because of spineless reps like YOU who vote for big government spending bills right along with Nancy Pelosi. You continue to try and put a band-aid on a cut artery. Just resign. #worthless https://t.co/LjLcaBKfVQ
303,2022-07-14 00:37:17+00:00,1547379674350620673,"The Saudi's wouldn't take Joe Biden's call a few months ago.  He is going there to knock on their door now, will he bow if they let him in? #ImpeachBiden"
304,2022-07-13 23:33:54+00:00,1547363723223891974,The best way to get our economy back on track is by unseating reckless Democrat and RINOs like @RepNewhouse and putting America First once again!
305,2022-07-13 21:09:52+00:00,1547327473024745477,"Economics 101: The higher inflation numbers go, the lower Biden’s approval rating drops."
306,2022-07-13 20:46:10+00:00,1547321509349318662,"Inflation just reached 9.1%, a new record. Inflation was never “transitory.” You have big government spending and the RINOs like @RepNewhouse who supported that spending to thank for that. They’re all at fault."
307,2022-07-13 18:31:30+00:00,1547287619188432897,"Wages are up 5.1% from last year. Inflation is up 9.1%. Rising costs have eliminated wage gains for workers. 

The Biden economy is a pure DISASTER!"
308,2022-07-13 03:33:01+00:00,1547061508248444928,Thank you @RhondaC12345 https://t.co/bsIhdE4Y2q
309,2022-07-13 03:22:54+00:00,1547058962855407617,It's only relevant for us serfs. https://t.co/1wIh4dc3Sh
310,2022-07-13 02:59:12+00:00,1547052998014091264,Amazing what they WON'T do with OUR money. https://t.co/O4G06torvY
311,2022-07-13 02:00:23+00:00,1547038198101995520,LIVE w/LOREN 7/12/22 https://t.co/FrtPHSnBzK
312,2022-07-13 01:35:04+00:00,1547031828132794373,See you at 7:00 LOREN LIVE!  Election security solutions and How's the Campaign going?
313,2022-07-13 01:26:44+00:00,1547029727034081280,"When Republicans retake Congress, I pledge to investigate Hunter Biden and the president’s shady dealings with China. When we find that smoking gun, I will introduce another article of impeachment against Biden."
314,2022-07-12 19:49:02+00:00,1546944746123395075,"RINO @RepNewhouse immediately jumped to impeach President Trump. Why hasn’t he moved to impeach Biden for the open corruption in this administration? Because he’s an establishment DC fraud. 

Where’s Newhouse? 👀"
315,2022-07-12 17:41:31+00:00,1546912654899429376,"We’re writing weekly billion dollar checks to Ukraine as Americans suffer through the worst economic crisis in decades.

STOP funding foreign adventures and prioritize our own country for a change!"
316,2022-07-12 16:29:08+00:00,1546894438051586049,"Biden is going to the Middle East to beg Saudi Arabia for oil while he cancels pipelines and drilling leases right here in America.

With Biden and Biden’s hacks it’s ALWAYS America Last!"
317,2022-07-12 13:34:10+00:00,1546850404603928581,"America is in chaos. The border is being overrun. Crime is sweeping our cities. Inflation is crushing our economy. And @RepNewhouse is nowhere to be found.

Where’s Newhouse?"
318,2022-07-12 01:45:24+00:00,1546672036919087105,Elections have consequences! https://t.co/a5hAMsDwl4
319,2022-07-12 00:32:37+00:00,1546653722712936448,".@RepNewhouse voted to impeach Trump but stays TOTALLY silent on the corrupt Biden administration.

We will unseat this RINO and elect a true conservative fighter for WA-4."
320,2022-07-11 21:53:12+00:00,1546613603503144961,"Our oil is headed to China and our money is headed to Ukraine. 

America First. Now more than ever."
321,2022-07-11 20:11:23+00:00,1546587979291930624,YOU VOTED TO GIVE HIM EVERY DOLLAR HE ASKED FOR!! https://t.co/WyFVfip9XX
322,2022-07-11 18:57:46+00:00,1546569456591200260,"Hunter Biden is a clear national security threat. 

Where are the DOJ and the FBI?!"
323,2022-07-11 17:46:57+00:00,1546551634439831552,"Follow me on Truth Social and spread the word!

https://t.co/sAk8RWicsh"
324,2022-07-11 03:18:59+00:00,1546333200594526210,"Never back down, never give in, always Stand! Here is a fine example. https://t.co/KkYevnIPNA"
325,2022-07-11 02:37:33+00:00,1546322777048723458,How many high level security officials said Hunters laptop was Russian disinformation?  Whatever you do don't click #hunter it's trending but don't do it.
326,2022-07-11 01:48:45+00:00,1546310492234231808,"Just to remind everyone, voting integrity is not a Republican or Democrat issue. Both have said there are problems with security. This is an American issue that needs to be fixed. 7/12 at 7pm live right here, I will present the Constitutional remedy I will push when in Congress. https://t.co/CwoOV1irOx"
327,2022-07-10 17:52:52+00:00,1546190735321419777,"Standing Strong, today and yesterday. When you vote for someone to represent you in Congress don't gamble your vote on a candidate who SAYS they will protect your rights. Vote for the candidate who has PROVEN he will.https://t.co/6R8VmNdlTi"
328,2022-07-10 16:49:45+00:00,1546174850804301825,Just in time for the election. https://t.co/GpfGYtln4c
329,2022-07-10 15:29:48+00:00,1546154732065996800,Kitsap County!  Here's your sign.  Follow and retweet please. https://t.co/aV2Prc74oo
330,2022-07-10 15:22:43+00:00,1546152948664713216,"I've been purging a few bots and trolls lately, they can go scream at the sky from their own place😃 This is also a warning for those that are left, I have plenty of ammo. https://t.co/upETvPe5lF"
331,2022-07-09 20:33:27+00:00,1545868759222845441,"In my experience as a candidate.  The most vial lies and smear campaigns come from other ""Republicans"" who say they are Christians.  I am a Christian and I have read the 9th Commandment. I'll pray for them. https://t.co/iuzCHTg13W"
332,2022-07-09 01:19:31+00:00,1545578361749225472,"We sent oil to China while Americans face a historic energy crisis. 

Disgraceful and unacceptable!"
333,2022-07-08 23:49:26+00:00,1545555693331030016,"Ballots are out here in WA4. When you vote for someone to represent you in Congress don't gamble your vote on a candidate who SAYS they will protect your rights, it's not worth the gamble. Vote for the candidate who has PROVEN he will. https://t.co/6R8VmNdlTi"
334,2022-07-08 23:27:26+00:00,1545550154371039240,Investigate Hunter Biden’s shady business deals and prosecute the Biden crime family. We have more than enough evidence.
335,2022-07-08 23:21:47+00:00,1545548732917174273,Listen to this and then imagine how the news media and the left would react if it was President Trump. https://t.co/DU7TaoB24g
336,2022-07-08 23:00:09+00:00,1545543287993315329,Ballots aren't supposed to be out yet according to their schedule but I got mine as well.  Thank you for your vote! https://t.co/I9D3WLocmV
337,2022-07-08 20:35:37+00:00,1545506916952055809,.@RepNewhouse represents the failed DC establishment swamp. America Last RINOs are gone for GOOD in 2022!
338,2022-07-08 19:16:46+00:00,1545487073318141959,"Biden can barely make it through a public speech. This administration is pure elder abuse.

25th amendment NOW!"
339,2022-07-08 18:27:09+00:00,1545474585377886210,"“End of quote. Repeat the line.” - An actual quote today from “President” Biden.

Who is running our country?!"
340,2022-07-08 16:26:32+00:00,1545444230356619264,Hardly any politician talks about the 9th and 10th amendments. They are needed in times like these.  They are key to reigning in the out of control Federal Government. https://t.co/rZwZRteM2L
341,2022-07-08 01:34:58+00:00,1545219861911052290,Visit any city controlled by rich liberal elites and tell me how well gun control works for that city.
342,2022-07-08 01:29:17+00:00,1545218430508224517,"I often ask myself why ""Republican"" Dan Newhouse voted along with them. https://t.co/3eb5VduRL8"
343,2022-07-07 23:44:10+00:00,1545191977200693250,"Primary ballots drop next week and right on cue, the pretenders all become ""America First"" and resort to desperate underhanded tactics to smear my name and campaign.  I am the ONLY candidate who's endorsed by President Trump, the rest are working against him and me."
344,2022-07-07 22:05:21+00:00,1545167111403851776,"Let me call the Biden presidency what it is: 

Elder abuse."
345,2022-07-07 19:58:18+00:00,1545135136592707584,Only 11% of voters strongly support Newhouse. https://t.co/4PdPuFuukC
346,2022-07-07 17:19:15+00:00,1545095112463720451,Open our pipelines and close the border.
347,2022-07-07 16:30:56+00:00,1545082950936584192,"Biden’s war on American energy ALONE is enough to impeach him. 

I’ll introduce articles of impeachment against Biden and his cronies the moment I’m elected to Congress."
348,2022-07-07 04:44:08+00:00,1544905079429312513,News piece from yesterday https://t.co/HlTz3ocd2S @OANN
349,2022-07-06 23:50:34+00:00,1544831201302548481,"What could go wrong? 

""Biden to allow some migrants with terrorist ties into country, raising security concerns""   https://t.co/DYMfs9vmRE"
350,2022-07-06 23:26:32+00:00,1544825152675778561,"It makes sense. They are trying to replace their dwindling voter base.  Few Americans vote for them anymore, Trump endorsed America First candidates are winning everywhere so they import voters. https://t.co/ajfVWF4PBc"
351,2022-07-06 23:03:58+00:00,1544819473101729792,"2022 isn't about Republican vs Democrat, it's about Good vs Evil.  ""All that is necessary for evil to triumph is for good people to do nothing"" Don't be passive, get involved, support the candidate of your choice with time, money or both. Our country depends on YOU!"
352,2022-07-06 22:58:17+00:00,1544818043167027200,"It isn't the party of JFK anymore. It has become the party of anti-American socialists. @BrandonStraka is helping to lead them to sanity. I urge everyone to listen to his story and thousands of others, think for yourselves.  #walkaway https://t.co/zqNJ9u7iNK https://t.co/X1ZfNz121g"
353,2022-07-06 20:23:19+00:00,1544779042615767040,"As a Veteran, I know the VA doesn't just have a ""record system"" problem!  Our Veterans deserve better and I will push for them being able to see the Doctor of THEIR choice.  The VA needs a major flushing not politicians who want to tinker with a broken records system! #VoteHimOut https://t.co/2FHzZKJIpK"
354,2022-07-06 03:12:52+00:00,1544519725291491328,It was my honor to be the Keynote Speaker at the Independence Day Celebration in the town of George Washington.https://t.co/7pEeXOarqf https://t.co/8JjyaqogRs
355,2022-07-06 02:02:48+00:00,1544502092210900992,Live w/Loren 7/5/22 https://t.co/IiDZijP67J
356,2022-07-06 01:17:17+00:00,1544490633984892928,"Mitt Romney, Liz Cheney, and RINO hacks like @RepNewhouse are doing everything they can to prevent Trump from running in 2024.

Sorry, but that ship has sailed. Trump is the leader of the party now. Republicans voters are done with the establishment."
357,2022-07-05 23:47:34+00:00,1544468057560580097,"In Congress I will move to impeach Biden, Mayorkas, Buttigieg, Becerra, and every other corrupt official in this administration immediately. We will demand full accountability and give the American people the transparency they deserve."
358,2022-07-05 22:12:46+00:00,1544444200862851072,Energy security is national security. We are not a strong nation without a strong energy supply.
359,2022-07-05 20:46:08+00:00,1544422400070242306,"Joe Biden’s America is dangerous and destructive. 

Democrat soft-on-crime policies have handed our country over to criminals and cartels."
360,2022-07-05 19:57:09+00:00,1544410073207779328,"If you think things have been crazy so far, what in the hell is the biden administration doing now? Fighting for foreign citizens to vote in U.S. Elections.  #impeach https://t.co/RDzLIcLHWY"
361,2022-07-05 03:47:45+00:00,1544166113671385088,Thank you Pat. https://t.co/d2liRUjjIu
362,2022-07-05 02:44:41+00:00,1544150243511398400,Truth is funny sometimes https://t.co/O0CKWMLGVj
363,2022-07-05 02:35:19+00:00,1544147884823625729,Happy Independence Day Video!  👇 https://t.co/rR3TqtCBjJ
364,2022-07-05 02:03:12+00:00,1544139804979253248,https://t.co/nakccxRCfz
365,2022-07-05 02:01:35+00:00,1544139394990292992,https://t.co/0g1btZzf45
366,2022-07-05 02:01:10+00:00,1544139290094972929,https://t.co/50bDYuXwov
367,2022-07-05 02:00:13+00:00,1544139054291116033,3 parades in one day! A Huge thank you to the Culp for Congress Volunteers and their families!  So much support everywhere we go! https://t.co/DdzvfdVkhn
368,2022-07-04 14:17:50+00:00,1543962293725118465,Don't be fooled by fake polls and fake information put out by others. There is only one candidate in the 4th District of Washington who is endorsed by President Trump. https://t.co/daWbVY2yXW https://t.co/3TUKwEwgm2
369,2022-07-04 07:30:40+00:00,1543859824462422016,Happy Independence Day!!  I will be the keynote speaker in George Washington TODAY!! https://t.co/rM0O3AoxUX
370,2022-07-03 19:24:00+00:00,1543676954691264512,Slopping up that gravy. Foreign aid is money laundering for the well connected and the political powerful using our tax dollars to enrich themselves. https://t.co/cdDIZDe1SW
371,2022-07-03 02:58:17+00:00,1543428889233334272,True intentions of the left. Conservatives need to take this seriously because our country is literally being destroyed right now. https://t.co/ug9AHXhhhd
372,2022-07-03 01:25:32+00:00,1543405548208640000,Legitimate questions. https://t.co/KdBwroV2mF
373,2022-07-03 01:03:57+00:00,1543400115368448000,This is video from today in Okanogan County!
374,2022-07-03 01:02:39+00:00,1543399788393410560,We will win because we the people are what I am all about. I will always Stand for America with YOU! https://t.co/dOkWWNQZju
375,2022-07-02 15:58:31+00:00,1543262855033602048,Still waiting on the hearings for someone to be held accountable for arming the Taliban or are we supposed to forget about that?
376,2022-07-01 22:46:15+00:00,1543003074385645569,"Trump made America great again.

Biden made America weak again. 

RINO @RepNewhouse is complicit in Biden’s failures."
377,2022-07-01 20:01:38+00:00,1542961649656668162,"Biden only has excuses for his backwards energy policy. 

The solution is simple: Unleash domestic production, start drilling, and lower costs at the pump!"
378,2022-07-01 18:11:33+00:00,1542933943665786880,"This administration tells Americans facing record high gas prices that we must make sacrifices for the “future of the liberal world order.” 

America Last policies are wrecking this nation. Disgraceful."
379,2022-07-01 15:11:44+00:00,1542888690938130432,The WA State Constitution prevents the police from going inside a lawfully stopped vehicle without a warrant even if they see something illegal per Article 1 Section 7 but Jay Inslee can tell you what to put inside your body with a letter? #Donotcomply https://t.co/LtRZOHRxjl
380,2022-07-01 15:02:53+00:00,1542886464446349313,Politicians always champion the idea of bringing back money to their district.  How about not taking it from us to begin with?
381,2022-07-01 14:58:28+00:00,1542885355728252928,"We have grown far too accustomed to the Federal Government being involved in every aspect of our lives, business, families and every day life.  This must change.  READ THE 10th AMENDMENT, it is the law of the land and what our founders intended to achieve individual freedom."
382,2022-07-01 00:41:35+00:00,1542669711942483970,Ultra MAGA is here and it’s unstoppable.
383,2022-06-30 19:47:29+00:00,1542595699287670786,"SCOTUS rulings making it clear that Congress is the lawmaking branch of our federal government, not unelected judges. 

Obviously the Democrats hate this, because they would rather govern by force than legislate."
384,2022-06-30 18:50:40+00:00,1542581402402693120,"SCOTUS just reined in the corrupt EPA.  When I am in Congress I will move to get rid of the Dept. of Education, EPA, IRS, ATF, and any unnecessary overreaching dept. We need less government, not more."
385,2022-06-30 18:00:28+00:00,1542568769620283392,Yet you continue to vote for Biden and Pelosi’s big government spending bills. You really are pathetic. https://t.co/xQVb2m6bd4
386,2022-06-30 17:42:07+00:00,1542564148755791874,"When we retake Congress, Republicans must work to dismantle our three letter agencies and hold them accountable. I will start by working with the Freedom Caucus to get rid of the Department of Education. The unconstitutional and unelected Deep State is a threat to our Republic."
387,2022-06-30 16:43:18+00:00,1542549348877082624,"Today is the last day of the Quarter with ballots coming out very soon.  Will you help me take this seat in Congress back from an impeachment voting, 2nd amendment violating, big spending RINO? https://t.co/ajJYXNqFYf"
388,2022-06-29 22:51:58+00:00,1542279740463411200,"Trump has only gotten more popular since leaving office. 

Biden reaches new lows daily.

The MAGA movement is stronger than ever before, and we’re just getting started!"
389,2022-06-29 20:03:39+00:00,1542237380123545600,"50 illegal immigrants were found dead in a truck in TX. Our president and our “Border Czar” VP are nowhere to be found.

A dereliction of duty and a betrayal of their oaths of office."
390,2022-06-29 18:00:21+00:00,1542206350230540291,"The border is being overrun. Gas costs almost $6. Inflation is out of control.

And all the MSM can talk about are J6 show trials. Truly the enemy of the people!"
391,2022-06-29 07:25:23+00:00,1542046558023061506,This is exactly what I talked about on my show tonight. Per the 10th amendment I will push for the elimination of the Federal Dpt of Education and return power back to local control where PARENTS will once again have a say in their children's education NOT bureaucrats in DC. https://t.co/Vsk42M5lRN
392,2022-06-29 07:17:57+00:00,1542044685937418241,"Thank you Bentley, YOU inspire me. https://t.co/7HyvKBZZEw"
393,2022-06-29 02:41:35+00:00,1541975135992721410,"Congratulations to @laurenboebert. America WINS, Freedom WINS!! https://t.co/nBehs5EgeQ"
394,2022-06-29 02:03:11+00:00,1541965470667927552,Live w/Loren 6/2822 https://t.co/jbsecq648M
395,2022-06-28 23:41:11+00:00,1541929737420947456,"Open borders, crime waves, and skyrocketing prices under one-party Democrat rule. 

J6 Political theater is an insulting distraction from the Biden administration’s numerous failures."
396,2022-06-28 21:40:18+00:00,1541899315076993024,"Concerned Democrats staged a theatrical committee vote to help an embattled Republican, @RepNewhouse, survive his August 2 primary race against a small-government candidate endorsed by former President Donald Trump @LorenCulp. https://t.co/4PdPuFuukC"
397,2022-06-28 19:51:21+00:00,1541871896588943367,"Just how desperate are the Democrats? 

They’re now thinking about running Hillary Clinton in 2024. 

Good luck with that!"
398,2022-06-28 18:48:36+00:00,1541856104220708865,"RINO @RepNewhouse has failed to deliver results for the people of Washington state.

Voters are fed up with DC establishment politicians. 

We’re unseating this FRAUD in 2022!"
