,Created at,User ID,Text
140,2022-08-01 21:16:28+00:00,1554214504258572294,"The media likes to only point to Newhouse voting to impeach President Trump for the reason I'm running against him. They ignore his voting with Democrats 40-50% of the time, funding planned parenthood to murder babies, voting for red flag laws etc. At his core he is a D."
141,2022-08-01 20:39:59+00:00,1554205321895129089,Do it! In WA if you don't vote someone may vote for you. https://t.co/TJ81AWQEWs
142,2022-08-01 20:34:50+00:00,1554204025477730304,Kitsap County tomorrow night! @VoteRickSheriff https://t.co/5XkFqEEWlL
143,2022-08-01 20:30:26+00:00,1554202918642806785,A police report has been filed with the Yakima Police Department. https://t.co/9SqMtzEqn0
144,2022-08-01 19:16:16+00:00,1554184254157905922,"How does the Left get away with constantly changing definitions and moving goalposts?

Easy.

1. They paint themselves as intellectually and morally superior, which eliminates any sense of hypocrisy on their end

2. They're evil"
145,2022-08-01 16:15:34+00:00,1554138779878715395,"A lot is happening in this election in WA 3 &amp; WA 4
https://t.co/fsxOgy8pvt"
146,2022-08-01 14:39:48+00:00,1554114680792047618,This morning they are showing zero across the board but yesterday this is what was up. Big Problem with election integrity and a violation of election law. https://t.co/03tInIYRv2 https://t.co/CrklBZoSPk
147,2022-08-01 07:06:49+00:00,1554000685317836800,Someone needs to go to jail!   https://t.co/iTop0QALob https://t.co/CrklBZoSPk
148,2022-08-01 06:40:53+00:00,1553994155986022403,@secstatewa @Jim_Brunner @jasonrantz @LarsLarsonShow @DanNewsManBall @ChanelRion Screen shot https://t.co/Yfv6fbnHoY
149,2022-08-01 06:23:18+00:00,1553989731616100355,"The election is not until August 2nd why is the Yakima Herald publishing results on July 31st? This is voter influencing and tampering with an election!   @secstatewa @Jim_Brunner @jasonrantz @LarsLarsonShow @DanNewsManBall @ChanelRion   

https://t.co/CZ23lLnsmT"
150,2022-08-01 01:51:50+00:00,1553921413542686720,All true 👍😃 https://t.co/6gmK5n5blg
151,2022-07-31 21:07:57+00:00,1553849975028588544,Great Song and it's how I feel. https://t.co/FXtxfJiDHb https://t.co/X7eKPg5fN4
152,2022-07-31 18:43:40+00:00,1553813662879473664,"“Well, if there’s any die-hard Republicans in here, you might want to clutch your pearls,” Culp said, “because I don’t give a rat’s ass – sorry – about a party, as much as I do about the United States of America.”"
153,2022-07-31 18:28:11+00:00,1553809766916337664,"Should I care more about a party than America? If my statement offends you, you should ask yourself why?  
https://t.co/QN54NIvfMZ"
154,2022-07-31 18:04:10+00:00,1553803725071794176,Defund and Abolish per the 10th Amendment along with the Department of Education just to name 2 of the many. https://t.co/aq5Y1ocgrR
155,2022-07-31 17:47:22+00:00,1553799493908193280,"Big money from the DC Swamp and @RepNewhouse going scorched earth on me with lies is all he has because he can't run on his voting record (RINO). Attacking a Veteran, a retired police officer who was awarded the key to the city and voted Home Town Hero helps me. Attack more Dan. https://t.co/GvZ9FnTU0N"
156,2022-07-31 16:49:19+00:00,1553784888234774528,Just think how our government would act if we the people didn't have the means to resist tyranny. One look at history is all you need. I will not waver on 2A. The same now as then: https://t.co/6R8VmMWiRi https://t.co/uxHWd958b0
157,2022-07-31 16:45:50+00:00,1553784009825460224,Gain of FICTION is highly appropriate. https://t.co/6s5rAIcXWf
158,2022-07-31 16:32:50+00:00,1553780737983143936,"RINO Newhouse and the DC swamp dark money PAC's have increased spending on hit pieces against me, total lies, to about 2 million dollars as of last report. He is their cash cow.  I will work for WE THE PEOPLE."
159,2022-07-31 16:25:19+00:00,1553778844909182977,Birds of a feather.  Newhouse has been in office since the CCP started doing this! NOW he wakes up for an election? https://t.co/PSh2h0gAhq
160,2022-07-31 04:13:21+00:00,1553594641441665024,"We have three days left to show the DC swamp in both parties that We the People will not be denied! All eyes are on WA Tuesday.

https://t.co/GsVR4pHhz3"
161,2022-07-30 14:06:55+00:00,1553381630235926528,I'm on the road this morning headed to Klickitat County for their Lincoln Day Luncheon. #teamculp #neverstop
162,2022-07-30 14:02:52+00:00,1553380608105013248,"The same is happening here in WA4 to keep RINO @RepNewhouse in office.  Why do the DC Swamp dark money PAC's want to keep them in office? Why would they spend MILLIONS?  They want business as usual to keep the money flowing. Sorry DC, the status quo isn't what the people want! https://t.co/9VxvscgWyV"
163,2022-07-30 13:43:39+00:00,1553375775985790976,"The Enemy is inside the wire! My interview with Bannon on the War Room from yesterday.
https://t.co/QasOTCEJAz"
164,2022-07-29 22:28:58+00:00,1553145584722198528,Quick message before I hit the road. https://t.co/wM9jap5PNI
165,2022-07-29 21:51:12+00:00,1553136083772116992,Why is Newhouse attacking me? Because he doesn't want to talk about his votes to fund planned parenthood. He doesn't want to talk about voting for red flag laws. He doesn't want to talk about voting with Nancy Pelosi and AOC 40-50% of the time.  He can't run on his voting record
166,2022-07-29 21:37:33+00:00,1553132647987023872,Why did Newhouse vote to eliminate Country Of Origin Labeling on our food? I want to know where our food comes from so I can buy from American Farmers &amp; Ranchers don't you?
167,2022-07-29 20:04:09+00:00,1553109140741963776,"Wikipedia editors have already altered the page on recessions and then locked it to public edits.

Who needs a Ministry of Truth if you can just have the private sector to quietly do it for you?

This Big Tech tyranny must be brought to an end as soon as we take back the House."
168,2022-07-29 04:26:55+00:00,1552873281585197058,Truth https://t.co/qXArq9I8kK
169,2022-07-28 22:47:33+00:00,1552787875455909888,"If we don't get Conservatives in Congress to fight back, not go along to get along like @RepNewhouse has done, we are going to lose our country."
170,2022-07-28 22:25:30+00:00,1552782324361596928,Q &amp; A with Loren.  https://t.co/M1rIhVkWko
171,2022-07-28 16:52:51+00:00,1552698611816837121,"He ""forgot"" to mention that he is as guilty as Biden because he voted FOR the big spending bills. #hypocrite 
https://t.co/A7IS2RPD3d https://t.co/fG65ayJSVo"
172,2022-07-27 23:41:23+00:00,1552439034823442432,"The White House tries to change the definition of recession and the corrupt FAKE news immediately jumps to change their definition too. 

Enemy of the people!"
173,2022-07-27 20:14:49+00:00,1552387048966963201,We should not send any more American dollars to Ukraine. Cut it all off! This money laundering operation should never have started in the first place. We face enough problems on our own. It’s a farce!
174,2022-07-27 19:58:21+00:00,1552382906886004736,"WE THE PEOPLE WIN, the swamp loses. VOTE!! https://t.co/s0hIYEEZdA"
175,2022-07-27 19:51:39+00:00,1552381219316195330,A message from one of the greatest patriots in Congress! I look forward to serving with her. VOTE! https://t.co/h42kCsGFfW
176,2022-07-27 19:28:48+00:00,1552375468715716608,"Let's get it done, VOTE! VOTE! VOTE! https://t.co/DvawXtabR7"
177,2022-07-27 19:11:05+00:00,1552371010711605248,This morning I was on Bannons War room with Steve Bannon for a lively interview. Check it out and retweet https://t.co/kOqmhKBqRt
178,2022-07-27 17:51:21+00:00,1552350946587467778,What kind of drugs are Biden’s handlers shooting him full of? They can barely keep this guy running. The American people deserve to know.
179,2022-07-27 14:00:13+00:00,1552292778222055424,"""The Conservative Review's Liberty Scorecard gives  Congressman Newhouse a 54% score"". 
Culp is winning this race!

 https://t.co/Xc3dwVlocF"
180,2022-07-27 02:51:44+00:00,1552124548731920384,Thank you for your families sacrifice. I served in the military and I know the hardships of a military family. Jay Inslee and the democrats are hell bent on turning WA into a 3rd world crapper.  You and your spouse have my deepest appreciation and respect. https://t.co/d0iIWqp7h9
181,2022-07-27 02:01:44+00:00,1552111967925547008,Live W/Loren 7/26/22 The Final Countdown! https://t.co/srCbjNQo3T
182,2022-07-27 01:31:28+00:00,1552104350855548928,Election Night. I will be watching the returns here and hanging out with whoever wants to join me for the celebration ✅🇺🇸 https://t.co/CGjdeXCCp5
183,2022-07-27 01:23:15+00:00,1552102280807124992,He must be making his DC buddies a lot of money for them to dump a million into trying to smear me.  They are scared and they should be. The taxpayer gravy train is about to end for them. https://t.co/z4gAuQ8ZCO
184,2022-07-27 01:11:08+00:00,1552099234089996288,"Biden is releasing even more barrels of oil from our strategic reserves. These barrels are supposed to be for emergencies only, yet Biden is using the sale to offset his disastrous energy policy. Bad news!"
185,2022-07-27 00:25:13+00:00,1552087678681657349,Thank you! https://t.co/I3y7Dnds8c
186,2022-07-26 23:50:38+00:00,1552078976448970757,This administration has put America Last from the very beginning. Articles of Impeachment coming soon!
187,2022-07-26 22:55:11+00:00,1552065021223456768,"A quick message from me to YOU, yes YOU, the person reading this right now.  Watch 👇 https://t.co/ysdM4uVBWs"
188,2022-07-26 22:51:51+00:00,1552064180257112064,"Happy to have the endorsement of one of the most outspoken 2nd Amendment advocates on planet earth, the Motor City Madman Himself!  Rock and Roll Legend @TedNugent https://t.co/t5mabYrBQR"
189,2022-07-26 22:48:46+00:00,1552063406462550016,Proud to have the endorsement of America's Sheriff @SheriffClarke Let's get it done.  https://t.co/A7IS2RPD3d https://t.co/8nAkD9sGxt
190,2022-07-26 22:04:21+00:00,1552052227338027011,Never-Trump Republicans and Democrats have pulled out all the stops to keep Trump off the ballot in 2024. We the PEOPLE will make our voices heard in 2022 and 2024 🇺🇸
191,2022-07-26 21:43:51+00:00,1552047070160113664,I'll take former Florida Attorney General @PamBondi  and President Trump's endorsements any day. They are REAL America 1st all day everyday and so am I. https://t.co/A7IS2RPD3d https://t.co/qaEfu6QwO0
192,2022-07-26 21:20:05+00:00,1552041088013066240,"Not Fun Facts: It took from our founding to 1981 to have 1 trillion in debt. IF you earned $1 per second, it would take you 31,688 years to make a trillion dollars. The U.S. is somewhere around 30 Trillion in debt. Thanks to tax and spend politicians like Newhouse."
193,2022-07-26 18:50:05+00:00,1552003338350350337,The FBI played a role in censoring sensitive info about Hunter Biden ahead of the 2020 election. Demand accountability. Charge and arrest those responsible.
194,2022-07-26 16:35:34+00:00,1551969485464018944,AND these two when they ask why:  Tenth Amendment. https://t.co/3H71w2o6OX
195,2022-07-26 08:42:04+00:00,1551850328630235136,Eyes wide opened.  The swamp wants to keep its swamp creature @RepNewhouse.  Newhouse doesn't care about right or wrong and he certainly doesn't care about his constituents. He cares about the money and position and power. We the People have to send a clear message with our vote. https://t.co/loL4QYfelw
196,2022-07-26 05:41:25+00:00,1551804866191769600,If you want to be offended then be offended.  The media and the left are going to be offended a lot after this next election.  It's time conservatives stopped caring if they are or not. https://t.co/5HvIfQQruF
197,2022-07-26 02:29:47+00:00,1551756639962685441,Not surprised in the least. https://t.co/lvnIs5SAiT
198,2022-07-26 01:16:57+00:00,1551738310137155584,"Liz Cheney, Adam Kinzinger, and RINOs like @RepNewhouse have turned their backs on the issues voters care about. 

Unseat each and every one of them!"
199,2022-07-26 00:44:32+00:00,1551730151515234304,"Being a small business owner is tough, I know, I was one for well over 20 years.  It's even tougher when we have economic policies and out of control spending like we do now. Thanks to Biden. Newhouse has voted for the big government spending every step of the way. #inflation"
200,2022-07-25 23:54:06+00:00,1551717459828166657,"Michigan! Vote this man in, I've met him, I've spoken to him.  He is a fighter that we need in Congress!! @votejohngibbs https://t.co/NH0i139J3Y"
201,2022-07-25 23:49:53+00:00,1551716396903563264,Biden’s White House told us inflation was “transitory.” It wasn’t. Will they lie about a recession too?
202,2022-07-25 22:46:54+00:00,1551700546658000896,"Never give in, always stand. https://t.co/9ehNn11J1K"
203,2022-07-25 22:38:06+00:00,1551698334867329024,"Has anyone seen any of the dark money PAC's that support @RepNewhouse  going after the Democrat in this race or even see them helping we the people in 2020 to unseat dictator inslee?  Nope, didn't think so, it's not about helping anyone but the machine in DC. Follow the money."
204,2022-07-25 19:28:08+00:00,1551650527632580608,"Under Democrat leadership, the border is being invaded, crime is sweeping cities, and the dollar is getting devalued.

They are unfit to lead our country."
205,2022-07-25 18:05:34+00:00,1551629746177314816,"""Culp is uneducated"" How many times have we heard that from the establishment ""elites""?  If your profession requires a degree then get one if you want to but you should never look down on anyone who chooses another path including trade school, military or other. https://t.co/AiXvORRD1d"
206,2022-07-25 18:02:08+00:00,1551628882129965057,The J6 Committee is illegitimate and Trump is the 2024 GOP frontrunner. Enough said!
207,2022-07-25 05:05:19+00:00,1551433393606254595,If you pray please say a prayer for this young man. https://t.co/DN8nDqy2x6
208,2022-07-25 00:09:00+00:00,1551358821167087617,The 4th isn't the only place with deceptive lying candidates and big DC money rolling in to protect the establishment. @joekent16jan19 is facing the same thing. Anyone who says they support America First and President Trump then fight against him and we the people is a fraud. https://t.co/9RPvXkRzXe
209,2022-07-24 23:33:20+00:00,1551349847151636481,"Wyoming, VOTE Hageman!  Can Cheney!! https://t.co/C24c2JLLal"
210,2022-07-24 22:42:00+00:00,1551336927617355776,I wonder when Biden and Newhouse will call for Ukraine to become the 51st State?  Foreign Aid to corrupt regimes is nothing more than money laundering for the rich and politically connected.  A small fraction of what Newhouse voted to send overseas could have finished the wall.
211,2022-07-24 21:53:25+00:00,1551324702085242881,Mainstream wants to keep the money stream but the status quo doesn’t cut it anymore. WE THE PEOPLE!
212,2022-07-24 19:07:09+00:00,1551282856655106048,"Here is their latest attempt. If any of it were true Bob Ferguson would have had me in prison.  This makes me smile, Newhouse is scared. His mainstream republican PACs want the status quo.  Sorry, I will work for WE THE PEOPLE, NOT PACS, Bye Bye Danny. https://t.co/wgqIHcU20Z"
213,2022-07-24 18:52:22+00:00,1551279139939766273,"Newhouse and establishment republican PACs are spending hundreds of thousands if not over a million attacking me, not anyone else, me.  I welcome it, they know we are winning and they are scared. The mud they are slinging full of outright lies will fall on them. Bring it"
214,2022-07-24 18:20:37+00:00,1551271148423225344,But....what's a woman? https://t.co/IFTzqQ1IOT
215,2022-07-24 18:19:06+00:00,1551270765240020992,Public Service Announcement. https://t.co/eRrc3sMudI
216,2022-07-24 18:15:14+00:00,1551269792354471936,"""oh probably"" https://t.co/DWvHXj1qGS"
217,2022-07-24 17:59:24+00:00,1551265809162350593,"My interview on Lars Larson, what I stand for and the attacks on my reputation.  @RepNewhouse is scared!
 https://t.co/TLnoEkiBEo"
218,2022-07-23 21:16:03+00:00,1550952911177273344,"Everyone MUST VOTE!  Do NOT stay home, that's what the left wants. Yes there were ""shenanigans"" in 2020 but smaller races are less prone to it.  VOTE! https://t.co/XkGxnRZHd1"
219,2022-07-23 19:26:04+00:00,1550925230389874688,"Okanogan County, I’ll see you Today! 5-6pm https://t.co/uM2JrFcNTd"
220,2022-07-23 18:31:04+00:00,1550911389203542017,Fat Cats in DC and @RepNewhouse every election cycle.  The rest of the time he is in bed with them. https://t.co/CNR2hOOphQ
221,2022-07-23 05:40:04+00:00,1550717362722091009,"Who voted to impeach 45,voted for Pelosi's sham J6 committee political theatre,voted for red flag laws, voted to fund planned parenthood,voted for thousands more IRS agents,voted for Trillions in more government spending,voted to send BILLIONS to other countries?Newhouse &amp; Dems."
222,2022-07-23 05:14:24+00:00,1550710900163612672,"Do NOT put your ballot in the mail, trust me, I have a friend in the USPS. Ballots are not safe, they are often thrown in the trash and are constantly mis-sorted and sent where they should not be going, massive amounts of them.  I'm told it happened in 2020 and it's happening now"
223,2022-07-23 04:48:46+00:00,1550704451614154753,This is how misinformed the left is.  They don't even know what they are talking about. https://t.co/sNoKZ2PLh3
224,2022-07-23 04:39:47+00:00,1550702188472590337,"Don't be fooled by the big money swampy PAC's that are spending MILLIONS to defame us both in print and TV.  They attacked Trump relentlessly with lies and they are doing it to us now.  We are in the way of business as usual in DC. We will win, YOU will once again have real reps! https://t.co/wAoM2dRonT"
225,2022-07-22 20:59:31+00:00,1550586361471610880,"Most of my supporters could school you on this:
The United States is not and never has been a democracy.  Article 4 Section 4; ""The United States shall guarantee to every State in this Union a Republican Form of Government, and shall protect each of them against Invasion;"" so... https://t.co/PVxkSTAad0"
226,2022-07-22 18:22:24+00:00,1550546820043984896,Honored to have @PamBondi 's endorsement! #WeThePeople https://t.co/LliOLUppnh
227,2022-07-22 18:15:15+00:00,1550545021006254080,"Like a classic car restoration, our government needs to be stripped down to the frame and the only accessories put back on have to be Constitutional."
228,2022-07-22 16:34:35+00:00,1550519686478974977,"Now do Nancy Pelosi

""Fraud is fraud is fraud, whether it occurs on the blockchain or on Wall Street,"" Damian Williams, the U.S. Attorney in Manhattan, said in a statement. https://t.co/JiA7JkHyhc"
229,2022-07-22 14:45:41+00:00,1550492282901577728,"Litigation notices sent to 25 Washington State Counties ref breaking federal and state election laws in 2020. @jasonrantz @LarsLarsonShow @BrandiKruse @Jim_Brunner 

https://t.co/e96aJFMzDP"
230,2022-07-22 06:02:12+00:00,1550360541603831808,Oops. https://t.co/1dypipMNNA
231,2022-07-22 00:18:45+00:00,1550274111334670341,"A new MAGA movement is on the horizon, and it’s going to be glorious."
232,2022-07-21 23:12:25+00:00,1550257418197577728,Very happy to have the endorsement of Veterans for America First! https://t.co/pMtHJUZCUr https://t.co/L2VPVjJ0xq
233,2022-07-21 22:52:16+00:00,1550252347787337729,"Although I've never had it despite the ""super spreader"" events we had but I'm told you do lose it. #snifferinchief https://t.co/CnVl9p5uws"
234,2022-07-21 22:33:52+00:00,1550247717766451200,"It's called 'lack of integrity'.

https://t.co/NnSu38EJCy"
235,2022-07-21 22:15:05+00:00,1550242988994859008,"A message from my friend, Congresswoman @laurenboebert https://t.co/E3zwOs7CiA"
236,2022-07-21 21:34:38+00:00,1550232809519820800,"Female Military Veteran fired during maternity leave by the Marxist WA AG @BobFergusonAG .  Story by @jasonrantz  

https://t.co/aUWtOXUPg1"
237,2022-07-21 20:01:37+00:00,1550209400987680769,The media is just now asking questions about corruption in Ukraine’s government. We were saying this months ago. Unbelievable.
238,2022-07-21 18:24:07+00:00,1550184863642402816,"Dr. Fauci and Biden took the shots, got COVID, and get to keep their jobs.

Those who refused to comply were fired and shunned from society."
239,2022-07-21 16:59:06+00:00,1550163470615687169,"Newhouse has the super pac's backing him with HUGE money.  I have you and will always stand for you. I need your help to fight for our country! Together, we can do this, they are scared! Please donate $17.76 or more TODAY, here:  https://t.co/z1ZfKwDsLN"
240,2022-07-21 16:33:45+00:00,1550157088470380544,"Finally something positive in his term.

https://t.co/LvhhjffsLC"
241,2022-07-21 16:25:35+00:00,1550155036553928704,He is a real POS. https://t.co/udG29pNSK1
242,2022-07-21 16:06:59+00:00,1550150355505201153,"Newhouse and his handlers in Super PAC's are spending big money on a smear campaign against me before the primary.  They want to keep their puppet @RepNewhouse in office for business as usual....Won't work, I stand for we the people, he stands for them."
243,2022-07-21 15:51:23+00:00,1550146428332171264,"I support small farmers and ranchers!  The PRIME act should be passed and I will support it when in Congress.
@RepThomasMassie is correct. Local is better and it's none of the Federal Governments business. https://t.co/amj6HAqiRk"
244,2022-07-21 00:46:47+00:00,1549918776774238208,"I would just like to point out that NOT breaking the law is the best way to avoid all charges. If you are detained DO NOT put your hands where the officer can't see them. ""Let me see your hands"" is code for I'm going home to my family. https://t.co/F4XbHWfBfs"
245,2022-07-21 00:19:48+00:00,1549911989274628096,A vote for less government and more freedom. https://t.co/oygrnbawwe
246,2022-07-20 22:18:11+00:00,1549881383316701184,Let's start a list of things that are not taxed or regulated by the Government.....
247,2022-07-20 21:46:08+00:00,1549873316961259520,"The U.S. needs to heed the words of Thomas Jefferson ""friends with all nations, entangled alliances with none"" The corrupt UN and WHO need to be cut from U.S. tax payer money and kicked from our shores. They can take globalist big spending Newhouse with them."
248,2022-07-20 20:07:22+00:00,1549848459053715456,"Exactly WHY the left wants to disarm us. I will always fight to protect your right to defend yourself, your family and your country. https://t.co/yX8mEOa7p9"
249,2022-07-20 08:43:27+00:00,1549676347512893440,Good people with guns stop bad people from killing others but our government won't let this happen in Schools.  That must change. https://t.co/aSItamtO5r
250,2022-07-20 07:17:47+00:00,1549654789662748672,"Here is the link to the files discussed tonight:  https://t.co/4PeHHF7k49...
For information on Jerrod Sessler's fake degree from the diploma mill, Kennedy Western University, click this link:  https://t.co/33A1dk3zQo"
251,2022-07-20 02:00:18+00:00,1549574893536063488,"Loren Live! - Newhouse, Sessler, the Chinese and...the Mafia?: Loren Sets the Record Straight https://t.co/eYbXYQp2j1"
252,2022-07-20 00:41:31+00:00,1549555065391747072,"The cure is removing the radical left and RINO's who vote with them, then following the Constitution. https://t.co/pCBHYHDkP4"
253,2022-07-19 23:02:09+00:00,1549530059676925952,Amazing https://t.co/cxXSrzzmND
254,2022-07-19 23:00:50+00:00,1549529728545169413,"MAGA kept our country rich, strong, and safe.

Build Back Better made our country poor, weak, and dangerous.

Vote MAGA in November."
255,2022-07-19 21:50:28+00:00,1549512017970700290,"Now Biden wants to declare a climate “emergency” 

As if this senile puppet hasn’t wrecked the economy enough."
256,2022-07-19 20:04:39+00:00,1549485389127200768,"I welcome the attacks, it means we are winning.  That's all they got. https://t.co/4NNiuSPiZE"
257,2022-07-19 19:23:10+00:00,1549474948246343680,AOC and the rest of her Fraud Squad are an embarrassment to Congress and the United States.
258,2022-07-19 05:50:56+00:00,1549270543215382529,YOU should have demanded that you vote NO on big government spending bills instead of your yes vote. YOU should have demanded that YOU didn't sent BILLIONS to protect another countries border while ours is being invaded. YOU should have demanded YOU resign. #hypocrite https://t.co/edN355kKwf
259,2022-07-19 01:37:31+00:00,1549206768684863491,"That's how this works, right? https://t.co/x7QbKdTT4o"
260,2022-07-19 01:12:09+00:00,1549200385339863040,"My interview with @DanNewsManBall on @OANN from today. Please retweet.
https://t.co/SuDXQXoIdq"
261,2022-07-18 22:35:19+00:00,1549160919229407233,"Steve Bannon is INNOCENT!

Free the J6 political prisoners and end the DC show trials."
262,2022-07-18 22:22:51+00:00,1549157782200340483,'All that is necessary for evil to triumph is for good people to do nothing' https://t.co/uIwvcVjyyN
263,2022-07-18 22:10:40+00:00,1549154714008203264,I will be on the @DanNewsManBall show today on @OANN Let Freedom Ring! https://t.co/HwCVqL8lgb
264,2022-07-18 21:58:12+00:00,1549151575599222784,"I know that a lot of Democrats, 10's of thousands of them, voted for me in the 2020 WA Governors race, because I hear from them, I've talked to them, I saw the vote. Now is the time to wake up your friends.  Unplug from CNN, unplug from the now radical D party. #WalkAway Watch👇 https://t.co/tStyklB48J"
265,2022-07-18 21:28:40+00:00,1549144145171623936,Thank YOU! You are not alone @BrandonStraka is doing a great job with the  #WalkAway movement. https://t.co/wdSzilHnnq
266,2022-07-18 20:19:00+00:00,1549126611739475970,"This isn’t Joe Biden’s administration.

It’s Obama’s third term."
267,2022-07-18 18:29:50+00:00,1549099138511523840,"Dr. Fraudci has finally announced his impending retirement.

This criminal bureaucrat should spend the rest of his life rotting in a jail cell!"
268,2022-07-18 05:27:25+00:00,1548902239279845376,Yep! https://t.co/6OAjBfRVQG
