,Created at,User ID,Text
122,2015-05-08 20:38:13+00:00,596776137730166785,Congratulations to all of the participants.  I'm so very proud of you and your talent! http://t.co/4fRt0RrZC1 via @youjoomla
123,2015-05-05 22:50:39+00:00,595722301313789952,Joining w/ all of you in celebrating #CincoDeMayo and Mexican Americans' rich history and contributions to US culture!
124,2015-04-29 23:54:02+00:00,593563925096099840,I hope you will join me &amp; @RepRobinKelly this Sat. (5/2) at @cdrewu in a review of the fed. government's response to #HIVAIDS
125,2015-04-28 22:28:58+00:00,593180131264462848,Thank you @blackenterprise for covering this important issue!  Take a look: http://t.co/f3Fd8AYyu4
126,2015-04-28 18:53:00+00:00,593125780726636545,What a wonderful picture.  Thank you so very much! https://t.co/61K82LlBzq
127,2015-04-25 21:23:43+00:00,592076544706613248,My thoughts and prayers are with the families and loved ones of all those impacted by the #NepalQuake
128,2015-04-25 15:06:28+00:00,591981607445143552,"While I applaud DOJ for a thorough #ComcastTWC review, #fcc needs to finish media ownership review &amp; tackle the lack of ownership diversity"
129,2015-04-22 14:51:13+00:00,590890604634251265,"Federal study shows student loan troubles persist, especially for poor, elderly http://t.co/isiPQ8IatO via @pittsburghpg"
130,2015-04-21 19:34:29+00:00,590599506598723585,Headed to the @HouseFloor to defend the CFPB from more Republican attacks. Consumers need a strong and fully funded watchdog #handsoffcfpb
131,2015-04-21 19:29:00+00:00,590598123694718978,Congratulations @DailyBreezeNews and the LA News Group for winning the local reporting @PulitzerPrize! What a prestigious honor!
132,2015-04-16 17:44:32+00:00,588759894427209728,With my dear friend @GloriaSteinem and the esteemed @BarbaraBoxer #TBT http://t.co/Op0iU4DGOt
133,2015-04-16 14:22:50+00:00,588709136558198784,"#LorettaLynch has now been waiting an unprecedented 23 weeks to be confirmed, and she has the votes. Where's the leadership? #confirmlynch"
134,2015-04-15 21:17:22+00:00,588451067387490304,Nigeria marks anniversary of Boko Haram schoolgirl kidnappings http://t.co/lHst1KhrAy via @YahooNews
135,2015-04-15 21:16:57+00:00,588450964467617792,"I'm wearing red today, commemorating the 1 year anniversary of the #BokoHaram kidnapping of 276 girls. #BringBackOurGirls"
136,2015-04-15 14:22:53+00:00,588346761397272576,I'm very pleased State AGs are supporting the students!  Take a look: http://t.co/oVuKIm9bPu via @HuffPostPol #Corinthian100
137,2015-04-15 14:12:31+00:00,588344153727234048,Maxine Waters Works to Shrink Wealth Gap http://t.co/dprPP8GnTf via @sharethis
138,2015-04-14 23:30:43+00:00,588122241457590273,"Thinking about these girls, still missing one year later #BringBackOurGirls  https://t.co/TIz5GPG6LS"
139,2015-04-14 23:22:35+00:00,588120193899036674,It's not enough to talk about income inequality &amp; the wealth gap.  Words must be met w/ actions and a commitment to change #EqualPayDay
140,2015-04-14 23:14:07+00:00,588118062588624896,Women on average make .78 for every $1 men make.  It's time to close the wage gap! #EqualPayDay #EqualPayNow
141,2015-04-14 23:04:29+00:00,588115637366579200,Hispanic women's salaries were just 54% and African American women's salaries were just 64% of what men earned in 2013 #equalpayday
