,Created at,User ID,Text
112,2022-02-05 22:01:51+00:00,1490083274223403009,"As your Congressman, I will lead with unwavering principles, unrelenting determination, and unmatched toughness to stand firm and do what’s right. It’s the East Texas way. #toughprovenconservative https://t.co/GyDufCpXWN"
113,2022-02-04 18:42:32+00:00,1489670726634422281,I've always enjoyed having the opportunity to work hard in a free country! https://t.co/EGjLnwejrh
114,2022-02-01 20:38:47+00:00,1488612819582992385,"Signs going up in Hideaway, Tx.
If you would like a yard sign contact our campaign!#CD1 https://t.co/6Mn0GaA4gi"
115,2022-02-01 02:01:38+00:00,1488331676140855303,Thank you to the Henderson Area Chamber of Commerce for the opportunity to speak at tonight’s candidate forum. Great turnout. Enjoyed being able to talk about the issues that are important to the people of Henderson. #CD1 https://t.co/9cFp0W3r2T
116,2022-01-29 04:27:09+00:00,1487281133444386819,I am honored to be endorsed by @TXRightToLife #ProLife #CD1 https://t.co/XCXbQyhXVW
117,2022-01-28 19:34:53+00:00,1487147185523277829,Thank you @ETx4Liberty for all that you do to promote conservative values. I am honored to have your endorsement. #CD1 https://t.co/6xUl3uSMbt
118,2022-01-28 01:48:42+00:00,1486878872008286211,"Enjoyed speaking at the Sabine County Republican Party Forum. Thank you all for coming out tonight and standing for faith, family, and freedom! https://t.co/yX4on38urp"
119,2022-01-22 22:27:52+00:00,1485016392269246466,"Historic March for Life yesterday.  Life begins at conception. Let’s work to protect it. 

#proudlyprolife
#overturnRoe"
120,2022-01-21 21:42:02+00:00,1484642470579392513,Signs going up in Bowie County! Go to our website if you would like to volunteer or need a sign. #CD1 https://t.co/7o5PqqyKHl
121,2022-01-20 21:37:58+00:00,1484279055394516998,"Enjoyed getting to meet so many great people today in San Augustine, TX.  Rich history.  Hard working folks who love their families and community.  #CD1 https://t.co/4Bvxzj7WEB"
122,2022-01-19 22:23:13+00:00,1483928056498692103,Very proud to receive this strong endorsement from @GAWTP. A big thank you to them for standing strong for liberty for so many years. Keep up the great work! https://t.co/aYZ3vlq4HQ
123,2022-01-19 19:22:01+00:00,1483882457191657476,"Enjoyed being at Vera Bank in Henderson, TX for the ribbon cutting with Conterra Networks. This growing partnership will help with rural broadband and with economic development. #CD1 https://t.co/56q31Ev9bz"
124,2022-01-18 19:30:55+00:00,1483522308694110210,Thank you Kelly and The Longview Chamber Of Commerce for giving me the opportunity to speak about issues that are important to you all. #CD1 https://t.co/m7AaiVNkCi
125,2022-01-18 01:31:04+00:00,1483250556806205444,Thank you to the Cherokee Rose Republican Women for all that you do in the community. Enjoyed being able to speak to such a wonderful group of people! #CD1 https://t.co/03lE1WTQ6D
126,2022-01-17 18:28:17+00:00,1483144157212422149,“I have a dream.” May we continue to embrace the words of Dr. Martin Luther King Jr. https://t.co/wUcTjpcwvg
127,2022-01-15 23:53:15+00:00,1482501163756961794,"Praying fervently for the safety of those at Congregation Beth Israel, and for their release from danger."
128,2022-01-15 23:36:57+00:00,1482497059626364929,The Panola County Republican Women Cookies with Candidate was a great success today. Thank you to all who hosted us and to everyone who attended. I look forward to building a strong relationship with the people of Panola County. #CD1 https://t.co/fWXxBnXqAI
129,2022-01-15 04:05:37+00:00,1482202287388962816,"What a great day of traveling across the district and meeting community leaders in Camp, Titus, and Marion county. We are all so blessed to live in East Texas. #CD1 https://t.co/WCfB7dcV52"
130,2022-01-14 17:50:05+00:00,1482047379448676352,"It’s a beautiful day in Pittsburgh,TX! 
#CD1 #CampCounty"
131,2022-01-12 01:47:56+00:00,1481080472209956866,Great turnout in Texarkana for the Texarkana Republican Women candidate forum! Thank you to the Texarkana Republican Women for giving me the opportunity to speak. #CD1 https://t.co/qHcI3hpGLa
132,2022-01-11 15:09:54+00:00,1480919908213047307,Thank you @StaceinTexas for hosting all of us last night at the East Texans 4 Liberty candidate forum. Thank you all for your grassroots involvement. #CD1 https://t.co/gemQLlaEBg
133,2022-01-09 19:23:25+00:00,1480258929309454352,"Today, on #NationalLawEnforcementAppreciationDay, we reinforce our appreciation for the daily sacrifices our officers make to keep our communities safe. Thank you. #LEAD2022 https://t.co/32LR5eiSBD"
134,2022-01-07 16:48:51+00:00,1479495257398067200,I enjoyed meeting everyone last night at the Panola Republican Party candidate forum. Thank you for the opportunity to talk with you all.#CD1 https://t.co/A8KUZ5xJRr
135,2022-01-07 00:11:56+00:00,1479244373099491334,I am so grateful to everyone who has supported my campaign. #CD1 https://t.co/5UYTBoZrf6
136,2022-01-06 20:10:06+00:00,1479183513995862022,I hope you’ll all come out to @GAWTP candidate forum for Congressional District 1 next week! I look forward to discussing my proven conservative record. #CD1                                                https://t.co/PfiqtTFlon
137,2022-01-05 13:17:24+00:00,1478717266934050824,These are the results when you prioritize liberty and allow businesses to grow! Grateful to live in Texas!#CD1 https://t.co/bCduuzvqLZ
138,2022-01-01 16:01:33+00:00,1477309023875735555,Happy New Year! https://t.co/DhQYNoNCII
139,2021-12-31 21:51:46+00:00,1477034774539739142,East Texas is very proud to see the @KCRangerettes at the @CottonBowlGame today! #CFBPlayoff #Kilgore #CD1
140,2021-12-24 01:55:16+00:00,1474196949528162312,All the county ballot drawings for CD1 are done! Thank you to the community leaders across the district who have been so welcoming to me this week. https://t.co/IRlh2hry2F
141,2021-12-22 17:58:42+00:00,1473714627787862021,"Looking forward to seeing everyone at Uncle Joe’s Coffee at 6:30 in Gilmer, TX tonight! #upshurcounty #CD1 #gilmer"
142,2021-12-21 23:12:13+00:00,1473431140673503243,Looking forward to making more trips to Panola County. Thank you to the county staff for putting on the Panola County Ballot Draw. #carthage #panolacounty #CD1 https://t.co/XyPcu6cWcH
143,2021-12-20 23:10:08+00:00,1473068229811748866,"Thank you to the Texarkana City Manager, Dr. David Orr, and his staff for a very productive meeting. Thankful for the meetings with city and business leaders in Northeast Texas today. #cd1 #TAPintoTEXARKANA https://t.co/WXHX1Ds3zv"
144,2021-12-17 20:32:25+00:00,1471941372773031938,What a great turnout for the Republican Women of Harrison County. Thank you for all of your hard work! #marshall #CD1 https://t.co/joZWU3bttI
145,2021-12-17 17:39:44+00:00,1471897915245355008,"Had a wonderful meet &amp; greet at Joe Pine Coffee in Marshall, Texas! #marshall #cd1 https://t.co/olCsnmYJfu"
146,2021-12-11 01:22:27+00:00,1469477648090939402,"My record of cutting taxes, supporting law enforcement, and fighting for personal liberty is resonating across East Texas, from Center to Texarkana and everywhere in between.

#TX01 #provenconservative"
147,2021-12-11 01:22:27+00:00,1469477646685937669,"In the first 7 days of the campaign, we’ve raised over $100,000 with over 150 endorsements by East Texas conservative, business, and community leaders.

Kyna and I are overwhelmed by the outpouring of support we have received since announcing my campaign for Congress."
148,2021-12-03 22:03:55+00:00,1466890969358512137,What a wonderful lunch with the @ARTXRedi Board of Directors in Texarkana! Great first day on the campaign trail in Bowie County. Thanks to you all and so many more for spending time with me today. #tapintotexarkana https://t.co/CQAVYz0LdM
149,2021-12-02 16:07:41+00:00,1466438935014424580,"My wife, Kyna, and I are ready to fight for America’s future. I hope you will stand beside us in that fight. #letsdothis 4/4"
150,2021-12-02 16:07:41+00:00,1466438932732825614,"To those I haven’t met yet, please know you can count on me to never back down and always stand tall for the strong conservative and moral values that bind us together. 3/4"
151,2021-12-02 16:07:41+00:00,1466438931323437063,"I hope and believe that those who have served with me these past few decades would say that I lead with unwavering principles, unrelenting determination, and unmatched toughness to stand firm and do what’s right. 2/4"
152,2021-12-02 16:07:40+00:00,1466438930077831169,"Today I announced my candidacy to serve in Congress, TX-1. I am grateful to @SenBryanHughes and so many more strong, conservative East Texas leaders for encouraging me in this race. 1/4"
