,Created at,User ID,Text
235,2022-05-18 02:08:25+00:00,1526746500675477505,"Watching to see how many Trump-backed candidates who lose decide to adopt their own versions of ""my election was rigged"" to keep on grifting."
236,2022-05-17 20:50:57+00:00,1526666606381699078,Live tweeting it is. https://t.co/svLNLXIabW
237,2022-05-16 22:28:48+00:00,1526328844415664128,"You can order free at-home tests once a month if you live in Washington (or Minnesota, apparently): https://t.co/HIrQ9Z3SMr

And here's the USPS link for anyone in the country. A third round is now available: https://t.co/bFREqsO5HL"
238,2022-05-16 21:14:19+00:00,1526310096522706944,Can't get it out of my head don't want it out of my head https://t.co/RBjjYrGtdT
239,2022-05-16 20:39:26+00:00,1526301320176496640,Please settle this for me.
240,2022-05-16 20:38:18+00:00,1526301033521029120,"I apologize for not live-tweeting the North Rhine-Westphalia state election results this weekend. I know this is the content you crave, and I will do better next time."
241,2022-05-16 00:37:21+00:00,1525998803991482368,5.5 million views in 16 hours: https://t.co/EaJvF81Hwz https://t.co/y4BBQA1vaz
242,2022-05-14 00:08:29+00:00,1525266765214720000,"Statewide COVID-19 Hospital Occupancy is up 35% over the last 2 weeks.

Data: https://t.co/g43RnroBfc https://t.co/fxWgTt0nZO"
243,2022-05-13 15:16:01+00:00,1525132765326241793,"The pandemic and its knock-on effects continue harming the country. But since the White House insists the difficult parts of the pandemic are behind us, they are left with a bunch of pandemic-connected economic and social problems they cannot convincingly explain or solve."
244,2022-05-13 14:42:36+00:00,1525124354287095808,"“New, more contagious subvariants of omicron are making their way through the U.S. population, leading not only to rising first-time COVID-19 cases but also frequent reinfections.”

https://t.co/lfwdWbA6FW"
245,2022-05-12 02:58:20+00:00,1524584734352834560,"My cousin John regularly completes amazing athletic feats, but I have perfected the art of lying on the couch and wishing I hadn’t left my orange soda just outside arm’s reach. https://t.co/plXwpWi6Be"
246,2022-05-11 03:53:34+00:00,1524236244284100608,The Nebraska Secretary of State finishing below 50% against two far-right kooks feels mighty ominous. https://t.co/u5Jw66pc50
247,2022-05-10 01:40:17+00:00,1523840315722928128,A very good boy https://t.co/zP0d1o2QLf
248,2022-05-09 19:38:03+00:00,1523749157659312128,I'd never looked into the technical details of joining the EU until a few weeks ago but it's quite an interesting constitutional and lawmaking process. Ukraine is moving quickly to make it happen. https://t.co/j2CVGilKOc
249,2022-05-09 14:23:24+00:00,1523669970537705473,"“Historians believe that the Marcos dictatorship was marked by 3,257 known extrajudicial killings, 35,000 documented tortures, 77 'disappeared', and 70,000 incarcerations.

Some 2,520 of the 3,257 murder victims were tortured and mutilated before their bodies were dumped”"
250,2022-05-09 14:18:34+00:00,1523668755322048513,https://t.co/b67vzmNVgJ https://t.co/PxAnEA1Kxo
251,2022-05-08 16:02:30+00:00,1523332521819185152,Lots of Easter Eggs in primary election results caused by the boundaries of TV markets. Here's the August 2012 WA gov primary. Minor Dem candidate (Hill) got 3% statewide but 10%+ in 5 counties. Why? All 5 are in the Portland TV market and Inslee's campaign didn't run ads there. https://t.co/WfYm8qg6PR
252,2022-05-08 15:46:58+00:00,1523328614787272704,See if you can guess which TV markets Ohio gubernatorial candidate John Cranley bought TV ads in https://t.co/GOTTi0zhNT
253,2022-05-08 03:31:01+00:00,1523143408654569472,Mélenchon went on French TV the night Macron was re-elected and proclaimed his new coalition the Third Estate https://t.co/Gc1Vsn9E8L
254,2022-05-06 20:58:13+00:00,1522682169205747714,"Boris cost his party hundreds of seats in yesterday’s local elections, but there’s no one popular enough to replace him as party leader so on and on he goes.

https://t.co/yCr1OmEuAO"
255,2022-05-05 20:29:27+00:00,1522312539417104384,Be on the lookout for some of your favs in this video celebrating the 75th YMCA Youth Legislature (currently in session!) https://t.co/Mx6ZWdE5GA https://t.co/JoRFN1yN4V
256,2022-05-05 19:33:43+00:00,1522298513261940736,"Omicron BA.4/BA.5 are driving the wave in South Africa

BA.2.12.1 is driving the wave in New York and New England

BA.2 was the most commonly detected lineage in WA in the most recent week of reporting (Apr 17-23), but BA.2.12.1 prevalence was increasing: https://t.co/gDGDEOM3bP https://t.co/kQ9EN7Exhg"
257,2022-05-05 00:38:22+00:00,1522012794304057344,"Data

CDC's community transmission map: https://t.co/YqazoPcfRm

WA DOH dashboard with disease activity and hospital use data: https://t.co/g43Rnr70nE

Reported COVID-19 Reinfections in Washington State (PDF): https://t.co/kEAioXx2Di"
258,2022-05-05 00:35:53+00:00,1522012169583218689,"Last one is from today's Reported COVID-19 Reinfections in Washington State update... reinfections can and do happen, especially with Omicron variants.

44,200 reinfections reported in WA since last fall... count is once again trending upwards. https://t.co/U3tk9uEyiJ"
259,2022-05-05 00:27:55+00:00,1522010166698332161,Hospital occupancy never dropped much after the January Omicron wave because of postponed surgeries and other strains on our health care system... occupancy now trending back up https://t.co/v9ZHxSwpe2
260,2022-05-05 00:25:19+00:00,1522009509773725696,Latest R-effective (estimated disease transmission) is 1.84... one of the highest values since the pandemic began https://t.co/T66oHWWgre
261,2022-05-05 00:12:38+00:00,1522006318613024768,"A few maps and charts I am paying attention to today 🧵

Community transmission levels here in Washington https://t.co/Z5KHrgNQgU"
262,2022-05-04 14:36:06+00:00,1521861230763204608,"Toss-up seat in NW Ohio. Could be back at the U.S. Capitol next January 6th, but this time as a Member of Congress! One more thing at stake in the 2022 election. https://t.co/X2Cqu803ag"
263,2022-05-04 03:05:37+00:00,1521687463672000513,"""No, it can't possibly only be Tuesday,"" he told himself. 
He checked his phone again, realized it was true, and let out a long sigh."
264,2022-05-04 00:43:35+00:00,1521651718492082178,Big crowd outside the Temple of Justice gathering in support of the right to choose https://t.co/zJxUhFAkL6
265,2022-05-02 23:24:34+00:00,1521269446966272001,"Data

https://t.co/g43RnroBfc

https://t.co/EN8F9rKtCi

There's a note on today's update indicating total case counts may include up to 3,200 duplicates. Still the largest one-day increase since February 11 even taking this into account."
266,2022-05-02 23:24:34+00:00,1521269445628293120,"Washington reported an additional 12,193 cases today, the largest one-day increase since February 11.

It's a great time to get that booster shot you may have been putting off: https://t.co/CMkWHEkNPo"
267,2022-05-01 18:36:42+00:00,1520834613068804096,"Anyways, I recommend you read the whole article, maybe twice.

https://t.co/TEujf5FWvi"
268,2022-05-01 18:36:41+00:00,1520834612011798528,"There’s just too much demand for too little housing in America today. Rising rates will make it more expensive to access equity. But this equity, Mr. Zandi said, “will prove largely durable.”"
269,2022-05-01 18:36:41+00:00,1520834610942291969,"""Homeowners who recall the 2008 housing bust may feel nervous. But this is a very different housing market, said Zandi, Moody's chief economist.

Price growth will most likely slow now that interest rates are rapidly rising, but economists generally don’t expect prices to fall."""
270,2022-05-01 18:36:41+00:00,1520834609881120773,"""It’s also inseparable from the housing affordability crisis for those who don’t. For them, rents are rapidly rising. Inflation is whittling away incomes. And the very thing that has created all this wealth has pushed homeownership as a means of wealth-building further away."""
271,2022-05-01 18:36:41+00:00,1520834608849252353,"""Most of this money has been created by the simple fact that housing, in short supply and high demand across America, has appreciated at record pace during the pandemic. 

It’s a remarkably positive story for Americans who own a home"""
272,2022-05-01 18:36:40+00:00,1520834607872045058,"“It’s not that they’re not doing anything; it’s that they’ve aggressively blocked development in so many places.”

This wealth has been created, he said, precisely because it’s so hard to build housing in America. And that could make the case for building more of it harder still."
273,2022-05-01 18:36:40+00:00,1520834606697615360,"“There’s actually something that’s kind of pernicious about this,” he said. In a sense, millions of people have made trillions of dollars the last two years by doing nothing.

“But it’s worse than that,” he continued.

https://t.co/TEujf5FWvi"
274,2022-05-01 16:40:38+00:00,1520805406670417921,"Data

https://t.co/meiaIqgpai

https://t.co/bcKVhkwmze"
275,2022-05-01 16:40:38+00:00,1520805405361799168,"Covid is on the rise in WA again. Booster shots are the best protection available.

40% of Washingtonians who are eligible for a booster don't have one yet, including 23% of eligible seniors.

You can book a booster today if that's you or someone you love: https://t.co/CMkWHEkNPo https://t.co/NNA7OIu0fz"
276,2022-04-29 15:20:54+00:00,1520060565359497216,“Falling deaths at the barrier went from zero to 16 during that time”
277,2022-04-29 15:20:26+00:00,1520060445272408069,"“Since 2019, when the barrier’s height was raised to 30 feet along much of the border in California, the number of patients arriving at the UC San Diego Medical Center’s trauma ward after falling off the structure has jumped fivefold, to 375”

https://t.co/JTD3ymjn2x"
278,2022-04-28 23:30:07+00:00,1519821293314461697,"There's an Office episode where Kevin has an idea about where to put cookies in the vending machine, and Robert California thinks Kevin is trying to make an insightful point, until Robert realizes no, it was just actually cookies the whole time.

Thinking about that a lot lately. https://t.co/dKee4QuDdX"
279,2022-04-28 21:09:11+00:00,1519785823511584768,"When he was a state legislator @brucedammeier voted against marriage equality. I've never heard him say he's changed his mind (maybe he hasn't?) He does not support the LGBTQ+ community, and the legal pretzel he's created to stop the Pride flag from being flown is shameful. https://t.co/AzGQWSNyiZ"
280,2022-04-28 04:01:22+00:00,1519527164395225088,"One of my closest friends from high school went through this culinary program and loved it. It’d be a real shame for the whole state if it were to shut down.

https://t.co/2uB6ITtkC6"
281,2022-04-28 02:43:53+00:00,1519507665356873728,"“After the breakup of the Soviet Union, the Sevastopol facility was used by Ukraine to train dolphins for therapy sessions. 

Russia resumed the training of military sea mammals after taking control of the port city in 2014.”

Priorities!

https://t.co/TQDgtAPhKc"
282,2022-04-28 01:13:29+00:00,1519484918916476928,"Margin on these grew to 56-44 and 57-43 after more ballots were counted. Raw vote increases for each side compared to February show why running robust turnout campaigns for levies can make a difference:

Prop 1: Yes +5,275 from Feb, No +170
Prop 2: Yes +4,990 from Feb, No +470 https://t.co/5OiTgcSmPO"
283,2022-04-27 19:26:10+00:00,1519397512934658048,They've got our hopes and dreams right where they want them https://t.co/tazvZ2APle
284,2022-04-27 03:38:55+00:00,1519159130216296449,And a whole bunch of educators and classified staff who helped out. And community members. Lots of people! Teamwork.
285,2022-04-27 03:36:56+00:00,1519158628569075718,"Congrats to the parents, students, and organizers in the Bethel School District who completely flipped the outcome of their school levies from February to April 🏫 https://t.co/tlYP6CWkTL"
286,2022-04-26 21:31:10+00:00,1519066582974013440,"Elected sheriffs have been a consistent source of public corruption and abuse of power for as long as they've existed, but the overall political and social climate is only going to make it worse."
287,2022-04-26 21:27:59+00:00,1519065780519809029,The decay of democratic norms in our society + the practice of electing sheriffs = more and more situations like this one in the years ahead. https://t.co/yE5k9lZOas
288,2022-04-26 15:06:33+00:00,1518969789930106882,"Rate of increase is often even higher in rural counties. For example, median sale price is up 57% in King County over last 5 years vs. up 240% in NE WA Stevens County, pop. 46,445. Not just a Puget Sound regional problem.

https://t.co/NPzgMSRQoY
https://t.co/0BIrrSqmvc https://t.co/AB7AFMeD9w"
289,2022-04-26 14:59:30+00:00,1518968013914972160,Statewide the median sale price of all home types is up 74% over the last 5 years: https://t.co/KsBhJrmfjD https://t.co/O20muWZf3N
290,2022-04-26 14:40:17+00:00,1518963180684206080,"“Prices in the Seattle area were up 26.6% from a year earlier, the seventh biggest year-over-year jump among the cities the index tracks.”

https://t.co/Bh4GE6NcGl"
291,2022-04-26 04:35:31+00:00,1518810984688717829,Imagine being told to “make the signature illegible” and understanding that to mean “write ‘signature illegible’” https://t.co/GWs1DEmLdp
292,2022-04-25 19:14:20+00:00,1518669759767711744,"I assume the new owner of Twitter is going to let Trump back on here, and I’m not really sure what impact that’s going to have on American politics, and I’m not looking forward to finding out."
293,2022-04-25 00:49:02+00:00,1518391598194696192,They can't just win a narrow victory in a primary. They'd need to win a majority of votes in the general election against whoever else advances out of the primary. Much more difficult task than Trump candidates elsewhere.
294,2022-04-25 00:44:23+00:00,1518390428311048192,"Le Pen hopes her party can gain seats in the June legislative elections. But voting occurs in 2 rounds, and the French usually unite around the not-far-right candidate in their district in the 2nd round.

Notably, this is the same problem Trump's candidates face in WA-03 &amp; WA-04."
295,2022-04-24 20:26:12+00:00,1518325455954210817,"26 days until the filing deadline.
100 days until the primary.
198 days until the 2022 general election."
296,2022-04-24 19:58:46+00:00,1518318550720532481,Why is everyone leaving right after the victory speech? This Is Fun and We Are Having A Good Time!
297,2022-04-24 19:16:17+00:00,1518307859678720001,"We are Grassroots and Spontaneous with Enthusiastic Supporters. Tonight we Let Loose, but Not Too Loose."
298,2022-04-24 19:04:55+00:00,1518304999515693056,Macron victory party has the same manufactured pop culture vibe of those Mike Bloomberg rallies in late 2019. Lots of People Dancing and Having Fun with a Hip DJ.
299,2022-04-24 18:04:07+00:00,1518289699650949121,"Macron defeats Le Pen 58-42 according to projections by French pollsters.

One less thing to worry about."
300,2022-04-24 15:07:56+00:00,1518245359989837824,"The world we live in: ""Putin sincerely believes in the nonsense he hears on television and he wants to win big."" https://t.co/KggVL5TEqs"
301,2022-04-24 14:08:55+00:00,1518230509385445377,"TL;DR: French voting ends an hour earlier outside major cities, they begin counting votes immediately, and by the time polls close everywhere there are enough real results to model the final nationwide results very accurately.

Projections come at 11am PT
https://t.co/8Z12gXrf3s"
302,2022-04-23 21:53:16+00:00,1517984977392369664,"The new GOP nominee for Michigan Secretary of State is a true believer in 2020 election conspiracies. She'd be in charge of the 2024 elections if she won this fall, and while I'd like to think her views make her unelectable, I'm really not sure anymore!
https://t.co/JQtRggpEYY"
303,2022-04-20 19:39:18+00:00,1516864101363830785,Le Pen is now holding up a piece of paper with a tweet printed out on it
304,2022-04-20 19:22:19+00:00,1516859828605382656,"English-language broadcast. So far it's a pretty dry discussion of the cost of living and energy prices, the number one issue for voters near and far.

https://t.co/pGmpJ9IEWN"
305,2022-04-20 19:17:59+00:00,1516858737440350211,Convenient of them to schedule this during my lunch hour
306,2022-04-20 19:17:10+00:00,1516858531709800448,Close quarters at the only French presidential debate https://t.co/FHxNqpWii3
307,2022-04-20 01:06:21+00:00,1516584020024328196,Nah that’s just Macron from another timeline. Writers are doing a multiverse arc. Bit overdone at this point. https://t.co/beRjhLbC3c
308,2022-04-16 01:49:08+00:00,1515145234736455683,"It’s a beautiful day in Tacoma, Washington ☀️ https://t.co/TlbXgIFIta"
309,2022-04-14 15:43:23+00:00,1514630405189603329,On TVW and online tonight 🏘️ #waleg https://t.co/VaJFJGXSIO
310,2022-04-13 19:29:42+00:00,1514324971375398912,"Not surprising but yowza: “According to Ratings Group, [Zelensky’s] approval rating jumped 60 points to a staggering 93%.” https://t.co/gk6SoYpid8"
311,2022-04-13 01:11:29+00:00,1514048595607007233,I was minding my own business and then this story came on the radio and all of a sudden so many FEELINGS. https://t.co/uMmB3WBy8T
312,2022-04-12 01:33:39+00:00,1513691784248848385,This is so sick. https://t.co/NQCBXa5RJ7
313,2022-04-11 00:33:19+00:00,1513314216593088514,The Socialist Party was created in 1969 to be more electable than the French Communist Party... and that worked for a while (won 3 presidential elections)... but today their candidate (the Mayor of Paris) finished behind the Communists. Wild. https://t.co/PhxmiTQUkY
314,2022-04-10 23:57:51+00:00,1513305289218424833,The 2012 second round was between Hollande of the Socialist Party and Sarkozy of The Republicans. Today those parties received a combined 6.5% of the vote. Times... change.
315,2022-04-10 18:04:12+00:00,1513216289522683905,"Initial exit poll on French TV: Macron 28%, Le Pen 23%, Melenchon 20%

These are historically very accurate. Never misidentified the two candidates who will advance to the second round."
316,2022-04-10 17:55:05+00:00,1513213997591322628,"French voting is quite different from our own. At 30 seconds in you can see Macron pick up 12 slips of paper from 12 different piles. A single name is printed on each (also in braille). Pick the name you want, put it in an envelope, then in a ballot box. Discard the other papers. https://t.co/G4h1rDeOWZ"
317,2022-04-08 20:15:07+00:00,1512524460766621698,The mural has a new look today https://t.co/IkxHWO6QIr
318,2022-04-08 15:49:22+00:00,1512457583595909126,"We're once again at the point where cases are rising in workplaces with testing protocols and it's treated as some odd phenomenon instead of a warning light.

https://t.co/NK2wp6CkHD"
319,2022-04-08 15:13:41+00:00,1512448601246474247,"“By buying Russian oil and gas, you are financing the killings of Ukrainians. Act more decisively. It is enough to feed the Russian military machine.

Poland, Lithuania, Latvia and Estonia have already refused to finance the genocide.” https://t.co/mU4Hs70VDe"
320,2022-04-08 13:46:11+00:00,1512426584149401601,"The Russian state doesn't really care whether you believe their bullshit narratives. What they care about is making you feel like you can't be certain about anything. The lies are meant to sow doubt in your mind. Doubt is the goal, because doubt drives inaction and indifference."
321,2022-04-08 13:35:13+00:00,1512423821403336710,"Putin’s violent acts show his invasion was never about geopolitics or alliances or security concerns. It was always about forcing the submission of a population to his will. Ukraine said no, so now Putin rains down death and destruction on them. https://t.co/8VtaTbXaBR"
322,2022-04-08 04:11:44+00:00,1512282019132178435,"Can’t ignore the fact that someone brainwashed online by Russian state propaganda would see this as a patriotic act of “denazification”, and I really hope there turns out to be a more benign explanation!"
323,2022-04-08 03:17:28+00:00,1512268359089287168,Some pretty twisted vandalism in Gig Harbor last night. This mural was up for only a day before two people showed up with paint rollers and destroyed it. The artist is already working to re-do it: https://t.co/liUzaCZ4Kr https://t.co/Guo8aVybVo
324,2022-04-07 22:18:34+00:00,1512193138282090499,Proof! https://t.co/y9Nrw13Shc
325,2022-04-07 22:01:04+00:00,1512188734690758662,Trump and Stephen Miller and other white nationalists intentionally smashed this system for 4 years. They'll do it again when given the chance. Perhaps we can rebuild it in a way that would be more difficult for them to dismantle. We already know what play they're going to run.
326,2022-04-07 21:27:48+00:00,1512180365376454686,"The sad reality of our broken refugee resettlement system: ""President Biden has raised the cap on admissions to an impressive 125,000 for 2022. But six months into the government’s fiscal year, we have accepted fewer than 9,000.""
https://t.co/jSSqpUspp3"
327,2022-04-07 20:31:48+00:00,1512166271034425368,It sure is sunny today ☀️
328,2022-04-07 16:59:31+00:00,1512112850453479426,You can’t fire me — I quit! https://t.co/eWnajCPTwl
329,2022-04-07 14:28:12+00:00,1512074768056414213,PM of Italy https://t.co/bNnzfJF6HB
330,2022-04-07 00:30:14+00:00,1511863889016725506,"The frontrunner to be the Philippines’ next president is the son of Ferdinand Marcos, who was the country’s authoritarian ruler for 21 years. The younger Marcos is engaged in a campaign of historic denialism about his father’s regime, and everything about the situation is bleak. https://t.co/9djceZCzh9"
331,2022-04-06 03:15:38+00:00,1511543123092013060,I never went because I was too busy serving in or seeking to abolish or administering the elections for the student government. Long story.
332,2022-04-06 03:10:18+00:00,1511541783276273674,"When I was in college students would wander over to CPAC to either network or gawk or hate-watch, depending on their political leanings. Then one year Trump came and, well, here we are."
333,2022-04-06 03:05:07+00:00,1511540475676692483,"“CPAC: Hungary” is coming to a dystopian timeline you’re living in this May.
https://t.co/PiAjcxovMX"
334,2022-04-04 16:13:08+00:00,1511014013424996352,"Vile essay published by RIA Novosti, Russia's main state news agency. It's a proposal for genocide. https://t.co/NSrcy2pDAb"
335,2022-04-04 01:41:16+00:00,1510794597986803722,😬 https://t.co/ORFQvYlQCL
336,2022-04-03 23:16:06+00:00,1510758066144223235,Wasn’t really much of a campaign. Orban controls state media and his allies control what’s left of the privately-owned outlets. Opposition parties weren’t allowed to purchase ads in major media outlets. With this result Hungary looks like Russia did during Putin’s second term. https://t.co/qUO0o5UTKn
337,2022-04-03 21:32:47+00:00,1510732065066520580,It's almost as complicated as the U.S. Electoral College!
338,2022-04-03 21:22:27+00:00,1510729468293177348,"On top of gerrymandering Hungary's electoral map, Orban put in place this incredibly complex, one-of-a-kind electoral system that *looks like* proportional representation to the voter but actually favors the largest party (his party) when they count the votes. https://t.co/ISLNbjCYTW"
339,2022-04-03 03:24:24+00:00,1510458166449872896,"Zelensky ripping into Orban tonight, hours before polls open in Hungary. https://t.co/YdR87TgF0c"
340,2022-04-02 20:48:55+00:00,1510358639889956865,Hopefully the united opposition can reduce Orban’s majority to less than 2/3. Unlikely the opposition can win outright this time thanks to gerrymandering. https://t.co/fYTZx3VY21
341,2022-04-02 17:40:45+00:00,1510311284897509376,"More on Brovary: “A key city east of the Ukrainian capital, Kyiv, has been recaptured from Russian forces, Ukrainian officials have said, but retreating troops were said to be heavily mining the lost territory in their wake.” https://t.co/qIJ0bZlbma"
342,2022-04-01 21:18:23+00:00,1510003668694695946,Biden cannot back down on ending Title 42. This stuff from Manchin and Sinema is awful. https://t.co/KJN5evwWyc
343,2022-04-01 19:22:52+00:00,1509974597621346309,This AG opinion is also my go-to remedy for insomnia. https://t.co/xY5mqw0ixB
344,2022-04-01 15:51:06+00:00,1509921302890483716,https://t.co/q4TihSi0sv
345,2022-04-01 15:51:05+00:00,1509921301556699138,"""The occupiers left the Brovary district near Kyiv, - the City Council""

https://t.co/H6lKuKSqQ8"
346,2022-04-01 15:12:01+00:00,1509911466710867971,"Small relief to see the frontline moving far from Brovary, Tacoma's Sister City. https://t.co/bzGL2y3bAP"
347,2022-04-01 14:27:58+00:00,1509900381773463552,Looks like a very good boy. https://t.co/1fKiphPKPD
348,2022-03-31 22:54:48+00:00,1509665543925559319,Our electoral system is such a mess. https://t.co/XgthwmRI7C
349,2022-03-29 19:42:08+00:00,1508892281129951233,"She's right.
https://t.co/QypcFwboyD"
350,2022-03-29 00:24:03+00:00,1508600839912374272,These 32 tons of medical supplies can get to parts of Ukraine the Red Cross won't operate in right now. Departing from SeaTac later this week. https://t.co/hmLMsCYClb https://t.co/ozNittMgBP
