,Created at,User ID,Text
117,2022-07-31 01:27:04+00:00,1553552795529142272,Found a friend https://t.co/OioMEYyzL3
118,2022-07-31 00:09:14+00:00,1553533207424839680,At an outdoor wedding reception on the surface of the Sun… or maybe this is Lacey? Who can remember.
119,2022-07-30 19:12:19+00:00,1553458483625746432,"It’s maddening, and this is how Manchin’s operated since he was a state legislator. Examples: https://t.co/qsHLZpyaIl https://t.co/jpMvG7OqyK"
120,2022-07-30 00:38:48+00:00,1553178260862734337,"Data

https://t.co/KBh3ichuWJ"
121,2022-07-30 00:38:32+00:00,1553178192877273088,"Statewide turnout is at 17.4%, on track to be a smidge behind 2018 turnout. However, this final weekend is when the return rate can vary the most from election to election. 40% turnout would be quite high by the standards of recent decades. https://t.co/KPupBYC7zO"
122,2022-07-30 00:33:46+00:00,1553176994094780417,"Turnout by age range statewide as of 5pm Friday. There's a 4-times higher turnout rate among voters 65+ than voters under 45.

Get those primary ballots in before 8pm this Tuesday, August 2nd! https://t.co/nzif2oejNF"
123,2022-07-28 02:56:04+00:00,1552488030228754432,Tacoma needs its own large walking robot. https://t.co/YA6QoWxyBs
124,2022-07-28 00:08:51+00:00,1552445949150392320,"This year I’m voting for a world where housing is abundant, health care isn’t criminalized, pandemics are taken seriously, climate action isn’t just a slogan, countries don’t invade other countries, and a whole lot more.

Please get your primary ballot in before 8pm on Tues 8/2! https://t.co/6lkI5M0YQO"
125,2022-07-27 21:52:24+00:00,1552411609846255616,"Joe Manchin, drama queen"
126,2022-07-27 21:51:50+00:00,1552411466816401413,And here we are after those “months to go” in the BBB saga. https://t.co/K93KXwfCfw
127,2022-07-26 01:50:32+00:00,1551746759189151744,Redistricted and logging on for a new LD organization’s Zoom meeting. The life of a PCO. This is the Way.
128,2022-07-26 00:25:42+00:00,1551725412647981056,"Ballots get returned in Washington state in a very similar pattern each election. Thurston @TCAuditor is doing a good job showing the historical trend. The return rate is so far tracking closely to the 2018 primary, when turnout statewide was 41% (PDF):    https://t.co/Jg1YnFqDd0 https://t.co/tIvtW3itpU"
129,2022-07-25 21:47:48+00:00,1551685675044335616,"I am usual, though I do love and welcome the very, very unusual. https://t.co/IuMOzH5hls"
130,2022-07-25 16:04:17+00:00,1551599227347746816,"Our health care system is in far worse shape than it was when the pandemic began. The situation is going to keep deteriorating until there's a coordinated response by state and federal policymakers. It will not get better on its own.
https://t.co/7zFKzRdhX7"
131,2022-07-25 04:07:26+00:00,1551418823382745088,"So long, weekend https://t.co/E9laDYyi66"
132,2022-07-24 16:28:07+00:00,1551242837844324354,"The consequences of the housing supply shortage are real and terrible. This story comes from Maine, but there are many families in Washington living in similar situations.

WA needs to legalize the construction of affordable housing options statewide. No more excuses. #Homes4WA https://t.co/cF0qleuRFw"
133,2022-07-22 22:04:29+00:00,1550602711837528064,"Visited at work by consuls of Mexico, Peru, Guatemala, Honduras, and El Salvador. It was bring your own flag (BYOF) https://t.co/JpikYTmJUr"
134,2022-07-22 04:15:53+00:00,1550333787304644608,I can’t get a song from Lady and the Tramp out of my head and it’s brutal.
135,2022-07-22 03:55:59+00:00,1550328779834159109,"Saw @MalloryMcMorrow in Seattle last weekend. She is working to flip the Michigan Senate red to blue and has a lot of good ideas about how to do it. You would probably like her too.

https://t.co/RoPuTtJrhG"
136,2022-07-22 02:57:24+00:00,1550314037095067648,Data https://t.co/09J0Cjk5XQ
137,2022-07-22 02:57:05+00:00,1550313956362727425,"80% of the King County ballots returned so far are from voters 45 or older. 50% from voters 65 or older.

Everyone else has until 8pm on August 2nd! Get those primary ballots in. https://t.co/SGYhI0V6oP"
138,2022-07-20 01:50:47+00:00,1549572495275016192,Herrera Beutler and McMorris Rodgers voted No. All WA Democrats and Newhouse voted Yes. https://t.co/cX1rwtIekJ
139,2022-07-19 15:27:57+00:00,1549415756990779392,"Here's the CDC chart. You may notice excess deaths in WA track closely with covid waves, but in a somewhat different way than the national trend. WA's covid deaths have disproportionately happened in 2021 and 2022, after social distancing measures ended.

https://t.co/sRtqAp22fL"
140,2022-07-19 15:17:54+00:00,1549413225438973952,"Heat is the deadliest weather event. It's not even close.

https://t.co/4WDJZv8tye"
141,2022-07-19 15:14:40+00:00,1549412412083671040,"As we watch Europe bake, a look back at the deadly cost of last summer's heat event in the PNW.

This CDC chart shows excess deaths by week in Washington. More deaths than expected were recorded in the weeks with a + sign.

The big spike in late June 2021? Week of the heat dome. https://t.co/MolEPI9QeM"
142,2022-07-19 02:44:13+00:00,1549223553752387584,It is not normal for the hospitals to hold a press conference just to warn people how bad things are. Our health care system is breaking down and not enough is being done to stop it. https://t.co/xHWD2uU57m
143,2022-07-19 01:26:05+00:00,1549203891853488129,"In the Pierce County Auditor race I strongly encourage folks to vote for Linda Farmer, who I’ve known and trusted for years.

Linda will work on increasing voter turnout, and she will always administer fair, transparent, and trustworthy elections.

https://t.co/0IaJnuY6zA"
144,2022-07-19 00:51:35+00:00,1549195210625691649,cc: @SharlettMena
145,2022-07-19 00:50:59+00:00,1549195059706286080,You love to see it 🗳 https://t.co/3DaDn4tdBI
146,2022-07-18 23:46:42+00:00,1549178881243918337,"""Going into another COVID-19 wave, WA hospitals are already in a bad spot. Many hospitals are at 130% capacity or more.

This is due to staffing shortages, the typical increase in summer injuries, and the people who had care delayed during the pandemic.""

https://t.co/nzbWsnJHiB"
147,2022-07-18 23:46:41+00:00,1549178879750705152,"""Dr. Steve Mitchell, medical director for the Washington Medical Coordination Center, said that hospitals in King, Pierce and Snohomish counties 'are more strained today than really at any other point since the pandemic began.'""
https://t.co/Du4veQLXKo"
148,2022-07-18 23:46:41+00:00,1549178878156894209,"3 stories published today on the situation in WA's hospital system:

""Washington’s hospitals are again 'dramatically over capacity,' as challenges discharging patients worsen and staff shortages persist, the state’s health care leaders said Monday.""

https://t.co/PP2a646lSH"
149,2022-07-18 18:54:31+00:00,1549105350560714752,I feel seen. https://t.co/dyNW4dQy6o
150,2022-07-16 02:43:32+00:00,1548136219380371456,Lincoln District Food Walk is bopping. https://t.co/zsgFa3rweS
151,2022-07-15 21:05:34+00:00,1548051168131026945,"Tugendhat was the only one willing to say “no” when asked whether Boris Johnson was an honest person. But Tug is also likely to be the next candidate eliminated, since telling the obvious truth about Boris is a liability in this race. https://t.co/rtYU3kIOLE"
152,2022-07-14 04:05:44+00:00,1547432131256655872,"Nice to hear ""@Lyndafstr in Tacoma, Washington"" on the radio today.

https://t.co/xJUTwYNOLc"
153,2022-07-14 01:31:35+00:00,1547393338692620288,"Bummed about this. Grateful for Hadeel and her willingness to try and do something about the housing crisis.

If I lived in the 46th I’d still vote for Hadeel in the primary and the general. She’ll be on both ballots. A vote for her is a vote for the values she ran on. https://t.co/Vyij06I84R"
154,2022-07-13 20:34:59+00:00,1547318694568529920,"45% turnout would be 10 points less than 2020 but still quite high by the standards of the last few decades. Higher than 2018.

Relevant data point since midterm primary turnout in WA is a decent predictor of general election turnout. https://t.co/AGuZcg19Q3"
155,2022-07-12 21:14:13+00:00,1546966183252873216,"🚨 BFD Alert: ""The U.S. Fish and Wildlife Service has finally approved Thurston County’s long-awaited plan to manage federally protected species, including the Mazama pocket gopher.""

Years and years of work by many, many people. Congrats to all involved!

https://t.co/VeGJgSBGAV"
156,2022-07-12 14:23:30+00:00,1546862821337473024,"“Business as usual will not restore the health and abundance of Pacific Northwest salmon. We need a durable, inclusive and regionally crafted long-term strategy for the management of the Columbia River Basin,” says @WHCEQ @BrendaMallory46. Yes!

https://t.co/yuVkxWGWrB"
157,2022-07-12 14:01:59+00:00,1546857404435800066,"3 weeks until the WA primary! 🔜

Watch for your ballot in the mail this week. 👀

Vote and return it by August 2nd. No stamp required. 🗳📬"
158,2022-07-11 04:20:40+00:00,1546348723973722112,Nice out here 🌅 https://t.co/5EL3NGoD7J
159,2022-07-09 15:52:14+00:00,1545797986529071104,https://t.co/awUIJRj1th
160,2022-07-09 15:49:47+00:00,1545797372394934273,"""Astronomers around the world are—how do I put this very seriously and scientifically?—absolutely psyched about this. Just bouncing off the walls.""

Coming Tuesday at 7:30am PT!

https://t.co/WlUU7JUGHL"
161,2022-07-08 15:51:02+00:00,1545435297860632576,"You may notice a weekly fluctuation in the number of WA counties in which the CDC recommends masking indoors. The number fluctuates because the rec is based on hospital admissions.

But if you want to avoid catching or sharing the virus, masking indoors makes sense anywhere in WA https://t.co/xB6ujkYxsw"
162,2022-07-07 13:20:59+00:00,1545035148411883520,https://t.co/cSUMcLRefv https://t.co/jKyDD2a0mj
163,2022-07-07 02:37:02+00:00,1544873093679566848,omg omg omg https://t.co/6QGcwR64ZF
164,2022-07-06 19:36:38+00:00,1544767294433136642,Well we certainly wouldn’t want to inject chaos into this very stable situation. https://t.co/bk3Onp8QCB
165,2022-07-06 15:31:34+00:00,1544705622658015232,"Not a great sign when TV producers add a ""Government Resignations"" tracker during your live appearances. https://t.co/6HJl2gXoPE"
166,2022-07-02 19:06:34+00:00,1543310177704611841,Why did this happen? Pandemic disruptions made organizing more difficult and (probably more significantly) the tight labor market made paid signature gathering extremely expensive.
167,2022-07-02 18:58:42+00:00,1543308197716340736,The lists of past initiative and referendum attempts live here: https://t.co/MAVu8UIMgf
168,2022-07-02 18:57:48+00:00,1543307972264071169,There won't be any statewide initiatives or referendums on WA's general election ballot for the 2nd year in a row. It's the first time since the initiative and referendum process was adopted in 1912 that Washington will go 2 general elections in a row without any on the ballot.
169,2022-07-02 00:10:15+00:00,1543024215732809728,😷✅ https://t.co/hirHfyLM9j
170,2022-07-01 21:35:41+00:00,1542985318093099008,It's a bop. https://t.co/VjkKYtAUBC
171,2022-07-01 15:23:23+00:00,1542891622672637952,Happy Canada Day 🇨🇦
172,2022-07-01 02:25:03+00:00,1542695748755566592,"At midnight @WAStateLeaders becomes the 3rd trustee agency of our state, giving its youth programs a fresh start. Thanks to its biggest champion @SenClaireWilson for her leadership and passionate advocacy for all the young scholars who participate."
173,2022-06-27 14:31:45+00:00,1541429080536387584,"“An estimated 2.1 million Washingtonians age 18 and older have tested positive for the coronavirus or been diagnosed with COVID by a health care provider.

Of those, about 31%, an estimated 662,000, had symptoms that persisted for several months or more.”

https://t.co/DjISR63G5y"
174,2022-06-26 16:26:22+00:00,1541095537390129152,Nothing like days and days isolating in a hotel room to make the fresh air feel so good. https://t.co/9u6QwRIlYu
175,2022-06-26 16:05:33+00:00,1541090297475584000,"If you care about abortion rights here in the PNW, one of the most impactful things you can do is support @EmilyRandallWA against her extremist anti-choice Republican opponent. Vote, give, volunteer, do anything and everything."
176,2022-06-26 15:18:42+00:00,1541078504984281090,"I missed reacting to some international election results, so to recap:

France legislative: Whoa

Colombia presidential: Whoa!

British by-elections: Lol Boris"
177,2022-06-25 16:52:16+00:00,1540739666269425664,"I tested positive in February. This time was worse. I’m also vaccinated and diligent about masking in public. In other words I “used the tools available” to avoid Covid. It wasn’t enough in my case, or in the case of thousands each week. Feels like we’ve surrendered to the virus."
178,2022-06-25 16:35:18+00:00,1540735397688446976,"A 🤒😷 update: I caught Covid at the end of a trip to NY last week. I felt quite sick but was eligible for Paxlovid due to an underlying condition. It helped a ton, I’m feeling better, and I’ll be headed home soon. Lucky to have been traveling w/ family who did not get infected."
179,2022-06-18 15:03:41+00:00,1538175626615611393,Hudson River 🚆 https://t.co/s7SSTZr5zC
180,2022-06-14 20:34:32+00:00,1536809334717431808,"Macron’s Ensemble needs 289 seats (sièges) for a majority, so the future of his presidency is very much on the line this Sunday.

If he falls short he’d likely partner with the mainstream right LR, but if both combined fall short of 289… who knows what’ll happen. https://t.co/5pJTVtYneV"
181,2022-06-13 16:20:04+00:00,1536382906335219713,"148 specifically, for the nerds."
182,2022-06-13 16:18:24+00:00,1536382488129507329,"50 days until the primary.
Less than 150 days until the general."
183,2022-06-12 21:51:31+00:00,1536103932895932417,"Strongly approve of Google Translate going with ""Nope"" instead of ""No"". https://t.co/ZFOxhFyrG5"
184,2022-06-12 18:49:38+00:00,1536058160963891201,Nice out here https://t.co/hO173mVs3N
185,2022-06-10 14:23:37+00:00,1535266439787061249,"Putin to Russian audience: I am a modern day Peter the Great, aggressive empire-builder and colonizer.

Putin to international audience: This war is all your fault! All I want is peace!

https://t.co/nLIfPPmDOY"
186,2022-06-10 03:24:49+00:00,1535100646738825228,I don’t think this difference is going to negate the years of lies and constant stream of Trump propaganda pumped into millions of American homes. But I do think it makes it easier to communicate the truth to viewers already inclined to believe it… which is an improvement.
187,2022-06-10 03:24:49+00:00,1535100645719609350,The hearings during the first Trump impeachment (the Ukraine one) were polluted by conspiracy theories from his sycophants on the committee. It exhausted viewers and made most tune out. Not having the Trump lackeys around this time turns these hearings into very different events.
188,2022-06-09 12:52:06+00:00,1534881020050169857,Yeah I went to Iceland in the winter. There was no one on that island but me and the sheep and the puffins and it was wonderful. Entire national museum to myself. Bliss.
189,2022-06-09 12:46:58+00:00,1534879727076265984,No I’m not going to Iceland this time but you’ll still never find me.
190,2022-06-09 12:46:32+00:00,1534879618821304320,"Set my first out of office reply since February 2018… two sessions, one interim, two campaigns, several variants, one impeachment, and one midterm ago."
191,2022-06-08 03:00:00+00:00,1534369623969234945,"It's time for one of the simple joys in life: watching people on the East Coast complain online about how gradually West Coast election results come in.

Take a seat and stay a while, folks! Perhaps a few days."
192,2022-06-06 21:15:03+00:00,1533920426316795904,"""We want to urge you to do whatever you can to protect yourself,” said Cassie Sauer of the Washington State Hospital Association.

Sauer added one major reason people should avoid getting COVID-19 is the possibility of getting 'long COVID.'""

https://t.co/384pzYQcdW"
193,2022-06-06 20:56:14+00:00,1533915693237735424,"""Washington hospital officials warned Monday that facilities are heading toward the bad old days of COVID-19... officials on the media briefing call Monday implored people to return to wearing high-quality masks indoors in crowded, public spaces.""

https://t.co/uEgb0Q5dwD"
194,2022-06-06 17:42:13+00:00,1533866868544483328,Living her best life https://t.co/vWm21extwS
195,2022-06-03 22:48:49+00:00,1532856859308085248,https://t.co/VI4R8cLer3
196,2022-06-03 15:39:14+00:00,1532748752598970369,And anyone working against fascism here in the United States has more to learn from than teach Ukrainians who are fighting the fascism of an occupying colonizer.
197,2022-06-03 15:22:52+00:00,1532744636204085248,Ukrainians deserve dignity and respect from Western leaders and thinkers as they fight to obtain a lasting peace. Their choices are up to them. They know conflicts end with dialogue and negotiation. They know peace and justice never come quickly enough. They don't need lectures.
198,2022-06-03 14:42:51+00:00,1532734565394964480,"8 years since Russia's invasion of Ukraine began. 100 days since the genocidal violence resumed.

Ukrainians will fight colonization by a fascist state for as long as it takes. Any free person would.

@ZelenskyyUa: ""Life will win over death, and the light will win over darkness."""
199,2022-06-03 13:04:48+00:00,1532709886626123777,https://t.co/dXUeo99NdN
200,2022-06-03 04:02:49+00:00,1532573493878853632,Snaps to the Ontario election administrators — 99% counted in less than 3 hours (4.6 million votes)
201,2022-06-03 03:42:07+00:00,1532568286222635008,"Election in Ontario. Ford's party won 2.3 million votes 4 years ago. Won fewer than 2 million votes tonight, but still gained seats.

Why? Center/center-left parties failed to energize voters and lost to a shrinking minority. Turnout was down 15% from '18. It can happen here too! https://t.co/f3FtdlcAv0"
202,2022-06-02 02:54:43+00:00,1532193967382536194,"The eligibility criteria is quite broad at this point. Details at the link. Treatment needs to begin within 5 days of the first symptoms, so don’t delay if you think someone could benefit."
203,2022-06-02 02:51:14+00:00,1532193090613571584,"I’ve seen firsthand that Paxlovid works as advertised. It’s not a silver bullet for the pandemic (none of those exist), but it is saving a lot of lives.

Here’s a Paxlovid locator tool if you or anyone in your life has Covid symptoms and tests positive: https://t.co/6cytSnuhBB https://t.co/mg6sDznJ7K"
204,2022-06-01 17:40:48+00:00,1532054570712432640,"“I cannot really tell you how pissed I am about this,” [Sen. Manka Dhingra, D-Redmond] said.

“Because it is completely unacceptable. This is 2022. We should not be having this conversation about allocating resources for survivors.” https://t.co/UTRyhYU7Xs"
205,2022-05-27 15:55:36+00:00,1530216156832731137,"""'There’s always an excuse for you if you’re a white man with money like Josh Harris and make mistakes,' Carter-Mixon said."""
206,2022-05-27 15:46:59+00:00,1530213988574715906,"""Monèt Carter-Mixon, Ellis’ sister, said Harris is the embodiment of a double standard in the Pierce County legal system and called his candidacy 'a bad situation waiting to happen.'""

https://t.co/GWhpci3vhV"
207,2022-05-27 15:02:24+00:00,1530202766844448768,Moral: the Tally Room is wonderful and so are the Australians who keep it humming. The End and happy clicking. 🇦🇺🗳️🖱️
208,2022-05-27 15:02:23+00:00,1530202765657444352,"3: Incredibly, all this data is updated on the website multiple times a day, all day, every day, in as close to real time as they can manage. There's even a feed with timestamps of the most recently updated seats!

https://t.co/aVJ1K6DwdH"
209,2022-05-27 15:02:23+00:00,1530202764738932736,"2: On top of providing all the data needed to actually determine winners, there are dozens of additional tables and displays available just because they're useful for analysis. Want to know turnout by state? 1st preferences by party in urban seats? Done.

https://t.co/SbD4GkzwCe"
210,2022-05-27 15:02:23+00:00,1530202763790938112,"1: Australia uses ""preferential voting"", or what is known in the U.S. as ranked choice voting. The multiple rounds of counting simply produce more data by necessity. It's all documented in detail down to the polling site. And by vote type - early, mail, E-Day, etc."
211,2022-05-27 15:02:23+00:00,1530202762822025216,"In the opinion of this election data nerd, there is one election results website that stands out above all others on the planet: Australia's Tally Room

These folks are playing chess while everyone else is eating checkers pieces. There are 3 reasons why.

https://t.co/i1kK6fStpg"
212,2022-05-27 03:09:55+00:00,1530023465150951425,The red map looks alarming because the situation is alarming! https://t.co/Vj1kI3xp7g
213,2022-05-26 15:24:33+00:00,1529845953292664833,Though to be clear there are still in-person and drive-thru sites operating. https://t.co/0quxdtP0NX
214,2022-05-26 15:15:30+00:00,1529843676754477057,"I'm glad the government was shamed into providing free at-home tests. The mass drive-thru sites only worked for people with lots of time and a vehicle.

But I wonder what this chart of reported cases would look like if those sites were collecting data now.
https://t.co/g43RnroBfc https://t.co/FeSYAAh4l6"
215,2022-05-26 14:56:11+00:00,1529838816722178049,"This is having the predictable impact on hospital admission rates.

Any patient who tests positive requires additional infection controls, placing an additional burden on hospital workers.

https://t.co/keP7MDexW5 https://t.co/u81nOelSQ8"
216,2022-05-26 14:31:42+00:00,1529832655826563072,"The Omicron lineage circulating today ""spreads more rapidly than previous versions, including the form which sent U.S. cases soaring over the winter.

The new version evolved from BA.2 which itself was more contagious than any variant that came before it.""
https://t.co/WqFLx1u4Xq"
217,2022-05-26 01:36:00+00:00,1529637444173168640,"If you’re lucky enough to live in the 29th LD (like me), be sure to vote for @SharlettMena this August 2! https://t.co/8yj8J0Q5aN"
218,2022-05-25 20:24:57+00:00,1529559164904611840,Rhodies in bloom at #waleg https://t.co/sW4mZ8yfEk
219,2022-05-25 15:09:29+00:00,1529479774480912384,A couple weeks ago I spoke with a Ukrainian living a few hours from the front line. One of the first things he asked me was whether it was true people in the U.S. could walk into a Wal-Mart and buy a gun on demand. Our gun culture is infamous across the world. https://t.co/pA3kyFPIxV
220,2022-05-25 03:21:44+00:00,1529301663357358080,So much could be different without the filibuster.
221,2022-05-23 22:43:07+00:00,1528869160758915072,"White House COVID-19 Response Coordinator yesterday: “When you’re in an indoor space, you should be wearing a mask. I feel that very strongly, that in crowded indoor spaces, in places with high transmission, people should be doing that.”

Applies to nearly all Western WA counties https://t.co/IvU0lAGwme"
222,2022-05-23 15:42:29+00:00,1528763304545353729,Fighting election misinformation down under 🇦🇺🦭 https://t.co/m5eSBoLsK5
223,2022-05-22 21:18:35+00:00,1528485497533714432,A new name on Putin’s “banned from Russia” list: Деннис ХЕК https://t.co/xFC6yN5YBO
224,2022-05-21 00:23:49+00:00,1527807340056961024,"Last one for now: Secretary of State. 4 Republicans filed against appointed Dem Steve Hobbs. Non-partisan Pierce County Auditor Julie Anderson also filed.

Republicans could easily split their vote and miss out on the general. Depends on how well Anderson does in the primary."
225,2022-05-21 00:16:39+00:00,1527805537244499969,"A filing deadline twist while I was writing the first tweet: in WA-03, 1 of the 2 Dems who was mounting a campaign has withdrawn.

This makes an R vs. R general election all but impossible. Jaime Herrera Beutler will need to finish ahead of all 4 of her pro-Trump challengers."
226,2022-05-21 00:06:55+00:00,1527803084063133696,"Candidate filing is over. A 🧵

Most consequential outcome: WA-04, where only 1 Democrat filed against 7 Republicans. Floor for Dems here is ~25% in a primary, usually enough to finish in the top 2. That means incumbent Dan Newhouse must finish ahead of Loren Culp in the primary."
227,2022-05-20 01:57:45+00:00,1527468591490031617,"Because reasons, candidates in Washington can use up to 18 characters to describe their party preference. These labels appear between the words ""Prefers _____ Party"" on the ballot."
228,2022-05-20 01:41:49+00:00,1527464579768254464,It's filing week in Washington. Here are a few of the party labels chosen by candidates for public office. https://t.co/GABWvD7Scq
229,2022-05-19 18:12:48+00:00,1527351580130889749,For your planning purposes: Election in Australia on Saturday. Last polls close at 3am our time. Cannot confirm nor deny what I will be doing at that time. EOM.
230,2022-05-18 14:01:59+00:00,1526926075334230016,"Housing supply champion/former House Speaker Tina Kotek won the Oregon Democratic primary for governor last night. By a lot.

https://t.co/ry6S7zZgxF"
231,2022-05-18 03:53:48+00:00,1526773020903124992,https://t.co/7cGuwTq5xG
232,2022-05-18 03:52:05+00:00,1526772587677638656,Bye! 👋 https://t.co/xUpkbE0h4w
233,2022-05-18 03:47:58+00:00,1526771550996684801,oh FFS https://t.co/Gk1b4F9XX7
234,2022-05-18 02:11:57+00:00,1526747385883283456,"Loren Culp road-tested this last year, though I'm not totally sure how well it's panned out for him."
