,Created at,User ID,Text
326,2018-02-18 01:02:33+00:00,965028729629085698,Photos of Seth Hall https://t.co/IkoRcoHjUb via @HallCongress
327,2018-02-17 02:38:14+00:00,964690423468974080,https://t.co/9I29lp3lLt much of tax bill's benefits do the richest 1 percent get? The answer might surprise you-surprise-you
328,2018-02-17 02:16:03+00:00,964684838040211457,"@HallCongress  @sethhallforcongress https://t.co/9z8pzhzvaM

Statement from @HallCongress for Ky House of Representatives CD 4 https://t.co/JrjeZIl4GX"
329,2018-02-17 02:08:46+00:00,964683005188038661,We need to get big money out of elections.  https://t.co/9z8pzhzvaM @HallCongress https://t.co/9f39R36q7O
330,2018-02-17 02:05:51+00:00,964682271176486918,Voting Republicans out of office will go further towards reducing school shootings. So my prayers are directed towards that purpose.  https://t.co/9z8pzhzvaM https://t.co/YjfqaCew09
331,2018-02-17 01:55:45+00:00,964679730208403457,GOP propaganda station.  Fellow American where ever you go.  Ask for Fox News to be turned off or changed to another station. https://t.co/anSyq2tksi
332,2018-02-17 01:52:12+00:00,964678837954019328,"There is a group of people the ""wealthy elite"" playing a game of monopoly with us.  Now we all know how the game ends right? https://t.co/845QIOIW1l"
333,2018-02-17 01:51:00+00:00,964678537310597120,"https://t.co/yMS16SLmLw

Let's remember their lives."
334,2018-02-15 02:16:16+00:00,963960118726578177,"My thoughts and prayers are with the victims and their families of today’s mass shooting in Florida. Violence like this shouldn’t be commonplace in America- it takes courage to address this issue and it’s an issue that we must address.

https://t.co/5p2y1ncra1"
335,2018-02-15 00:23:13+00:00,963931668498337793,We are the only country in the world that has these mass shootings at our schools.  Blood is on the hands our leaders that sit back and flood more guns into our society without allowing us to study the root cause of these shootings.
336,2018-02-14 11:41:07+00:00,963739881401995265,Happy Valentines Day.  Support Unions and Buy Union Candy for your sweet heart. https://t.co/PXhzrB9JBC
337,2018-02-13 04:08:26+00:00,963263570686480384,VA watchdog to say Shulkin improperly used taxpayers' dollars: report https://t.co/MYkTxT58jz
338,2018-02-13 03:55:37+00:00,963260347418279936,The next recession is really gonna suck https://t.co/zXJgxm9YHE via @HuffPostPol
339,2018-02-09 02:07:30+00:00,961783583542317056,Join the Campaign and send experience to Washington DC.  https://t.co/9z8pzhzvaM https://t.co/JSh8nTvdIL
340,2018-02-09 02:03:52+00:00,961782673122496518,"Exactly we need strong, competent and couragous leadership instead of grand standing to create an economic collapse. https://t.co/ccSnhS5Vit"
341,2018-02-09 02:01:51+00:00,961782163652927489,Rand ranting about having requiring a super-majority to raise the debt ceiling or to run a deficit “is a veritable summons to political extortion by an intransigent minority” and could trigger a constitutional crisis. We are close to that now with a majority vote.
342,2018-02-09 02:00:15+00:00,961781762568355841,What we need is responsible leadership who can set priorities for our country and manage those priorities with appropriate budgeting.  Rand don't stand and lecture when you voted to give away a trillion and a half in tax breaks to billionaires.
343,2018-02-06 08:45:43+00:00,960796638007701504,#TrumpSlump2018 Millions of dollars would have been lost on our Kentucky pensions if Bevin had got his gamble on moving to a 401k plan.  Protect our Teachers and First responders and public employees.  #BevinsBlunder https://t.co/oCuBuH1537
344,2018-02-06 00:25:35+00:00,960670774670577664,"Republican economic policies will always lead to greed and bust economies.  My great grandmother told me to never vote Republican even if you like them.  They will always destroy the economy.  #TrumpShutdown market collapse, Fired the Fed Chair, and government shutdown coming. https://t.co/PMxrhQDNR6"
345,2018-02-06 00:14:42+00:00,960668033009225729,"Oh he called and said ""No Way"" https://t.co/6m7Ze9HZlt"
346,2018-02-05 23:58:41+00:00,960664002392154112,Two days of falling stocks hitting a record.  #TrumpShutdown  you must be proud.   You own it....
347,2018-02-03 16:13:12+00:00,959822087358738432,Spending Father and Son time at the Louisville Women's March.  Dane is holding the sign.  He's got the political bug. https://t.co/FsLuQDIam8
348,2018-02-03 15:01:07+00:00,959803946297589761,With all the corruption we have going on in America.  Support candidates that will tell the truth and will implement laws to eliminate corruption. https://t.co/YRPn3Vm8gR
349,2018-01-29 12:30:15+00:00,957954039878123520,https://t.co/pJx5nhEmwu
350,2018-01-25 02:44:42+00:00,956357129878851584,This Democrat is running in Kentucky's 4th Congressional District to defeat Thomas Massie.  https://t.co/A9dI1hFaRg
351,2018-01-25 01:52:59+00:00,956344112965398528,End @StopBigMoney https://t.co/ALCkSTxTq5
352,2018-01-25 01:52:09+00:00,956343904886034432,"cheri via, I think I see the dot on Kentucky for La Grange https://t.co/BQ1CIB3XTj"
353,2018-01-24 02:51:32+00:00,955996459924586496,Heartbreaking day in Kentucky with the senseless killing of more children in Marshall county.  The greatest country on the face of the earth cannot solve a problem of mass killings.  We do not have to take anyone guns away. Elect people that can solve this problem.
354,2018-01-21 00:01:23+00:00,954866476711927814,Looks like another great turn out even more than the Trumpys election. https://t.co/B1fS6iE00Y
355,2018-01-21 00:00:01+00:00,954866134041415681,Trumpy's shutdown https://t.co/qEHHZSbtws
356,2018-01-20 23:56:20+00:00,954865205456134150,Join me in supporting Kenton County Democratic Executive Committee (KY) via @actblue https://t.co/ovPQ7pv5Vn
357,2018-01-19 02:56:37+00:00,954185801826557952,We #NeedtoImpeach @RealDonaldTrump. Join me and sign on to @TomSteyer’s petition demanding Congress impeach Trump. https://t.co/tkepOrwiK4
358,2018-01-18 03:31:17+00:00,953832139098902529,https://t.co/pJx5nhEmwu
359,2018-01-18 03:30:52+00:00,953832032328667136,Seth Hall — Candidates With A Contract https://t.co/z14lF8NG0O via @PartyOfAll
360,2018-01-18 03:11:37+00:00,953827189765607426,"I am officially accepting donations for my campaign for @HallCongress to take on Thomas Massie.  Let's make this blue wave roll.  Please donate your time, talent, and or treasure to restore American values.  https://t.co/pJx5nhEmwu"
361,2018-01-17 01:05:10+00:00,953432978276933632,Nicely done Senator Booker on calling out this crap.  It is complicity to do harm to the US. https://t.co/nXkHJV6prf
362,2018-01-17 00:53:20+00:00,953430001856245763,Making a commitment to get corruption out of our election process. https://t.co/YRPn3Vm8gR
363,2018-01-16 00:50:36+00:00,953066923524272128,https://t.co/NfT13IQojE
364,2018-01-07 01:16:49+00:00,949812029724020741,"https://t.co/mDwj4p3Ppa

Great video clip from Dr @DrWestinForTX07"
