,Created at,User ID,Text
212,2018-06-12 22:35:44+00:00,1006666388918894592,Join me this Friday at the Henry County Democrats' Spring Fundraiser with @rick_rand and @DaveSuetholz https://t.co/N5fn5FVPz4
213,2018-06-12 00:22:48+00:00,1006330945572626434,Join me in supporting Henry County Democratic Party Executive Committee (KY) via @actblue https://t.co/vxd06SGtWq
214,2018-06-11 17:55:47+00:00,1006233546657292291,"We had a great day celebrating diversity and standing for equality with our friends at @IndivisibleNKY4 and the @kentondems at the  NKY Pride Parade and Pridefest yesterday. 🌈🏳️‍🌈

https://t.co/q1xATOf6yo"
215,2018-06-07 23:06:51+00:00,1004862277953126402,I want to make one thing clear. I will NOT get support from Special Interests in the smoke filled back rooms of DC like my opponent. YOU can make a difference! Please give what you can now at https://t.co/qYH0L9LesH Thank you. #ItsAboutUs
216,2018-06-06 18:22:18+00:00,1004428283759513601,https://t.co/pn8tAIDitE
217,2018-06-04 16:08:46+00:00,1003669901884776448,"When it comes to the specific use of the word ""men,"" which may have been standard for the time, but has no bearing in modern society. Let's make it right for ALL people. #ItsAboutUs https://t.co/tNt2dVjZ3i"
218,2018-06-04 16:08:07+00:00,1003669736620789761,"Our country was founded on the core belief that all men are created equal. Over 200 years later, too may are STILL left out. (1/2) https://t.co/4xUaxJkRgE"
219,2018-06-04 15:51:33+00:00,1003665569499971584,This is what it's all about folks!  Registering every eligible voter and turning out in a BIG way with the GOTV effort!  Let's do this District 4! #ItsABoutUs #HallOrNothing #FlipThe4th #PinkSlipMassie https://t.co/qt78JQZUyX
220,2018-06-04 09:00:34+00:00,1003562143000608768,"No child should have to ask for these things in the US.

https://t.co/VOb5lFcqXH"
221,2018-06-02 01:17:03+00:00,1002720716750491648,226 years ago today the Commonwealth of Kentucky became the 15th State. Our motto “United We Stand. Divided We Fall” are words we need to put into action in our current political climate. #ItsAboutUs #HallOrNothing #FlipThe4th https://t.co/LzlcH3WrXE
222,2018-05-31 10:21:03+00:00,1002132842510540800,"Seth talks A LOT abt infrastructure improvements for District 4: strengthening public safety &amp; our future by creating local jobs- please consider investing in Seth's Campaign today. Every cent goes a long way to electing a Congressman who will #InvestInUs 
https://t.co/qYH0L9LesH"
223,2018-05-30 20:29:30+00:00,1001923576029700097,"Common sense legislation that should NOT be a partisan issue. In my platform:  ""Guarantee equal treatment for women and people of color in the workplace -- pay, hiring, promotions, etc."" The ONLY reason to vote no would be if your goal is to keep certain groups down. #ItsAboutUs https://t.co/lN0sZRdNfO"
224,2018-05-28 20:43:21+00:00,1001202286369165313,Thanks for sharing @plwkyblue ! https://t.co/Tij1jUorIf
225,2018-05-28 15:36:01+00:00,1001124945982783488,These battles determine who we are as a society and the soul of our country. https://t.co/xSYZGbqMC5 #WhereAreTheChidren (3/3)
226,2018-05-28 15:35:07+00:00,1001124719121391621,"do everything in our power to find, save, &amp; protect them. We can not wait until a new Congress is voted in. Call, email, protest, &amp; support organizations working to help. This isn't a partisan issue. It's a human issue. (2/3)"
227,2018-05-28 15:34:38+00:00,1001124598740586496,"It is unconscionable that US treatment of immigrants, esp. children, would devolve into the horrific stories we are reading daily. This country was founded &amp; built by immigrants. Children are the precious resources &amp; keepers of our future. We must all (1/)"
228,2018-05-28 11:05:09+00:00,1001056777167933441,We remember those that have fallen for our rights this Memorial Day. https://t.co/bQDmlNTvmq
229,2018-05-27 15:08:37+00:00,1000755662752804864,"I'll be there!  Come out and meet all of the candidates from Boone, Campbell, Grant, and Kenton Counties supported by @IndivisibleNKY4 on June 6 at 6:30 pm at the Covington library! https://t.co/fJQ8bEAKQf"
230,2018-05-26 16:49:45+00:00,1000418725902741504,"As we remember those who have sacrificed to protect &amp; promote the freedoms we hold so dear this Memorial Day weekend, don't forget one of the most basic of those freedoms is our ability to participate in our government.  Honor their memory by exercising your right to #Vote https://t.co/QpWu3pLvk5"
231,2018-05-26 16:41:21+00:00,1000416612598640641,https://t.co/9vAgk3T6le
232,2018-05-24 22:16:45+00:00,999776241292111872,Thank you! Let's rally the troops across the district and state to bring home wins for Kentucky Democrats wanting to serve the people across the Commonwealth! https://t.co/H6OjoqkBJI
233,2018-05-24 20:21:09+00:00,999747149456986112,Thank you to everyone who got involved in this election regardless of whom you supported. I’m looking forward to uniting the party and building a coalition to unseat one of the least effective members of Congress. https://t.co/dRgu7Mnqhb
234,2018-05-24 04:14:10+00:00,999503800300957697,Thank you Jeff!  Will do! https://t.co/r9K82tqV70
235,2018-05-24 01:47:01+00:00,999466767612305413,"Thank you @BonniBK !  It's going to take ALL of us talking to folks, knocking on doors, making phone calls, rallying, donating, but most of all #VOTING to return the seat of the 4th Congressional District in KY to the people! #ItsAboutUs https://t.co/ljO5vazPob"
236,2018-05-24 01:44:44+00:00,999466194875895809,Thank you @DrDinD ! Proud to be a Moms Demand Action candidate of distinction and more than ready for this fight! https://t.co/z9XJq34whN
237,2018-05-23 02:08:15+00:00,999109724326023169,https://t.co/59URmeDGjE
238,2018-05-23 01:45:41+00:00,999104044433072128,"Thank you to everyone in Congressional District 4 who called, emailed, donated, knocked on doors, and most importantly voted for us! Even if you voted for one of my opponents, thank you for voting.  Now, let's go get Massie and #FlipThe4th #ItsAboutUs"
239,2018-05-22 22:29:28+00:00,999054667089838080,"As the election results begin to come in, I want to extend a hardy, Good Luck to all of the primary candidates across Kentucky. Anyone willing to put their name on a ballot and publicly state their beliefs then fight for them, has my respect."
240,2018-05-22 19:46:39+00:00,999013692250443776,Show Up for Seth! We need your #vote in the Democratic Primary Today #Election2018 https://t.co/yhSNPMy4YK
241,2018-05-22 09:08:50+00:00,998853178107092993,Today is the day Kentucky! Let's set a voting record for the primaries in Congressional District 4 and across the Commonwealth.  Give the Governor &amp; Thomas Massie a preview of things to come in November!  Good luck to ALL of the primary candidates today! #VoteSethHall #ItsAboutUs https://t.co/wG3DkImNLx
242,2018-05-21 23:43:53+00:00,998711007232122880,Let’s take our district back by sending Seth to Congress to stand up up for us! Vote Seth Hall tomorrow #ItsAboutUs https://t.co/L5tvDfee5J
243,2018-05-21 21:13:23+00:00,998673131979108352,"Seth Shows Up For Us! Let him know if you've heard his ad and where! 📻

https://t.co/QDVDDFAS9u"
244,2018-05-21 21:05:53+00:00,998671244038897665,"If you want a true Representative who will fight full-time for your rights and be a voice of the people, please Show Up and #VoteSethHall for Congress Tomorrow so Seth can show up for us in Washington #ItsAboutUs

https://t.co/SFKnmPxbcg"
245,2018-05-21 12:16:36+00:00,998538045958840320,Hey @KentuckyYoungDems flashback to when Seth Hall was a Young Dem National Committeeman. He's proud of his roots with the Kentucky Young Democrats and all the lessons it taught him and how it prepared him to be the next Congressperson from District 4! https://t.co/5KKKl4RIy3 https://t.co/DzBQUAcFvz
246,2018-05-21 08:38:56+00:00,998483268063367168,"Double check your polling place, find your sample ballot for last minute research on candidates and more:

https://t.co/23Zu09H5dK"
247,2018-05-21 08:29:47+00:00,998480965700812800,https://t.co/cCRNh2WBbO https://t.co/Kcdjj7kDys
248,2018-05-21 02:45:35+00:00,998394344402051072,"Thank you to @IndivisibleNKY4 for the opportunity to speak with you and the constituents on key issues important to District 4 in KY.

https://t.co/wJyG7xRv6E"
249,2018-05-20 21:50:36+00:00,998320107427454977,"Just over an hour from now!  Please join us and send in your questions!

https://t.co/h9rlcl3YHW"
250,2018-05-20 19:54:54+00:00,998290993559560192,"#ItsAboutUs

https://t.co/dMkB0xmEpH"
251,2018-05-20 19:54:10+00:00,998290807538028545,"Just 2 days to go!  Let's do this District 4! It's time to hire https://t.co/cCRNh2WBbO to bring Competence, Compassion, and Courage back to Congress in the form of a Representative who WILL insist the voices of District 4 Kentuckians be heard. https://t.co/vyNB1tjEFr"
252,2018-05-20 05:01:41+00:00,998066205645733888,"Ads are hitting the airwaves, calls are being made, literature is being dropped to Get Out The Vote this weekend. Would you consider donating $22 to help with our final push to the winner’s circle on Tuesday the 22nd? 
https://t.co/qYH0L9LesH"
253,2018-05-19 21:00:37+00:00,997945144015032320,"Working hard talking to the people and getting out the signs in Boone County today with @ForParks! Just 3 days left until the primary in Kentucky.  #VoteSethHall on May 22 to take down Massie in the Fall. Remember, #ItsAboutUs https://t.co/rt0QHK8yCa https://t.co/sqCASuMheI"
254,2018-05-19 17:57:50+00:00,997899141257859075,"Seth Hall Shows Up - He needs you to show up and #VoteSethHall on May 22! #ItsAboutUs

https://t.co/znog9y7K7E"
255,2018-05-18 17:20:40+00:00,997527402598338560,Science Is Real https://t.co/QmUxTsoMqE
256,2018-05-18 15:43:51+00:00,997503037877964800,"Thoughts &amp; prayers for all affected at Santa Fe HS in TX readily given, but not enough. We have to change the leadership in Washington DC. Inaction is no response to this carnage. Vote Massie out! We can't tolerate the ""craziest SOB"" running our district any longer #VoteSethHall https://t.co/nTg7N1aa24"
257,2018-05-18 13:02:52+00:00,997462524160339970,Have you heard our radio ad in your area?  Let us know where and what you think! https://t.co/4DT8ndXsP5
258,2018-05-18 11:35:33+00:00,997440551489343488,"I am signing this contract to get big money out of politics.
https://t.co/z14lF8NG0O https://t.co/ZxUb1Egm5E"
259,2018-05-18 11:30:30+00:00,997439277863723008,Did you catch Seth last night with WLWT’s John London sharing his solutions for 4th District? https://t.co/MxO3p2vSX5
260,2018-05-18 11:22:25+00:00,997437243689197568,"Just 4 days left to primary voting day in KY on Tuesday, May 22! Please join us for our election night watch party at our campaign office:
Seth Hall for Congress
606 Crystal Place, Suite 11, La Grange, Kentucky 40031

https://t.co/9sUrEWWbIp"
261,2018-05-18 02:00:54+00:00,997295933611298816,"#VoteSethHall on May 22 and hire him with your second #VOTE on Nov. 6 to right the course we are on!  Let's get rid of the billionaire class representatives and return Competence, Compassion, and Courage to do what's right to Congress. #ItsAboutUs https://t.co/WT6TlzFM1P"
262,2018-05-18 01:53:39+00:00,997294111458807808,4 days and 8 hours until the polls open! https://t.co/eB54RQXchP
263,2018-05-18 00:21:46+00:00,997270985769406464,This is why we fight! This is why more &amp; more everyday folks are running for office. The widening income inequality gap &amp; inability of hard-working Americans to work full-time &amp; provide for their families in the richest country in the world is appalling! #VoteSethHall #ItsAboutUs https://t.co/cUeqK6tAuN
264,2018-05-17 17:47:19+00:00,997171722255249408,https://t.co/79zwEhC1FB
265,2018-05-17 10:57:24+00:00,997068562400329730,https://t.co/g1aMyirofT
266,2018-05-17 02:02:34+00:00,996933968187613186,"'Our Congressional representatives should have a basic respect for all voters. Thomas Massie only respects his donors.' – Seth Hall, candidate for Congress from the 4th district https://t.co/J7bdGqEy1Z via @ForwardKY"
267,2018-05-17 02:01:52+00:00,996933790831345666,"'When good people give up their fight for liberty and independence, evil will prevail. I decided it was time for me to get off the sidelines and get in the game.' – Seth Hall, candidate for Congress in the 4th CD https://t.co/J7bdGqEy1Z via @ForwardKY"
268,2018-05-17 00:29:56+00:00,996910654232645633,"Seth has real ideas to help strengthen unions and provide for teachers.
https://t.co/rt0QHK8yCa https://t.co/FdDZBbjUYR"
269,2018-05-17 00:25:57+00:00,996909652125323264,"https://t.co/rt0QHK8yCa
Seth is the ONLY Congressional candidate in District 4 advocating for women's rights openly in his platform! Women make up over 50% of the population! They deserve a Congressman supports them! #VoteSethHall in 6 days on May 22. #ItsAboutUS https://t.co/O0ovm59UeE"
270,2018-05-16 20:38:42+00:00,996852463042023424,#VoteSethHall on May 22 #ItsAboutUs https://t.co/5XcBcPe3Af
271,2018-05-16 09:23:36+00:00,996682570350911494,"Join Seth and @IndivisibleNKY4 this Sunday, May 20, at 7 pm for an hour-long discussion on key issues. 
Watch via Facebook Live here: https://t.co/fIoanqGJPA
or on YouTube here: https://t.co/rDGvkf4XDV https://t.co/ZJDcdjy2kK"
272,2018-05-16 09:07:42+00:00,996678568607387648,"Vote for Competence, Compassion, and Courage in the primary in 6 days. #VoteSethHall on May 22! #ItsAboutUs!

https://t.co/UHD68mS2nj
https://t.co/cCRNh2WBbO"
273,2018-05-16 09:02:52+00:00,996677349864288258,"CD 4 has the top 2 wealthiest counties in KY, &amp; 3 school districts in the top 10, yet 50% of homes w/ single mothers and a child &lt; 5 are in poverty. That number only drops to 41% if there is a child &gt; 5 but under 18. #VoteSethHall for real solutions &amp; support for working families https://t.co/3hxiqo3uS1"
274,2018-05-15 13:56:01+00:00,996388736379359232,"We don't just need #NetNeutrality, too many parts of KY, including District 4, don't have broadband access at all! We need a Congressman who will fight for the infrastructure funding necessary to make it happen! Call @RandPaul and @SenateMajLdr today! #VoteSethHall on May 22 https://t.co/uoJmFmbNLR"
275,2018-05-15 13:47:13+00:00,996386522646671360,"Seth Hall proudly supports family farmers and the work they do, and will do everything in his power to make sure they can put food on the table for their families and that what they contribute to Kentucky's economy and future is protected. #VoteSethHall on May 22 #ItsAboutUs! https://t.co/FUQ7Jz8X8H"
276,2018-05-15 13:44:14+00:00,996385769680986113,Teachers work tirelessly &amp; sacrifice deeply w/o reservation. They give until it hurts. then keep on giving. We owe them retirement w/ dignity. Stop the Koch brothers' agenda of destroying pensions.  #120Strong https://t.co/cCRNh2WBbO https://t.co/D0Qzn7oTBU
277,2018-05-15 13:30:11+00:00,996382235031990272,"As a life-long, active member of the KDP, I understand that unions have long been part of the backbone of the party. Now is the time to INCREASE unionization, offer incentives to those businesses that employ union workers, and raise the min. wage to a living wage. #ItsAboutUs https://t.co/tGCISdqkCa"
278,2018-05-15 11:16:50+00:00,996348675336044544,"Big or small, we'll deliver them all! Where can we bring you a sign in District 4? #SethHallForCongress #VOTEKY https://t.co/RLOLTKyrkL"
279,2018-05-15 11:13:00+00:00,996347712546263040,"1 week from today is the primary! #VOTE #SethHall May 22 for a Congressman with PLANS for the future! It's About Us!
*Promote economic equality
*Focus on innovation
*Revitalize manufacturing communities.
*Bring jobs back to the U.S.
For specifics and more: https://t.co/rt0QHK8yCa"
280,2018-05-15 04:30:29+00:00,996246414857555968,"""As of February of this year, 613,772 Kentuckians have SNAP.  To qualify as a family of four, the income limit is about $31,563 a year."" The new House GOP Farm bill will make it harder for KY families to get the help they need. 
https://t.co/sBXUpBIylu"
281,2018-05-14 18:48:54+00:00,996100054854270976,"Thomas Massie may be swayed by Koch brothers' money, but I never will. 
If you're tired of being frustrated with poor representation in Congress, vote Seth Hall on May 22nd, and vote for hard working Kentuckians and their families!

https://t.co/5KKKl4RIy3 https://t.co/AekujswcVh"
282,2018-05-14 11:20:06+00:00,995987113219969024,"As part of my vision of public education in my platform:
5) Assert strong oversight and regulation of for-profit colleges. Debt won’t hold you back.
https://t.co/rt0QHK8yCa https://t.co/lXYAQwj6em"
283,2018-05-14 08:58:49+00:00,995951554770489344,The Primary Election is just 8 days away and there are lots of opportunities to get involved -sign up today! https://t.co/sawaHlijnt
284,2018-05-14 08:56:52+00:00,995951063701352448,"8 days until the primary! On Tuesday, May 22, I'm asking for your vote to continue on in the general election to challenge Thomas Massie for the Congressional District 4 seat. Message us if you want a sign, bumper sticker, or business cards! It's about us! https://t.co/cCRNh2WBbO https://t.co/nLxusV0b0n"
285,2018-05-13 15:43:45+00:00,995691074768293889,"Whether you are a past, present, or soon-to-be mother, a grandmother, aunt, teacher, single dad, or special person who has stepped in to provide that role in the life of a child, today may you know how special, loved, and appreciated you are for the love and guidance you provide. https://t.co/3TjxmsqCox"
286,2018-05-12 23:54:30+00:00,995452185466015745,Vote for Seth Hall for Congress in District 4! We are the top name on the ballot for the primary. https://t.co/cCRNh2WBbO https://t.co/NC6nUqlBhZ
287,2018-05-12 23:47:41+00:00,995450471132336128,This entire thread! https://t.co/6X4RkjKCfC
288,2018-05-12 23:10:50+00:00,995441199182942209,"This is a bill I would definitely support. In my platform: Promote economic equality by encouraging collective bargaining, increased unionization, &amp; both shared &amp; employee ownership. Include in all Fed Contracts provisions to give preferred status to contractors with Union labor. https://t.co/4m3hU5xBRN"
289,2018-05-12 20:59:10+00:00,995408061073326080,"District 4 doesn't just need Net Neutrality, we NEED broadband internet access for ALL!  Internet access will help people look for jobs, help small businesses grow, and will help the economy. Invest in our district's future by sending Seth Hall to Congress to fight for you! https://t.co/DJjynq8pSs"
290,2018-05-12 20:15:41+00:00,995397118750846977,"As a resident of the more rural parts of District 4 all of my life, I know how important public education is for ALL of our citizens.  I will fight for increased funding of our public schools and for better benefits for teachers when you hire me as your Congressman. https://t.co/wAs1hN2DMT"
291,2018-05-12 20:09:34+00:00,995395578199764992,We need to send a clear message to Frankfort that Kentucky is not for sale to ALEC and the Koch brothers' machine! https://t.co/ix01LI4xbd
292,2018-05-12 18:22:18+00:00,995368585739558913,"Seth Hall vows to have the courage of his convictions by standing up to the NRA! Universal background checks are an imperative not a false sense of security as Massie contends.

https://t.co/IycHRNqZol"
293,2018-05-12 18:19:13+00:00,995367808472158209,"In 6 years, Mr. Massie has done nothing to improve the quality of life in District 4 and has never passed a bill out of committee in 6 years! He was ranked one of the most ineffective Congressmen for a reason. It's time to elect a Congressman who will represent ALL of district 4! https://t.co/SfkQ5PhNrG"
294,2018-05-12 17:35:55+00:00,995356911401885698,"Donate if you can!  Even just $10 helps a lot!  As a true grassroots campaign of, for, and by the people, we need your help to get the job and take back District 4 for all of us, not just ""the craziest SOB in the race,"" as Massie calls himself.

https://t.co/qYH0L9LesH"
295,2018-05-12 17:33:54+00:00,995356404037931009,"Come join our campaign! 

https://t.co/sawaHlijnt"
296,2018-05-12 17:17:40+00:00,995352320056668161,"The #1 statement from folks all across Congressional District 4 is that ""Seth's platform is by far the best."" Read it for yourself.  Ask questions. Then hire Seth to represent you on May 22 and Nov. 6!
https://t.co/rt0QHK8yCa"
297,2018-05-12 17:14:53+00:00,995351618970406912,"fossil fuels. He values the environment–like the green spaces, wildlife, and farm animals–and will work to protect them. https://t.co/HJnlx1IRZh /2"
298,2018-05-12 17:14:33+00:00,995351537768697857,"Endorsed by the Sustainable Politician Project, ""District 4
Our pick: Seth Hall is looking forward to bringing renewable energy jobs to Kentucky, namely wind and solar.He sees this as an opportunity to fight climate change, support rural communities, and reduce our reliance on /1"
299,2018-05-12 17:08:11+00:00,995349934957350913,"Join Seth on Sunday, May 20th as he speaks live with @IndivisibleNKY4 and takes your questions 2 days before the primary! You can watch on Facebook Live or YouTube:
https://t.co/h9rlcl3YHW
https://t.co/rDGvkf4XDV
https://t.co/fIoanqGJPA"
300,2018-05-12 17:03:21+00:00,995348717224984577,"Shelbyville Sentinel-News profiled our race for Congress and Seth’s Solutions to the issues facing our Commonwealth. Vote for the candidate with real ideas, real plans, competence, compassion, and courage! Hire Seth Hall https://t.co/cCRNh2WBbO

https://t.co/n4QlZDVPss"
301,2018-05-12 16:56:52+00:00,995347086974603265,With school aged children protecting our students isn’t just a talking point for Seth. He will take action in Washington and offer real solutions to the issues surrounding school safety. Thank you to Moms Demand Action for Gun Sense in America for supporting our campaign. https://t.co/jzGqUUY4mR
302,2018-05-12 16:55:29+00:00,995346739258429441,Yard Signs are popping up all over the 4th District if you’d like to show your support send us a message and we will get one out to you! https://t.co/ZnmOVhV6Rb
303,2018-04-18 02:15:18+00:00,986427924420153344,Rest in Peace https://t.co/Zjj127drMQ
304,2018-04-17 01:00:57+00:00,986046824019562496,"On @KyTonightKET discussing my solutions to issues like Health Care for All, Infrastructure Improvements, Opioid Crisis, &amp; Agriculture Issues. Issues that affect all of us. Issues that require Competence, Compassion, &amp; Courage to address. #Elections2018 https://t.co/XIndzJgPA9"
305,2018-04-17 00:54:48+00:00,986045275654512641,Hope everyone watched https://t.co/71e3vvxxve
306,2018-04-16 18:09:09+00:00,985943189625425921,Watch Seth Hall tonight https://t.co/DykR27CJFr
307,2018-03-28 10:48:47+00:00,978946999226597376,"Seth Hall for Congress in Congressional District 4 in Kentucky let’s bring Courage, Compassion, and Competence to Congress.  https://t.co/9z8pzhzvaM"
308,2018-03-14 10:51:56+00:00,973874362620284928,"Let’s vote in competent, compassionate and courageous leaders.  We have to remove Treason from our country. @HallCongress https://t.co/Had5TBKtnc"
309,2018-03-14 05:40:10+00:00,973795905706000387,"While I was no fan of Tillerson, his firing via Twitter was disrespectful and an insult to American values.  He spoke out against Putin one day and fired the next."
310,2018-03-14 05:37:51+00:00,973795320990699520,At a time when science has been under attack a great mind has passed away.  Rest In Peace Stephen Hawking.
311,2018-03-11 18:05:28+00:00,972896301238116352,Does not work. https://t.co/ZZ5TAXhIds
312,2018-03-02 00:43:13+00:00,969372520313950210,Love this.  @HallCongress https://t.co/HrLRLjnN6v
313,2018-03-02 00:41:51+00:00,969372176817229825,Go moms...  https://t.co/9z8pzhzvaM @HallCongress https://t.co/TamHAWiY9c
314,2018-03-02 00:35:01+00:00,969370455923621889,With courage and competence we can find the revenue to give our State workers and Teachers the raise they deserve. @HallCongress https://t.co/NObe7JlKFC
315,2018-03-02 00:32:40+00:00,969369863033622528,@HallCongress  loves the public schools and supports investing in our schools and giving Teachers a pay raise. https://t.co/83yc6yDMR3
316,2018-03-02 00:31:22+00:00,969369537895452672,"Seth @HallCongress  supports our State workers, First Responders, county workers and Teachers.  We have to keep our promise to them. https://t.co/fD0Ldi0Ryf"
317,2018-03-02 00:29:52+00:00,969369162391937024,This was a bad decision from the Supreme Court.  Elect people to office that can work to remove money from our political system so people that truly represent the people are elected.  @HallCongress https://t.co/Q5HosK48YB
318,2018-02-23 02:55:40+00:00,966869138688880641,@HallCongress  Cowards probably would not shot up a school with armed Teachers but what about someone mentally challenged?  Would it matter? https://t.co/OQ3o5U6pJV
319,2018-02-23 02:52:59+00:00,966868459949879296,Maybe we should do the same. https://t.co/Hh72jRKIQD
320,2018-02-22 00:21:01+00:00,966467828198068224,Some of my favorite ladies in Oldham @OldhamKYDems  They are bringing life back to @OldhamDemocrats https://t.co/II23Kyv1CK
321,2018-02-20 03:08:32+00:00,965785209781260289,Bullitt get out and vote.  @RepLindaBelcher https://t.co/CIIl4SgUJa
322,2018-02-19 01:46:17+00:00,965402126619959296,"Ann, my son Dane could be interested as that is the day of his Prom.  Are there times? https://t.co/aH8iw0AvVj"
323,2018-02-19 01:33:40+00:00,965398950948859905,Tweet back at @hallcongress what is the first thing the Democrats should do once the House of Representatives is a Democratic majority.
324,2018-02-18 11:37:10+00:00,965188438134788096,Next Saturday. https://t.co/EZXeGYEnI1
325,2018-02-18 11:36:41+00:00,965188315266932741,This is a fundamental right of our people to have clean drinking water and repairing our infrastructure is a priority of Seth @HallCongress https://t.co/3KMYe1LLQE
