,Created at,User ID,Text
0,2020-07-22 13:48:42+00:00,1285934799002243073,https://t.co/oe0PiGJ7I0
1,2020-06-09 00:52:06+00:00,1270156684577644550,I am endorsing Alexandra Owensby for 4 th Kentucky Congressional District. @AMOwensby https://t.co/Tdb5dO2gCj
2,2020-05-30 20:48:53+00:00,1266833985071652866,2020 Congressional District 4 Candidate Forum https://t.co/VhrndBfETE via @YouTube @OldhamKYDems @OldhamDemocrats
3,2020-05-19 20:06:44+00:00,1262837113747312640,"Oldham County Democratic Executive Committee invites you to a Virtual Happy Hour and Fundraiser for Dr. Karen Berg, our Candidate for the State Senate District #26 Special Election. 

Donate online at: https://t.co/YuRXmcsqR6
Get details on how to join the fundraiser."
4,2019-09-05 12:06:41+00:00,1169582623854923778,Do you think better pay would help retain more teachers? I voted Yes on WHAS. What's your vote? https://t.co/XykvhPbSfG
5,2019-06-11 23:37:38+00:00,1138591148476436481,Join me in supporting Henry County Democratic Party Executive Committee (KY) via @actblue https://t.co/R79cfIRpza
6,2019-04-15 17:47:08+00:00,1117846832774828032,I am supporting Rocky as the next Governor. https://t.co/IeIDYbSyed
7,2019-04-11 01:22:32+00:00,1116149498491867136,Come out to our regional meet and greet April 11. https://t.co/mmMfotUoj2
8,2019-04-09 10:51:31+00:00,1115567912750911490,Come out and meet the candidates for 2019 State Office.  Time to retire Bevin Republicans https://t.co/TjkBxhZIuE
9,2019-02-10 19:53:42+00:00,1094685863898951681,Go follow @Mary81836367
10,2018-12-31 12:41:56+00:00,1079719303899955205,Happy New Year and have a Blessed 2019
11,2018-12-25 17:51:01+00:00,1077622758912212992,Merry Christmas and Happy New Year.
12,2018-11-22 18:10:01+00:00,1065668741122457600,I wish everyone a blessed and joyful Thanksgiving.
13,2018-11-07 02:17:45+00:00,1059993276089069568,We came up short tonight. Thanks for all your hard work and support! Congratulations @RepThomasMassie https://t.co/hDbSkXJNfj
14,2018-11-06 12:25:04+00:00,1059783723456126977,Today’s the Day we take our Country and Commonwealth back! Polls are open until 6 pm. Vote Seth Hall! #ElectionDay #Midterms #kentucky #vote https://t.co/eP1DAHQ68t
15,2018-11-06 10:17:59+00:00,1059751743653851136,It is time to do this and vote to bring back the soul of our state and nation! @HallCongress @IndivisibleNKY4 @OldhamKYDems @OldhamDemocrats @seaman4kyhouse @karenforky @bradley4mag7 @karenforky @karinsoltau @ViaCheri
16,2018-11-06 03:25:38+00:00,1059647970856046592,Tonight we burned the midnight oils to #GOTV2018 for the #MidtermElections2018 tomorrow. Thanks for all your hard work and support. Tomorrow we #VOTE! https://t.co/Uyxmrb5jai
17,2018-11-05 22:07:31+00:00,1059567917447217152,"Seth’s Beyond the Podium on @Local12 

https://t.co/KvgO94237f"
18,2018-11-03 13:53:40+00:00,1058718859786665984,The next great State Senator.  Proud to be running along side her. @rachel4ky https://t.co/AscYWfhRvo
19,2018-11-03 01:55:35+00:00,1058538146336595969,Please remember us.  Last minute get out the vote activities.  Donate and help add to the blue wave! https://t.co/WuigkD1oUY
20,2018-11-02 21:17:57+00:00,1058468276987146243,From Ashland to East Louisville; Cynthiana to Covington we’ve heard the same thing- When you call Massie for help you only get an answering machine. Seth will show up for us and respond to our needs with Competence and Compassion #MidtermElections #vote https://t.co/Jqr2WbwVAf
21,2018-11-01 14:39:45+00:00,1058005678961422336,Thanks to the hard working folks at the @UAW for their endorsement and support. #Election2018 #UnionStrong https://t.co/WaBf8fDWJB
22,2018-11-01 14:25:14+00:00,1058002024585924609,#ItsAboutUs https://t.co/jMbZoK2GmX
23,2018-10-31 23:44:39+00:00,1057780419473666048,"Great day on the trail with my fellow Pro-Public Education candidates @CoulsonForKY &amp; @Rachel4KY! Folks in Bracken, Pendleton &amp; Harrison Counties are ready to take our Country &amp; Commonwealth back. Thanks @LeaderAdkins for the support #RememberInNovember https://t.co/GJtfXJTC7C"
24,2018-10-31 18:41:01+00:00,1057704009346224128,Thank you for your endorsement and support. Together we can take this across the finish line. https://t.co/Ho64Eia2oA
25,2018-10-31 00:09:55+00:00,1057424390109962240,Seth isn’t just a candidate he’s also the @OldhamKYDems Chairman- his counterpart at the Oldham Co GOP have stooped to an extremely inappropriate mail piece in light of the recent Domestic Terrorism Attempts and Hate Crimes. Check out Seth’s statement and the piece👇🏼 https://t.co/wcOlMHTe9a
26,2018-10-30 12:58:04+00:00,1057255314423201792,Seth showed up to Harrison County this morning for breakfast at Biancke’s and will be on WCYN’s Coffee Break at 9:15. https://t.co/UpDslL6Ea3
27,2018-10-28 20:09:37+00:00,1056639139905396736,Thanks so much for the shout out. #ItsAboutUs https://t.co/6fys6yfjRq
28,2018-10-28 20:08:01+00:00,1056638738753875971,#ItsAboutUs https://t.co/bVoSqs4P9C
29,2018-10-25 23:42:33+00:00,1055605566360428544,"Thank you Grant County, I think this is my last forum. https://t.co/rjEr82YWP9"
30,2018-10-24 18:35:58+00:00,1055166022733492230,Statement from KY 4th Congressional Candidate on Domestic Terrorism. https://t.co/FliulQjUnh
31,2018-10-15 23:40:19+00:00,1051981124212322305,"Our internal polling is showing we can win this if we can get the message out. We need $10,000 this week. If you want change in Washington DC give. All amounts are welcome. We have marched, made the calls and now it is time to Donate at https://t.co/9z8pzhzvaM ."
32,2018-10-14 01:03:15+00:00,1051277218272428032,Good way to start the day. https://t.co/d6xvU9uSpE
33,2018-10-13 13:55:28+00:00,1051109165026955264,This is what you get with Massie. https://t.co/0gO90boyY5
34,2018-10-13 13:29:21+00:00,1051102592913293313,If you want a change in the 4th District it is up to you.  Only you can donate to help my campaign.  There is no money coming from DNC or the KDP.  #itsaboutus https://t.co/s9tgzaqsob
35,2018-10-02 10:47:59+00:00,1047075717572382721,Action for the day:  supporters please write a letter to the editor of your local paper supporting Seth Hall and the slate of Democrats on our ticket!
36,2018-09-29 23:28:06+00:00,1046179843703021570,Our campaign is only funded by donations from you! We do not get money from the Kentucky Democratic Party or the National Democratic Party. Sept 30 at midnight is the deadline for FEC filing. If you can change in Washington. Thank you. Donate what you can! https://t.co/0O4r66qM9p
37,2018-09-27 19:15:49+00:00,1045391577634545664,It’s disgusting that we’ve reached this point that we actually have to put this on a t-shirt but here we are. Judge Kavanaugh’s past certainly needs closer scrutiny - the FBI needs to investigate the growing list of accusations immediately. https://t.co/XGI2RJa0dW
38,2018-09-27 10:50:14+00:00,1045264345893150721,To sit on the Supreme Court is the highest honor and people selected should be reflective in character of that honor.  No person with any hint of impropriety should be accorded the robes of the office.
39,2018-09-26 11:25:29+00:00,1044910825696382982,Massie is not going to debate me.  I challenge him to a debate!
40,2018-09-18 19:33:33+00:00,1042134549164163072,"This weeks fundraising goal is $15,000 to get us on the airwaves across the district. We're almost half way there! A donation of $20, $50 or more will ensure our message is heard from Louisville to Ashland. https://t.co/uByHKJoOCB"
41,2018-09-14 19:55:38+00:00,1040690557889249281,"Six years and nothing to show- we deserve better. 

https://t.co/66eCvWe6Bi"
42,2018-09-08 19:44:06+00:00,1038513327679434755,Enjoyed joining @urieforstaterep last night in Owen County for a spaghetti super and a crowd of folks ready to take our Commonwealth and Country back! #Election2018 https://t.co/Nw66YKB4UI
43,2018-09-05 13:46:15+00:00,1037336109452353537,"This is an important thread &amp; article for ALL Kentuckians to read! Some may wonder why I would promote/discuss a state issue, but my entire reason for running for Congress is that I am a Kentuckian who cares about our state, it's people, &amp; their mistreatment &amp; underrepresentation https://t.co/Q1Zk0xQyIY"
44,2018-09-05 11:45:13+00:00,1037305649045155841,"When elected to Congress, I will work to help pass H.R.1205 - Social Security Fairness Act of 2017 which repeals the Government Pension Offset and the Windfall Elimination Provision for our teachers. These hard-working public servants deserve to retire with dignity and security."
45,2018-09-04 18:54:22+00:00,1037051257960235008,"Labor Day has passed, campaigns are firing on all cylinders, but, I need your help to #FlipThe4th! Please consider a donation today so the people of District 4 can have a true representative voice in Congress!  Every dollar counts. Thank you! https://t.co/uByHKJoOCB"
46,2018-09-04 00:26:26+00:00,1036772438758105088,We also made it to Rabbit Hash in Boone County this weekend for Old Timer's Day. @amyferg11981921 Amy Ferguson for Boone County Clerk was along for the fun as we took in this historical treasure within KY-04 and spoke with the good folks who live there. https://t.co/jySDPmOSLU
47,2018-09-04 00:10:38+00:00,1036768461773524993,"Another hot, busy weekend of traveling the district having real conversations w/ real folks at the places that matter to THEM.  Thank you to Karen Fitch &amp; @rb_mckenzie from the Greenup County Dems for being so gracious &amp; hospitable in showing me around! #FlipThe4th #ItsAboutUs https://t.co/8Hg69JXpZZ"
48,2018-09-02 23:45:50+00:00,1036399833622474752,"This weekend remember the men, women, &amp; children who gave blood, sweat, &amp; tears as they fought for things like safe working environments, child labor laws, the 40-hour work week, plus better wages and benefits that we ALL reap the rewards of! https://t.co/NcCZHC4YQq"
49,2018-08-31 14:50:31+00:00,1035540341242429441,"I agree with the majority of Kentuckians. It's way past time for comprehensive Criminal Justice Reform. KY incarcerates more women than any other state, puts too many addicts in jail as opposed to treatment, &amp; lacks re-entry programs. It's time to act!
https://t.co/eNzyeWx7W0"
50,2018-08-31 12:00:29+00:00,1035497551385042944,"#FundraisingFriday No candidate likes to ask hard-working folks for money. But, I need your help to get to Congress. KY-04 needs a representative voice for ALL! Donate 20.18 today! Let's #FlipThe4th together! #ItsAboutUs https://t.co/qYH0L9LesH or https://t.co/pJx5nhEmwu"
51,2018-08-29 21:55:30+00:00,1034922516333125633,Soybean farmers in Pendleton Co will be hit particularly hard by these tariffs. Bailouts will mostly go to large corporate farmers at the expense of family farms &amp; are only short-term solutions for long-term problems. Our proud KY farmers want markets to sell in not bailouts. https://t.co/f5vbMRXdm5
52,2018-08-29 16:55:26+00:00,1034847002528493569,"Join me! Let's talk about the most important issues facing the district.
Seth Hall for Congress Town Hall
Tuesday, September 11 at 5:30 PM – 7:30 PM 
Campbell County Public Library
901 East 6th Street, Newport, Kentucky 41071
Open, FREE, public event for ALL https://t.co/T8QVDZjQDx"
53,2018-08-29 13:24:43+00:00,1034793975004188672,"“More must be done at the state and federal level to spur job growth and increase job quality,” Bailey said. “Congress should be pursuing direct job creation in distressed regions like eastern Kentucky and expanded investment in needs like infrastructure..."" I couldn't agree more https://t.co/bg78oV2QJe"
54,2018-08-28 18:11:51+00:00,1034503845341224960,When the #PumpkinSpiceLatte drops you know fall (and #Election2018) is near. Signup today https://t.co/bxzqyEaMHi to stay up informed with the campaign as we work towards a win on Election Day. https://t.co/NgebGQc71M
55,2018-08-28 11:40:49+00:00,1034405439188992000,"*Increase minimum wage.
*Promote economic equality by encouraging collective bargaining/unionization with both shared &amp; employee ownership.
*Increase focus on innovation -manufacturing, clean energy (solar, wind, etc) &amp; biotech.
*Eliminate the taxes on Soc Sec Income https://t.co/FBkJArjNbe"
56,2018-08-28 02:22:25+00:00,1034264912091127809,"Thank you @KYMMJason @KentuckyNORML @NORML for the thought-provoking article. I have long been a supporter of the legalization of medical cannabis at the federal level. Not only will it help real people with their daily struggles, it will also add much-needed revenue in KY. https://t.co/5RJiHBGHL1"
57,2018-08-26 04:02:10+00:00,1033565241454542848,"Our thoughts and prayers are with Senator John McCain's family. He was a true American Hero who answered our country’s call to service time and time again. Principled individuals with honor and the courage of their convictions are hard to come by, Fly high, sir. Rest in peace. https://t.co/HnoC8rfQYd"
58,2018-08-25 22:14:12+00:00,1033477670481416193,"#SaturdayReflections Looking back over all of the journeys across Dist 4, &amp; even Frankfort. Thinking about all of the amazing people I've met &amp; talked to. If you haven't connected to with me, please visit https://t.co/cCRNh2WBbO . Join our team, donate, or contact us today! https://t.co/qTFdQrQUXc"
59,2018-08-24 00:08:32+00:00,1032781669357572102,"Of all things teachers have reported they were in need of, guns never made the list. They are hired to nurture &amp; educate, not replace trained police. Let's have honest discussions abt school safety needs &amp; put the grant money where it can do the most good. #BooksNotBullets #SROs"
60,2018-08-23 19:17:36+00:00,1032708450936139781,💯% THIS! #PeopleOverProfits #HealthcareIsARight Good luck Dr. Rob @VoteRobDavidson I look forward to working with you in Congress to build the system we NEED. https://t.co/l2LvXX5WXh
61,2018-08-23 18:50:08+00:00,1032701540308594688,"Showing up for our Agricultural Community this morning at the KY Farm Bureau @KYFB Ham Breakfast at the State Fair. @ForParks Jesse Parks for State Representative and @CoulsonForKY Greg Coulson joined us to share their commitment to our hard-working, farming families. https://t.co/82DhiuwEnN"
62,2018-08-22 12:37:42+00:00,1032245428329361411,Thanks to the @floydsforkclub for hosting a great meeting last night. A standing room only crowd of folks ready to take our Commonwealth and Country back! #Midterms2018 #Louisville #Elections2018 https://t.co/7nxz0RlJCB
63,2018-08-21 19:31:00+00:00,1031987047505047552,"Thanks to the hard working folks at the International Brotherhood Boilermakers, Iron Ship Builders, Blacksmiths, Forgers &amp; Helpers for their endorsement! They agree that #KY04 deserves a Congressman who will serve with Competence, Compassion &amp; Courage. #Election2018 #Midterms2018 https://t.co/DmT3WSRwYU"
64,2018-08-21 15:49:02+00:00,1031931187852468224,KY is experiencing an epidemic of Black Lung; lawmakers have made it more difficult for miners to receive care; all reports show a decline in coal jobs despite promises; benefits of the Clean Water and Clean Air Acts are well-established. How could a doctor approve? #LetUsBreathe https://t.co/AWznhvxsrN
65,2018-08-20 22:38:20+00:00,1031671806686584834,"Support local, sustainable agriculture to help rural communities, &amp; protect open spaces of the environment. Prepare for the impacts of climate change, &amp; tell the public about the realities of those impacts. Promote transportation solutions aimed at reducing greenhouse gases (2/2)"
66,2018-08-20 22:35:09+00:00,1031671004517605382,"“Protect our Planet, it is all we have” We MUST: Support green energy technologies, conservation, &amp; energy efficiency. Become the world’s clean-energy superpower &amp; meet the climate challenge. Protect the environment; including wildlife, commercial, &amp; domesticated animals (1/2) https://t.co/94gXYEU62F"
67,2018-08-20 14:39:19+00:00,1031551256073052160,"#Courage - I WILL stand up for what's right for ALL living in District 4, even if that means going against party lines. I will ALWAYS stand by #PeopleOverPolitics This campaign isn't about me.  It's about ensuring a voice in Congress for ALL of District 4 #ItsAboutUs (3/3)"
68,2018-08-20 14:36:03+00:00,1031550434257895424,"#Compassion - Every member of Congress should be the voice of ALL of their constituents, not just a select few.  Being compassionate is a strength, not a weakness.  It means taking the time to meet with, listen to, &amp; understand them while working in the best interest of ALL (2/3)"
69,2018-08-20 14:32:02+00:00,1031549421635481601,"#Competence - means not only will I work for YOU, it means I WILL achieve results. I'm a known problem-solver who is open to new ideas and out-of-the-box thinking to achieve the needs of the people of District 4. I won't end up on anyone's ""Least Effective"" list. (1/3)"
70,2018-08-20 12:59:55+00:00,1031526240665182208,"COMMIT TO VOTE IN THE MIDTERM ELECTIONS ON NOVEMBER 6!
https://t.co/f5x7M7lvhf https://t.co/gmQt1rfkez"
71,2018-08-20 12:55:26+00:00,1031525115262058497,Exciting &amp; busy weekend at the KY State Fair &amp; Wendell Ford Dinner. The enthusiasm in the Democratic Party grassroots movement is palpable!  Let's harness that energy and bring home a win on Nov. 6! You can help us achieve that goal by donating today! https://t.co/2UfIwiQi8e https://t.co/Du9EiBDmhh
72,2018-08-17 14:49:15+00:00,1030466592860237824,"We NEED to build an economy that works for EVERYONE by raising min wage, strengthening our unions, securing equal pay for equal work for ALL, &amp; protecting/expand Soc Sec and Medicare so working class people can retire with dignity where no one goes broke due to healthcare needs. https://t.co/tNIgwZxYzc"
73,2018-08-16 22:40:30+00:00,1030222799632302081,@campbell_dems @kyvirginaj @linda_nesbitt4 @ConnieCommish @kilmerforky68 @plwkyblue @Rachel4KY
74,2018-08-16 21:58:03+00:00,1030212116597420032,"Had a great time at the 19th Amendment Dinner last night! Thanks to the Campbell Co Dem Woman's Club for a great event! Women make up 51% of our population. They are smart, strong, capable, independent thinkers who deserve respect &amp; support of their Congressperson #ItsAboutUs https://t.co/3cc9tLdqQu"
75,2018-08-14 18:00:48+00:00,1029427632943837184,"Seth has been traveling the 4th District meeting voters &amp; growing our grassroots support base. One way you can help our campaign grow is by committing to make a small monthly donation to the campaign. Become a Sustainability Supporter today! 
https://t.co/2UfIwiQi8e"
76,2018-08-10 13:04:15+00:00,1027903454361120768,"""They both believed in the importance of funding public education."" 

Education is the key that unlocks the future for our children, society, the economy, &amp; innovation. It is a moral imperative that we fully fund it and help it grow. #ItsAboutUs (2/2) 
https://t.co/laYkpDnJnk"
77,2018-08-10 12:58:35+00:00,1027902027312062464,"""Two of our greatest Founding Fathers, John Adams and Thomas Jefferson, were fierce political adversaries. But in the first years of our nation, these rivals — with vastly different backgrounds and disparate political views — shared common ground."" (1) https://t.co/kSo9LkRQ7a"
78,2018-08-10 03:36:11+00:00,1027760494218825728,Well done Maysville Mayor David Cartmell and Maysville Human Rights Commission! https://t.co/1u8wdDwfZU
79,2018-08-09 18:17:56+00:00,1027620005364555776,"KY set the gold standard for the implementation of the ACA &amp; expanded Medicaid. It makes no sense to spend more money to strip it away from people than it costs to continue the program as is. We CAN &amp; MUST ensure affordable, accessible, quality healthcare for ALL!  #ItsAboutUs https://t.co/zYCU0dxfAA"
80,2018-08-08 19:03:31+00:00,1027269090468081665,"Infrastructure: The Brent Spence bridge has been ranked worst in the country; we have water lines over 100 years old, &amp; we need Broadband internet access for ALL. These projects would bring good paying jobs while solving problems.  What other infrastructure concerns do YOU have?"
81,2018-08-07 20:25:16+00:00,1026927274107527168,"Register as a first-time voter, update your registration if you've moved, check your registration status to make sure you weren't purged, find your polling location, or sign up to be a poll worker today! Above all, exercise your right to vote! #ItsAboutUs https://t.co/23Zu09H5dK https://t.co/3ZUbSOy47e"
82,2018-08-05 23:56:07+00:00,1026255561074065409,More pictures from the Ohio River cruise on this beautiful day! @ConnieCommish @ColforKentucky @kilmerforky68 https://t.co/mUW120QTOV
83,2018-08-05 23:52:59+00:00,1026254771924201472,Thank you to @linda_nesbitt4 and the @campbell_dems for a fabulous day on the Riverboat Cruise! Campbell County is ready to #FlipThe4th!  Are you? Volunteer today! https://t.co/sawaHlijnt #ItsAboutUs @RepHarrisKy @Rachel4KY @DennisKeene https://t.co/7OlFF0nEZk
84,2018-08-05 23:24:09+00:00,1026247515950272512,I don’t think the farmers in Kentucky’s 4th District think they’re “working big time” when they have cattle &amp; hogs they can’t sell. https://t.co/eAjg8hkNvJ
85,2018-08-05 15:31:28+00:00,1026128561458106369,Ensuring every person in #Kentucky has access to healthcare is a key plank in our campaign’s platform share your thoughts today on #SaveMedicaidKY https://t.co/s2wWYryQ9n
86,2018-08-05 03:13:23+00:00,1025942815837249537,"Another amazing night out with the folks of District 4.  This time, we were at the Germantown Fair talking to the good people of Bracken and Mason Counties. https://t.co/WQSAWv4NBE"
87,2018-08-04 15:48:30+00:00,1025770459701420033,"Another beautiful day on tap for Dist 4 KY!  Come out to the Germantown Fair tonight! I'll be there at 6 pm.  Tomorrow, I'll be in Campbell County on the annual Riverboat Cruise with the @campbell_dems &amp; friends. Looking forward to meeting as many of you as possible! #ItsAboutUs https://t.co/pz1vdtRL7r"
88,2018-08-04 03:17:25+00:00,1025581444243116032,Great news! https://t.co/lshO7zQqEA
89,2018-08-04 03:03:09+00:00,1025577853436522496,Had a great night at the Grant County Fair tonight meeting and talking with the constituents of District 4. #ItsAboutUs https://t.co/LVCQixvb7D
90,2018-08-03 18:30:58+00:00,1025448961329582080,"For grassroots candidates who refuse to take corp PAC $$$, raising enough to compete can be tough. It's even more difficult to ask folks to donate their hard-earned money when you know their struggles, stories, &amp; the truth of it all. If you can, donate $5 https://t.co/qYH0L9LesH"
91,2018-08-03 17:06:38+00:00,1025427737899663360,"Meet me tonight at the Grant Co, Fair &amp; Sat. night at the Germantown Fair. I'm asking for YOUR vote on Nov. 6. You should have the chance to meet &amp; talk with me.  (3/3) #ItsAboutUs #PeopleOverPolitics #RespectFostersCommunication"
92,2018-08-03 17:06:02+00:00,1025427585596108802,I'm traveling the district at events open to ALL constituents!  I want to hear from YOU. I will never disrespect a constituent for having a different opinion &amp; vow to hold multiple OPEN Town Halls every year once elected. (2/3)
93,2018-08-03 17:05:34+00:00,1025427467014692864,"Has Massie EVER held a Town Hall that was open to the public &amp; not sponsored by a fringe or donor group? He's currently home on Fall break attending fundraisers for local candidates &amp; speaking at donor group events rather than talking to YOU, the constituents. (1/3)"
94,2018-08-02 19:08:55+00:00,1025096120219979776,Join me Friday night at the Grant County Fair from 7 pm to close w/ the 𝐆𝐫𝐚𝐧𝐭 𝐂𝐨𝐮𝐧𝐭𝐲 𝐃𝐞𝐦𝐬 &amp; Saturday at the Germantown Fair w/ the 𝗕𝗿𝗮𝗰𝗸𝗲𝗻 &amp; 𝗠𝗮𝘀𝗼𝗻 𝗖𝗼𝘂𝗻𝘁𝘆 𝗗𝗲𝗺𝘀 𝗽𝗹𝘂𝘀 𝘁𝗵𝗲 𝗕𝘂𝗳𝗳𝗮𝗹𝗼 𝗧𝗿𝗮𝗰𝗲 𝗬𝗼𝘂𝗻𝗴 𝗗𝗲𝗺𝘀 from 6 pm to close.
95,2018-07-31 00:23:22+00:00,1024088094079954944,Well said!  Imagine if West Virginians and Kentuckians teamed up in such endeavors for the entire area! #ItsAboutUs https://t.co/4XEbYYvecj
96,2018-07-30 17:21:58+00:00,1023982044815286272,"98 days until the election, and we're going retro!  I was a national committeeman for the KY Young Dems back in the day!  Please consider a donation of 19.80 to help us defeat Thomas Massie on Nov. 6! #ItsAboutUs #RememberInNovember #PeopleOverPolitics https://t.co/qYH0L9LesH https://t.co/08IgHUwfPB"
97,2018-07-29 17:29:37+00:00,1023621580423929856,"Government of the people, by the people, and for the people is representative and means YOU decide!  #VOTE #ItsAboutUs #PinkSlipMassie (3/3)
https://t.co/z14lF8NG0O"
98,2018-07-29 17:28:47+00:00,1023621372113764353,He is suggesting that repealing the 17th Amendment is a better solution for getting big money out of politics. This just shifts the dark money from one place to another to ensure corporate choices are made at the state level! (2/3)
99,2018-07-29 17:28:14+00:00,1023621231663370241,"As one of the Candidates With A Contract who has agreed to get dark money out of politics by working to repeal Citizens United @StopBigMoney (because corporations are NOT people), I find it abhorrent that Massie would rather take away YOUR right to vote for YOUR Senators! (1/3)"
100,2018-07-29 03:31:26+00:00,1023410645151215617,Thank you to @karinsoltau for hosting tonight's @OldhamKYDems Barn Dance all while running for 8th district magistrate! The comforts of home and conversations with friends and supporters is always uplifting! @karenforky  #ItsAboutUs https://t.co/woe1U5jV5X
101,2018-07-28 12:15:05+00:00,1023180036256477184,It's a beautiful morning setting up for the Henry County Harvest Showcase. Join me at the Henry County Democrats' booth during the day and/or at the Oldham County Dems' Barn Dance tonight! https://t.co/epVSHroY98
