,Created at,User ID,Text
124,2022-08-31 19:39:12+00:00,1565061662662688776,And the Union news continues today!  We just got the UAW endorsement! #UnionStrong #NY24
125,2022-08-31 17:21:45+00:00,1565027071499313152,Proud to announce our most recent endorsement- the NY State AFL-CIO! #UnionStrong #NY24
126,2022-08-31 14:37:22+00:00,1564985702244302850,"Unlike my opponent (but like most of you), I don't funnel money through my campaign so I can buy a house to move immediately. As a military officer, I have lived in every corner and timezone in the US. I'm not a carpetbagger, I am a duffle bagger."
127,2022-08-31 13:46:21+00:00,1564972864893239296,"Looks like even Fox News is asking the same question I want to know! Even seeing the classification markings gives me the shivers. You know, my opponent was just at Mar-a-Lago. #Whatdidshesee #NY24 https://t.co/ok4WwrmWsh"
128,2022-08-31 13:13:34+00:00,1564964616568029184,"My friend Melanie is right! Our District is the home to Women's Rights, the Abolitionist Movement, and Religious Freedom. There is no better place than #NY24 to send a message that we stand for freedom! https://t.co/yY5xO6ok7Z"
129,2022-08-31 13:10:46+00:00,1564963910092038144,"I am sure Claudia Tenney will be on Newsmax tonight talking about Hunter Biden's laptop in 3, 2, 1... https://t.co/2OvakLJ5Or"
130,2022-08-31 13:09:34+00:00,1564963608999641091,Question of the Day! https://t.co/sGTZmftEka
131,2022-08-31 13:08:12+00:00,1564963264508854272,"I was asked recently in a national radio interview about defending democracy. My oath did not end when I retired. If we do not hold these people accountable, to include the former POTUS, then the rule of law is gone. This goes back to the Magna Carta. #NY24 https://t.co/z1ZLfOINQd"
132,2022-08-31 13:04:36+00:00,1564962358916702210,"My friend @CastelliMatt is right, and we need to remove Stefanik's good buddy, Claudia Tenney as well. As I have said before, if Matt and I would have done this, we would have been in Federal Prison. #NY24 https://t.co/Q9Lp1v8AUM"
133,2022-08-31 13:00:59+00:00,1564961449725857794,"You want to know why home prices are skyrocketing, here is why. We need to prohibit these firms from buying residential property. #NY24 https://t.co/JJRlexzkHH"
134,2022-08-30 22:47:27+00:00,1564746648072380416,"And we must protect our vital water supply in #NY24. That is why I oppose fracking, as it is bad for children, homeowners, and farmers. https://t.co/yi9MB1h4K1"
135,2022-08-30 19:57:56+00:00,1564703989232549889,"Rural communities rely on the USPS for medications, checks, and critical supplies. DeJoy must leave! https://t.co/69OSJRxyNX"
136,2022-08-30 19:47:25+00:00,1564701342920318979,"Unions built our District, which is why I am proud to have support from IBEW and CWA! https://t.co/fD298nOVnn"
137,2022-08-30 19:03:38+00:00,1564690324982743046,What does my opponent have to say about this?  What about the rule of law? #NY24 https://t.co/YZEfTjTDUA
138,2022-08-30 18:59:22+00:00,1564689252067278849,"If elected, I will introduce legislation to ban candidates from funneling campaign funds into their own business. As a small business owner, I would never use your hard-earned cash in such a way. #NY24"
139,2022-08-29 19:09:34+00:00,1564329427886014466,"Everyone, join me tonight with one of my favorite fellow Syracuse Grads @MSignorile! https://t.co/9nxxEy80MU"
140,2022-08-29 12:49:17+00:00,1564233728376938497,"Claudia Tenney's buddy is 100% wrong again. As someone who has helped get numerous Afghan interpreters and their families here, they believe more in America than she does. https://t.co/2qkH4uvXS3"
141,2022-08-29 12:42:54+00:00,1564232122935787523,Or anybody in the military... https://t.co/NrSvimNbhD
142,2022-08-28 13:30:38+00:00,1563881746172723200,"Just your kind reminder that Clauida Tenney voted against The American Rescue Plan, which provided money to state and local governments to pay their police, fire, and first responders. THAT is defunding the police. #NY24 https://t.co/NPjqy1uIWK"
143,2022-08-26 17:27:26+00:00,1563216563335229441,We are proud to have the support of @KathyHochul. Her tireless work for Western New Yorkers is longstanding. Thank you immensely! https://t.co/i3zZkOqP5j
144,2022-08-26 14:06:34+00:00,1563166014103179264,"Today is #WomensEqualityDay2022. Our District is the birthplace of the Women's Rights Movement and the Women's Rights National Memorial. Let's honor women by codifying abortion rights, ratifying the ERA, and making childcare affordable and available. #NY24 #TheLakeDistrict"
145,2022-08-26 13:33:15+00:00,1563157629639495682,"A lot of businesses in the Lake District needed PPP loans, and didn't get them. The rules were intentionally vague so those who got those loans would not need to pay them back. That is going to change. #NY24 https://t.co/lgew8c1utr"
146,2022-08-26 13:21:29+00:00,1563154665985871872,"As did Claudia Tenney's friends Matt Gaetz, MTG, and Lauren Boebert. #NY24 #TheLakeDistrict https://t.co/5RFkoSqtlz"
147,2022-08-26 12:27:16+00:00,1563141024804786177,"Anyone in #NY24, especially farmers, should look at this. Is this what you want as groundwater? Would you use this water? If Claudia Tenney gets her way, this is the future of our water supply. https://t.co/Rc7MOvyBgY"
148,2022-08-26 11:50:23+00:00,1563131742869139456,And Claudia Tenney is on the case! https://t.co/H6bug9SBh6
149,2022-08-25 17:56:40+00:00,1562861532811493376,"Supporters, as you know, I am the Democrat taking on Claudia Tenney. She is well-funded and has the support of both Trump and Stefanik. If you can, please go over to https://t.co/afbRUvt3AR. Thanks!"
150,2022-08-25 14:59:05+00:00,1562816843257364485,Claudia Tenney's good friend and bill cosponsor is upset about student loan forgiveness. But let's look at this... https://t.co/sAYso0uWDJ
151,2022-08-25 14:56:54+00:00,1562816294411718656,"Claudia Tenney is cosponsoring with MTG the ""Protecting Children's Innocence Act."" How about funding baby formula? Protecting innocent children from school shootings? BTW, House GOP members should be the last people talking about protecting children. #NY24 #TheLakeDistrict"
152,2022-08-25 13:32:31+00:00,1562795054963429377,"If you are concerned about the economy, inflation, or the Federal budget, I am the only one in this race who is a Certified Financial Manager with the federal government. I will always look out for your tax dollars."
153,2022-08-25 12:38:16+00:00,1562781404630372358,People like Claudia Tenney think this. They are not out for you. #NY24 https://t.co/t2rtrkLD5c
154,2022-08-25 12:35:23+00:00,1562780677564555269,"People like @PatRyanUC @FDConole @DellaPiaForNY23 @CastelliMatt @VoteJackie4NY @MaxRose4NY and I all have had or still do have security clearances, and he is right. All of us would be in Leavenworth right now if we did what 45 did. https://t.co/7Lz8cydmzu"
155,2022-08-24 23:50:22+00:00,1562588154326294531,QTNA https://t.co/svMterIspj
156,2022-08-24 02:28:02+00:00,1562265447583604736,Castelli
157,2022-08-23 14:56:44+00:00,1562091476238143489,"For the women in #NY24 and around the country who are irate about Dobbs decision, let me introduce you to the man who did it...Leonard Leo... https://t.co/8MIlkTmt3L"
158,2022-08-23 13:27:32+00:00,1562069026183970817,Today is our primary day for Congress in NY. Every single voter needs to make their voice heard. Vote against big business. Vote against the status quo. Vote your conscience. Vote for integrity. It's the fastest way to get to the better future we all envision.
159,2022-08-23 12:33:52+00:00,1562055519682052099,"Folks in #NY19, go support my friend @JoshuaUE99. You won't go wrong! https://t.co/rHGOvU1OKz"
160,2022-08-23 12:32:15+00:00,1562055116030709761,"Everyone in #NY24, please send good vibes to @DarrigoMelanie in #NY3. She is a fighter who is on your side! https://t.co/RTTjLLFxse"
161,2022-08-23 12:30:40+00:00,1562054714883186691,Go get 'em Soldier! @PatRyanUC https://t.co/bnaxPIz3eI
162,2022-08-23 12:29:46+00:00,1562054489603014659,Two of my favorite people on the case on this one. Both of those guys are Veterans. I cannot wait to see what Claudia Tenney calls me. Let's send Claudia and her minion packing! #NY24 #NY22 #TheLakeDistrict https://t.co/nk7MG3xYX7
163,2022-08-23 12:20:35+00:00,1562052177367007232,Sending good vibes your way from #NY24! https://t.co/eBBShpCjtp
164,2022-08-23 12:15:36+00:00,1562050923404345345,"700! Those documents being out in the open endanger people's lives to include our troops. This is un-American!
#NY24 #TheLakeDistrict https://t.co/uSch9QQe6k"
165,2022-08-23 12:11:47+00:00,1562049963504406528,We must have judicial reform! #NY24 #TheLakeDistrict https://t.co/J7gd0R4B7T
166,2022-08-23 01:43:06+00:00,1561891751295684609,Ane we will beat her in #NY24 #TheLakeDistrict https://t.co/9asdjzMkgI
167,2022-08-23 01:41:39+00:00,1561891386588291072,And then we will do the same this November in #NY24 #TheLakeDistrict https://t.co/bm3Ku2wkMl
168,2022-08-23 01:40:44+00:00,1561891154362261504,"So, Congresswoman Tenney, what say you? https://t.co/AIopEibrrk"
169,2022-08-23 01:36:55+00:00,1561890194395209728,"Please get out and support my fellow Vets, @DellaPiaForNY23 and @PatRyanUC. It is the patriotic thing to do. https://t.co/tRUow96SE6"
170,2022-08-23 01:34:52+00:00,1561889676390240256,"300! If I would have taken just ONE, I would be in Leavenworth right now. https://t.co/LPU437p1lh"
171,2022-08-23 01:32:53+00:00,1561889178022993920,"This is why I am proud to have a grassroots, people-powered campaign. I will work to expose just who is trying to buy our democracy and put us all at risk. https://t.co/TCWpJOOkM1"
172,2022-08-22 11:30:12+00:00,1561677110397341697,I've got a confession to make. One of my highest positioned staffers is a Patriots fan. So I had to take a picture with the Super Bowl LVII MVP @JoshAllenQB https://t.co/12AAeBrUXP
173,2022-08-22 11:08:19+00:00,1561671605973094401,This is why #bodycams are so important. When police actions can be reviewed we can further ensure that government employees will be held accountable for overstepping and that they are protected from frivolous claims. https://t.co/YkwduZP0Te
174,2022-08-22 11:08:18+00:00,1561671598490501122,When I was in combat there were very strict guidelines on conduct that ensured the Army didn't have moments that looked this bad. https://t.co/xtVgScNknt
175,2022-08-22 10:19:49+00:00,1561659399122345984,One of the things that everyone agreed on is that subsidies and credits need to be structured so they serve family farms first. If Big ag takes the lions share of subsidies and uses them to beat local farmers over the head and force them out of generational farms. https://t.co/RSB8pcjUnO
176,2022-08-22 10:19:48+00:00,1561659393191600129,Last week I got to spend some time at a candidate forum with the Farm Bureau in beautiful Ontario County to emphasize my ties to the ag community and get good feedback from current farmers. https://t.co/JlRuWhsrl9
177,2022-08-21 15:28:39+00:00,1561374731911266304,#NY24 #TheLakeDistrict is the home of Women's Rights! Let's do this! https://t.co/7yirwobomk
178,2022-08-21 15:22:18+00:00,1561373131587354624,"A Nation must be judged on how we take care of those in the shadows. As someone who has a niece and sister-in-law on SSI, I always will fight for Social Security. https://t.co/COH1ynds1L"
179,2022-08-20 17:52:25+00:00,1561048521536638977,There are reasonable measures that we need to take to become truly energy independent as a nation and stop pumping so much pollution into our air and water and fracking is nowhere near close to being one.
180,2022-08-20 17:52:24+00:00,1561048518898470912,"Some politicians champion fracking because big oil writes big checks to politicians puts us, our families, and our water resources at risk. We don't need to poison our land to make the grid reliable. 
https://t.co/F5ZsnPCDKi"
181,2022-08-20 17:52:23+00:00,1561048516830666752,Claudia Tenney wants to bring this to New York as an energy solution. Currently 60% of the power in our state is provided by reliable clean energy. We don't need to poison our children to make the grid more reliable.  https://t.co/Z76a14aIb4
182,2022-08-20 15:27:06+00:00,1561011954352783360,"I wish it were possible to take so called #ProLife people at their word. But every single day another article of this type pops up. 

Voting for candidates that will not compromise on issues of health for over half of the U.S. population is imperative.

https://t.co/psNjrV1aIm"
183,2022-08-19 13:40:02+00:00,1560622621011886082,Every vote counts. You don't just stop shooting baskets because you're up. If we didn't already know we learned that in 2016. https://t.co/Sc0Ru49pxu
184,2022-08-19 13:29:17+00:00,1560619917715673089,"It's not just Michigan, it is here in #NY24 #TheLakeDistrict too. I hear lifelong Republicans tell us they cannot support this GOP. This is not the party of Ike, Ford, or even Reagan and Bush. As one voter told me ""we can disagree on policy later, but we must save democracy now."" https://t.co/bJn5HexAG5"
185,2022-08-19 13:21:10+00:00,1560617872816209920,And GOP elected officials want to take it from you. Not on my watch! https://t.co/VREnphqHn6
186,2022-08-19 12:26:14+00:00,1560604047236898816,This is just a friendly reminder that the NY Post is a rag. You can ignore it and your life will be better off. https://t.co/onZQnW6icu
187,2022-08-18 18:08:27+00:00,1560327781292154881,"It is up to us, the voters, to do our part to break this cycle and only vote for candidates dedicated to comprehensive affordable healthcare policies."
188,2022-08-18 18:08:26+00:00,1560327779589259264,"Did you know that more than 20% of kindergartens need corrective lenses and most don't get them because vision isn't covered by most insurance. 

This contributes to poor grades and low engagement which compounds until the problem is fixed or the child is left behind."
189,2022-08-18 18:08:26+00:00,1560327778582552581,We have to seal the gaps in our health care system.
190,2022-08-18 17:35:28+00:00,1560319481557274629,"These are the same words I live by, and the same reason you should vote our great Democratic Veterans across the state this year. #VoteVets https://t.co/jx2a2PsRYt"
191,2022-08-18 15:43:58+00:00,1560291420145065986,"I have numerous GOP supporters who understand that our democracy is in peril, we need to rebuild rural America, &amp; need to take care of our Veterans &amp; Seniors. We will tell the truth &amp; let everyone make their decisions. Before anything, we are Americans.#NY24 https://t.co/dP4cKz2wxL"
192,2022-08-18 15:38:25+00:00,1560290025245495302,I call on Claudia Tenney to denounce these attacks on the FBI and law enforcement. https://t.co/OFGb82I8v5
193,2022-08-18 15:34:06+00:00,1560288938090237952,"Yates, Seneca, and in some communities in Ontario Counties, please vote for my good friend Max! He is a true patriot! Send two Veterans to Congress this year! https://t.co/2chelWCPy5"
194,2022-08-18 14:14:37+00:00,1560268935794024448,"Cayuga County has a significant Ukrainian community. We cannot forget that the Ukrainian people are still fighting a war against a ruthless aggressor. As someone who worked on NATO operations, I better understand how to truly represent their interests. Slava Ukraini https://t.co/NEnFP1m6oX"
195,2022-08-18 14:11:34+00:00,1560268170849841154,More Indigenous voices! I cannot wait to serve with Mary and work for Tribal Sovereignty. https://t.co/GLNyMyQlhM
196,2022-08-18 13:59:55+00:00,1560265237277732868,"I was right about why gas prices will fall, and I am right about fracking. I grew up around this, and I know the truth. #NY24 #TheLakeDistrict https://t.co/ArkJfvkUVq"
197,2022-08-18 12:54:00+00:00,1560248646683299841,"In #NY24 and #TheLakeDistrict, it is also a ""veggie tray"" and we know Dr. Oz wasn't in a Wegmans. https://t.co/7bwusZi1rh"
198,2022-08-18 12:51:11+00:00,1560247939599065090,"Service with humility, honesty, and integrity. Our country needs this right now. We must honor our Seniors, Veterans, and ensure a bright day for our neighbors and children. #NY24 https://t.co/UgIMeWrJes"
199,2022-08-16 15:44:00+00:00,1559566652940886018,I agree with my friend Josh. He and I will work for voting rights and fairness from Day 1. And he has my full support! https://t.co/XDFFEGRvPn
200,2022-08-16 15:42:56+00:00,1559566388196507649,Another classic burn from @RexChapman! Another three from way downtown! https://t.co/H8JRXBIirk
201,2022-08-16 15:41:29+00:00,1559566022759354376,I will propose legislation outlawing CrossCheck and voter purges. I didn't wear the uniform for over 20 years to watch people lose the right to vote. https://t.co/CmxR54MYxg
202,2022-08-16 15:40:00+00:00,1559565646932893700,Positive vibes headed to one of the classiest FLOTUS in history! Everyone keep her in your thoughts. https://t.co/NPRocSfwgK
203,2022-08-16 13:27:13+00:00,1559532232695488517,A leader takes responsibility. A fake one blames thier subordinates. https://t.co/vCngXAu8Ty
204,2022-08-15 11:34:32+00:00,1559141487614611457,I was in OKC when a right wing terrorist attacked where I lived. What those three are doing is adding fuel to the fire. https://t.co/G7YHJWJQ3t
205,2022-08-15 11:28:30+00:00,1559139970027323393,You want to know why prices are going up? These folks are a big reason why. https://t.co/aFajZSXWbu
206,2022-08-15 11:25:42+00:00,1559139263051997185,"Everyone, it looks like the new thing is to be Pro-Spy! #NY24 #TheLakeDistrict #TenneyVotedNo https://t.co/XPN3hp6djp"
207,2022-08-15 11:23:11+00:00,1559138630161014785,#TenneyVotedNo https://t.co/i6jK4yQQw5
208,2022-08-15 11:19:46+00:00,1559137771331227654,"Or Bedminster, or Trump Tower... https://t.co/slMP4NcIdE"
209,2022-08-15 11:18:41+00:00,1559137498026151937,Congresswoman Tenney just took a selfie with 45 at Bedminster. We can see she has no concern about classified documents.
210,2022-08-14 14:27:05+00:00,1558822521524420608,"NY Stand Up!

You can go vote right now instead of waiting in line on election day. It's safer, faster, and checks an item off of your to do list."
211,2022-08-13 17:26:14+00:00,1558505219209691143,"In the upcoming special elections,please support my fellow Veterans @PatRyanUC and @DellaPiaForNY23. Our country needs us now more than ever."
212,2022-08-13 17:19:24+00:00,1558503498920198148,"Energy policy is a tough nut to crack but anything that could damage the quality of water in Lake Ontario or further pollute some of the Finger Lakes is a non starter for me. We have the best water, farmland, fishing, hunting, and wine in the country. I'm not giving that up. https://t.co/S0JVIYUCCJ"
213,2022-08-13 13:13:37+00:00,1558441646425100289,"Back the Blue? Yeah, just like supporting Veterans. Until it isn't convenient. https://t.co/JCp3wcZt5l"
214,2022-08-13 13:09:58+00:00,1558440726412886020,"Like my friend Matt, I too have a security clearance, and I concur 100%. https://t.co/aq7RkjpnUG"
215,2022-08-12 13:00:17+00:00,1558075901534945282,https://t.co/xM0S5TRulO
216,2022-08-12 12:17:17+00:00,1558065081354780675,"Instead of deflecting about Hunter Biden's laptop, Claudia Tenney should be asking these questions. https://t.co/jJtFoFayUj"
217,2022-08-12 03:00:30+00:00,1557924963079913473,But you can bet Claudia Tenney will be on the case! Stay tuned! https://t.co/6SaRXWw8Mr
218,2022-08-11 19:44:12+00:00,1557815164623372288,"And, yes I try to keep my speech clean because my mom reads these tweets but an old Army man like myself will slip up from time to time and say something wild. 
Nuclear power needs strong support."
219,2022-08-11 19:40:36+00:00,1557814258863415297,"While the US needs to increase our energy output to meet demand we have alternatives to oil. Wind, solar, and, pardon my french, nuclear are all safer and cleaner than fossil fuels.

Signs of BP's Deepwater Horizon Oil Spill Persist Over a Decade Later https://t.co/wXN9c9ACbs"
220,2022-08-11 14:32:16+00:00,1557736662217592838,#TenneyVotedNo #NY24 https://t.co/DBLscpbWiZ
221,2022-08-11 12:11:04+00:00,1557701127948406784,And I will not let Claudia Tenney forget that she voted NO twice. The people of #NY24 #TheLakeDistrict won't either. https://t.co/Rkv5AwQhjl
222,2022-08-11 00:38:41+00:00,1557526883876720641,Just chatted with @TishJames this weekend. We both were in a good mood... https://t.co/50MkXFzKu7
223,2022-08-11 00:22:27+00:00,1557522801229287425,"If you send classified material over the wrong system, use the wrong copier, or forget that you left it at the bottom of your briefcase, you are in deep trouble. I still have my clearance, and demand that everyone follows the same rules. https://t.co/d5dlLpEOuK"
224,2022-08-11 00:17:45+00:00,1557521616543817733,"Rural VA care will be a priority for me once in Congress. No Veteran should travel hours just to be seen, and we deserve to get the best providers helping them. #SoldierforLife #NY24 #TenneyVotedNo https://t.co/bzp7mbDcMY"
225,2022-08-10 20:53:18+00:00,1557470165281001477,"First, they did not fund state, local, and tribal governments who needed money to keep police and first responders paid. Now, it is this. So, who is the real party of defunding the police? #NY24 #TenneyVotedNo https://t.co/8MdJnA3yxd"
226,2022-08-10 20:50:05+00:00,1557469356682100739,"Right along with Flynn, here is another retired Army Officer who has dishonored the uniform. https://t.co/36D2wmsHNp"
227,2022-08-10 20:48:15+00:00,1557468893999992834,Part of that history is right here in our District at Safe Haven in Oswego County. I am proud that I have received welcomed support from the Jewish American community since the start of our campaign! #NY24 #TheLakeDistrict https://t.co/VUpVCPcYmd
228,2022-08-10 17:57:12+00:00,1557425848843751424,Will be up there with info soon! Can't wait for the parade on Friday! #VoteBlue2022 https://t.co/uIt05tU9H2
229,2022-08-09 17:38:58+00:00,1557058871650402306,Countdown to Claudia Tenney going on Newsmax to talk about Hunter Biden's laptop! https://t.co/h62rM8rxc3
230,2022-08-09 17:35:47+00:00,1557058072589340673,"Claudia Tenney is on the case! Anytime something goes wrong, they bring out this tired trope. How is this helping ordinary Americans, and even their supporters? #NY24 #TheLakeDistrict https://t.co/4t1QCRXJ8F"
231,2022-08-08 13:19:53+00:00,1556631284683882497,And #TenneyVotedNo in the House https://t.co/UAT9lRl4VD
232,2022-08-06 16:59:10+00:00,1555961692785369088,"I'm sad to say that I was just informed that come Sep 15 in Indiana Abortions will only be allowed if the pregnant person’s serious health or life is at risk; if there’s a lethal fetal anomaly up to 20 weeks post-fertilization; and in cases of rape or incest, only up to 10 weeks."
233,2022-08-06 13:49:01+00:00,1555913840629612544,Been saying this for months! https://t.co/AXvNnBU4sj
234,2022-08-06 13:42:42+00:00,1555912250589839362,"You want to know why rent, mortgages, food, cars, clothes, and just living is so expensive?  Private equity firms.  They are the old school trusts. We need new anti-trust legislation to bring these costs down. https://t.co/NGTiHtFYNy"
235,2022-08-05 21:10:02+00:00,1555662436639948800,My new rural white paper specifically mentions situations like this. My district has ever increasing maternal mortality rates due to L&amp;D wings closing and lack of federal support. When I'm in congress this will stop or I will die trying  https://t.co/oizNW3mPzi
236,2022-08-05 17:59:05+00:00,1555614384596176896,"Finally official, the first version of our working policy paper for rural development is live on the website. Visit it and tell me what you think. 

https://t.co/hLzQyqSFXm"
237,2022-08-04 18:31:21+00:00,1555260113522511873,Plain and simple. You should not be a member of an extremist organization and serve our country. #TenneyVotedNo https://t.co/yRZ6jhDBF2
238,2022-08-04 16:02:37+00:00,1555222683998195713,And now is a good time to remind people that Mario Fratto likes to quote SEN Hawley in his opposition to helping Ukraine. https://t.co/lzhGVqCd8l
239,2022-08-04 16:00:29+00:00,1555222146749710336,This is along the lines of something I said months ago. It costs nothing to be a decent person. Please help someone in need. https://t.co/hXt8Clz8Ye
240,2022-08-04 13:03:17+00:00,1555177556621549569,"Whenever I had a government phone, they recorded all messages as official government action. The same goes with emails on official government systems. If we don't get this resolved in the next few months, I will demand that information be given to us. https://t.co/Hh0ZVYt2tp"
241,2022-08-04 11:54:25+00:00,1555160223807143937,And we will!!!!!! https://t.co/39P4vHH8AY
242,2022-08-04 11:53:59+00:00,1555160115459784705,"This is another win. I wonder in her latest edition of ""Claudia explains her vote"" on her website how she can explain this one. https://t.co/ClW8vMSEfy"
243,2022-08-03 13:26:33+00:00,1554821021798203393,My fellow Lieutenant Colonel is right! https://t.co/0oHROdakCV
244,2022-08-03 13:23:37+00:00,1554820284892446723,"This is a huge win for my fellow Veterans and America. However, let's not forget this November that #TenneyVotedNo TWICE! https://t.co/OwhsVreDft"
245,2022-08-03 12:35:47+00:00,1554808246841577473,"Folks, Kansas is more GOP than #NY24. I know, as I grew up no more than 15 miles from the Kansas border. It has a GOP supermajority, and they tried every trick to get this passed. They organized and won. We can do this here! https://t.co/hbanbvUrSj"
246,2022-08-03 02:18:35+00:00,1554652923665305600,The senate got the PACT act over the hump. After political pressure from politicians and @jonstewart helped turn republican senators away from being cowards and voting no. I don't know about you but I look forward to military parents spending extra decades with their kids.
