,Created at,User ID,Text
366,2022-07-01 03:01:18+00:00,1542704874680369152,"oh, and paid time off. Women in those countries who think they might be pregnant because their state subsidized birth control might have failed them, they can take a day off of work without losing their jobs and see their doctor that they already have"
367,2022-07-01 03:01:18+00:00,1542704873304719360,"""Yes, France and Germany, and Denmark have abortion restrictions that kick in at 12 or 14 weeks. You know what else those countries have? Socialized medicine, comprehensive sex education, free and universal access to birth control, and abortions paid for by the state,"
368,2022-07-01 03:01:18+00:00,1542704871803076608,"Savage was responding to certain conservative claims that they'd rather have the abortion rules of France, or Germany, which restrict abortions at around the end of the first Trimester."
369,2022-07-01 03:01:17+00:00,1542704870360219649,"Catching up on old podcasts post the first round of primaries and we turned to @fakedansavage on his podcast Savage Love, episode 811 to be precise. His beginning of the show message was so precise and well said that I reproduce it here."
370,2022-07-01 02:44:42+00:00,1542700695928901632,"I am the Democrat running against Republican Claudia Tenney here in #NY24 #TheLakeDistict. She was endorsed by Trump &amp; Stefanik &amp; said the 1/6 attackers were ""her people."" Help me beat her! Please retweet, donate and join our fight to beat her this November."
371,2022-07-01 02:35:12+00:00,1542698306488471552,"We have 13 Circuit Courts, one SC Justice for each Circuit.  That is the intent of this. Hence we would have 13.  Also, we need term limits for Justices (18 years is what I hear), and a code of ethics. https://t.co/uDI0ydMG3Z"
372,2022-07-01 00:53:37+00:00,1542672739902816256,"And @LucasKunceMO will defeat Greitens

@JohnFetterman will defeat Dr. Oz

Tim Nelson will defeat Ron Johnson https://t.co/EPmyeLa392"
373,2022-07-01 00:50:19+00:00,1542671908793114624,Noted historian @StevenBeschloss gets it! https://t.co/7QEo2t55KO
374,2022-07-01 00:48:30+00:00,1542671453711130626,"We must act NOW! Congress must act to protect democracy.  Democracy is on the ballot this fall, and we need New York to be COMPLETELY Blue- from Long Island Sound to Niagara Falls! https://t.co/ogKUHtcJyU"
375,2022-07-01 00:44:34+00:00,1542670464404922373,"I know that there are patriots tonight out there, regardless of party, who are scared right now. But let's take action! Everyone can do something! Volunteer, donate, protest, if there is a vacancy, run for office.  We need everyone of good will to stand up! https://t.co/5foneGR0CL"
376,2022-06-30 17:39:39+00:00,1542563530339131392,Just reminding everyone here that today is the end of the quarter. We ask you to help by going to https://t.co/afbRUvsvLj to donate and push us over the line! Thanks!
377,2022-06-30 17:38:06+00:00,1542563137286803456,"You need to protect and expand the majority in the House, and then get at least two more Dems in the Senate who will kill the filibuster.  @JohnFetterman and @LucasKunceMO would be great choices. https://t.co/5jtqb3UFbh"
378,2022-06-30 16:04:23+00:00,1542539552656658432,There's really one solution for this and that's that the legislature put something on the president's desk that specifically authorizes the EPA to regulate fossil fuel use for power generation. https://t.co/yPwIiCidKw https://t.co/ACkNemXoRP
379,2022-06-29 20:03:13+00:00,1542237270429908995,Congratulations @KathyHochul and @DelgadoforNY ! I look forward to being on the campaign trail with you this year in #thelakedistrict #NY24
380,2022-06-29 14:52:47+00:00,1542159147042480128,"I knew it was just a matter of time that they would curtail McGirt &amp; come after Tribal Governments. If the crime is on Tribal land, then let the Tribal Courts handle it. If an American commits a crime overseas, they are charged in that country, not in American. Same concept here. https://t.co/XSHShNYQ2R"
381,2022-06-29 12:30:06+00:00,1542123239954055171,"I am on the reocrd stating that we need to expand the Court, establish term limits, and create a SCOTUS code of ethics. https://t.co/ulK6nWmoW0"
382,2022-06-28 21:49:29+00:00,1541901627514290177,People need to start talking to Flynn's (I no longer refer to his rank because he has dishonored it) brother. His job in the Army is to oversee Federal deployments including the National Guard. Let's talk to him!
383,2022-06-28 21:24:23+00:00,1541895309890052096,Republicans in #NY24 #thelakedistrict this is coming from the Former RNC Chair. He knows the players. https://t.co/snBkjBpClp
384,2022-06-28 21:22:02+00:00,1541894719919325189,To inlcude Claudia Tenney https://t.co/To62F6HvoU
385,2022-06-28 21:12:28+00:00,1541892311902294023,"Congresswoman Tenney, did you know? #thelakedistrict #NY24 https://t.co/Abjx33FjFi"
386,2022-06-28 21:06:54+00:00,1541890909708640256,"Remember, Claudia Tenney that these folks were ""her people."" https://t.co/f92kxqM35m"
387,2022-06-28 12:53:30+00:00,1541766743655424003,It is Primary Day for statewide races and for the Assembly. Get out and vote!
388,2022-06-27 15:28:15+00:00,1541443297251627010,We sure will! https://t.co/gkyrA8Pn1q
389,2022-06-27 15:25:10+00:00,1541442523704483840,"I cannot say this enough! You lose in 100% of the fights you don't take up and we have an electorate who is angry. If we tell the truth, and act as it we can win, we will win. https://t.co/xhHIdY8kwQ"
390,2022-06-27 01:16:28+00:00,1541228939921616898,And I was glad to be there! https://t.co/zqfj7YqoR6
391,2022-06-26 01:56:13+00:00,1540876553218834434,"Two spirited rallies and media comments in the past 24 hours, two more tomorrow. If it is protecting our rights and standing up for Democracy and truth, I will be there all day, every day!"
392,2022-06-25 12:06:02+00:00,1540667633657315328,If Republicans won't stay in a comfortable building with aides and air conditioning for a couple of days what justification do they have to tell a woman that she has to risk death?
393,2022-06-25 12:04:19+00:00,1540667198884040704,"Just so I'm clear, the Senators can't go home for the day unless they vote to leave via unanimous consent or a simple majority. If we are going to play hardball then let's play it smart. Call the capitol switchboard at (202) 224-3121 and let your senator know never adjourn."
394,2022-06-25 12:04:17+00:00,1540667193985212423,"I went to sleep mad and woke up mad. 

Every day that the senate is in session and doesn't take up the reproductive choice act is a day that the Senate doesn't vote to adjourn or recess. We may not have enough senators to force votes but we have enough to do a silent filibuster."
395,2022-06-25 11:43:13+00:00,1540661892124909570,"My kids are grown and out of the house. I'm honorably retired from the Army. I have insurance, I live in a safe neighborhood, I got my college paid for. Every single American deserves that same treatment. Send me to congress, I'll secure that for us or die trying."
396,2022-06-25 11:43:12+00:00,1540661888249364480,"Yesterday I went to rallies, I took phone calls and I prayed a lot more than normal. A lot of people don't know what they can do. They don't have the time to do much. That's why I'm running. That's why I need your support. I have always been a tireless defender."
397,2022-06-25 11:43:11+00:00,1540661884327690251,I am one of many people that are making sure that her and the rest of the fake Christian mob cannot continue to deny people their own humanity. Join the movement or donate at https://t.co/cMXigzpVRm #Roe #Ibelieveinsteven
398,2022-06-25 11:43:10+00:00,1540661879722442753,"You know what really grinds my gears? Hypocrisy.

Claudia Tenney says she’s all about protecting children.
During an unprecedented shortage of baby formula she wouldn’t vote to spend a single penny to get formula into our hands"
