,Created at,User ID,Text
0,2022-10-10 17:44:41+00:00,1579528360052817922,"With the Indian Child Welfare Act under assault by the right as never before, I want to be on the front lines of all these fights, serving my country as the next Rep. for #NY24.

NY has never had an Indigenous member of Congress, it would be my great honor to be the first. /End"
1,2022-10-10 17:44:41+00:00,1579528358471557120,"I have never lost that desire to serve this country I love, but this time my goal is to serve as a member of Congress.

Because while abortion rights and environmental justice are on the ballot this year, so is tribal sovereignty. /8"
2,2022-10-10 17:44:41+00:00,1579528356777037824,"This sense of service to the homeland was a value instilled in me as the son of Indigenous parents. It's no accident that Native Americans enlist in the U.S. military at 5x the national average.

But that sense of service did not end when I left the U.S. Army. /7"
3,2022-10-10 17:44:40+00:00,1579528355095146498,"As we know, the US has a history of taking Indigenous children off tribal lands and placing them with white families, as they did with my mom. My father, who is of Ottawa heritage, was told to sign away his land. He refused.

Yet I signed up to fight in the U.S. Army. /6"
4,2022-10-10 17:44:40+00:00,1579528353316380672,"I was lucky to be raised on a dairy farm and now live in the pristine Lake District of NY. Protecting these lands is not just a mission of mine, it's a deeply ingrained legacy.

My opponent has been clear she wants to bring fracking back to New York State.

Not on my watch. /5"
5,2022-10-10 17:44:39+00:00,1579528351362211840,"That's why the radical Dobbs decision and conservative abortion bans offend me to my core. 

And why I believe so strongly that reproductive rights are human rights and have pledged to codify Roe when I am elected to Congress. /4"
6,2022-10-10 17:44:39+00:00,1579528349785149442,"This is a value passed down through generations of Native cultures, so many of which had women as their leaders.

For me, the right to control your own reproductive choices is about human dignity and being able to control your own destiny. /3"
7,2022-10-10 17:44:39+00:00,1579528348233240576,"As a child I was raised mostly by my mom, who was of Cherokee heritage. She was adopted off a reservation when she was 3 years old.

She ingrained in me a deep belief and trust in women, not just as leaders but as people with sovereignty over their own lives, bodies &amp; choices. /2"
8,2022-10-10 17:44:38+00:00,1579528346555518977,"Today, on #IndigenousPeoplesDay, I am reflecting on my own Indigenous heritage and how it informs my public service to this day. 

A 🧵 /1"
9,2022-10-10 15:59:26+00:00,1579501870758125569,Love to see it! #NY24 https://t.co/KjUxK0mSwn
10,2022-10-10 00:47:11+00:00,1579272298129162240,"Yes, @IAmPoliticsGirl nails it. Congressional Republicans like my opponent try to sabotage any progress we make and just make life harder for everyday Americans. All they care about is holding onto power.

I'm running to help people like us here in #NY24 make it in America. https://t.co/KIoJlM6og3"
11,2022-10-09 22:20:19+00:00,1579235335992913920,"Had a great time today joining Rep. Joe @VoteMorelle to meet with Orleans County voters at Cobblestone Museum in Albion, NY! #NY24 https://t.co/DRh1AVdvaU"
12,2022-10-09 21:14:30+00:00,1579218770480214017,Proud to stand with the women of #NY24 in support of reproductive rights! #womenswave https://t.co/cHxbUfx3QF
13,2022-10-09 21:08:06+00:00,1579217162782507008,"Democrats out in force at Genesee Valley Hunt Races in Geneseo, NY yesterday! 

Anyone else sensing a theme here? #VoteBlue https://t.co/GwELpHnDUN"
14,2022-10-08 19:29:25+00:00,1578829939482439680,"Just one month to go! #NY'ers, remember:

🖊️Registration deadline: Oct. 14th
🗳️Early voting: Oct. 29 - Nov. 6
✅Election Day: Nov. 8

Make your plan to vote: https://t.co/d99fRoOE0V https://t.co/QUoQzoE00U"
15,2022-10-08 19:00:50+00:00,1578822746444017665,"Here in #NY24, the birthplace of the women’s rights movement, I am fighting for reproductive rights. 

You can not chart your own destiny if you can not control your own body. As a member of Congress, I will vote to codify Roe and #protectourfreedoms! 
#womenswave https://t.co/N9XF2PjbNQ"
16,2022-10-08 17:41:29+00:00,1578802776939040768,"My forced-birth MAGA opponent and her Republican allies in Congress want a nationwide abortion ban. 

Not on my watch. 

I will vote to codify Roe to protect the freedom to choose. #ProtectOurFreedoms #WomensWave #NY24"
17,2022-10-08 17:41:28+00:00,1578802772262064130,"Proud to join activists at today's #WomensWave rally in Canandaigua, NY fighting for reproductive rights. 

Reproductive rights are also human rights, and I will fight to protect that freedom as your next Rep. from #NY24, the birthplace of the women's rights movement. https://t.co/T1Pdr25j7v"
18,2022-10-06 11:51:43+00:00,1577989978394697730,Courtesy of @FreshResists. Tenney is one of the 172 Republicans who would not vote to keep women safe. https://t.co/SpRJIGPuvY
19,2022-10-05 15:01:49+00:00,1577675432081727489,"Great paying jobs that will help CNY and WNY, FLX! I called for this 18 months ago when I started my run. Let's keep up the momentum! #NY24 https://t.co/jViwNjWV12"
20,2022-10-05 14:58:15+00:00,1577674535737982976,"Don't be fooled! If the GOP starts this lie, call them on it! #NY24 https://t.co/gKxrFZ6eQt"
21,2022-10-05 14:56:11+00:00,1577674013882683396,We must honor our Seniors https://t.co/pwRHegsnVn
22,2022-10-05 14:50:47+00:00,1577672657008578562,I look forward to working with my good friend @CastelliMatt to provide a bright future to Jefferson County and the Watertown-Fort Drum Community! #NY21 #NY24 https://t.co/ZU0P00plPE
23,2022-10-05 14:48:22+00:00,1577672047240613890,Our District has a lot of Ukrainian-Americans. That drivel won't work here in #NY24. https://t.co/ssTKwDthrZ
24,2022-10-04 13:57:09+00:00,1577296771155369986,"If you want lower prices, we need to keep up the momentum. My opponent and her friends have no answers, just talk! #NY24"
25,2022-10-04 10:51:53+00:00,1577250146328289280,"My opponent and her good friend Matt Gaetz want to defund or reduce the money for the VA. Just a reminder for GOP voters in #NY24, the VA was started by...Ronald Reagan."
26,2022-10-04 10:47:43+00:00,1577249100080504832,I guess if they don't think they can win legitimately... https://t.co/VlJ9HjCxFk
27,2022-10-03 23:56:23+00:00,1577085185115377664,"https://t.co/KWCYapviq5

I wish they didn't keep being exposed as hypocrites. It's obvious that they want to hurt women. Not protect anything."
28,2022-10-02 16:17:30+00:00,1576607313527738368,"I'm a veteran with VA insurance and most of us would like nothing more than a system that everyone can understand and not get bankrupted by. 

Our republican congressmen don't care. https://t.co/VcoJ3yWQz8"
29,2022-10-02 15:24:19+00:00,1576593932208644097,In my district 1 out of every 9 kids is below the poverty line. But that means that there's another 10% of kids that's ignored. That can't afford breakfast and lunch at school and congress isn't helping. Elect me and I'll make sure no child goes hungry at school. https://t.co/jrQqahtYMs
30,2022-10-01 17:19:16+00:00,1576260471572733952,"Ask yourself two questions this November. Is it fair for insurance to deny you coverage because of technicalities that saved your life?
Is it the honorable thing to vote for someone who already has, and will in the future, denied insurance to working families and veterans?"
31,2022-10-01 17:19:15+00:00,1576260468447973376,Healthcare in this country is too convoluted. Even if we could vote with our feet. The ambulance took him to the closest hospital and his insurance denied coverage.
32,2022-10-01 17:19:14+00:00,1576260463246987264,One of my campaign staffers recently had a seizure. Service connected. Had to go to the ER and he gave me permission to share the fact that the VA is making him do more paperwork while he's saddled with a 6500 bill. He's also a victim of jet fuel exposure. https://t.co/DtMcTR5Ajs
33,2022-10-01 17:19:08+00:00,1576260439385993216,"If we made affordable Healthcare something every American had access to we could let the VA focus on other things, like VA home loans, and the GI bill and the dozens of other VA programs Gaetz knows nothing about. https://t.co/VcoJ3yWQz8"
34,2022-10-01 12:13:21+00:00,1576183482799513600,I cannot agree more! https://t.co/b0n1KwxEpC
35,2022-09-27 14:31:23+00:00,1574768670961811458,#NY24 #CountryOverParty https://t.co/S214L0upDy
36,2022-09-27 04:39:37+00:00,1574619748561731585,They said birth control wasn't even a factor. At some point we have to stop letting then lie and vote them out. https://t.co/btw9371JLj
37,2022-09-26 21:06:39+00:00,1574505753406234631,Shanah tovah u'metuka to the Jewish community nationwide but specifically to @ElizabethPasse2 and her wonderful family.
38,2022-09-25 23:41:34+00:00,1574182351420420096,I want to say Happy National Daughters' Day to my brilliant daughter Paige! https://t.co/xbDpWkP9gb
39,2022-09-25 13:30:52+00:00,1574028665121382400,"We are seeing amazing energy from No Party Affiliation (NPA) voters, as they see my opponent as too extreme. #NY24 https://t.co/Kpa0NlXBgq"
40,2022-09-23 11:17:22+00:00,1573270294885961730,And a huge win for those who believe in the rule of law. #NY24 https://t.co/VrRx8oFPkt
41,2022-09-23 11:16:49+00:00,1573270154280304640,#TenneyVotedNo #NY24 https://t.co/4yCj5af8NW
42,2022-09-23 11:15:59+00:00,1573269944837742592,My good friend @CastelliMatt and I are proud to be endorsed by @NYSAFLCIO and look forward to protecting the hard working folks in Jefferson County! #NY21 #NY24 https://t.co/pXPdamUnwk
43,2022-09-23 11:13:15+00:00,1573269258028687363,"And #NY24, Claudia Tenney is one! Let's protect democracy together. https://t.co/q5Qg4SExHY"
44,2022-09-23 11:11:51+00:00,1573268905539379201,"This is what I was saying yesterday in my radio interview. Our #Veterans, and rural America cannot wait! #NY24 https://t.co/jWevqAnrrZ"
45,2022-09-23 11:09:05+00:00,1573268210472087552,...and #NY24 https://t.co/cSzNmfI3j6
46,2022-09-23 11:08:42+00:00,1573268111360688128,"We must pass the DISCLOSE Act. Sunshine is always the best disinfectant! BTW, I still do not take corporate PAC money, just your hard-earned #BlueCollarDollar https://t.co/waT0I37oOO"
47,2022-09-23 11:05:53+00:00,1573267405316440065,Yesterday I was asked about this. We must get this under control. #NY24 https://t.co/QeYNNkwieM
48,2022-09-23 11:04:44+00:00,1573267113858551812,"Everyone, we will have a #Roevember to remember! Please come to Seneca Falls tonight from 6 to 7 to join the fight! #NY24 https://t.co/0D7U664LrL"
49,2022-09-22 14:44:10+00:00,1572959947255693312,Our District was critical to the Abolitionist movement. Let's remember this today! #NY24 https://t.co/4s4wNrPXwk
50,2022-09-21 12:33:16+00:00,1572564616735236098,We know already that Claudia Tenney supports Lindsey Graham's national abortion ban! #NY24 https://t.co/qetIiFV88Q
51,2022-09-20 17:40:05+00:00,1572279441539366912,"Ultra MAGA just clogged up the VA Suicide Prevention hotline. If we have Vets die, they will have to answer."
52,2022-09-16 12:53:40+00:00,1570757814506889218,#TenneyVotedNo #NY24 https://t.co/St0Afj0Qvb
53,2022-09-16 12:46:45+00:00,1570756070641143808,#DemocratsDeliver https://t.co/6y327i4UIH
54,2022-09-15 13:24:48+00:00,1570403257893240832,"This is why #SaveSocialSecurity is one of the key points of our campaign, &amp; my opponent wants to gut it. We have an older electorate here in #NY24, &amp; they worked their whole lives for it. Let's honor our parents and grandparents, &amp; never forget the sacrifices they made! #NY24 https://t.co/avB96ggkB8"
55,2022-09-15 13:18:47+00:00,1570401745733550081,"This is something I hear across our District from leaders in both parties. The Democrats are working together, and the GOP candidates aren't. This is going to be the difference across America this #Roevember #NY24 https://t.co/fKOWkwSdzP"
56,2022-09-15 13:06:49+00:00,1570398733225062405,"Selfless service &amp; servant-leadership have been cornerstones of my public life- both in the Army &amp; now. I will bring that everyday to DC, &amp; even if we disagree, you will have a voice and I will listen to your concerns. As my Grandmother used to say ""People before yourself."" #NY24"
57,2022-09-15 12:24:57+00:00,1570388199591268353,#DemocratsDeliver #NY24 https://t.co/rZigMCO3Ml
58,2022-09-15 12:22:00+00:00,1570387454946955267,"Yes, yes it does. And that money is not going back to the farmers who grew that crop and fed those livestock. It goes to out-of-state corporations funded by private equity firms. I will be talking about this tonight at 5 on FLX radio. #NY24 https://t.co/v2wauolMfF"
59,2022-09-15 12:18:46+00:00,1570386641205723141,"I cannot wait to work with @MaryPeltola to lift up Indigenous communties across the country, specifically the stories of Indigenous women, like my Mother. #NY24 https://t.co/0QTb2bgGaz"
60,2022-09-15 12:16:23+00:00,1570386044058750976,Sunshine is always the best disinfectant. #NY24 https://t.co/BDxM1b10zk
61,2022-09-15 00:48:34+00:00,1570212947229642752,"My father asked me just today why food prices were so high. I told him what Fmr, Sec, Reich said below. I support reining in these firms so your #BlueCollarDollar goes further. #NY24 https://t.co/A6QOonoRSP"
62,2022-09-14 14:31:09+00:00,1570057568113889281,Letting everyone here know that I am pledging for DC Statehood! https://t.co/Tjjoz50Vgz
63,2022-09-13 12:53:35+00:00,1569670629405921281,"Republican politicians across the country are touting these types of plans, but they all voted against them, to include my opponent. Call them out! https://t.co/cjyk3KaunD"
64,2022-09-13 12:51:24+00:00,1569670079125618689,There are places in #NY24 that are childcare deserts. We need to bring affordable childcare to all communities. https://t.co/B9uMhUNtv2
65,2022-09-13 12:50:15+00:00,1569669787617198085,"Just a reminder, I was right about gas prices two months ago and I am right about fracking now. https://t.co/kEVTBuaXtx"
66,2022-09-13 12:47:45+00:00,1569669159684050947,My father and sister are cancer patients. We must do all we can to fight it. https://t.co/Bbb6CanQrj
67,2022-09-13 12:44:09+00:00,1569668255912022023,"Claudia Tenney authored a personhood bill. I support a woman's right to choose. She voted against reducing insulin costs, &amp; my wife is diabetic. She voted against helping Veterans, &amp; I am helping Veterans start their own businesses. The difference is clear Actions not words #NY24 https://t.co/CylUPrGLoX"
68,2022-09-13 12:38:05+00:00,1569666728946290690,I agree with this. Women should be the only ones deciding their medical issues.  #NY24 https://t.co/wa43WYWK55
69,2022-09-13 12:35:43+00:00,1569666133493415938,Sounds pretty clear cut here...#NY24 https://t.co/ljqV2y7Mow
70,2022-09-12 13:06:48+00:00,1569311566167949315,...and it is happening here too! https://t.co/Ns13HWy73r
71,2022-09-12 12:50:46+00:00,1569307532140728323,"In order to protect the rule of law, there must be prosecution. If not, any law we write can be manipulated or ignored. #NY24 https://t.co/LB7Lodt9kR"
72,2022-09-12 12:48:06+00:00,1569306862348034048,Slava Ukraini! https://t.co/REfwPbDZDt
73,2022-09-12 12:45:18+00:00,1569306155683385344,"Folks, this is what my family gives livestock. Please do not use this! #NY24 https://t.co/gZoZmxffsy"
74,2022-09-12 12:42:29+00:00,1569305448225935362,"Thomas is out doing photo ops with Herschel Walker, Alito is out to doing political speeches, not mention Thomas's wife. We need a SCOTUS Code of Ethics along with substantial SCOTUS reform. #NY24 https://t.co/7oos2b81DK"
75,2022-09-11 21:03:52+00:00,1569069234772221957,When 9/11 comes around I think of two things. My multiple combat deployments and the brave first responders and bystanders that ran into burning skyscrapers to save complete strangers. Their sacrifice is unmatched in modern history! #NeverForget
76,2022-09-10 10:45:22+00:00,1568551197400776711,"Pat and I both took this oath, and I use these same words in my speech on the campaign trail. I will continue  upholding this oath in Washington. #NY24 https://t.co/KSb3EvEsu1"
77,2022-09-09 12:19:59+00:00,1568212621282639875,In case you forgot https://t.co/5mfhUYkoq6
78,2022-09-09 12:19:16+00:00,1568212439019184128,This is why we need judicial reform! #NY24 https://t.co/2VmAhxw6Ov
79,2022-09-09 02:46:41+00:00,1568068343407542273,"If Josh Allen isn't going to be the leader for MVP, I don't know who would be. Going into LA like that is a statement! #BillsMafia #NY24"
80,2022-09-09 00:44:26+00:00,1568037578330234881,We scored on the opening drive and Riley Dixon is an incredible punter. Looking forward to seeing his leg all game. #BillsMafia
81,2022-09-08 23:51:19+00:00,1568024213415677953,Just yesterday we had many high school seniors join our campaign! #NY24 https://t.co/i8JunjUrtH
82,2022-09-08 23:43:24+00:00,1568022221276463105,"We have a great grassroots campaign here in #NY24, and we don't take corporate PAC money, just help from folks like you. Please go to https://t.co/afbRUvt3AR to help!"
83,2022-09-08 23:39:50+00:00,1568021322369736712,#TenneyVotedNo https://t.co/HZ8Id6x79Z
84,2022-09-08 23:34:36+00:00,1568020005656084483,Which is why we need to hold both accountable this November! #NY24 https://t.co/7gd2VNQRiF
85,2022-09-08 22:03:39+00:00,1567997118975037440,We here in #NY24 want to give our prayers to the Royal Family. Queen Elizabeth II exemplified service to her nation and her legacy will live on. https://t.co/pRr0THZsBz
86,2022-09-08 18:08:29+00:00,1567937934887632902,"While my opponent, Claudia Tenney, also attacks the LGBT+ community, I look forward to working with @pfaff4congress to ensure #MarriageEquality is codified! https://t.co/clnRcBM0qn"
87,2022-09-08 18:02:18+00:00,1567936379933409290,My friend @JoshuaUE99  and I are dedicated to protecting human rights and we will work together in Congress to ensure everyone has a shot at the American Dream! #NY24 #N https://t.co/qf6xQg4UvT
88,2022-09-08 17:52:34+00:00,1567933928677187590,Sunshine is the best disinfectant! #NY24 https://t.co/nSIFmVuYjW
89,2022-09-08 16:13:02+00:00,1567908881858269185,"Oh, and btw today, GO BILLS! #BillsMafia #NY24"
90,2022-09-08 15:28:32+00:00,1567897681346846724,"He riled people up, and bilked people out of their hard-earned money just to line his pockets. Attica is in gorgeous Wyoming County in our beautiful #NY24. https://t.co/wLJ9tCkQZO"
91,2022-09-08 15:24:17+00:00,1567896612856274944,"When elected, this is part of the ethics reform I will support. Former Federal elected officials should not do this, and they also should not use your hard-earned #BlueCollarDollar to enrich themselves. #NY24 https://t.co/BlE1Ga4XzW"
92,2022-09-08 15:20:12+00:00,1567895585004437504,"This is nonsensical, and it is used to rile up people. Don't listen to the anti-choice hype. Honor our Women's Rights history in #NY24 https://t.co/VafehL7Zn1"
93,2022-09-08 15:17:06+00:00,1567894807506292738,"And Claudia Tenney was at Mar-a-Lago recently. Again I ask- is she a security risk, as well as other elected officials? It is a great question. And, I say again, 45 cannot declassify nuclear secrets! #NY24 #WhatDoesSheKnow https://t.co/doKMABnO1C"
94,2022-09-08 15:08:01+00:00,1567892518607396870,"If you wear the uniform, you don't get the right to join an organization that suborts the US Constitution and the Federal Government. You cannot serve two masters. #NY24 https://t.co/ZJxRoGjAaI"
95,2022-09-07 21:29:19+00:00,1567626088469127168,"My mom taught me the gospels. And I remember shivering when we got to Matthew 25. 

""The King will reply, ‘Truly I tell you, whatever you did for one of the least of these brothers and sisters of mine, you did for me.""

What are your morals when you condemn someone to die? https://t.co/RiXWWHJVG6"
96,2022-09-07 15:45:42+00:00,1567539617628299265,"According to the Atomic Energy Act, not even POTUS can downgrade nuclear secrets. #NY24 https://t.co/8SEeTcR2rw"
97,2022-09-07 15:37:56+00:00,1567537661144961026,I'm on the verge of tears after reading this. I'm furious after reading this. Come hell or high water if you put me in congress we will codify Roe.  https://t.co/dgLaxhLNEW
98,2022-09-06 20:44:14+00:00,1567252354612826114,Freedom isn't free. Nor is misbehavior. There are people that can not serve the public in a free democracy. We saw fit to put that idea into the constitution and now we're making sure it happens. https://t.co/gTpPzxL3Lf
99,2022-09-05 18:48:59+00:00,1566860965316001795,"This November I’m asking everyone to vote for America, vote for union endorsed candidates such as myself. Believe in Steven."
100,2022-09-05 18:48:59+00:00,1566860963164426246,"My father in law retired out of the UAW near Liverpool NY, this allowed him to raise a family in a good safe neighborhood. There are millions of families across the country that have the same story. We should build toward that not break it down."
101,2022-09-05 18:48:58+00:00,1566860960962322432,This labor day I affirm my unswerving support for union labor and American manufacturing. For too long we have allowed companies to pack up our jobs and send them to other countries. To use less developed countries to cover up ethical and safety violations that should never fly.
102,2022-09-05 18:48:58+00:00,1566860959083364354,"When we pass laws that close steel plants, shipyards, and factories what happens next is almost automatic. Entire cities die. The political support for these practices comes from a belief thatt union products cost more, my response to that, nothing is more expensive than poverty."
103,2022-09-02 20:05:15+00:00,1565792993000521729,I still want to know what Claudia Tenney knows. She went to Mar-a-Lago. She is on the House Foreign Relations Committee. #NY24 https://t.co/FpvCPmzNiy
104,2022-09-02 13:11:00+00:00,1565688743989764096,"We deliver, not divide! #NY24 https://t.co/wH9e2msxFK"
105,2022-09-02 13:09:30+00:00,1565688366200487938,"Folks in Jefferson County, @CastelliMatt and I will protect democracy, serve the good people of the North Country, and ensure our proud Soldiers and the families are honored and taken care of. #NY24 #NY21 https://t.co/mnG5uwaAV3"
106,2022-09-02 12:56:46+00:00,1565685160917565443,More GOP who get it! #CountryOverParty #NY24 #TheLakeDistrict https://t.co/GJopjTNnIY
107,2022-09-02 12:54:41+00:00,1565684637216686080,"There are many in #NY24 #TheLakeDistrict who rely on USPS for life-saving prescriptions, pensions, and supplies for their business. Once elected, I will demand that Louis DeJoy be fired and investigated. https://t.co/B0pxV7O75L"
108,2022-09-02 12:43:48+00:00,1565681899065991173,Democrats deliver! https://t.co/Ercb6okRUs
109,2022-09-01 20:45:39+00:00,1565440771658027013,"One hand of the republican party wants to cut social security and the other hand wants to ""coax"" retirees back into the workforce. Vote for me, I won't put up with anything that denies the dignity of people that already paid their dues. https://t.co/mJhLjqIxWI"
110,2022-09-01 20:04:31+00:00,1565430419851563008,#NY24 #TheLakeDistrict has one of the older populations in our State. This would be devastating to them. That is no way to honor our Seniors. https://t.co/3iX9W2eFcz
111,2022-09-01 19:58:28+00:00,1565428898577502211,We know one person who was there.... https://t.co/CLJEOGvTq5
112,2022-09-01 19:55:16+00:00,1565428095401828356,We have Veterans like Marcus and myself standing up for democracy all over this land! https://t.co/buT8KUpNx5
113,2022-09-01 19:47:49+00:00,1565426219549704193,"Claudia Tenney called these people ""her people."" Both of these men are wearing antisemitic clothing. Our District is home to Safe Haven, which is named for harboring Jewish refugees. #NY24 https://t.co/Zkzrirz4Pa"
114,2022-09-01 19:43:44+00:00,1565425193459351557,"This is something that as a new member of Congress, I will want answers for. We have troops and their families around the world whose lives are now much more at risk. It is truly sobering.  #NY24 https://t.co/9aqdSJ7aBC"
115,2022-09-01 15:33:28+00:00,1565362209605050368,As your congressman I will ensure these federally funded projects are based in NY24. The blue collar dollar spends local and supports the community. https://t.co/XHp8erhJIQ
116,2022-09-01 11:46:03+00:00,1565304979505774593,Sound familiar #NY24 https://t.co/onRf0ecIcZ
117,2022-09-01 11:38:13+00:00,1565303007088091136,Sounds like a losing strategy to me https://t.co/PwIgc6OwBA
118,2022-09-01 11:37:05+00:00,1565302723699941376,Or her even more extreme friend Claudia Tenney in #NY24 https://t.co/6bwX1K6rLq
119,2022-09-01 11:32:42+00:00,1565301620304494593,Perfect question for today! Army Privates get taught this early on. https://t.co/HFmfiFgXpf
120,2022-09-01 11:29:10+00:00,1565300730843512832,"And under the Atomic Energy Act, not even POTUS can declassify nuclear secrets. Again, Claudia Tenney was just at Mar-a-lago. Did she see anything? #NY24 https://t.co/mDdl4eTF3o"
121,2022-09-01 00:54:19+00:00,1565140965253435394,"Another similar race to ours, Alaska at-large goes to Democrat Mary Peltola. She is Indigenous going against a Trump acolyte, Sarah Palin. Sounds familiar! Congrats @MaryPeltola !"
122,2022-08-31 22:43:57+00:00,1565108154924519424,"This is why we need honest legislators who will support American industry. The @AFLCIO the @IBEW the @UAW and every other union in this great nation has an ally in me and an enemy on the other side of the ballot, simple and plain. Union busting and offshoring are un American. https://t.co/qzNJ0YhiBA"
123,2022-08-31 21:45:23+00:00,1565093417809575936,"Like other service members and Veterans in this District, I am not a carpetbagger, I'm a duffle bagger. https://t.co/Qd4knQy6Oz"
