,Created at,User ID,Text
247,2022-08-02 12:56:36+00:00,1554451096449556483,"Right now, it is democracy v. autocracy. These people understand that. I have support from across the political spectrum, and even though we might disagree, we agree that our country and the Constitution are worth fighting for. Please join us! #NY24 #TheLakeDistrict https://t.co/FWvVmU6PyU"
248,2022-08-02 12:50:50+00:00,1554449644951855106,"That means Claudia Tenney will be going on Newsmax talking about Hunter Biden's laptop again. Literally, that is ALL the State of NY is getting with her being in Congress. Let's retire her! #TenneyVotedNo #NY24 https://t.co/49AZcSVwPm"
249,2022-08-01 13:39:03+00:00,1554099393271308296,I am a retired Army Finance Officer who teaches finance and contracts to the Federal Government. I can assure you I know the difference between mandatory and discretionary spending. And the GOP is full of it! https://t.co/vzY6hBqn95
250,2022-08-01 13:35:22+00:00,1554098463280865282,And support we Veteran candidates facing those GOP members who voted against the bill! #NY24 #TheLakeDistrict https://t.co/tP5u7huE6V
251,2022-08-01 01:14:40+00:00,1553912063499583488,"I am the Democrat going against NY's most extreme Member of Congress, Claudia Tenney. I am an Army Vet w/ 4 tours, &amp; she voted x2 against the Burn Pit Bill! I still suffer from the exposure &amp; we have many Vets &amp; military families here. Help me get to 10K followers &amp; defeat her!"
252,2022-08-01 00:58:36+00:00,1553908016923172865,Great way to show your patriotism! #TenneyVotedNo https://t.co/GZvn1ct52X
253,2022-07-31 19:33:55+00:00,1553826308458795010,"Nichelle Nichols was an inspiration to me, to a great many men and women of all races, playing an officer and explorer in a society where race and gender were not barriers. God bless her legacy and her family."
254,2022-07-31 18:45:06+00:00,1553814022813880321,"If you want to see a cause for inflation, here it is. Greedy corporations trying to make up for profits lost during the pandemic on your backs. As always #TenneyVotedNo https://t.co/RChlZbCiAS"
255,2022-07-31 14:47:14+00:00,1553754162428624897,"This November, send a message! https://t.co/GxrIExcxb1"
256,2022-07-30 16:27:15+00:00,1553416944660922368,"Somebody yesterday at an event asked me why I was upset and fired up. She said I sounded divisive. Well, when it comes to my brothers and sisters in uniform get harmed and then seeing GOP Senators celebrate, more of us need to get fired up. https://t.co/MkpsQ5O4rw"
257,2022-07-29 17:23:27+00:00,1553068699296432134,"Claudia Tenney. Voted against Veterans even though her son is a Marine. She was MTG and Boebert before them, and further right than Stefanik. https://t.co/HD97FG4Ffm"
258,2022-07-29 17:17:41+00:00,1553067249589796864,"There is a word for people like her and Tom Cotton, both Veterans. It's called a Blue Falcon. You can look it up. https://t.co/xtX24lZihv"
259,2022-07-29 17:03:04+00:00,1553063571176783872,"My thoughts are the same as @LucasKunceMO. My body still has the aftereffects of exposure to burn pits. The smell and nausea never leave you. So, I ask Claudia Tenney, who voted against the bill in the House, and whose son is a Marine, what type of mother are you? https://t.co/IfI7eDxx6Y"
260,2022-07-29 12:49:01+00:00,1552999638852161538,He is 100% correct! https://t.co/MDuZtMDhEE
261,2022-07-29 12:46:24+00:00,1552998980514095104,...and their vote against Veterans. Looks like about time Claudia Tenney goes back on Newsmax talking about said laptop... https://t.co/eyyyIODtOY
262,2022-07-29 12:38:41+00:00,1552997037490184198,Sounds like a great policy position! https://t.co/uUeZPobSsS
263,2022-07-29 12:37:53+00:00,1552996833487687684,Watching Ted Cruz do a fist bump on the Senate floor reminds me of when he did the same thing to us when we were deployed in 2014. I am beyond angry today... https://t.co/lvwBgsIWZY
264,2022-07-29 12:21:26+00:00,1552992696364634114,And don't forget @DellaPiaForNY23! https://t.co/t4DCccW8Od
265,2022-07-29 01:25:34+00:00,1552827641954189312,"Stop calling yourselves the party for Veterans, Service Members and their families. To you, we are just props in a game for your own power and control. Full your duty to help us when we need it. Hold these politicians accountable! https://t.co/EWQZryLBnN"
266,2022-07-28 19:58:35+00:00,1552745352863924224,I cannot wait to cosponsor legislation with him in DC! https://t.co/g1eQ35cfZp
267,2022-07-28 19:56:45+00:00,1552744892195131392,"Mastriano has tarnished the uniform he wore and those Airborne wings on his hat. As a fellow Airborne Vet, shame on him...#FakePatriot https://t.co/rxfMmcL8X5"
268,2022-07-28 19:54:50+00:00,1552744408986034177,Well look which folks are actually working to lower the deficit...#TenneyVotedNo https://t.co/oviBLvyV3w
269,2022-07-28 19:50:16+00:00,1552743258417238018,"This one is a ""Tenney Two-for-one!"" #TenneyVotedNo https://t.co/F3i22lqCO6"
270,2022-07-28 19:49:20+00:00,1552743026644090880,#TenneyVotedNo https://t.co/0NbeSkbWhe
271,2022-07-28 19:48:18+00:00,1552742766815354880,We are working for the American people. People like Claudia Tenney work for their donors and their bank accounts... https://t.co/8ZxBTd0zUh
272,2022-07-28 19:46:47+00:00,1552742381883121664,What is funny is that we could envision Hawley if he showed up in Afghanistan... https://t.co/aRfZGpduYn
273,2022-07-28 19:45:40+00:00,1552742103922393088,"They may not be, but we are... https://t.co/VVtwhcwHVo"
274,2022-07-26 11:24:09+00:00,1551891115074265088,"Unions were formed not just to deliver good wages and workplace safety, but also to prevent the specific horrors of unsafe industrial work environments and child labor. @UAW exists because plants without them inevitably do things like what happened in the article below. https://t.co/xR0BjwStNZ"
275,2022-07-25 17:19:52+00:00,1551618247774150659,"This isn't just a Crimean issue, Russia is hungry and has been expanding slowly but virtually unchecked for awhile now.

Putin is a bully and sometimes you have to punch a bully in the face to stop him. 
Lucky for us Ukraine has the heart to punch Putin but not the budget."
276,2022-07-25 17:19:51+00:00,1551618241411383298,"I've been asked several times how I feel about our continual funding of the defense in #Ukraine. To be frank, I served 20 years and did 4 combat deployments. I'd much rather we contribute to an ally's defense with our dollars than with our sons and daughters."
277,2022-07-25 13:48:01+00:00,1551564934034636801,"https://t.co/RUrqkDhyY7
I stand firmly with those who protested this yesterday. There is no place in #NY24 #TheLakeDistrict for this hateful speech, conspiracy theories, &amp; lying. I ask every person of good will to stand with us, &amp; I ask my GOP colleagues to call this out as well."
278,2022-07-25 01:35:26+00:00,1551380572383203329,Our District is one of the oldest in the State. I see this as a direct insult to Seniors who spent their lives building our Country! #TheLakeDistrict let's prove them wrong in a big way. https://t.co/UIjAlNyNDE
279,2022-07-24 14:19:31+00:00,1551210473789562880,And Claudia Tenney was one of them https://t.co/TUghAmhepC
280,2022-07-22 15:30:02+00:00,1550503445265784832,"Last night, I was at two events where the people in attendance said this about us. We are real people who are concerned about you. That is what we need. https://t.co/C7j4z7IImT"
281,2022-07-22 15:23:50+00:00,1550501881809702913,"We must not forget that we need to protect the House to save our democracy. Our District, which has a history of standing up for women, minorities, &amp; religious freedom, is a great place to start! #NY24 #TheLakeDistrict"
282,2022-07-22 15:14:31+00:00,1550499536438792192,This is servant leadership. https://t.co/GQaKgpoMuQ
283,2022-07-22 15:13:23+00:00,1550499253750996992,Pennsylvania and America deserves @JohnFetterman.  I cannot wait to work with him from the House to co-sponsor legislation that will make a difference to workig families. https://t.co/suJ2qo4Jst
284,2022-07-22 13:38:37+00:00,1550475404716146689,As did Claudia Tenney!  #TenneyVotedNo #NY24 #TheLakeDistrict #VoteBlue2022 https://t.co/tyz7e7N8oY
285,2022-07-22 13:35:18+00:00,1550474568485183488,"Also, you are voting to hurt Seniors (ending Medicare and Social Security), raise your taxes, and against Veterans. https://t.co/3zOLLZNyKv"
286,2022-07-22 13:33:25+00:00,1550474096194080771,Something we can all agree on...#NY24 #TheLakeDistrict https://t.co/Qed3m0xDeZ
287,2022-07-20 15:39:25+00:00,1549781029619105793,"She also voted against Veterans, when every other member of the NY Delegation voted ""Yes."" It's almost like she is having a right wing challenger pull her further that way. Oh, wait... https://t.co/kLnTMBBQgF"
288,2022-07-20 15:35:53+00:00,1549780138077945859,#TenneyVotedNo https://t.co/OCRsMots8b
289,2022-07-20 15:35:11+00:00,1549779963263520769,"I support this as well.  The reason we have 9 justices now is that we had 9 Circuits at one point, and each Justice is responsible for a Circuit. We now have 13 Circuits. It only makes sense... https://t.co/Ey5lRFxwvp"
290,2022-07-20 14:13:58+00:00,1549759523635724288,"Just remember, Claudis Tenney is a member of the Republican Study Committee... https://t.co/ya9N8mbnj9"
291,2022-07-20 13:51:24+00:00,1549753845139505152,The largest voting bloc in America is the non-voting bloc. Please register and vote this November before it is too late. https://t.co/TfTTXOCBSM
292,2022-07-20 13:49:56+00:00,1549753478532272128,The UK's version of the GOP just voted to punish price-gouging. Why can't elected GOP officials here do the same? https://t.co/rvVyc2FQTb
293,2022-07-20 13:48:10+00:00,1549753033197764609,You heard the man... https://t.co/VJMSJAhSUu
294,2022-07-20 13:25:47+00:00,1549747397219291136,"But, #TenneyVotedNo https://t.co/NHt0ki41Jm"
295,2022-07-20 12:45:14+00:00,1549737195665244161,"Talk about cutting off your nose to spite your face. @ChipotleTweets
https://t.co/5VM5ysMEcN"
296,2022-07-19 16:15:56+00:00,1549427830588678144,One of my potential GOP opponents does not support Ukraine nor NATO. No one like that deserves to be in Congres...NO ONE! https://t.co/UTcmtbAyZ7
297,2022-07-18 14:15:39+00:00,1549035170568757253,Matt and I look forward to pushing policies to transform the North Country and Western NY.  Please join us!  #NY24 #NY21 #TheLakeDistrict https://t.co/dPcBNRGXPy
298,2022-07-18 14:11:33+00:00,1549034139382415360,"As the Man in Black once said ""what is done in the dark will be brought to the light""... https://t.co/S8YP8lRta4"
299,2022-07-18 14:10:38+00:00,1549033909790425094,"Just reminding that there is still a war in Ukraine. NY is the most Ukrainian state in the Union, and there are many in the District. I am the only candidate in #NY24 who has worked with NATO &amp; understands how to deter aggression from the Russian Federation. #StandWithUkraine https://t.co/HYWQEb2psx"
300,2022-07-18 14:01:00+00:00,1549031484744691713,Dark money has taken #SCOTUS. This has been a decades-long strategy aligning with billionaire donors who have lied about issues. I cannot wait to work with @SenWhitehouse to lifting the lid on this. https://t.co/eS0Q59IxVc
301,2022-07-18 02:25:02+00:00,1548856338452824065,"The Holden Family has long ties to Missouri. Here's to serving with you in DC, Marine! https://t.co/SeLkRpDaqg"
302,2022-07-18 02:16:57+00:00,1548854306417385473,Of course #TenneyVotedNo https://t.co/ozq6BH2eLS
303,2022-07-18 02:14:06+00:00,1548853589501673472,"This year, voting is a matter of life and death for women across this country. Here is proof... https://t.co/W6cl7bO5xm"
304,2022-07-18 02:12:50+00:00,1548853271443509248,I never want to hear GOP politicians such as Claudia Tenney talking about protecting children or family values again. End of story! #NY24 #TheLakeDistrict #TenneyMustGo https://t.co/thJMHDOcVJ
305,2022-07-15 22:17:17+00:00,1548069216842301440,"Claudia Tenney once again showed her true colors. She voted against a woman's right to an abortion, and continued her assault on our Veterans.  She is not worthy of representing #NY24 #TheLakeDistrict"
306,2022-07-15 12:43:40+00:00,1547924858838798339,"Again, I urge every Veteran in #NY24 #TheLakeDistrict to vote against this horrible example of a Member of Congress. We have a duty to protect those who have put their lives on the line for us. #TenneyVotedNo https://t.co/682z7t8FBp"
307,2022-07-15 12:40:55+00:00,1547924167076417536,And we will end her political career in #NY24. She will be replaced by two Veterans this fall! https://t.co/yUYm15weyb
308,2022-07-15 12:36:14+00:00,1547922989097750528,"No shocker here! This is a man who once told Republicans to vote on Tuesday and Democrats to vote on Wednesday. When you can't win, I guess you just cheat! https://t.co/Rq1SZobxTM"
309,2022-07-15 12:34:29+00:00,1547922547785617413,"Claudia, STOP USING VETERANS AND THE MILITARY AS PROPS! You don't really give a flip about any of us, just your backers! https://t.co/OxpJ55toi0"
310,2022-07-14 21:23:14+00:00,1547693224319324160,"This is anti life, not pro. Let's call it what it is. https://t.co/5RZt2ngy3a"
311,2022-07-14 14:09:31+00:00,1547584077628223491,"Claudia Tenney just stabbed me and my fellow Veterans in the back yesterday. She voted against the PACT Act, and was the only NY GOP to vote against it. Just disgusting! Every Veteran in our District MUST vote against her. #NY24 #TheLakeDistrict #TenneyVotedNo"
312,2022-07-13 11:55:13+00:00,1547187890144395266,And he gave Tenney over $27000 over the years... https://t.co/tevwszRvgl
313,2022-07-13 11:47:54+00:00,1547186050325528577,People such as Claudia Tenney do not think about the consequences for their support of these policies. https://t.co/5tvxLvZCcZ
314,2022-07-13 11:46:21+00:00,1547185661110878209,"I want to hear Claudia Tenney's complaint about this, too. https://t.co/LpCY7ZdbIH"
315,2022-07-13 11:40:58+00:00,1547184306191204352,You are right. This is all on him. https://t.co/Luix3Zi5mK
316,2022-07-13 11:39:55+00:00,1547184042788929540,It is actually a very small number of senior leaders who have this issue. Most of the ones I have known are apolitical/independent. You are right about Flynn's brother. I have called for his investigation from the beginning. https://t.co/DkEy08FIIl
317,2022-07-12 18:18:37+00:00,1546921989176270849,Well done and said Soldier! https://t.co/uYKO5nwOiw
318,2022-07-12 18:13:39+00:00,1546920739189710849,I served with him about 15 years ago.  He was radicalized because President Obama told him NO. He then started to go down the rabbit hole. It was saddening and disturbing to say the least. https://t.co/1sqmKqPWJu
319,2022-07-11 09:37:47+00:00,1546428531210584065,We as Dems have our talking points right here... https://t.co/iYS04cLQ7l
320,2022-07-11 09:29:47+00:00,1546426516522901505,"And, you guessed it, #TenneyVotedNo... https://t.co/ZjSXFVtsPL"
321,2022-07-10 23:22:43+00:00,1546273742111870976,Here's another example... https://t.co/FPDkjqDwnQ
322,2022-07-10 22:16:01+00:00,1546256956440076295,"Umm, where are the media and the GOP during this? https://t.co/6NYqnsfyLN"
323,2022-07-10 22:14:31+00:00,1546256578856329219,Thank you!!!!! https://t.co/HmNDhIYwNg
324,2022-07-10 21:14:48+00:00,1546241551537475585,There's a difference between being pro life and anti choice. Claudia Tenney is anti choice. Send me to Congress so I can reauthorize VAWA and the whole slate of other laws in the bullpen that protect women. https://t.co/dbSWIhgbwf
325,2022-07-10 20:57:52+00:00,1546237291592646659,"CAN YOU BELIEVE that one of the big points against the PRO act is that it forces employers to go to court instead of arbitration. 

In cases where workers are forced into arbitration for contract or workplace abuses they win 1.6% of the time

#UnionStrong"
326,2022-07-10 13:56:13+00:00,1546131178700292096,"When states, like GA, AL, VA, IN, and others, take mothers that wanted to have their baby but are the victims of circumstances beyond their control and sends them to jail for miscarriages why don't you say anything? Why doesn't pro life cover the life of the mother too? #QTNA"
327,2022-07-10 11:13:32+00:00,1546090238459756545,"My children and grandson live in Georgia. Let's keep @ReverendWarnock in office and put @staceyabrams in the Governor's Mansion! Also help @JohnFetterman, @LucasKunceMO, @TimRyan, @SenMarkKelly, @valdemings, @NelsonforWI, and @CheriBeasleyNC. https://t.co/ieNhPQuei8"
328,2022-07-10 11:03:58+00:00,1546087830384005121,And Native Americans have a right to not have States enforce their laws on Tribal lands... https://t.co/HzLKLYfWzp
329,2022-07-10 01:56:33+00:00,1545950070067142656,"I'm proud to say that today I received the endorsement of @ibew840now on the strength of my platform and our shared ideals of strengthening access to collective bargaining, keeping jobs in America, and keeping the age of retirement secure. #UnionStrong"
330,2022-07-09 01:10:25+00:00,1545576069511651328,"I have asked that question, and got no answer. https://t.co/FPWOqrwgwe"
331,2022-07-08 21:24:12+00:00,1545519141473353729,"Upstate, where I'm running, has the same problem. The legacy of union busting and... legal political donations is why big business is allowed to abuse and underpay their workers for so much as asking for better conditions. https://t.co/AF6glOjvqO…
#UnionStrong #Organize https://t.co/iEbTJIPrIJ"
332,2022-07-08 18:30:08+00:00,1545475336850268160,"This is a start.  @POTUS is right, we must elect legislators this fall who put abortion care and reproductive health as priorities. #NY24 is the home of Seneca Falls, the birthplace of Women's Rights, and we will fight for that in our District. https://t.co/YP2RnvmFOi"
333,2022-07-08 17:32:23+00:00,1545460804174094336,"Another great jobs report, and a lot of that has to do with Build Back Better!  But, as always, #TenneyVotedNo #NY24 #VoteBlueToSaveDemocracy #TheLakeDistrict #RetireTenney https://t.co/BfTDGdiQSP"
334,2022-07-08 12:31:08+00:00,1545384991483465731,"As a fellow combat Vet here as the Democratic Nominee in #NY24, I look forward to working with you to doing just that! https://t.co/580tD61Mj0"
335,2022-07-08 12:30:00+00:00,1545384704957980675,And we are all at risk... https://t.co/gfRybmFWa6
336,2022-07-08 04:34:05+00:00,1545264938280689664,I didn't serve in the army for 20 years to defend some parts of the constitution. I defend the whole document.
337,2022-07-08 04:34:05+00:00,1545264937047625728,"To be clear. I don't support a gun ban. I support common sense gun controls.We can enact reasonable controls (i.e. background checks for all sales, gun violence database) and the use of science to develop methods to tamp this down."
338,2022-07-08 04:20:04+00:00,1545261409671462912,"Shinzo Abe was just shot in the 1st gun violence incident of the year in Japan. To compare, we have over 300 A DAY.

Cynical takes like ""If we ban guns people will just make them at home so there's no use doing anything"" are a smokescreen.

This is evidence gun control works."
339,2022-07-06 13:08:49+00:00,1544669699337850885,"Again, #TenneyVotedNo.  She does not get to complain about anything.  She does nothing, but then yells about that problem. https://t.co/tzkAv92387"
340,2022-07-06 12:32:43+00:00,1544660612353085445,"As my wife says, stop deflecting! Of course it is the guns! https://t.co/W2zPXTQ2bu"
341,2022-07-06 12:31:45+00:00,1544660372753375237,"Just as reminder, this is Claudia Tenney's favorite network to air her grievances... https://t.co/33bqLj17K1"
342,2022-07-06 12:30:04+00:00,1544659945790005248,"Just remember, Claudia Tenney was Boebert and Greene before they came on the scene.  All need to go! https://t.co/GVsJneFYOs"
343,2022-07-06 12:27:42+00:00,1544659352417701888,"We need to regulate these private equity firms who are buying up housing units and jacking up prices.They are a big reason inflation is out of control in so many parts of our society (food, gas, housing, clothing, autos). I guarantee you, I am going to do something about it. https://t.co/FCGej4XsZd"
344,2022-07-06 12:22:20+00:00,1544657999335153665,I will use my background in forensic accounting to work with @SenWhitehouse to pull the mask off the groups and make it illegal for these groups to influence judicial nominations. #NY24 #TheLakeDistrict https://t.co/zFR4WlxhxV
345,2022-07-05 19:38:54+00:00,1544405478339395584,"This ought to scare you and is exactly what autocrats do.  This is literally a ""Thought Police."" No matter you views, this is reason alone to vote these folks out in November. https://t.co/QqSfvkK4nK"
346,2022-07-05 19:33:39+00:00,1544404157007790082,"You right to collective bargaining is on the line as well.  This is year, everything is on the line. Get registered. Get your friends and family registered. Have a plan to vote, and let no one stand in your way. https://t.co/KgyCUB3xWG"
347,2022-07-05 19:23:43+00:00,1544401658217725959,I wonder why?  And I wonder if people like Claudia Tenney will talk about it... https://t.co/DWUlSokgcL
348,2022-07-05 15:07:00+00:00,1544337051054661636,"Last month, after the massacre at Tops, Claudia Tenney voted against a gun control bill. 
She's a consistent advocate for the gun lobby. 
Here's speaking against studying gun violence in 2018
https://t.co/poxXC6aXhj

We have to move in unison to vote her out."
349,2022-07-05 14:03:02+00:00,1544320953362128897,"The front page of @TheOnion today was evocative and sad. You can never write them off as a satire site, they do some powerful journalism. We can pass common sense gun laws if we come together honestly. Most Republicans don't want to come to the table. #VoteThemOut https://t.co/nCLsgVeyoR"
350,2022-07-05 10:35:22+00:00,1544268694049755137,"Yesterday, in Geneseo, I gave my second empassioned speech in two weeks (the other in Seneca Falls), on how this rogue SCOTUS is eroding precedent to create an America we won't recognize.  #WeAreAsleepNoMore https://t.co/oQmihO05t7"
351,2022-07-04 21:37:00+00:00,1544072810254897152,Something we know to be true. As long as gas prices remain high the price of everything else will keep skyrocketing. Call your senator and urge them to introduce the Consumer Fuel Price Gouging Prevention Act every day until it gets an honest vote. https://t.co/Y0Zy8oif2o
352,2022-07-03 12:55:08+00:00,1543579092691439618,"Again, #TenneyVotedNo. I don't want to hear anything about supporting Veterans, lowering gas prices, inflation, or the baby formula shortage. https://t.co/5z5ZvVKuAz"
353,2022-07-01 22:35:59+00:00,1543000489914257409,"This is another #NoBrainer, federal and state lands that are tribal lands should return to tribal stewardship. Now land management contracts will be awarded to Native businesses and foster development and independence, not paternalism. 

https://t.co/Fic1YkJauj."
354,2022-07-01 22:07:39+00:00,1542993361346461697,What an interesting video. If you can watch this and still believe that Republicans represent competent electoral options please reach out to me on my website at https://t.co/afbRUvsvLj https://t.co/oy8VOiLlxP
355,2022-07-01 14:23:46+00:00,1542876623384576002,"Yesterday's SCOTUS ruling is a disaster for family farms, Now, the USDA is toothless to take on Big Ag and help farmers get needed aid to stay afloat. Also, if the GOP thinks this will help, two more lifelong GOP called me this morning to say ENOUGH! And more are coming!"
356,2022-07-01 12:07:38+00:00,1542842360471724032,"In standing US Law, it points to us having 13 Justices now. https://t.co/654PSsuCdT"
357,2022-07-01 12:00:40+00:00,1542840610121564161,Let's KEEP rebuilding rural America! #RebuildRuralAmerica #NY24 #TheLakeDistrict https://t.co/ePoxRbrR4h
358,2022-07-01 11:54:22+00:00,1542839022766129152,"Another Republican who gets it, and her husband is a GOP state party official in Florida. https://t.co/pNEmIaPBwy"
359,2022-07-01 03:01:21+00:00,1542704885598240770,"Thank you Mr. Savage, and I was honored and overjoyed to end my pride month listening to you."
360,2022-07-01 03:01:21+00:00,1542704884386086913,"If we give up because we don’t get what we want as quickly as we want it we will never get what we want, what we deserve. What women deserve. Autonomy and control of their own bodies and their own destinies."""
361,2022-07-01 03:01:20+00:00,1542704881705811968,"And you know what, we really do have to borrow a page from the right. They didn’t give up when they didn’t get their way after electing Reagan, and then Reagan again, and then Bush Sr. and then Bush Jr. and then Bush Jr. again and then Trump. They fought for 50 years."
362,2022-07-01 03:01:20+00:00,1542704880384708608,"This is gonna get worse before it gets better and its gonna be a long struggle. The right fought to overturn Roe for 50 years, we’re not going to win one midterm election or one presidential election and set this right."
363,2022-07-01 03:01:19+00:00,1542704879008980993,"to save the life of the mother, broad exceptions for the health of the mother including the mother’s mental health. That’s what they’ve got in France and Germany and Denmark and that’s not what Conservatives, Republicans are proposing for women in the United States."
364,2022-07-01 03:01:19+00:00,1542704877465440256,"You know what’s not on the table here right now. You know what conservatives aren’t putting on the table here, right now? Medicare for all, and free birth control, and free abortions... and then maybe abortion restrictions that kick in after 14 or 16 weeks with broad exceptions"
365,2022-07-01 03:01:19+00:00,1542704876089737217,"because they have socialized medicine, for free, and if they’re pregnant, get an abortion, that day, for free. Ending abortion, controlling women’s bodies, banning IUDs and Plan B, all of that is on the table here, right now."
